id,repo,body,url,issue_url,issue_title,created_at,user
3661208567,whatwg/dom,> [@LeaVerou](https://github.com/LeaVerou) thanks for doing this work! I've given you write access t,https://github.com/whatwg/dom/issues/1439#issuecomment-3661208567,https://github.com/whatwg/dom/issues/1439,[meta] MutationObserver improvements tracking issue,2025-12-16T15:46:25Z,LeaVerou
3661157093,whatwg/html,"@farre @jnjaeschke @nt1m ",https://github.com/whatwg/html/pull/12024#issuecomment-3661157093,https://github.com/whatwg/html/pull/12024,Navigation API: nullify ongoing navigate event on successful cross-document navigation,2025-12-16T15:34:42Z,noamr
3660964496,whatwg/html,I think a timeout idea would work to solve this as well. I agree with you that there may be better a,https://github.com/whatwg/html/issues/11968#issuecomment-3660964496,https://github.com/whatwg/html/issues/11968,(scroll-to-text) Allow limiting the number of scroll fragments,2025-12-16T14:54:50Z,vmpstr
3660932881,w3c/payment-request,"Ping @marcoscaceres and @nickjshearer, if you have any opinions here, especially on my ""hrm"" thought",https://github.com/w3c/payment-request/issues/1040#issuecomment-3660932881,https://github.com/w3c/payment-request/issues/1040,Improved error codes,2025-12-16T14:48:28Z,stephenmcgruer
3660849671,w3c/pointerevents,@patrickhlauke please note that the WebDriver BiDi spec is landed now. Please consider review and me,https://github.com/w3c/pointerevents/pull/561#issuecomment-3660849671,https://github.com/w3c/pointerevents/pull/561,WebDriver BiDi emulated max touch points,2025-12-16T14:30:27Z,sadym-chromium
3660757041,whatwg/html,Note that leaving the ongoing event dangling creates a weird behaviour with BFCache (currently shipp,https://github.com/whatwg/html/issues/11860#issuecomment-3660757041,https://github.com/whatwg/html/issues/11860,Navigation API: Dangling ongoing navigate event causes inconsistent behavior in tests,2025-12-16T14:14:33Z,noamr
3660717507,whatwg/html,@annevk do you think there's implementer interest from WebKit?,https://github.com/whatwg/html/pull/11959#issuecomment-3660717507,https://github.com/whatwg/html/pull/11959,"Set ""is currently stalled"" before firing events",2025-12-16T14:07:25Z,foolip
3660648184,whatwg/html,Let me nominate #11975 again.,https://github.com/whatwg/html/issues/12012#issuecomment-3660648184,https://github.com/whatwg/html/issues/12012,Meeting 33 for joint OpenUI-WHATWG/HTML-CSSWG task force on styleable form controls,2025-12-16T13:56:04Z,annevk
3660642427,whatwg/html,I've written a test using a custom Python handler in https://github.com/web-platform-tests/wpt/pull/,https://github.com/whatwg/html/pull/11959#issuecomment-3660642427,https://github.com/whatwg/html/pull/11959,"Set ""is currently stalled"" before firing events",2025-12-16T13:55:05Z,foolip
3660641748,whatwg/html,@bfgeek does that mean they are supported by something other than the specification change? What are,https://github.com/whatwg/html/issues/11975#issuecomment-3660641748,https://github.com/whatwg/html/issues/11975,"Revert ""Switch dialog/popover to using place-self:dialog""",2025-12-16T13:54:57Z,annevk
3660176354,whatwg/html,Good catch!,https://github.com/whatwg/html/pull/12021#issuecomment-3660176354,https://github.com/whatwg/html/pull/12021,Fixing button command early-bail steps,2025-12-16T12:01:08Z,lukewarlow
3660031206,whatwg/html,"> > No. This is purely a way to flesh out potential same-origin violations and edge cases, a some A-",https://github.com/whatwg/html/issues/11839#issuecomment-3660031206,https://github.com/whatwg/html/issues/11839,[focus-without-user-activation] Clarify focus behavior for subframes with denied policy,2025-12-16T11:18:59Z,noamr
3659545292,w3c/FileAPI,[ultraslayyy](https://github.com/ultraslayyy) marked as non substantive for IPR from ash-nazg.,https://github.com/w3c/FileAPI/pull/218#issuecomment-3659545292,https://github.com/w3c/FileAPI/pull/218,Editorial: Avoid shadowing `type` parameter in `package data` algorithm,2025-12-16T09:14:25Z,w3cbot
3659381737,whatwg/dom,Duplicate of https://github.com/whatwg/html/issues/4148.,https://github.com/whatwg/dom/issues/1438#issuecomment-3659381737,https://github.com/whatwg/dom/issues/1438,downloads.download() should be appear in the API,2025-12-16T08:31:45Z,annevk
3659356780,whatwg/dom,Note that we have a WIP PR for this at #885. It mainly needs someone to tend to it and in particular,https://github.com/whatwg/dom/issues/398#issuecomment-3659356780,https://github.com/whatwg/dom/issues/398,Consider adding localNameFilter to MutationObserver,2025-12-16T08:25:06Z,annevk
3659347381,w3c/FileAPI,"Ok sorry I missed that somehow. `type` is defined as both a parameter of `package data`, and a local",https://github.com/w3c/FileAPI/issues/124#issuecomment-3659347381,https://github.com/w3c/FileAPI/issues/124,"""package data"" reuses type variable",2025-12-16T08:22:17Z,ultraslayyy
3659317657,whatwg/dom,@LeaVerou thanks for doing this work! I've given you write access to whatwg/dom (so you can create l,https://github.com/whatwg/dom/issues/1439#issuecomment-3659317657,https://github.com/whatwg/dom/issues/1439,[meta] MutationObserver improvements tracking issue,2025-12-16T08:12:51Z,annevk
3659282283,w3c/FileAPI,I'm not sure what makes you say that? Step 3.1 under Text of https://w3c.github.io/FileAPI/#blob-pac,https://github.com/w3c/FileAPI/issues/124#issuecomment-3659282283,https://github.com/w3c/FileAPI/issues/124,"""package data"" reuses type variable",2025-12-16T08:02:17Z,annevk
3659262051,w3c/FileAPI,"The term `package data` now refers to the name of an algorithm, and no input parameter is redeclared",https://github.com/w3c/FileAPI/issues/124#issuecomment-3659262051,https://github.com/w3c/FileAPI/issues/124,"""package data"" reuses type variable",2025-12-16T07:55:18Z,ultraslayyy
3658769382,WICG/webcomponents,@justinfagnani My expression was incorrect. It's more accurate to say that what JSX factory function,https://github.com/WICG/webcomponents/issues/1069#issuecomment-3658769382,https://github.com/WICG/webcomponents/issues/1069,[templates] A declarative JavaScript templating API,2025-12-16T04:36:14Z,mizchi
3658652969,w3ctag/design-reviews,"> When websites send emails to users, email providers don't currently get a machine-readable proof t",https://github.com/w3ctag/design-reviews/issues/1169#issuecomment-3658652969,https://github.com/w3ctag/design-reviews/issues/1169,Incubation: Email Verification Protocol,2025-12-16T04:05:57Z,martinthomson
3658237959,whatwg/html,"In section of ""4.10.16 The legend element""; - ""Content model:"" of ""if the element is a descendant o",https://github.com/whatwg/html/pull/12011#issuecomment-3658237959,https://github.com/whatwg/html/pull/12011,[Draft] Introduce the new menu elements,2025-12-16T00:58:31Z,mtrootyy
3657965796,whatwg/html,> > [@noamr](https://github.com/noamr) I wouldn't say anything changes policy-wise if C is same orig,https://github.com/whatwg/html/issues/11839#issuecomment-3657965796,https://github.com/whatwg/html/issues/11839,[focus-without-user-activation] Clarify focus behavior for subframes with denied policy,2025-12-15T23:04:18Z,ffiori
3657868210,whatwg/html,"@smaug---- thanks, I think I understand the concern.  In the A->B->C scenario with the policy deni",https://github.com/whatwg/html/pull/11519#issuecomment-3657868210,https://github.com/whatwg/html/pull/11519,[focus-without-user-activation] Allow focus if a descendant has focus,2025-12-15T22:26:01Z,ffiori
3657831689,WICG/webcomponents,> developers have revealed a strong preference for markup-based syntaxes  That's why I included a [J,https://github.com/WICG/webcomponents/issues/1069#issuecomment-3657831689,https://github.com/WICG/webcomponents/issues/1069,[templates] A declarative JavaScript templating API,2025-12-15T22:14:09Z,atzufuki
3657609762,WICG/webcomponents,"@atzufuki   Flutter and similar platforms have explored builder APIs using the programming language ",https://github.com/WICG/webcomponents/issues/1069#issuecomment-3657609762,https://github.com/WICG/webcomponents/issues/1069,[templates] A declarative JavaScript templating API,2025-12-15T21:08:15Z,justinfagnani
3657606917,w3ctag/design-reviews,"Hi @martinthomson, apologies for the delay but just wanted to ack that the next step is indeed on ou",https://github.com/w3ctag/design-reviews/issues/1015#issuecomment-3657606917,https://github.com/w3ctag/design-reviews/issues/1015,Payment link type in HTML,2025-12-15T21:07:31Z,stephenmcgruer
3657598686,WICG/webcomponents,"@Eric-P7   > I've created Solarite, a library that works similar to this, in doing minimal DOM updat",https://github.com/WICG/webcomponents/issues/1069#issuecomment-3657598686,https://github.com/WICG/webcomponents/issues/1069,[templates] A declarative JavaScript templating API,2025-12-15T21:04:56Z,justinfagnani
3657596531,WICG/webcomponents,@mizchi   > I'm prototyping a UI framework and came across this discussion. Let me offer a few comme,https://github.com/WICG/webcomponents/issues/1069#issuecomment-3657596531,https://github.com/WICG/webcomponents/issues/1069,[templates] A declarative JavaScript templating API,2025-12-15T21:04:16Z,justinfagnani
3657583738,whatwg/html,"> Some of the linked tests are tentative, is there a PR to make them not tentative?  I added a chr",https://github.com/whatwg/html/pull/11758#issuecomment-3657583738,https://github.com/whatwg/html/pull/11758,Define base appearance for list box select elements,2025-12-15T21:00:03Z,josepharhar
3657471663,whatwg/html,> [@noamr](https://github.com/noamr) I wouldn't say anything changes policy-wise if C is same origin,https://github.com/whatwg/html/issues/11839#issuecomment-3657471663,https://github.com/whatwg/html/issues/11839,[focus-without-user-activation] Clarify focus behavior for subframes with denied policy,2025-12-15T20:31:18Z,noamr
3657356787,whatwg/html,"@noamr I wouldn't say anything changes policy-wise if C is same origin as A, the higher level frame ",https://github.com/whatwg/html/issues/11839#issuecomment-3657356787,https://github.com/whatwg/html/issues/11839,[focus-without-user-activation] Clarify focus behavior for subframes with denied policy,2025-12-15T19:59:02Z,ffiori
3657303066,WICG/webcomponents,"We already have a good imperative API, why not use that but declaratively? Pure JavaScript, like req",https://github.com/WICG/webcomponents/issues/1069#issuecomment-3657303066,https://github.com/WICG/webcomponents/issues/1069,[templates] A declarative JavaScript templating API,2025-12-15T19:41:34Z,atzufuki
3657225219,whatwg/html,"Some of the linked tests are tentative, is there a PR to make them not tentative?",https://github.com/whatwg/html/pull/11758#issuecomment-3657225219,https://github.com/whatwg/html/pull/11758,Define base appearance for list box select elements,2025-12-15T19:23:38Z,zcorpan
3656964787,whatwg/html,"I'd like to discuss https://github.com/whatwg/html/pull/11981 ",https://github.com/whatwg/html/issues/12015#issuecomment-3656964787,https://github.com/whatwg/html/issues/12015,Upcoming WHATNOT meeting on 2025-12-18,2025-12-15T18:11:38Z,KurtCattiSchmidt
3656759759,webkit/standards-positions,Adding a couple links to some issues for reference: https://github.com/w3c/csswg-drafts/issues/11909,https://github.com/WebKit/standards-positions/issues/378#issuecomment-3656759759,https://github.com/WebKit/standards-positions/issues/378,CSS reading-flow,2025-12-15T17:15:37Z,joe-watkins
3656496715,whatwg/dom,"I wonder if we can assert in ""adopt"" that it's not passed an attribute. And then only handle that ca",https://github.com/whatwg/dom/issues/1440#issuecomment-3656496715,https://github.com/whatwg/dom/issues/1440,Implementations do not match spec behavior for .adoptNode(attr),2025-12-15T16:18:45Z,annevk
3656025308,w3ctag/design-reviews,We've looked at this and think it looks fine.   For our future notes: we will probably have some opi,https://github.com/w3ctag/design-reviews/issues/1180#issuecomment-3656025308,https://github.com/w3ctag/design-reviews/issues/1180,[wg/i18n-core] i18n WG rechartering 2025,2025-12-15T14:43:47Z,hadleybeeman
3655886686,whatwg/dom,"> > [@sorvell](https://github.com/sorvell) `slotchange` doesn't fire for manual assignment, so that'",https://github.com/whatwg/dom/issues/1415#issuecomment-3655886686,https://github.com/whatwg/dom/issues/1415,Allow `MutationObserver` to observe across `<slot>`s,2025-12-15T14:18:31Z,LeaVerou
3655560841,whatwg/html,In [Safari's post about this feature](https://webkit.org/blog/17640/webkit-features-for-safari-26-2/,https://github.com/whatwg/html/issues/12019#issuecomment-3655560841,https://github.com/whatwg/html/issues/12019,Active match timing (until-found and <details>),2025-12-15T13:10:07Z,jakearchibald
3654807003,WICG/webcomponents,"I'm prototyping a UI framework and came across this discussion. Let me offer a few comments.  Based ",https://github.com/WICG/webcomponents/issues/1069#issuecomment-3654807003,https://github.com/WICG/webcomponents/issues/1069,[templates] A declarative JavaScript templating API,2025-12-15T10:06:12Z,mizchi
3652681167,WICG/webcomponents,"I've created Solarite, a library that works similar to this, in doing minimal DOM updates on web com",https://github.com/WICG/webcomponents/issues/1069#issuecomment-3652681167,https://github.com/WICG/webcomponents/issues/1069,[templates] A declarative JavaScript templating API,2025-12-15T02:56:08Z,Eric-P7
3652133159,whatwg/html,"Does anything change when (C) is same origin as (A)? (A->B->A) Supposedly, the main frame can set fo",https://github.com/whatwg/html/issues/11839#issuecomment-3652133159,https://github.com/whatwg/html/issues/11839,[focus-without-user-activation] Clarify focus behavior for subframes with denied policy,2025-12-14T21:03:59Z,noamr
3651988691,whatwg/dom,One tricky bit is that for `attributes` and `characterData` mutations you want to be filtering by th,https://github.com/whatwg/dom/issues/398#issuecomment-3651988691,https://github.com/whatwg/dom/issues/398,Consider adding localNameFilter to MutationObserver,2025-12-14T20:13:30Z,LeaVerou
3651606652,w3c/editing,"After giving this some more thought, there's one problem with aligning popovers to the native select",https://github.com/w3c/editing/issues/518#issuecomment-3651606652,https://github.com/w3c/editing/issues/518,Ability to anchor a popover to the native selection rectangle using CSS Anchor Positioning,2025-12-14T16:28:11Z,michael
3651594596,w3c/editing,Official bug report filed: https://bugs.webkit.org/show_bug.cgi?id=304143,https://github.com/w3c/editing/issues/516#issuecomment-3651594596,https://github.com/w3c/editing/issues/516,"Safari Desktop: Adding an empty span to an otherwise empty editable element, makes the element unselectable",2025-12-14T16:20:22Z,michael
3651575646,w3c/editing,Official Bug Report: https://bugs.webkit.org/show_bug.cgi?id=304142,https://github.com/w3c/editing/issues/499#issuecomment-3651575646,https://github.com/w3c/editing/issues/499,Safari Desktop: Conditional Show/ Hide of br element in contenteditable element make caret disappear,2025-12-14T16:09:02Z,michael
3651565289,w3c/editing,> 08:24 johanneswilm: Michael will upload a video. we'll keep the Agenda+ and see if we have an idea,https://github.com/w3c/editing/issues/516#issuecomment-3651565289,https://github.com/w3c/editing/issues/516,"Safari Desktop: Adding an empty span to an otherwise empty editable element, makes the element unselectable",2025-12-14T16:01:48Z,michael
3651525743,w3c/editing,"I'll try to summarize the state of the discussion here, please correct me where I'm wrong:  There's ",https://github.com/w3c/editing/issues/504#issuecomment-3651525743,https://github.com/w3c/editing/issues/504,Firefox + Chrome Desktop + Android: document.execCommand does not trigger a 'historyUndo' onbeforinput event after running document.execCommand('undo'),2025-12-14T15:39:06Z,michael
3651477866,w3c/editing,> I don't think this is a bug of Firefox unless it outputs different range than actually deleted lat,https://github.com/w3c/editing/issues/493#issuecomment-3651477866,https://github.com/w3c/editing/issues/493,Firefox: event.getTargetRanges() in beforeinput not consistent with window.getSelection(),2025-12-14T15:24:27Z,michael
3651119516,w3c/editing,Sound good. Thank you @Ahmad-S792 and @whsieh for clarifying.,https://github.com/w3c/editing/issues/492#issuecomment-3651119516,https://github.com/w3c/editing/issues/492,"Safari Desktop: Doesn't fire inputType 'formatBold', 'formatItalic' etc. in beforeinput",2025-12-14T14:07:58Z,michael
3650503792,whatwg/html,This seems to go further away from the lexicographical ordering desired by #3580. Is that still some,https://github.com/whatwg/html/pull/12017#issuecomment-3650503792,https://github.com/whatwg/html/pull/12017,Fix ordering of lifecycle callbacks to match implementations,2025-12-14T08:59:28Z,annevk
3650226363,whatwg/html,"In section of ""4.4.10 The menuitem element""; The following sentence shoud be added as firest senten",https://github.com/whatwg/html/pull/12011#issuecomment-3650226363,https://github.com/whatwg/html/pull/12011,[Draft] Introduce the new menu elements,2025-12-14T05:01:03Z,mtrootyy
3650056362,w3c/editing,It's currently a bit unclear whether this would be a WebKit or Safari bug (given that other WebKit a,https://github.com/w3c/editing/issues/492#issuecomment-3650056362,https://github.com/w3c/editing/issues/492,"Safari Desktop: Doesn't fire inputType 'formatBold', 'formatItalic' etc. in beforeinput",2025-12-14T02:03:04Z,whsieh
3650030071,whatwg/html," The menubar element & the menulist element is ""Interactive content""?   The menubar element & th",https://github.com/whatwg/html/pull/12011#issuecomment-3650030071,https://github.com/whatwg/html/pull/12011,[Draft] Introduce the new menu elements,2025-12-14T01:32:37Z,mtrootyy
3649872639,whatwg/html,Depends on what the spec editors want to do as a fix. This should do the job but if we need an alter,https://github.com/whatwg/html/pull/11140#issuecomment-3649872639,https://github.com/whatwg/html/pull/11140,Editorial: export Document's showing hint and auto popover lists,2025-12-13T22:26:08Z,lukewarlow
3649863482,whatwg/html,"Just ran by this. We should get this resolved as Fullscreen spec is still out-of-sync, which means i",https://github.com/whatwg/html/pull/11140#issuecomment-3649863482,https://github.com/whatwg/html/pull/11140,Editorial: export Document's showing hint and auto popover lists,2025-12-13T22:18:01Z,keithamus
3649785712,w3c/editing,> Official feature request filed: https://bugs.webkit.org/show_bug.cgi?id=304117 >  > [@whsieh](http,https://github.com/w3c/editing/issues/492#issuecomment-3649785712,https://github.com/w3c/editing/issues/492,"Safari Desktop: Doesn't fire inputType 'formatBold', 'formatItalic' etc. in beforeinput",2025-12-13T20:36:12Z,Ahmad-S792
3649645705,whatwg/dom,"> [@sorvell](https://github.com/sorvell) `slotchange` doesn't fire for manual assignment, so that's ",https://github.com/whatwg/dom/issues/1415#issuecomment-3649645705,https://github.com/whatwg/dom/issues/1415,Allow `MutationObserver` to observe across `<slot>`s,2025-12-13T17:29:02Z,sorvell
3649616923,whatwg/html,"The upcoming EU AI Act requires companies to declare, when they use AI. That to my understanding als",https://github.com/whatwg/html/issues/9479#issuecomment-3649616923,https://github.com/whatwg/html/issues/9479,Proposal: Meta Tag for AI Generated Content,2025-12-13T16:53:17Z,saitho
3649530045,w3c/editing,Official bug report filed: https://bugs.webkit.org/show_bug.cgi?id=304120,https://github.com/w3c/editing/issues/496#issuecomment-3649530045,https://github.com/w3c/editing/issues/496,Safari Desktop: position: relative on parent of empty text div makes content leak outside the text div.,2025-12-13T15:16:18Z,michael
3649528329,whatwg/html,"> fyi, it's possible to change the hole Request / Response by using service worker.  Can you elabora",https://github.com/whatwg/html/issues/7810#issuecomment-3649528329,https://github.com/whatwg/html/issues/7810,Add support to the window.open function for the Accept header.,2025-12-13T15:14:04Z,jonasheschl
3649527224,w3c/editing,Official bug report filed: https://bugs.webkit.org/show_bug.cgi?id=304119,https://github.com/w3c/editing/issues/497#issuecomment-3649527224,https://github.com/w3c/editing/issues/497,Safari Desktop: Editing an empty `<a>` makes content leak outside the `<a>`,2025-12-13T15:12:24Z,michael
3649522144,w3c/editing,Official feature request filed: https://bugs.webkit.org/show_bug.cgi?id=304117  @whsieh is the bug t,https://github.com/w3c/editing/issues/492#issuecomment-3649522144,https://github.com/w3c/editing/issues/492,"Safari Desktop: Doesn't fire inputType 'formatBold', 'formatItalic' etc. in beforeinput",2025-12-13T15:08:24Z,michael
3649503929,w3c/editing,Official bug report filed: https://bugs.webkit.org/show_bug.cgi?id=304114,https://github.com/w3c/editing/issues/494#issuecomment-3649503929,https://github.com/w3c/editing/issues/494,Safari Desktop: `insertReplacementText` not fired,2025-12-13T14:50:36Z,michael
3649096333,whatwg/dom,"@sorvell `slotchange` doesn't fire for manual assignment, so that's another use case for this.",https://github.com/whatwg/dom/issues/1415#issuecomment-3649096333,https://github.com/whatwg/dom/issues/1415,Allow `MutationObserver` to observe across `<slot>`s,2025-12-13T08:02:34Z,LeaVerou
3649095634,whatwg/dom,"> The proposed disconnect option would also be useful to me â€” and a `flush()` method even moreso, fo",https://github.com/whatwg/dom/issues/1283#issuecomment-3649095634,https://github.com/whatwg/dom/issues/1283,`mutationObserver.disconnect({ flush: true })`,2025-12-13T08:01:33Z,LeaVerou
3649066169,whatwg/dom,"Please note that this is not a correct polyfill, since each observation includes different options, ",https://github.com/whatwg/dom/issues/905#issuecomment-3649066169,https://github.com/whatwg/dom/issues/905,Proposal: add `childFilter` option to `MutationObserverInit`,2025-12-13T07:11:47Z,LeaVerou
3649043111,whatwg/dom,Yeah unfortunately observing property changes in general has been a longstanding NAK. I wonder if th,https://github.com/whatwg/dom/issues/1340#issuecomment-3649043111,https://github.com/whatwg/dom/issues/1340,Allow `MutationObserver` to observe (certain) element property changes,2025-12-13T06:35:04Z,LeaVerou
3648730656,whatwg/html,"Is there any update on this? From all the browsers I tested, only Firefox Nightly seems to have what",https://github.com/whatwg/html/issues/10687#issuecomment-3648730656,https://github.com/whatwg/html/issues/10687,Prevent currentScript from being overridden on document via name='',2025-12-13T01:51:17Z,Eccenux
3648577792,whatwg/html,looks good ðŸ‘,https://github.com/whatwg/html/pull/12008#issuecomment-3648577792,https://github.com/whatwg/html/pull/12008,Skip light dismiss when opening select's picker,2025-12-13T00:17:13Z,sb3nder
3648537973,whatwg/html,"> I wonder if instead of this, would it be possible to do something like the following? >  > in [*",https://github.com/whatwg/html/pull/12008#issuecomment-3648537973,https://github.com/whatwg/html/pull/12008,Skip light dismiss when opening select's picker,2025-12-12T23:49:57Z,josepharhar
3648440685,whatwg/html,"Looks good to me!  ~~My only nitpick is that, to open a modal dialog on pointerdown, one has to ca",https://github.com/whatwg/html/pull/11536#issuecomment-3648440685,https://github.com/whatwg/html/pull/11536,Change light dismiss to use click events,2025-12-12T23:00:39Z,sb3nder
3648280160,whatwg/html,"The problem is that *virtually every `<a>` will trigger this error*, if it contains any query parame",https://github.com/whatwg/html/pull/11988#issuecomment-3648280160,https://github.com/whatwg/html/pull/11988,Encourage always-escaping ampersand character.,2025-12-12T21:59:32Z,tabatkins
3648125540,whatwg/dom,"@LeaVerou I think you misinterpret it, with `DOMParser` you create a brand new document, thus you ha",https://github.com/whatwg/dom/issues/533#issuecomment-3648125540,https://github.com/whatwg/dom/issues/533,Make it possible to observe connected-ness of a node,2025-12-12T20:59:43Z,FrameMuse
3648097899,whatwg/dom,"Ah, right, d'uh! ðŸ¤¦ðŸ½â€â™€ï¸ Now Iâ€™m wondering if we need a property that _does_ work like thisâ€¦ ðŸ˜…  Bas",https://github.com/whatwg/dom/issues/533#issuecomment-3648097899,https://github.com/whatwg/dom/issues/533,Make it possible to observe connected-ness of a node,2025-12-12T20:48:12Z,LeaVerou
3648057148,whatwg/dom,> It seems that instead what most use cases need is to observe (a) `ownerDocument` changes and (b) `,https://github.com/whatwg/dom/issues/533#issuecomment-3648057148,https://github.com/whatwg/dom/issues/533,Make it possible to observe connected-ness of a node,2025-12-12T20:33:56Z,rniwa
3648051760,whatwg/dom,"Actually, Iâ€™m not sure if observing connectedness is what we need. Consider this:  ```js let parser ",https://github.com/whatwg/dom/issues/533#issuecomment-3648051760,https://github.com/whatwg/dom/issues/533,Make it possible to observe connected-ness of a node,2025-12-12T20:31:45Z,LeaVerou
3648034275,whatwg/html,Discussed in https://github.com/whatwg/html/issues/11989.,https://github.com/whatwg/html/issues/11839#issuecomment-3648034275,https://github.com/whatwg/html/issues/11839,[focus-without-user-activation] Clarify focus behavior for subframes with denied policy,2025-12-12T20:26:02Z,cwilso
3648031584,whatwg/html,Our next meeting is https://github.com/whatwg/html/issues/12015.  Minutes:  - Focus without User Act,https://github.com/whatwg/html/issues/11989#issuecomment-3648031584,https://github.com/whatwg/html/issues/11989,Upcoming WHATNOT meeting on 2025-12-11,2025-12-12T20:24:58Z,cwilso
