id,repo,body,url,issue_url,issue_title,created_at,user
3007002219,whatwg/html,@farre thanks so much for your suggested fix. I really appreciate you wading into this complexity an,https://github.com/whatwg/html/issues/11184#issuecomment-3007002219,https://github.com/whatwg/html/issues/11184,Navigation API: Navigation's ongoing navigate event is not null in #inner-navigate-event-firing-algorithm,2025-06-26T04:25:08Z,domenic
3006911378,whatwg/html,I'm facing the same issue. `togglePopover` has a weird behavior and is really counter-intuitive. I w,https://github.com/whatwg/html/issues/10890#issuecomment-3006911378,https://github.com/whatwg/html/issues/10890,`HTMLElement.togglePopover` can't close the popover when applied on `<td>`,2025-06-26T03:24:57Z,bakura10
3006843232,whatwg/html,"> Unfortunately ""changes"" feels ambiguous, although if you were reading as precisely as you could, y",https://github.com/whatwg/html/issues/11400#issuecomment-3006843232,https://github.com/whatwg/html/issues/11400,Link elements should not fetch and process upon idempotent attribute mutations,2025-06-26T02:37:29Z,domenic
3006506041,whatwg/html,Next meeting is at https://github.com/whatwg/html/issues/11399,https://github.com/whatwg/html/issues/11367#issuecomment-3006506041,https://github.com/whatwg/html/issues/11367,Meeting 22 for joint OpenUI-WHATWG/HTML-CSSWG task force on styleable form controls,2025-06-25T23:20:13Z,mfreed7
3006205693,mozilla/standards-positions,https://bugzilla.mozilla.org/show_bug.cgi?id=1965945 Would this encompass removing X-Moz: Prefetch i,https://github.com/mozilla/standards-positions/issues/1259#issuecomment-3006205693,https://github.com/mozilla/standards-positions/issues/1259,"Remove non-standard prefetch headers like X-Moz for Sec-Purpose for prefetches, prerenders, etc.",2025-06-25T21:31:36Z,srwei
3006165282,webkit/standards-positions,"FYI, there are some discussions on removing SpeechRecognitionPhraseList here: https://github.com/Web",https://github.com/WebKit/standards-positions/issues/517#issuecomment-3006165282,https://github.com/WebKit/standards-positions/issues/517,Web Speech API Contextual Biasing,2025-06-25T21:13:38Z,evanbliu
3006068925,whatwg/html,(Responding to just a couple points for now...)  > I am sad about how non-uniform our algorithm de,https://github.com/whatwg/html/pull/11392#issuecomment-3006068925,https://github.com/whatwg/html/pull/11392,Markup: Wrap algorithms in <div> tags,2025-06-25T20:34:45Z,jmdyck
3006033584,w3c/resource-timing,"In my opinion, there are 3 categories of values to be reconciled. Further discussion may be needed, ",https://github.com/w3c/resource-timing/issues/364#issuecomment-3006033584,https://github.com/w3c/resource-timing/issues/364,List of initiatorType types,2025-06-25T20:21:28Z,guohuideng2024
3005970011,whatwg/html,Hello there! Could you give me chance to work with you?,https://github.com/whatwg/html/issues/11397#issuecomment-3005970011,https://github.com/whatwg/html/issues/11397,"[mXSS] Consider making HTML parsing of `style`, `script`, `xmp` etc consistent between SVG, MathML, HTML",2025-06-25T19:56:51Z,0xtenso
3005961833,whatwg/html,> I introduced var-scope to be able to identify variable scopes that don't coincide with an algorith,https://github.com/whatwg/html/pull/11392#issuecomment-3005961833,https://github.com/whatwg/html/pull/11392,Markup: Wrap algorithms in <div> tags,2025-06-25T19:53:14Z,tabatkins
3005780266,whatwg/html,> There are at least some cases that are var-scopes but not algorithms. I'll try to look at those mo,https://github.com/whatwg/html/pull/11392#issuecomment-3005780266,https://github.com/whatwg/html/pull/11392,Markup: Wrap algorithms in <div> tags,2025-06-25T18:40:12Z,jmdyck
3005204779,whatwg/html,"@annevk Thank you again for your insights.  As the conversation has progressed, I realized that ther",https://github.com/whatwg/html/issues/11395#issuecomment-3005204779,https://github.com/whatwg/html/issues/11395,"Define optional normalization of full-width characters in <input type=""number"">",2025-06-25T15:28:04Z,kyouhei-horizumi
3004680743,mozilla/standards-positions,"Yes, this makes sense. Then we would potentially have to provide a different value for `env(safe-pri",https://github.com/mozilla/standards-positions/issues/1258#issuecomment-3004680743,https://github.com/mozilla/standards-positions/issues/1258,Expose unprintable areas via CSS,2025-06-25T12:58:21Z,mstensho
3004605196,whatwg/html,"> Did you mean to add a link?  Ah, sorry, yes. Here it is: https://research.securitum.com/mutation-x",https://github.com/whatwg/html/issues/11397#issuecomment-3004605196,https://github.com/whatwg/html/issues/11397,"[mXSS] Consider making HTML parsing of `style`, `script`, `xmp` etc consistent between SVG, MathML, HTML",2025-06-25T12:32:01Z,securityMB
3004600064,whatwg/html,"> That's definitely the case, here's an example of mXSS which _didn't_ rely on the fact that `<` and",https://github.com/whatwg/html/issues/11397#issuecomment-3004600064,https://github.com/whatwg/html/issues/11397,"[mXSS] Consider making HTML parsing of `style`, `script`, `xmp` etc consistent between SVG, MathML, HTML",2025-06-25T12:30:17Z,zcorpan
3004586472,whatwg/html,I'll leave it open for now as Domenic was considering adding a clarifying note.,https://github.com/whatwg/html/issues/7168#issuecomment-3004586472,https://github.com/whatwg/html/issues/7168,Behavior of disabled with input type=radio and option is unclear,2025-06-25T12:25:28Z,annevk
3004572615,whatwg/html,"@annevk  Anyway, probably its just me that dont understand the specs. the Original issue about input",https://github.com/whatwg/html/issues/7168#issuecomment-3004572615,https://github.com/whatwg/html/issues/7168,Behavior of disabled with input type=radio and option is unclear,2025-06-25T12:20:59Z,SB3NDER
3004422862,whatwg/html,Thanks for raising this issue!  > Some also used the fact that < and > were not escaped in attribute,https://github.com/whatwg/html/issues/11397#issuecomment-3004422862,https://github.com/whatwg/html/issues/11397,"[mXSS] Consider making HTML parsing of `style`, `script`, `xmp` etc consistent between SVG, MathML, HTML",2025-06-25T11:26:09Z,securityMB
3004301488,whatwg/html,"> I don't know whether keyboards or IMEs support, but adding inputmode=""numeric"" would be nicer for ",https://github.com/whatwg/html/issues/11395#issuecomment-3004301488,https://github.com/whatwg/html/issues/11395,"Define optional normalization of full-width characters in <input type=""number"">",2025-06-25T10:41:06Z,kyouhei-horizumi
3004202737,whatwg/html,> ### What problem are you trying to solve? > Placing block-level elements like >  > inside an tag v,https://github.com/whatwg/html/issues/11394#issuecomment-3004202737,https://github.com/whatwg/html/issues/11394,Avoid Using <div> Inside <a> – Violates HTML5 Semantics,2025-06-25T10:09:54Z,mtechamit
3004091843,whatwg/html,"I [added](https://bugzilla.mozilla.org/show_bug.cgi?id=1955578) some telemetry to Firefox 140, the f",https://github.com/whatwg/html/issues/10687#issuecomment-3004091843,https://github.com/whatwg/html/issues/10687,Prevent currentScript from being overridden on document via name='',2025-06-25T09:33:05Z,evilpie
3003999317,whatwg/html,I think at a minimum we should test that the `value` setter does not accept non-ASCII. That's weird.,https://github.com/whatwg/html/issues/11395#issuecomment-3003999317,https://github.com/whatwg/html/issues/11395,"Define optional normalization of full-width characters in <input type=""number"">",2025-06-25T09:04:24Z,annevk
3003449324,mozilla/standards-positions,I'm not necessarily saying that the spec has to require this preemptive upscaling or explain in deta,https://github.com/mozilla/standards-positions/issues/1258#issuecomment-3003449324,https://github.com/mozilla/standards-positions/issues/1258,Expose unprintable areas via CSS,2025-06-25T06:02:37Z,dholbert
3003446784,whatwg/html,"So, the diff is huge, and not reviewable on GitHub. But reviewing it locally, the following things s",https://github.com/whatwg/html/pull/11392#issuecomment-3003446784,https://github.com/whatwg/html/pull/11392,Markup: Wrap algorithms in <div> tags,2025-06-25T06:01:19Z,domenic
3003424374,mozilla/standards-positions,"> if you print a US-Letter page on A4 paper, the top and bottom edges will get larger effective marg",https://github.com/mozilla/standards-positions/issues/1258#issuecomment-3003424374,https://github.com/mozilla/standards-positions/issues/1258,Expose unprintable areas via CSS,2025-06-25T05:52:07Z,dholbert
3003362180,whatwg/html,Thanks for your detailed reply! I think I'm aligned on most points. To summarize:  * We can use th,https://github.com/whatwg/html/pull/11392#issuecomment-3003362180,https://github.com/whatwg/html/pull/11392,Markup: Wrap algorithms in <div> tags,2025-06-25T05:22:15Z,domenic
3002258781,mozilla/standards-positions,"`getUserMedia()` isn't going anywhere, so solving the three-click problem seems a bit of a tangent. ",https://github.com/mozilla/standards-positions/issues/1245#issuecomment-3002258781,https://github.com/mozilla/standards-positions/issues/1245,Page Embedded Permission Control (Take 2),2025-06-25T00:46:52Z,jan-ivar
3001749201,whatwg/html,"I don't know whether keyboards or IMEs support, but adding `inputmode=""numeric""` would be nicer for ",https://github.com/whatwg/html/issues/11395#issuecomment-3001749201,https://github.com/whatwg/html/issues/11395,"Define optional normalization of full-width characters in <input type=""number"">",2025-06-24T20:18:35Z,myakura
3001723081,mozilla/standards-positions,"Yes, good point about the downscaling. This needs to be a per-page thing, since not all pages may ha",https://github.com/mozilla/standards-positions/issues/1258#issuecomment-3001723081,https://github.com/mozilla/standards-positions/issues/1258,Expose unprintable areas via CSS,2025-06-24T20:07:53Z,mstensho
3001701610,whatwg/html,> This is more than I anticipated in [#10483 (comment)](https://github.com/whatwg/html/issues/10483#,https://github.com/whatwg/html/pull/11392#issuecomment-3001701610,https://github.com/whatwg/html/pull/11392,Markup: Wrap algorithms in <div> tags,2025-06-24T20:00:03Z,jmdyck
3001670281,mozilla/standards-positions,"(The 85in x 110in example is just for illustration; the more-likely real-world-scenario would be A4 ",https://github.com/mozilla/standards-positions/issues/1258#issuecomment-3001670281,https://github.com/mozilla/standards-positions/issues/1258,Expose unprintable areas via CSS,2025-06-24T19:47:22Z,dholbert
3001607405,mozilla/standards-positions,"Yeah, this seems fine to me too, in spirit.  I'll note a few things..  (1) the `env(safe-printable-i",https://github.com/mozilla/standards-positions/issues/1258#issuecomment-3001607405,https://github.com/mozilla/standards-positions/issues/1258,Expose unprintable areas via CSS,2025-06-24T19:20:44Z,dholbert
3001434011,whatwg/html,"yeah, I think it was a mistake to make disabled controls not focusable. EDIT: To clarify, I mean tha",https://github.com/whatwg/html/issues/7168#issuecomment-3001434011,https://github.com/whatwg/html/issues/7168,Behavior of disabled with input type=radio and option is unclear,2025-06-24T18:10:09Z,SB3NDER
3001187038,whatwg/dom,Is the problem with 2 that https://html.spec.whatwg.org/multipage/dom.html#htmlconstructor doesn't s,https://github.com/whatwg/dom/issues/1379#issuecomment-3001187038,https://github.com/whatwg/dom/issues/1379,Scoped custom element registry issues,2025-06-24T16:47:14Z,annevk
3000967774,w3c/pointerevents,> That scenario is indeed remedied by permission controlled APIs as you suggested at the cost of use,https://github.com/w3c/pointerevents/pull/318#issuecomment-3000967774,https://github.com/w3c/pointerevents/pull/318,Add secure context criteria to pointerrawupdate and getCoalescedEvents,2025-06-24T15:28:42Z,szmarczak
3000882088,whatwg/html,"This is interesting what it enables, but odd in how it does: certain features will be *runtime mixin",https://github.com/whatwg/html/issues/11061#issuecomment-3000882088,https://github.com/whatwg/html/issues/11061,Proposal: Customized built-in elements via `elementInternals.type`,2025-06-24T15:07:46Z,trusktr
3000881166,mozilla/standards-positions,> We are negative on this proposal. While we plan to describe the reasons further in [our proposal](,https://github.com/mozilla/standards-positions/issues/1015#issuecomment-3000881166,https://github.com/mozilla/standards-positions/issues/1015,Web Translation API,2025-06-24T15:07:30Z,sandstrom
3000838802,whatwg/html,"I don't think disabled means ""don't read""?",https://github.com/whatwg/html/issues/7168#issuecomment-3000838802,https://github.com/whatwg/html/issues/7168,Behavior of disabled with input type=radio and option is unclear,2025-06-24T14:55:16Z,annevk
3000797098,whatwg/html,"[According to the HTML standard](https://html.spec.whatwg.org/multipage/syntax.html#start-tags), the",https://github.com/whatwg/html/issues/11240#issuecomment-3000797098,https://github.com/whatwg/html/issues/11240,"Proposal: Shorthand syntax for external stylesheets (<style src=""..."">)",2025-06-24T14:43:03Z,maherbo
3000790367,whatwg/html,"PR is updated, created a PR to update the tests, and wrote a patch for WebKit.",https://github.com/whatwg/html/issues/10155#issuecomment-3000790367,https://github.com/whatwg/html/issues/10155,It's not clear how constraint validation works for FACE if the 'validation anchor' is null,2025-06-24T14:41:08Z,annevk
3000727036,whatwg/html,Firefox 140 shipped today!,https://github.com/whatwg/html/issues/7867#issuecomment-3000727036,https://github.com/whatwg/html/issues/7867,Remove UA style for h1-h6 in section (et. al.) and hgroup,2025-06-24T14:26:45Z,zcorpan
3000607234,w3ctag/design-reviews,Hi @yoavweiss!  Thanks for taking a look. I have amended the explainer with an API Shape section (co,https://github.com/w3ctag/design-reviews/issues/1097#issuecomment-3000607234,https://github.com/w3ctag/design-reviews/issues/1097,Browser Bound Keys for Secure Payment Confirmation,2025-06-24T13:55:39Z,pejic
3000146739,whatwg/html,I've been playing around a bit with this and I have the following suggestion:  * Since this is an is,https://github.com/whatwg/html/issues/11184#issuecomment-3000146739,https://github.com/whatwg/html/issues/11184,Navigation API: Navigation's ongoing navigate event is not null in #inner-navigate-event-firing-algorithm,2025-06-24T12:21:28Z,farre
3000018599,whatwg/html,"Hi @domenic Hope you are fine.  Thanks for the clarification. While HTML5 permits this, in practice,",https://github.com/whatwg/html/issues/11394#issuecomment-3000018599,https://github.com/whatwg/html/issues/11394,Avoid Using <div> Inside <a> – Violates HTML5 Semantics,2025-06-24T11:50:16Z,mtechamit
2999768057,whatwg/html,"See https://github.com/WICG/proposals/issues/216. It takes a lot of inspiration from the discussion ",https://github.com/whatwg/html/issues/2791#issuecomment-2999768057,https://github.com/whatwg/html/issues/2791,Client side include feature for HTML,2025-06-24T10:44:51Z,noamr
2999767630,whatwg/html,See https://github.com/WICG/proposals/issues/216,https://github.com/whatwg/html/issues/2142#issuecomment-2999767630,https://github.com/whatwg/html/issues/2142,A way to stream content into an element,2025-06-24T10:44:41Z,noamr
2999720672,mozilla/standards-positions,cc @dholbert / @jwatt / @alaskanemily / @jfkthame   I think this is fine.,https://github.com/mozilla/standards-positions/issues/1258#issuecomment-2999720672,https://github.com/mozilla/standards-positions/issues/1258,Expose unprintable areas via CSS,2025-06-24T10:28:04Z,emilio
2999585371,whatwg/html,Once .source retargeting is sorted out.,https://github.com/whatwg/html/pull/11255#issuecomment-2999585371,https://github.com/whatwg/html/pull/11255,Make command events not composed,2025-06-24T09:43:55Z,smaug----
2999552016,whatwg/html,"> Why It's a Problem: >  > 1. The  tag is inline by default, and putting a block-level element like ",https://github.com/whatwg/html/issues/11394#issuecomment-2999552016,https://github.com/whatwg/html/issues/11394,Avoid Using <div> Inside <a> – Violates HTML5 Semantics,2025-06-24T09:32:39Z,domenic
2999376911,w3ctag/design-reviews,"Hey @pejic!  The explainer covers the motivation well, but doesn't really explain how web developers",https://github.com/w3ctag/design-reviews/issues/1097#issuecomment-2999376911,https://github.com/w3ctag/design-reviews/issues/1097,Browser Bound Keys for Secure Payment Confirmation,2025-06-24T08:41:33Z,yoavweiss
2998818595,whatwg/dom,"AFAIK they use moveBefore already and you can move before any node, including text and comments so I",https://github.com/whatwg/dom/issues/1385#issuecomment-2998818595,https://github.com/whatwg/dom/issues/1385,[moveBefore] Consider making this a feature of Node not ParentNode,2025-06-24T05:04:04Z,WebReflection
2998793809,whatwg/html,"Sorry for the big delay, been able to spend less time browser hacking in my free time than I would l",https://github.com/whatwg/html/issues/11340#issuecomment-2998793809,https://github.com/whatwg/html/issues/11340,WorkerGlobal scope's URL accessed for fetch blob partitioning before being set,2025-06-24T04:48:06Z,shannonbooth
2998567441,mozilla/standards-positions,"As of 2024-09-20, Firefox de-facto supports this with the resolution of [bug 1910206](https://bugzil",https://github.com/mozilla/standards-positions/issues/1033#issuecomment-2998567441,https://github.com/mozilla/standards-positions/issues/1033,WebGPU: GPUAdapter info attribute,2025-06-24T02:33:37Z,ErichDonGubler
2998497217,whatwg/html,My reaction is the same as @tabatkins. This is more than I anticipated in https://github.com/whatwg/,https://github.com/whatwg/html/pull/11392#issuecomment-2998497217,https://github.com/whatwg/html/pull/11392,Markup: Wrap algorithms in <div> tags,2025-06-24T01:50:30Z,domenic
2998494245,whatwg/html,"> Out of curiosity, why use a different attribute marker to indicate an algorithm than what Bikeshed",https://github.com/whatwg/html/pull/11392#issuecomment-2998494245,https://github.com/whatwg/html/pull/11392,Markup: Wrap algorithms in <div> tags,2025-06-24T01:48:46Z,jmdyck
2998269433,webkit/standards-positions,I've drafted an [explainer](https://github.com/WebAudio/web-speech-api/pull/167) that contains a few,https://github.com/WebKit/standards-positions/issues/517#issuecomment-2998269433,https://github.com/WebKit/standards-positions/issues/517,Web Speech API Contextual Biasing,2025-06-23T23:28:13Z,evanbliu
2998115943,w3ctag/design-reviews,"It sounds like the central question you are asking is whether the use case is genuinely compelling, ",https://github.com/w3ctag/design-reviews/issues/1092#issuecomment-2998115943,https://github.com/w3ctag/design-reviews/issues/1092,Web Authentication Immediate Mediation,2025-06-23T22:14:38Z,kenrb
2998014093,whatwg/html,@annevk It's true that the HTML Standard doesn't mandate that the second input should be inaccessibl,https://github.com/whatwg/html/issues/7168#issuecomment-2998014093,https://github.com/whatwg/html/issues/7168,Behavior of disabled with input type=radio and option is unclear,2025-06-23T21:35:11Z,SB3NDER
2997955536,w3ctag/design-reviews,"@Shrinivassab, I must confess that my framework-fu is very weak, so I can't give you substantial ans",https://github.com/w3ctag/design-reviews/issues/1111#issuecomment-2997955536,https://github.com/w3ctag/design-reviews/issues/1111,Declarative Interactions,2025-06-23T21:12:18Z,szager-chromium
2997782023,mozilla/standards-positions,Note this position refers to the [explainer.md](https://github.com/WICG/PEPC/blob/9dee065fa7e28578a5,https://github.com/mozilla/standards-positions/issues/908#issuecomment-2997782023,https://github.com/mozilla/standards-positions/issues/908,Page Embedded Permission Control,2025-06-23T19:59:50Z,jan-ivar
2997730027,mozilla/standards-positions,I'm sorry - I'm new to these processes. Why isn't Kelsey's comment of 2024-7-8 sufficient to close t,https://github.com/mozilla/standards-positions/issues/1033#issuecomment-2997730027,https://github.com/mozilla/standards-positions/issues/1033,WebGPU: GPUAdapter info attribute,2025-06-23T19:39:31Z,jimblandy
2997213206,webkit/standards-positions,"Safari's rendering of find-in-page search results is not representable in CSS, so such a pseudo seem",https://github.com/WebKit/standards-positions/issues/421#issuecomment-2997213206,https://github.com/WebKit/standards-positions/issues/421," CSS highlight pseudo ::search-text",2025-06-23T16:59:35Z,hober
2997210579,whatwg/html,"Out of curiosity, why use a different attribute marker to indicate an algorithm than what Bikeshed u",https://github.com/whatwg/html/pull/11392#issuecomment-2997210579,https://github.com/whatwg/html/pull/11392,Markup: Wrap algorithms in <div> tags,2025-06-23T16:58:50Z,tabatkins
2996911644,whatwg/html,"I think it's one of these cases where the website itself has to be fixed. The only way to ""fix"" it o",https://github.com/whatwg/html/issues/6235#issuecomment-2996911644,https://github.com/whatwg/html/issues/6235,"Escape ""<"" and "">"" in attributes when serializing HTML",2025-06-23T15:22:28Z,securityMB
2996803049,whatwg/html,Is there a fix you envision other than asking the website to make it work on their end?,https://github.com/whatwg/html/issues/6235#issuecomment-2996803049,https://github.com/whatwg/html/issues/6235,"Escape ""<"" and "">"" in attributes when serializing HTML",2025-06-23T14:51:00Z,mozfreddyb
2996719613,whatwg/dom,Note to self: note that this resolves #1366 when merging.,https://github.com/whatwg/dom/pull/1384#issuecomment-2996719613,https://github.com/whatwg/dom/pull/1384,Copy document's allow declarative shadow roots,2025-06-23T14:27:54Z,annevk
2996636728,webkit/standards-positions,"Colleagues and I support the general idea here, but we'll wait with a formal position until the prop",https://github.com/WebKit/standards-positions/issues/513#issuecomment-2996636728,https://github.com/WebKit/standards-positions/issues/513,Customized built-in elements via elementInternals.type,2025-06-23T14:04:56Z,annevk
2996630762,w3c/pointerevents,@szmarczak this PR was merged a while ago and I do encourage you to file a new issue as that might g,https://github.com/w3c/pointerevents/pull/318#issuecomment-2996630762,https://github.com/w3c/pointerevents/pull/318,Add secure context criteria to pointerrawupdate and getCoalescedEvents,2025-06-23T14:03:24Z,NavidZ
2995956184,whatwg/html,Looks like https://source.chromium.org/chromium/chromium/src/+/main:third_party/blink/web_tests/http,https://github.com/whatwg/html/issues/8013#issuecomment-2995956184,https://github.com/whatwg/html/issues/8013,Prevent top navigations without user activation in some circumstances?,2025-06-23T10:55:57Z,annevk
2995804876,whatwg/html,"> That would allow the custom element itself to be the anchor, right?  Indeed, without having to rel",https://github.com/whatwg/html/issues/10155#issuecomment-2995804876,https://github.com/whatwg/html/issues/10155,It's not clear how constraint validation works for FACE if the 'validation anchor' is null,2025-06-23T10:10:10Z,annevk
2995669237,whatwg/html,Looks like we have the first bug report caused by this change: https://issues.chromium.org/issues/42,https://github.com/whatwg/html/issues/6235#issuecomment-2995669237,https://github.com/whatwg/html/issues/6235,"Escape ""<"" and "">"" in attributes when serializing HTML",2025-06-23T09:30:46Z,securityMB
2995551935,whatwg/dom,"Yeah, this should be handled by the CSS WG.",https://github.com/whatwg/dom/issues/1383#issuecomment-2995551935,https://github.com/whatwg/dom/issues/1383,Proposal: matchContainer API,2025-06-23T08:54:11Z,annevk
2995442692,mozilla/standards-positions,"I think the way Martin phrased it ""spontaneously without any interaction"" it is definitely true.  Th",https://github.com/mozilla/standards-positions/issues/1245#issuecomment-2995442692,https://github.com/mozilla/standards-positions/issues/1245,Page Embedded Permission Control (Take 2),2025-06-23T08:26:58Z,simon-friedberger
2995368654,webkit/standards-positions,"I discussed this with colleagues and we suggest resolving this as ""position: support"" one week from ",https://github.com/WebKit/standards-positions/issues/518#issuecomment-2995368654,https://github.com/WebKit/standards-positions/issues/518,__Http- and __HostHttp- cookie prefixes,2025-06-23T08:02:38Z,annevk
2995192953,mozilla/standards-positions,"Got it, thanks for clarifying.   > That doesn't mean that it wasn't a mistake. That a site can turn ",https://github.com/mozilla/standards-positions/issues/1245#issuecomment-2995192953,https://github.com/mozilla/standards-positions/issues/1245,Page Embedded Permission Control (Take 2),2025-06-23T07:04:34Z,mharbach
2995179832,mozilla/standards-positions,"> on my second visit, the camera turns on without me clicking any button on the page  This is not so",https://github.com/mozilla/standards-positions/issues/1245#issuecomment-2995179832,https://github.com/mozilla/standards-positions/issues/1245,Page Embedded Permission Control (Take 2),2025-06-23T06:59:32Z,martinthomson
2995168039,mozilla/standards-positions,> I see nothing in PEPC or our feedback that is threatening the persistent permission option in brow,https://github.com/mozilla/standards-positions/issues/1245#issuecomment-2995168039,https://github.com/mozilla/standards-positions/issues/1245,Page Embedded Permission Control (Take 2),2025-06-23T06:54:59Z,mharbach
2994885216,webkit/standards-positions,"Although the use case seems interesting, the part linked to in the spec doesn't answer how the value",https://github.com/WebKit/standards-positions/issues/517#issuecomment-2994885216,https://github.com/WebKit/standards-positions/issues/517,Web Speech API Contextual Biasing,2025-06-23T04:33:32Z,marcoscaceres
