id,repo,body,url,issue_url,issue_title,created_at,user
3033899218,w3ctag/design-reviews,"Password credentials are not cross-site (or cross-origin?) in the same way that this is, but using t",https://github.com/w3ctag/design-reviews/issues/1092#issuecomment-3033899218,https://github.com/w3ctag/design-reviews/issues/1092,Web Authentication Immediate Mediation,2025-07-03T22:57:47Z,martinthomson
3033773998,w3ctag/design-reviews,We [discussed this proposal this week](https://github.com/w3ctag/meetings/blob/gh-pages/2025/telcons,https://github.com/w3ctag/design-reviews/issues/1092#issuecomment-3033773998,https://github.com/w3ctag/design-reviews/issues/1092,Web Authentication Immediate Mediation,2025-07-03T21:50:55Z,jyasskin
3032799366,WICG/webcomponents,"The lower level of the templating proposal is DOM Parts with attach settable ranges to the DOM. The ",https://github.com/WICG/webcomponents/issues/1106#issuecomment-3032799366,https://github.com/WICG/webcomponents/issues/1106,agAST: A counter-proposal to dom-parts?,2025-07-03T15:59:49Z,justinfagnani
3032500404,whatwg/html,cancelling.,https://github.com/whatwg/html/issues/11408#issuecomment-3032500404,https://github.com/whatwg/html/issues/11408,Upcoming WHATNOT meeting on 2025-07-03,2025-07-03T14:32:52Z,cwilso
3032485555,whatwg/html,"@evilpie in the previous TC39 meeting, this proposal received stage 4.",https://github.com/whatwg/html/pull/11425#issuecomment-3032485555,https://github.com/whatwg/html/pull/11425,Make SuppressedError and AggregateError serializable,2025-07-03T14:28:30Z,zloirock
3032479968,whatwg/html,> I personally don't think there is much point in adding these without also specifying that their pr,https://github.com/whatwg/html/pull/11425#issuecomment-3032479968,https://github.com/whatwg/html/pull/11425,Make SuppressedError and AggregateError serializable,2025-07-03T14:26:44Z,anonrig
3032470695,whatwg/html,`SuppressedError` is part of the [Explicit Resource Management proposal](https://github.com/tc39/pro,https://github.com/whatwg/html/pull/11425#issuecomment-3032470695,https://github.com/whatwg/html/pull/11425,Make SuppressedError and AggregateError serializable,2025-07-03T14:23:46Z,evilpie
3032243539,whatwg/html,WebKit is supportive of doing this. I'm happy to help out with review if that is all that is remaini,https://github.com/whatwg/html/pull/5749#issuecomment-3032243539,https://github.com/whatwg/html/pull/5749,Expand JS error serialization,2025-07-03T13:19:25Z,annevk
3032238575,whatwg/html,WebKit is supportive of doing this.,https://github.com/whatwg/html/pull/11425#issuecomment-3032238575,https://github.com/whatwg/html/pull/11425,Make SuppressedError and AggregateError serializable,2025-07-03T13:17:45Z,annevk
3031915892,mozilla/standards-positions,I have made a similar proposal here: https://github.com/WICG/proposals/issues/215,https://github.com/mozilla/standards-positions/issues/1015#issuecomment-3031915892,https://github.com/mozilla/standards-positions/issues/1015,Web Translation API,2025-07-03T11:26:20Z,collimarco
3031706775,w3ctag/design-reviews,"We discussed this at the TAG breakout just now. This seems like a useful feature, so thanks for work",https://github.com/w3ctag/design-reviews/issues/1113#issuecomment-3031706775,https://github.com/w3ctag/design-reviews/issues/1113,Expose resource dependency in Resource Timing,2025-07-03T10:15:39Z,yoavweiss
3031657526,whatwg/dom,@otherdaniel I believe this spec PR fully matches your proposals to call TT as early as possible now,https://github.com/whatwg/dom/pull/1268#issuecomment-3031657526,https://github.com/whatwg/dom/pull/1268,Integrate Trusted Types enforcement into attribute handling,2025-07-03T09:58:44Z,lukewarlow
3031573010,whatwg/html,"> Fun fact, the Ruffle Flash emulator had to stop polyfilling these elements by using this code so w",https://github.com/whatwg/html/issues/2390#issuecomment-3031573010,https://github.com/whatwg/html/issues/2390,Standardize YouTube embed rewriting?,2025-07-03T09:33:21Z,RByers
3031560170,w3ctag/design-reviews,"hi @pejic, the TAG doesn't feel it can meaningfully comment on this, as it's a bit ""too in the weeds",https://github.com/w3ctag/design-reviews/issues/1097#issuecomment-3031560170,https://github.com/w3ctag/design-reviews/issues/1097,Browser Bound Keys for Secure Payment Confirmation,2025-07-03T09:29:06Z,marcoscaceres
3031554269,w3ctag/design-reviews,TAG review at https://github.com/w3c/strategy/issues/435#issuecomment-3031549761,https://github.com/w3ctag/design-reviews/issues/1112#issuecomment-3031554269,https://github.com/w3ctag/design-reviews/issues/1112,[wg/social] Social Web Working Group new charter,2025-07-03T09:27:05Z,csarven
3031382417,whatwg/webidl,"We do implement it precisely, and do throw when `arguments.length` is 0, but it seems ok from our si",https://github.com/whatwg/webidl/pull/1498#issuecomment-3031382417,https://github.com/whatwg/webidl/pull/1498,Do not throw if the attribute setter is called with no arguments,2025-07-03T08:35:17Z,lucacasonato
3031118676,mozilla/standards-positions,FYI Chromium is now shipping the per-file version of this proposal and we're working on the per-func,https://github.com/mozilla/standards-positions/issues/780#issuecomment-3031118676,https://github.com/mozilla/standards-positions/issues/780,Explicit compile hints,2025-07-03T07:03:48Z,marjakh
3031118470,webkit/standards-positions,FYI Chromium is now shipping the per-file version of this proposal and we're working on the per-func,https://github.com/WebKit/standards-positions/issues/172#issuecomment-3031118470,https://github.com/WebKit/standards-positions/issues/172,Explicit compile hints,2025-07-03T07:03:44Z,marjakh
3030998960,whatwg/webidl,@lucacasonato and @jasnell should be able to comment for Deno and Node.  Changing WPT as part of F,https://github.com/whatwg/webidl/pull/1498#issuecomment-3030998960,https://github.com/whatwg/webidl/pull/1498,Do not throw if the attribute setter is called with no arguments,2025-07-03T06:18:33Z,annevk
3030941812,whatwg/webidl,Thank you for reviewing!  I have some questions:   * what should I do for Deno and Node.js ?  I'm,https://github.com/whatwg/webidl/pull/1498#issuecomment-3030941812,https://github.com/whatwg/webidl/pull/1498,Do not throw if the attribute setter is called with no arguments,2025-07-03T05:55:38Z,arai-a
3030801249,whatwg/dom,"No longer being a superset of XML seems quite concerning to me. However, I can't get `a::b` to work ",https://github.com/whatwg/dom/issues/1387#issuecomment-3030801249,https://github.com/whatwg/dom/issues/1387,"Misalignment between spec and WPT for ""validate and extract""",2025-07-03T05:24:33Z,annevk
3030751525,WICG/webcomponents,"Yeah, you're quite right, nothing updates the DOM here. It wasn't and isn't my personal design goal ",https://github.com/WICG/webcomponents/issues/1106#issuecomment-3030751525,https://github.com/WICG/webcomponents/issues/1106,agAST: A counter-proposal to dom-parts?,2025-07-03T04:58:17Z,conartist6
3030673985,whatwg/dom,"Okay cool, based on the above, I've pushed a second commit to https://github.com/web-platform-tests/",https://github.com/whatwg/dom/issues/1387#issuecomment-3030673985,https://github.com/whatwg/dom/issues/1387,"Misalignment between spec and WPT for ""validate and extract""",2025-07-03T04:37:21Z,shannonbooth
3030582724,whatwg/dom,"Ah, apologies, yeah I was also thinking about the result local name",https://github.com/whatwg/dom/issues/1387#issuecomment-3030582724,https://github.com/whatwg/dom/issues/1387,"Misalignment between spec and WPT for ""validate and extract""",2025-07-03T04:06:42Z,shannonbooth
3030579286,whatwg/dom,"To be clear, when I say ""valid"", I mean, the implementation/tests say that it is a valid string, i.e",https://github.com/whatwg/dom/issues/1387#issuecomment-3030579286,https://github.com/whatwg/dom/issues/1387,"Misalignment between spec and WPT for ""validate and extract""",2025-07-03T04:04:52Z,domenic
3030571911,whatwg/dom,"> (no namespace, :foo): > > Previously: invalid character error. > After my spec update: invalid cha",https://github.com/whatwg/dom/issues/1387#issuecomment-3030571911,https://github.com/whatwg/dom/issues/1387,"Misalignment between spec and WPT for ""validate and extract""",2025-07-03T03:58:25Z,shannonbooth
3030301462,whatwg/dom,"So to make sure I understand:  (no namespace, `:foo`):  - Previously: invalid character error. - Aft",https://github.com/whatwg/dom/issues/1387#issuecomment-3030301462,https://github.com/whatwg/dom/issues/1387,"Misalignment between spec and WPT for ""validate and extract""",2025-07-03T02:18:53Z,domenic
3030124368,whatwg/html,"Thanks for your contribution!  Per my last message, there are two major blockers:  - Creating a ",https://github.com/whatwg/html/pull/11425#issuecomment-3030124368,https://github.com/whatwg/html/pull/11425,Make SuppressedError and AggregateError serializable,2025-07-03T01:43:56Z,domenic
3030031719,whatwg/html,@domenic thanks for the review. This is my first time contributing to html spec so any help/guidance,https://github.com/whatwg/html/pull/11425#issuecomment-3030031719,https://github.com/whatwg/html/pull/11425,Make SuppressedError and AggregateError serializable,2025-07-03T01:28:40Z,anonrig
3029973890,w3ctag/design-reviews,"> Done, thanks!  Thanks! And sorry, one more, please: @una.",https://github.com/w3ctag/design-reviews/issues/1058#issuecomment-3029973890,https://github.com/w3ctag/design-reviews/issues/1058,The `interesttarget` attribute,2025-07-03T01:08:44Z,mfreed7
3029579206,whatwg/dom,"Whoops, I should have disallowed empty namespace prefixes. I'll fix that.    > If we strictly split ",https://github.com/whatwg/dom/issues/1387#issuecomment-3029579206,https://github.com/whatwg/dom/issues/1387,"Misalignment between spec and WPT for ""validate and extract""",2025-07-02T22:56:57Z,josepharhar
3029534511,w3ctag/design-reviews,"Done, thanks!",https://github.com/w3ctag/design-reviews/issues/1058#issuecomment-3029534511,https://github.com/w3ctag/design-reviews/issues/1058,The `interesttarget` attribute,2025-07-02T22:41:24Z,jyasskin
3029434603,w3ctag/design-reviews,"> [@mfreed7](https://github.com/mfreed7), as I discussed with you directly, the TAG would like to in",https://github.com/w3ctag/design-reviews/issues/1058#issuecomment-3029434603,https://github.com/w3ctag/design-reviews/issues/1058,The `interesttarget` attribute,2025-07-02T21:58:49Z,mfreed7
3029407255,whatwg/html,"No issues pending, should we cancel?",https://github.com/whatwg/html/issues/11408#issuecomment-3029407255,https://github.com/whatwg/html/issues/11408,Upcoming WHATNOT meeting on 2025-07-03,2025-07-02T21:44:01Z,cwilso
3029364131,WICG/webcomponents,"I second @Westbrook's comment. The thing that makes DOM Parts useful is that they attach to the DOM ",https://github.com/WICG/webcomponents/issues/1106#issuecomment-3029364131,https://github.com/WICG/webcomponents/issues/1106,agAST: A counter-proposal to dom-parts?,2025-07-02T21:23:39Z,justinfagnani
3029125842,WICG/webcomponents,"If you're interested in gathering feedback, it might be useful to share something in the form of a m",https://github.com/WICG/webcomponents/issues/1106#issuecomment-3029125842,https://github.com/WICG/webcomponents/issues/1106,agAST: A counter-proposal to dom-parts?,2025-07-02T19:48:38Z,Westbrook
3029107835,mozilla/standards-positions,I had a thought about how to potentially get the same sort of opt-in to let authors restrict their c,https://github.com/mozilla/standards-positions/issues/1258#issuecomment-3029107835,https://github.com/mozilla/standards-positions/issues/1258,Expose unprintable areas via CSS,2025-07-02T19:40:22Z,dholbert
3029089356,webkit/standards-positions,"Hi, just wanted to know if there's any news on this topic. As an update on the API, the return type ",https://github.com/WebKit/standards-positions/issues/394#issuecomment-3029089356,https://github.com/WebKit/standards-positions/issues/394,highlightsFromPoint API,2025-07-02T19:31:56Z,ffiori
3029042163,w3ctag/design-reviews,"Thank you again for the review, I really appreciate the feedback. I understand the concern, but I ag",https://github.com/w3ctag/design-reviews/issues/1043#issuecomment-3029042163,https://github.com/w3ctag/design-reviews/issues/1043,CSS.highlights.highlightsFromPoint API,2025-07-02T19:11:50Z,ffiori
3028866472,w3c/resource-timing,"> @noamr : You mentioned `font` is used by IFT, I think I should add `font` here? >  > From https:",https://github.com/w3c/resource-timing/pull/418#issuecomment-3028866472,https://github.com/w3c/resource-timing/pull/418,Edit the list of possible initiatorType values.,2025-07-02T18:13:40Z,noamr
3028812743,w3c/resource-timing,"@noamr  : You mentioned `font` is used by IFT, I think I should add `font` here?   From https://ww",https://github.com/w3c/resource-timing/pull/418#issuecomment-3028812743,https://github.com/w3c/resource-timing/pull/418,Edit the list of possible initiatorType values.,2025-07-02T17:54:03Z,guohuideng2024
3028793899,whatwg/html,"@anonrig this is a rather vague formulation. For example, Safari still does not serialize it, and in",https://github.com/whatwg/html/pull/11425#issuecomment-3028793899,https://github.com/whatwg/html/pull/11425,Make SuppressedError and AggregateError serializable,2025-07-02T17:48:22Z,zloirock
3028772132,whatwg/html,@zloirock No need to mention them one by one due to:  ``` <li><p>Any interesting accompanying dat,https://github.com/whatwg/html/pull/11425#issuecomment-3028772132,https://github.com/whatwg/html/pull/11425,Make SuppressedError and AggregateError serializable,2025-07-02T17:44:57Z,anonrig
3028751760,whatwg/html,https://github.com/whatwg/html/pull/5749,https://github.com/whatwg/html/pull/11425#issuecomment-3028751760,https://github.com/whatwg/html/pull/11425,Make SuppressedError and AggregateError serializable,2025-07-02T17:41:31Z,zloirock
3028746437,whatwg/html,`.cause` also should be serialized.,https://github.com/whatwg/html/pull/11425#issuecomment-3028746437,https://github.com/whatwg/html/pull/11425,Make SuppressedError and AggregateError serializable,2025-07-02T17:40:41Z,zloirock
3028665080,w3ctag/design-reviews,"Thank you for the explanation. We're happy with this extension, but we note that there's no long-liv",https://github.com/w3ctag/design-reviews/issues/1105#issuecomment-3028665080,https://github.com/w3ctag/design-reviews/issues/1105,ScrollIntoViewOptions container attribute,2025-07-02T17:27:02Z,jyasskin
3028648154,WICG/webcomponents,"To give you an idea of how scary general this is, it also satisfies the requirements of the JSSugar ",https://github.com/WICG/webcomponents/issues/1106#issuecomment-3028648154,https://github.com/WICG/webcomponents/issues/1106,agAST: A counter-proposal to dom-parts?,2025-07-02T17:20:52Z,conartist6
3028642555,w3ctag/design-reviews,Thanks for the discussion and for pointing out [HTML-in-Canvas](https://github.com/WICG/html-in-canv,https://github.com/w3ctag/design-reviews/issues/1095#issuecomment-3028642555,https://github.com/w3ctag/design-reviews/issues/1095,"Canvas Text Metrics for Editing, Art and Design",2025-07-02T17:18:29Z,jyasskin
3028341995,whatwg/html,cc @annevk @domenic would you mind reviewing this?  > It might also be worth to serialize `aggrega,https://github.com/whatwg/html/pull/11425#issuecomment-3028341995,https://github.com/whatwg/html/pull/11425,Make SuppressedError and AggregateError serializable,2025-07-02T15:39:55Z,anonrig
3028206420,whatwg/webidl,"Having consistency sounds good, thanks!",https://github.com/whatwg/webidl/issues/1497#issuecomment-3028206420,https://github.com/whatwg/webidl/issues/1497,The attribute setter operation mismatch between browsers for the arguments count,2025-07-02T14:59:38Z,EdgarChen
3028112168,w3c/pointerevents,> ... do you think that `dblclick` event target should not be overridden by Pointer Event's new beha,https://github.com/w3c/pointerevents/issues/507#issuecomment-3028112168,https://github.com/w3c/pointerevents/issues/507,Clarify (or override) `dblclick` event target,2025-07-02T14:32:13Z,mustaqahmed
3028081191,whatwg/dom,"Actually, I unfortunately think there are some more tests that don't align, and I don't quite unders",https://github.com/whatwg/dom/issues/1387#issuecomment-3028081191,https://github.com/whatwg/dom/issues/1387,"Misalignment between spec and WPT for ""validate and extract""",2025-07-02T14:25:04Z,shannonbooth
3027782355,whatwg/dom,That's a good point. I think we only want to move step 5 to be a substep of 4. And we want to keep t,https://github.com/whatwg/dom/issues/1387#issuecomment-3027782355,https://github.com/whatwg/dom/issues/1387,"Misalignment between spec and WPT for ""validate and extract""",2025-07-02T12:55:11Z,annevk
3027699247,whatwg/dom,"Ah, right!  But also, itlooks like https://dom.spec.whatwg.org/#valid-namespace-prefix explicitly en",https://github.com/whatwg/dom/issues/1387#issuecomment-3027699247,https://github.com/whatwg/dom/issues/1387,"Misalignment between spec and WPT for ""validate and extract""",2025-07-02T12:31:00Z,shannonbooth
3027648874,whatwg/dom,I think we could make _prefix_ always be a string if we make step 5 a substep of 4. Then we don't ne,https://github.com/whatwg/dom/issues/1387#issuecomment-3027648874,https://github.com/whatwg/dom/issues/1387,"Misalignment between spec and WPT for ""validate and extract""",2025-07-02T12:14:21Z,annevk
3027392160,whatwg/html,> Do you have a test?  I tested it on playwright and I thought it uses the same WebKit engine but lo,https://github.com/whatwg/html/issues/11423#issuecomment-3027392160,https://github.com/whatwg/html/issues/11423,Spec issue: `form` property of input controls in Shadow DOM is inconsistent across browsers,2025-07-02T10:51:23Z,mozesstumpf
3027149444,whatwg/dom,I'm not 100% if my suggested change is correct or not from the divergence in browsers on WPT and wha,https://github.com/whatwg/dom/issues/1387#issuecomment-3027149444,https://github.com/whatwg/dom/issues/1387,"Misalignment between spec and WPT for ""validate and extract""",2025-07-02T09:32:11Z,shannonbooth
3026816633,whatwg/html,"> it will be possible to author a video, canvas, and image, that will render the same on all display",https://github.com/whatwg/html/issues/11424#issuecomment-3026816633,https://github.com/whatwg/html/issues/11424,Add tone mapping parameters to CanvasRenderingContext2DSettings,2025-07-02T07:46:37Z,ccameron-chromium
3026805313,whatwg/html,Good point. I added a section clarifying the interactions.  The `dynamic-range-limit` behaves the sa,https://github.com/whatwg/html/issues/11424#issuecomment-3026805313,https://github.com/whatwg/html/issues/11424,Add tone mapping parameters to CanvasRenderingContext2DSettings,2025-07-02T07:42:41Z,ccameron-chromium
3026727514,w3ctag/design-reviews,"Thanks @drkron, I've commented on the PR (it could be more direct), but this seems good to me.",https://github.com/w3ctag/design-reviews/issues/1110#issuecomment-3026727514,https://github.com/w3ctag/design-reviews/issues/1110,windowAudio for getDisplayMedia,2025-07-02T07:15:13Z,martinthomson
3026482872,w3ctag/design-reviews,"If it's helpful to grab some time in WebAppSec, our next meeting is on the 16th. Add yourself to the",https://github.com/w3ctag/design-reviews/issues/1052#issuecomment-3026482872,https://github.com/w3ctag/design-reviews/issues/1052,Early Design Review for Device Bound Session Credentials,2025-07-02T05:15:52Z,mikewest
3026129800,whatwg/html,It could also be useful to describe the interaction of a canvas' own tone mapping with [`dynamic-ran,https://github.com/whatwg/html/issues/11424#issuecomment-3026129800,https://github.com/whatwg/html/issues/11424,Add tone mapping parameters to CanvasRenderingContext2DSettings,2025-07-02T02:23:10Z,squelart
3026108749,whatwg/html,Is `dataurl` a possibility for the `type`?,https://github.com/whatwg/html/issues/9444#issuecomment-3026108749,https://github.com/whatwg/html/issues/9444,"Import with type text, bytes, and URL",2025-07-02T02:10:32Z,gulshan
3025797205,w3ctag/design-reviews,"@mfreed7, as I discussed with you directly, the TAG would like to invite you to our [plenary](https:",https://github.com/w3ctag/design-reviews/issues/1058#issuecomment-3025797205,https://github.com/w3ctag/design-reviews/issues/1058,The `interesttarget` attribute,2025-07-01T22:56:48Z,jyasskin
3025445330,WICG/webcomponents,@svieira   > There are a number of concerns that have been voiced here that I agree with (the lack o,https://github.com/WICG/webcomponents/issues/1069#issuecomment-3025445330,https://github.com/WICG/webcomponents/issues/1069,[templates] A declarative JavaScript templating API,2025-07-01T20:43:55Z,justinfagnani
3025113442,WICG/webcomponents,There are a number of concerns that have been voiced here that I agree with (the lack of an extra la,https://github.com/WICG/webcomponents/issues/1069#issuecomment-3025113442,https://github.com/WICG/webcomponents/issues/1069,[templates] A declarative JavaScript templating API,2025-07-01T18:31:08Z,svieira
3025009905,whatwg/html,"Do you have a test? ```  <form>       <div>         <template shadowrootmode=""open"">           <sele",https://github.com/whatwg/html/issues/11423#issuecomment-3025009905,https://github.com/whatwg/html/issues/11423,Spec issue: `form` property of input controls in Shadow DOM is inconsistent across browsers,2025-07-01T17:57:00Z,annevk
3024766502,whatwg/html,"cc @whatwg/canvas ",https://github.com/whatwg/html/issues/11424#issuecomment-3024766502,https://github.com/whatwg/html/issues/11424,Add tone mapping parameters to CanvasRenderingContext2DSettings,2025-07-01T16:37:53Z,annevk
3024447448,w3ctag/design-reviews,"Ah, sorry ""have you discussed this"" meant this specific proposal, not DBSC in general. We have not d",https://github.com/w3ctag/design-reviews/issues/1052#issuecomment-3024447448,https://github.com/w3ctag/design-reviews/issues/1052,Early Design Review for Device Bound Session Credentials,2025-07-01T15:08:05Z,drubery
3024417830,w3ctag/design-reviews,Are there minutes with comments from server operators outside of Google who say they prefer this des,https://github.com/w3ctag/design-reviews/issues/1052#issuecomment-3024417830,https://github.com/w3ctag/design-reviews/issues/1052,Early Design Review for Device Bound Session Credentials,2025-07-01T15:00:29Z,jyasskin
3024385340,w3ctag/design-reviews,"We have had some contact with webappsec. This proposal has been adopted by the Working Group, and we",https://github.com/w3ctag/design-reviews/issues/1052#issuecomment-3024385340,https://github.com/w3ctag/design-reviews/issues/1052,Early Design Review for Device Bound Session Credentials,2025-07-01T14:53:43Z,drubery
3023357402,webkit/standards-positions,> I discussed the subset idea with colleagues and conservative same-origin prefetch sounds totally r,https://github.com/WebKit/standards-positions/issues/54#issuecomment-3023357402,https://github.com/WebKit/standards-positions/issues/54,Navigational prefetching and prerendering,2025-07-01T10:47:50Z,yoavweiss
3023263708,w3c/pointerevents,"@mustaqahmed So, do you think that `dblclick` event target should not be overridden by Pointer Event",https://github.com/w3c/pointerevents/issues/507#issuecomment-3023263708,https://github.com/w3c/pointerevents/issues/507,Clarify (or override) `dblclick` event target,2025-07-01T10:28:53Z,masayuki-nakano
3022752627,whatwg/html,I think the solution to serializing/deserializing adopted stylesheets should be additional options i,https://github.com/whatwg/html/issues/11364#issuecomment-3022752627,https://github.com/whatwg/html/issues/11364,Exploration of exposing stylesheets across scopes,2025-07-01T08:49:38Z,noamr
3021635286,w3ctag/design-reviews,"Rather than continue to debate on a point-by-point basis, it might help to uplevel a little.  Have y",https://github.com/w3ctag/design-reviews/issues/1052#issuecomment-3021635286,https://github.com/w3ctag/design-reviews/issues/1052,Early Design Review for Device Bound Session Credentials,2025-07-01T03:40:41Z,martinthomson
3021622854,whatwg/webidl,"Yes, +1. AFAICT, it must be easy to remove the argument count check from Chromium entirely. I'm pers",https://github.com/whatwg/webidl/issues/1497#issuecomment-3021622854,https://github.com/whatwg/webidl/issues/1497,The attribute setter operation mismatch between browsers for the arguments count,2025-07-01T03:33:06Z,yuki3
3021612289,whatwg/webidl,I was told that @caseq and @mlippautz are the people to ask about Web IDL bindings in Chromium these,https://github.com/whatwg/webidl/issues/1497#issuecomment-3021612289,https://github.com/whatwg/webidl/issues/1497,The attribute setter operation mismatch between browsers for the arguments count,2025-07-01T03:26:32Z,domenic
3021504687,whatwg/webidl,"The exhaustive test cases list here, enough to uncover inconsistencies in Chromium and Firefox, is p",https://github.com/whatwg/webidl/issues/1497#issuecomment-3021504687,https://github.com/whatwg/webidl/issues/1497,The attribute setter operation mismatch between browsers for the arguments count,2025-07-01T02:24:34Z,domenic
3020935542,whatwg/html,https://html.spec.whatwg.org/multipage/form-control-infrastructure.html#reset-the-form-owner talks a,https://github.com/whatwg/html/issues/11423#issuecomment-3020935542,https://github.com/whatwg/html/issues/11423,Spec issue: `form` property of input controls in Shadow DOM is inconsistent across browsers,2025-06-30T21:58:10Z,smaug----
3020861003,whatwg/html,"My prototype fix for https://github.com/w3c/pointerevents/issues/542 seems to fix this, so https://g",https://github.com/whatwg/html/issues/10905#issuecomment-3020861003,https://github.com/whatwg/html/issues/10905,Popovers are broken when shown in a `contextmenu` event listener,2025-06-30T21:34:14Z,josepharhar
