id,repo,body,url,issue_url,issue_title,created_at,user
2520975112,webkit/standards-positions,To update this the latest PR is at https://github.com/whatwg/html/pull/10737,https://github.com/WebKit/standards-positions/issues/329#issuecomment-2520975112,https://github.com/WebKit/standards-positions/issues/329,Dialog light dismiss,2024-12-05T17:23:48Z,lukewarlow
2520930087,whatwg/html,The CSS Working Group just discussed `Add support for CSS reading-flow`.  <details><summary>The full,https://github.com/whatwg/html/pull/10613#issuecomment-2520930087,https://github.com/whatwg/html/pull/10613,Add support for CSS reading-flow,2024-12-05T17:01:55Z,css-meeting-bot
2520739850,webkit/standards-positions,Thank you @esprehn.  Colleagues and I think this makes for a good addition to the web platform and,https://github.com/WebKit/standards-positions/issues/292#issuecomment-2520739850,https://github.com/WebKit/standards-positions/issues/292,Observable,2024-12-05T16:00:06Z,annevk
2520634922,whatwg/html,This was decided as the format to use when I was upstreaming changes. There's no consistency with ho,https://github.com/whatwg/html/issues/10824#issuecomment-2520634922,https://github.com/whatwg/html/issues/10824,"""timer initialization steps"" perform EnsureCSPDoesNotBlockStringCompilation with undefined timer value",2024-12-05T15:30:15Z,lukewarlow
2520609751,mozilla/standards-positions,"@zcorpan feel free to close this PR. It no longer applies, and as @jgraham said, mapping your curren",https://github.com/mozilla/standards-positions/pull/1034#issuecomment-2520609751,https://github.com/mozilla/standards-positions/pull/1034,Map mozilla positions to web-features IDs,2024-12-05T15:20:20Z,captainbrosset
2520563875,whatwg/html,"> OK, I wrote some tests: >  >     * https://web.mit.edu/bzbarsky/www/testcases/security/csp-javas",https://github.com/whatwg/html/issues/4651#issuecomment-2520563875,https://github.com/whatwg/html/issues/4651,CSP integration for javascript: URLs seems to be broken,2024-12-05T15:02:43Z,mbrodesser-Igalia
2520536719,whatwg/html,"For `<iframe src=""javascript:true""></iframe>`, the spec currently says to do nothing, but Chrome and",https://github.com/whatwg/html/issues/1895#issuecomment-2520536719,https://github.com/whatwg/html/issues/1895,Iframe with initial javascript: source needs to fire the load event in various cases,2024-12-05T14:52:07Z,zcorpan
2520476618,mozilla/standards-positions,"I think if we want to do this, a system where the reporter indicates which feature the proposal cove",https://github.com/mozilla/standards-positions/pull/1034#issuecomment-2520476618,https://github.com/mozilla/standards-positions/pull/1034,Map mozilla positions to web-features IDs,2024-12-05T14:28:12Z,jgraham
2520413120,mozilla/standards-positions,We have now moved to a new setup as of https://github.com/mozilla/standards-positions/pull/1063  D,https://github.com/mozilla/standards-positions/pull/1034#issuecomment-2520413120,https://github.com/mozilla/standards-positions/pull/1034,Map mozilla positions to web-features IDs,2024-12-05T14:02:51Z,zcorpan
2520196444,webkit/standards-positions,Any news on PRF?,https://github.com/WebKit/standards-positions/issues/183#issuecomment-2520196444,https://github.com/WebKit/standards-positions/issues/183,WebAuthn PRF extension,2024-12-05T12:32:34Z,mghmay
2520193064,mozilla/standards-positions,"+1 hope this gets implemented soon, my browser of choice is Firefox but if I can't use my yubikey I ",https://github.com/mozilla/standards-positions/issues/798#issuecomment-2520193064,https://github.com/mozilla/standards-positions/issues/798,WebAuthn PRF extension,2024-12-05T12:31:12Z,mghmay
2519687942,whatwg/notifications,"The full URL comparison is not accidental. On all Apple platforms, when you click a link outside the",https://github.com/whatwg/notifications/pull/213#issuecomment-2519687942,https://github.com/whatwg/notifications/pull/213,Allow notifications and actions to specify a navigable URL,2024-12-05T09:06:34Z,annevk
2519612181,whatwg/html,It looks like you're already on the invite list and have accepted the invite.,https://github.com/whatwg/html/issues/10805#issuecomment-2519612181,https://github.com/whatwg/html/issues/10805,Upcoming WHATNOT meeting on 2024-12-05,2024-12-05T08:31:27Z,annevk
2519326532,whatwg/html,Hey @tathastu871 did you ever find a solution to your issue you posted in the bitwarden thread? I ha,https://github.com/whatwg/html/issues/10751#issuecomment-2519326532,https://github.com/whatwg/html/issues/10751,Way to close stale window with null reference that browser opens after a blocked popup was allowed by user,2024-12-05T06:38:26Z,YesTrustMe
2519270224,whatwg/notifications,"This will need some flushing out, but in principle this seems like a reasonable idea to colleagues a",https://github.com/whatwg/notifications/issues/224#issuecomment-2519270224,https://github.com/whatwg/notifications/issues/224,Allow each window to handle notification click without service worker,2024-12-05T06:13:22Z,annevk
2519012975,WICG/webcomponents,"Apologies if I missed an earlier resolution on these issues, but I have come across some other poten",https://github.com/WICG/webcomponents/issues/1086#issuecomment-2519012975,https://github.com/WICG/webcomponents/issues/1086,Reference Target Tracking Issue,2024-12-05T03:31:54Z,alice
2518996203,whatwg/html,I've started compiling some rough notes on the work I think would need to happen in the various spec,https://github.com/whatwg/html/issues/10707#issuecomment-2518996203,https://github.com/whatwg/html/issues/10707,Reference Target,2024-12-05T03:12:57Z,alice
2518980143,whatwg/html,I'd like to attend.,https://github.com/whatwg/html/issues/10805#issuecomment-2518980143,https://github.com/whatwg/html/issues/10805,Upcoming WHATNOT meeting on 2024-12-05,2024-12-05T02:56:54Z,schenney-chromium
2518891189,whatwg/html,> > Did you see my comments on [#9373 (comment)](https://github.com/whatwg/html/issues/9373#issuecom,https://github.com/whatwg/html/pull/10737#issuecomment-2518891189,https://github.com/whatwg/html/pull/10737,Add dialog light dismiss behavior,2024-12-05T01:29:17Z,mfreed7
2518761598,whatwg/html,I've compared the results of the [Intl.Segmenter](https://tc39.es/ecma402/#segmenter-objects) `segme,https://github.com/whatwg/html/issues/10677#issuecomment-2518761598,https://github.com/whatwg/html/issues/10677,Canvas TextMetrics additions for editing and text styling,2024-12-04T23:25:13Z,schenney-chromium
2518691459,whatwg/html,This behavior for chromium and webkit was implmented here: - https://chromium.googlesource.com/chro,https://github.com/whatwg/html/issues/8189#issuecomment-2518691459,https://github.com/whatwg/html/issues/8189,Rendering <select> as a listbox is a one-line widget that opens a popup on iOS and Android,2024-12-04T22:30:13Z,josepharhar
2518578246,whatwg/html,I think this is missing a required spec change: https://html.spec.whatwg.org/multipage/parsing.html#,https://github.com/whatwg/html/pull/10557#issuecomment-2518578246,https://github.com/whatwg/html/pull/10557,Relax `<select>` parser,2024-12-04T21:16:28Z,lukewarlow
2518537827,whatwg/html,"> I would like to discuss this one more time briefly during the CSS + WHATWG call. In particular to ",https://github.com/whatwg/html/pull/10613#issuecomment-2518537827,https://github.com/whatwg/html/pull/10613,Add support for CSS reading-flow,2024-12-04T20:53:05Z,fantasai
2518422857,whatwg/html,I added accessibility related PRs to the OP,https://github.com/whatwg/html/issues/9799#issuecomment-2518422857,https://github.com/whatwg/html/issues/9799,Customizable `<select>` element,2024-12-04T19:48:03Z,josepharhar
2518421389,WICG/webcomponents,"This change to using a default role of ""none"" to remove these elements from the a11y tree can now be",https://github.com/WICG/webcomponents/issues/1073#issuecomment-2518421389,https://github.com/WICG/webcomponents/issues/1073,Web components authors are currently using ARIA in problematic ways that lead to duplicate announcements,2024-12-04T19:47:17Z,aleventhal
2518222083,w3c/pointerevents,Today the PEWG reached the consensus that the PointerEvents spec should match the UIEvent spec behav,https://github.com/w3c/pointerevents/issues/529#issuecomment-2518222083,https://github.com/w3c/pointerevents/issues/529,Mouse and Pointer events from a stationary mouse,2024-12-04T18:29:02Z,mustaqahmed
2518174083,whatwg/html,I edited the image locally by essentially replacing the text. Seems to look good enough.  I'm no l,https://github.com/whatwg/html/pull/5826#issuecomment-2518174083,https://github.com/whatwg/html/pull/5826,Reference even more baseline concepts in CSS Inline Layout,2024-12-04T18:06:30Z,annevk
2518156445,whatwg/html,"Thanks for taking a look and making the demo page!  > shows that body element gets the click  I ",https://github.com/whatwg/html/issues/10762#issuecomment-2518156445,https://github.com/whatwg/html/issues/10762,How to spec user interaction for select,2024-12-04T17:57:36Z,josepharhar
2517976487,whatwg/html,"Re comment: https://github.com/whatwg/html/pull/10613#pullrequestreview-2465972149 I looked at the ",https://github.com/whatwg/html/pull/10613#issuecomment-2517976487,https://github.com/whatwg/html/pull/10613,Add support for CSS reading-flow,2024-12-04T16:37:49Z,dizhang168
2517964339,w3c/pointerevents,"While it's not particularly common on the web to have multi-button interactions, there are many game",https://github.com/w3c/pointerevents/issues/530#issuecomment-2517964339,https://github.com/w3c/pointerevents/issues/530,Interop: major browsers fire click/auxclick events differently for chorded buttons,2024-12-04T16:32:30Z,flackr
2517962813,whatwg/webidl,"Maybe, but then https://url.spec.whatwg.org/#dom-url-href cannot use it. https://fetch.spec.whatwg.o",https://github.com/whatwg/webidl/issues/1454#issuecomment-2517962813,https://github.com/whatwg/webidl/issues/1454,Consider adding a URLString type,2024-12-04T16:31:51Z,annevk
2517901540,whatwg/webidl,I should go look at the prose for several of these to make sure this is plausible (but I won't be ab,https://github.com/whatwg/webidl/issues/1454#issuecomment-2517901540,https://github.com/whatwg/webidl/issues/1454,Consider adding a URLString type,2024-12-04T16:12:40Z,jyasskin
2517467150,w3c/pointerevents,We now have WPT coverage for this: [pointerevent_pointercapture_in_frame.html](https://wpt.fyi/resul,https://github.com/w3c/pointerevents/pull/300#issuecomment-2517467150,https://github.com/w3c/pointerevents/pull/300,Define active document for the active pointers,2024-12-04T13:51:53Z,mustaqahmed
2517461307,mozilla/standards-positions,I have already updated `rationale` with a summary of that comment. `mozPositionDetail` got refactore,https://github.com/mozilla/standards-positions/pull/1104#issuecomment-2517461307,https://github.com/mozilla/standards-positions/pull/1104,FedCM Update,2024-12-04T13:50:13Z,bvandersloot-mozilla
2517446573,webkit/standards-positions,Also cross-linking WebKit Bugzilla issue: https://bugs.webkit.org/show_bug.cgi?id=264720 (missing fr,https://github.com/WebKit/standards-positions/issues/231#issuecomment-2517446573,https://github.com/WebKit/standards-positions/issues/231,css-ui `field-sizing` property,2024-12-04T13:45:40Z,myfonj
2517262032,whatwg/webidl,I doubt most of these places can automatically convert to a URL record? I could be missing something,https://github.com/whatwg/webidl/issues/1454#issuecomment-2517262032,https://github.com/whatwg/webidl/issues/1454,Consider adding a URLString type,2024-12-04T12:50:40Z,annevk
2517158423,w3c/pointerevents,"Hmm, no idea which branch I should have used.  And I was anyhow trying out the builtin github editor",https://github.com/w3c/pointerevents/pull/531#issuecomment-2517158423,https://github.com/w3c/pointerevents/pull/531,"Clarify that click, auxclick and contextmenu get their .button and .buttons behavior from UIEvents, https://github.com/w3c/pointerevents/issues/513",2024-12-04T12:05:08Z,smaug----
2516990775,whatwg/webidl,Is https://w3ctag.github.io/design-principles/#idl-string-types a sufficient fix for this?,https://github.com/whatwg/webidl/issues/84#issuecomment-2516990775,https://github.com/whatwg/webidl/issues/84,provide clearer advice about USVString vs. DOMString,2024-12-04T11:04:01Z,jyasskin
2516637145,whatwg/html,"> As asked on Chat, is there an a11y PR for this?  There is: https://github.com/w3c/aria/pull/2354",https://github.com/whatwg/html/pull/9841#issuecomment-2516637145,https://github.com/whatwg/html/pull/9841,Add commandfor & command attributes to HTMLButtonElement,2024-12-04T09:11:04Z,keithamus
2516558379,whatwg/html,I'm not seeing anything about a11y in OP. I kinda doubt we can do this feature without any changes t,https://github.com/whatwg/html/issues/9799#issuecomment-2516558379,https://github.com/whatwg/html/issues/9799,Customizable `<select>` element,2024-12-04T08:39:09Z,annevk
2516472041,whatwg/html,"Ah thank you – I'll test this in my use case, which needs it every frame, and update the code in the",https://github.com/whatwg/html/issues/9721#issuecomment-2516472041,https://github.com/whatwg/html/issues/9721,We need something like `requestFinalFrame()` to run logic after all `*Observer` callbacks,2024-12-04T08:04:10Z,StephenHaney
2516465365,whatwg/html,"(Fwiw, I don't see this proposal competing with command/commandfor, but rather complementary to it, ",https://github.com/whatwg/html/issues/10499#issuecomment-2516465365,https://github.com/whatwg/html/issues/10499,Toggle (show/hide) button,2024-12-04T08:01:19Z,nt1m
2516462578,whatwg/html,"As asked on Chat, is there an a11y PR for this?",https://github.com/whatwg/html/pull/9841#issuecomment-2516462578,https://github.com/whatwg/html/pull/9841,Add commandfor & command attributes to HTMLButtonElement,2024-12-04T07:59:52Z,annevk
2516456305,whatwg/html,@StephenHaney you don't need an rAF loop nor to dirty your layout by resizing this div. `ResizeObser,https://github.com/whatwg/html/issues/9721#issuecomment-2516456305,https://github.com/whatwg/html/issues/9721,We need something like `requestFinalFrame()` to run logic after all `*Observer` callbacks,2024-12-04T07:56:46Z,Kaiido
2516428982,whatwg/html,I created a [loopBeforePaint](https://github.com/StephenHaney/loopBeforePaint) helper repo as a work,https://github.com/whatwg/html/issues/9721#issuecomment-2516428982,https://github.com/whatwg/html/issues/9721,We need something like `requestFinalFrame()` to run logic after all `*Observer` callbacks,2024-12-04T07:44:07Z,StephenHaney
2516367418,mozilla/standards-positions,I think that it makes sense to take a positive position on finding out the Web compat constraints fo,https://github.com/mozilla/standards-positions/issues/1086#issuecomment-2516367418,https://github.com/mozilla/standards-positions/issues/1086,Relax `<select>` parser,2024-12-04T07:06:52Z,hsivonen
2516197437,whatwg/html,"Oh my goodness, what a great early Christmas gift!!  @annevk, do you want to take a look? I can he",https://github.com/whatwg/html/pull/10818#issuecomment-2516197437,https://github.com/whatwg/html/pull/10818,Make named window lookup more precise and correct BCG swap logic,2024-12-04T04:57:47Z,domenic
2516098430,whatwg/html,I think it would be worth pursuing this as it reduces the cognitive load for the mini-language insid,https://github.com/whatwg/html/issues/10499#issuecomment-2516098430,https://github.com/whatwg/html/issues/10499,Toggle (show/hide) button,2024-12-04T03:34:52Z,nt1m
2516043857,whatwg/html,Happy for this to be closed and with the issue kept here as a reference or point of discussion,https://github.com/whatwg/html/issues/10815#issuecomment-2516043857,https://github.com/whatwg/html/issues/10815,"Should `input[type=""search""]` (and other types) allow `popovertarget` ?",2024-12-04T02:40:02Z,Techn1x
2516043243,whatwg/html,"Thanks, these are all fair points you make, and I'm glad it was discussed at time of creation.  > ",https://github.com/whatwg/html/issues/10815#issuecomment-2516043243,https://github.com/whatwg/html/issues/10815,"Should `input[type=""search""]` (and other types) allow `popovertarget` ?",2024-12-04T02:39:21Z,Techn1x
2516028160,whatwg/html,"> Do you think this path sounds good @domenic?  I think it sounds reasonable.  But, I want to ta",https://github.com/whatwg/html/issues/10099#issuecomment-2516028160,https://github.com/whatwg/html/issues/10099,Navigation: DocumentState request referrer is not set for about:srcdoc,2024-12-04T02:25:30Z,domenic
2515860172,whatwg/html,"> Is there a corresponding accessibility PR? This seems like the kind of feature that needs one.  ",https://github.com/whatwg/html/pull/9778#issuecomment-2515860172,https://github.com/whatwg/html/pull/9778,Add popover=hint,2024-12-04T00:22:40Z,mfreed7
2515790163,whatwg/html,Click event is dispatched to the common ancestor of *down/*up. https://mozilla.pettay.fi/moztests/s,https://github.com/whatwg/html/issues/10762#issuecomment-2515790163,https://github.com/whatwg/html/issues/10762,How to spec user interaction for select,2024-12-03T23:20:37Z,smaug----
2515765933,whatwg/html,"> One thing to define is how click works on options - current Canary dispatches click to the common ",https://github.com/whatwg/html/issues/10762#issuecomment-2515765933,https://github.com/whatwg/html/issues/10762,How to spec user interaction for select,2024-12-03T23:11:46Z,josepharhar
2515400141,mozilla/standards-positions,any update @beurdouche @mozfreddyb @yoavweiss ?,https://github.com/mozilla/standards-positions/issues/1010#issuecomment-2515400141,https://github.com/mozilla/standards-positions/issues/1010,Importmap integrity,2024-12-03T19:24:31Z,OrionCodeDev
2515391417,whatwg/html,Can we please add https://github.com/whatwg/html/pull/10613#pullrequestreview-2468472784 to the agen,https://github.com/whatwg/html/issues/10813#issuecomment-2515391417,https://github.com/whatwg/html/issues/10813,Meeting 12 for joint OpenUI-WHATWG/HTML-CSSWG task force on styleable form controls,2024-12-03T19:19:45Z,mfreed7
2515361091,whatwg/html,Making this change to unify the definition of top/em-over and bottom/em-under in the canvas text sty,https://github.com/whatwg/html/pull/5826#issuecomment-2515361091,https://github.com/whatwg/html/pull/5826,Reference even more baseline concepts in CSS Inline Layout,2024-12-03T19:03:25Z,schenney-chromium
2515300782,whatwg/html,I disabled this new parser behavior in chrome 131 due to a bug with one of multiple code paths which,https://github.com/whatwg/html/pull/10557#issuecomment-2515300782,https://github.com/whatwg/html/pull/10557,Relax `<select>` parser,2024-12-03T18:29:44Z,josepharhar
2515105588,whatwg/html,Is there a corresponding accessibility PR? This seems like the kind of feature that needs one.,https://github.com/whatwg/html/pull/9778#issuecomment-2515105588,https://github.com/whatwg/html/pull/9778,Add popover=hint,2024-12-03T16:58:36Z,annevk
2514982675,w3c/editing,"bumping, really missing the lack of `<input type='emoji'>`. Can't even fathom the combined weight of",https://github.com/w3c/editing/issues/350#issuecomment-2514982675,https://github.com/w3c/editing/issues/350,JS API to invoke native desktop emoji picker,2024-12-03T16:08:08Z,pketh
2514970444,whatwg/html,when popover / popovertarget were being created this use case was discussed.  but one of the reasons,https://github.com/whatwg/html/issues/10815#issuecomment-2514970444,https://github.com/whatwg/html/issues/10815,"Should `input[type=""search""]` (and other types) allow `popovertarget` ?",2024-12-03T16:03:19Z,scottaohara
2514427365,whatwg/html,"Per discussion in Matrix ([1](https://matrixlogs.bakkot.com/WHATWG/2024-12-02#L22), [2](https://matr",https://github.com/whatwg/html/pull/10557#issuecomment-2514427365,https://github.com/whatwg/html/pull/10557,Relax `<select>` parser,2024-12-03T12:27:03Z,zcorpan
2514178891,whatwg/html,> I don't think you mentioned connectedMoveCallback everywhere connectedCallback is mentioned (and i,https://github.com/whatwg/html/pull/10657#issuecomment-2514178891,https://github.com/whatwg/html/pull/10657,State-preserving atomic move integration,2024-12-03T10:40:08Z,noamr
2514172860,mozilla/standards-positions,This is to address feedback from @jcsteh.,https://github.com/mozilla/standards-positions/pull/1134#issuecomment-2514172860,https://github.com/mozilla/standards-positions/pull/1134,Use aria-describedby on <summary>,2024-12-03T10:37:31Z,zcorpan
2514122363,whatwg/html,> > This is cumbersome to implement as not all browsers/platforms respond in the same way >  > Tha,https://github.com/whatwg/html/issues/10799#issuecomment-2514122363,https://github.com/whatwg/html/issues/10799,Allow `MutationObserver` to observe (certain) element property changes,2024-12-03T10:16:58Z,bramus
2513837017,whatwg/html,I'm facing a similar situation. My current approach to workaround this limitation is to use web lock,https://github.com/whatwg/html/issues/1766#issuecomment-2513837017,https://github.com/whatwg/html/issues/1766,Add onclose event to MessagePort,2024-12-03T08:20:46Z,schickling
2513787738,mozilla/standards-positions,Marking as position: positive per https://github.com/mozilla/standards-positions/issues/135#issuecom,https://github.com/mozilla/standards-positions/issues/135#issuecomment-2513787738,https://github.com/mozilla/standards-positions/issues/135,content-visibility API,2024-12-03T07:53:16Z,zcorpan
2513778089,mozilla/standards-positions,"> Yeah, we talked this in WebPerf and we are positive about this. >  > Basically the changes on Fi",https://github.com/mozilla/standards-positions/issues/1110#issuecomment-2513778089,https://github.com/mozilla/standards-positions/issues/1110,Consolidate `paintTime` and `presentationTime` in performance APIs,2024-12-03T07:47:12Z,noamr
2513613092,whatwg/html,"hmm, I am not sure what I messed up with the branching.  edit: Should be resolved now",https://github.com/whatwg/html/pull/10814#issuecomment-2513613092,https://github.com/whatwg/html/pull/10814,Editorial: Move a note at the end of a spec step,2024-12-03T05:45:16Z,shannonbooth
2513353448,whatwg/html,"Something that probably should be done with `{ type: ""url"" }` is the ability to set a destination so",https://github.com/whatwg/html/issues/9444#issuecomment-2513353448,https://github.com/whatwg/html/issues/9444,"Import with type text, bytes, and URL",2024-12-03T01:41:44Z,Jamesernator
2513318519,WICG/webcomponents,"In the case that we could ""move"" `role` (or similar) via a `roleDelegate` (or so), it does open the ",https://github.com/WICG/webcomponents/issues/1087#issuecomment-2513318519,https://github.com/WICG/webcomponents/issues/1087,Reference Target naming,2024-12-03T01:07:23Z,Westbrook
2513285350,webkit/standards-positions,I'll mark this as `position: support` pending objections week from now.,https://github.com/WebKit/standards-positions/issues/432#issuecomment-2513285350,https://github.com/WebKit/standards-positions/issues/432,"CSS Inline `text-box`, `text-box-trim`, `text-box-edge`",2024-12-03T00:42:12Z,nt1m
2513158647,whatwg/html,"> Other examples might include a ""toast"" that shows up (via `popover=manual`) and has a Close button",https://github.com/whatwg/html/issues/10811#issuecomment-2513158647,https://github.com/whatwg/html/issues/10811,Should non-modal top layer elements that come after modal dialogs also escape inertness?,2024-12-02T23:02:19Z,mfreed7
2513144039,WICG/webcomponents,"To me `commandFor` is part of a sentence: ""button `foo` is a[n open] `commandFor` popover `bar`"" -> ",https://github.com/WICG/webcomponents/issues/1087#issuecomment-2513144039,https://github.com/WICG/webcomponents/issues/1087,Reference Target naming,2024-12-02T22:50:49Z,alice
2513130850,mozilla/standards-positions,"Yeah, we talked this in WebPerf and we are positive about this.   Basically the changes on Firefox",https://github.com/mozilla/standards-positions/issues/1110#issuecomment-2513130850,https://github.com/mozilla/standards-positions/issues/1110,Consolidate `paintTime` and `presentationTime` in performance APIs,2024-12-02T22:43:12Z,sefeng211
2513065862,mozilla/standards-positions,"I've rebased this so that it edits activities.yml instead, and added ""W3C"" per @tantek 's comment. I",https://github.com/mozilla/standards-positions/pull/1104#issuecomment-2513065862,https://github.com/mozilla/standards-positions/pull/1104,FedCM Update,2024-12-02T22:16:59Z,zcorpan
2512546886,whatwg/html,Given this comment (https://github.com/WebKit/standards-positions/issues/305#issuecomment-2506465534,https://github.com/whatwg/html/pull/9778#issuecomment-2512546886,https://github.com/whatwg/html/pull/9778,Add popover=hint,2024-12-02T19:22:37Z,mfreed7
2512382846,w3ctag/design-reviews,"hey @jyasskin; I think the intent here is to get this into WICG or similar, but I've never understoo",https://github.com/w3ctag/design-reviews/issues/1018#issuecomment-2512382846,https://github.com/w3ctag/design-reviews/issues/1018,[Handwriting] Add Handwriting CSS Value,2024-12-02T18:33:03Z,slightlyoff
2512251926,whatwg/html,I think the expected behavior from user's point of view when dealing with Home/End/PgDn/PgUp is that,https://github.com/whatwg/html/issues/10762#issuecomment-2512251926,https://github.com/whatwg/html/issues/10762,How to spec user interaction for select,2024-12-02T17:37:24Z,smaug----
2512191113,whatwg/html,One thing to define is how click works on options - current Canary dispatches click to the common an,https://github.com/whatwg/html/issues/10762#issuecomment-2512191113,https://github.com/whatwg/html/issues/10762,How to spec user interaction for select,2024-12-02T17:10:12Z,smaug----
2511684393,whatwg/html,"Yes, I'll review once I make sure I understand all of the context for the change.",https://github.com/whatwg/html/pull/5826#issuecomment-2511684393,https://github.com/whatwg/html/pull/5826,Reference even more baseline concepts in CSS Inline Layout,2024-12-02T14:25:12Z,schenney-chromium
