id,repo,body,url,issue_url,issue_title,created_at,user
2161679292,whatwg/html,> I also want to echo what @muan said in [#9625 (comment)](https://github.com/whatwg/html/issues/962,https://github.com/whatwg/html/issues/9625#issuecomment-2161679292,https://github.com/whatwg/html/issues/9625,[Proposal] Invoker Buttons - allowing popover/dialog and more to be invoked without JS,2024-06-11T22:06:33Z,keithamus
2161602747,whatwg/html,"@emilio @annevk @rachelandrew feedback appreciated, thanks!",https://github.com/whatwg/html/issues/10407#issuecomment-2161602747,https://github.com/whatwg/html/issues/10407,Proposal: CSS reading-order-items,2024-06-11T21:08:21Z,mfreed7
2161454747,whatwg/html,I would like to re-start this discussion from a sightly different angle and try to focus on two prob,https://github.com/whatwg/html/issues/4217#issuecomment-2161454747,https://github.com/whatwg/html/issues/4217,Image decode() algorithm has odd behavior,2024-06-11T19:21:53Z,gterzian
2161449745,w3c/pointerevents,Done landing WPTs for slotted elements: web-platform-tests/wpt#46694,https://github.com/w3c/pointerevents/issues/477#issuecomment-2161449745,https://github.com/w3c/pointerevents/issues/477,Clarify `pointerleave` and `pointerout` events when first pointer move after removing an element under the pointer,2024-06-11T19:18:44Z,mustaqahmed
2161357067,webkit/standards-positions,Chromium is no longer pursuing this feature directly; see the superseding Standards Position request,https://github.com/WebKit/standards-positions/issues/101#issuecomment-2161357067,https://github.com/WebKit/standards-positions/issues/101,Fullscreen Popup Windows,2024-06-11T18:20:05Z,michaelwasserman
2161354744,mozilla/standards-positions,Chromium is no longer pursuing this feature directly; see the superseding Request for Position in Is,https://github.com/mozilla/standards-positions/issues/714#issuecomment-2161354744,https://github.com/mozilla/standards-positions/issues/714,Request for Position: Fullscreen Popup Windows,2024-06-11T18:18:34Z,michaelwasserman
2161306842,whatwg/html,I'd like to propose that https://github.com/whatwg/html/pull/9144 be added to the agenda for the nex,https://github.com/whatwg/html/issues/10401#issuecomment-2161306842,https://github.com/whatwg/html/issues/10401,Meeting 3 for joint OpenUI-WHATWG/HTML-CSSWG task force on styleable form controls,2024-06-11T17:48:23Z,mfreed7
2161297980,whatwg/html,"@annevk  are you supportive of the popover API? Because it shares many of the behaviors you seem to ",https://github.com/whatwg/html/issues/9625#issuecomment-2161297980,https://github.com/whatwg/html/issues/9625,[Proposal] Invoker Buttons - allowing popover/dialog and more to be invoked without JS,2024-06-11T17:42:48Z,mfreed7
2161254287,whatwg/html,The HTML attribute for anchor positioning was just discussed again at the CSSWG F2F:  https://gith,https://github.com/whatwg/html/pull/9144#issuecomment-2161254287,https://github.com/whatwg/html/pull/9144,Add anchor attribute,2024-06-11T17:16:08Z,mfreed7
2161235511,whatwg/html,"> The only difference between the beginLayer() and the other two methods is beginLayer() implicitly ",https://github.com/whatwg/html/pull/9537#issuecomment-2161235511,https://github.com/whatwg/html/pull/9537,Add a layer and filter interface in the 2D canvas,2024-06-11T17:04:39Z,graveljp
2161126731,whatwg/html,I think the idea that controls are nested in a `<form>` and together create a form is pretty straigh,https://github.com/whatwg/html/issues/9625#issuecomment-2161126731,https://github.com/whatwg/html/issues/9625,[Proposal] Invoker Buttons - allowing popover/dialog and more to be invoked without JS,2024-06-11T16:05:01Z,annevk
2161007224,whatwg/html,"As per https://whatwg.org/working-mode#changes you'll need sufficient implementer interest which it ",https://github.com/whatwg/html/issues/8909#issuecomment-2161007224,https://github.com/whatwg/html/issues/8909,Adding document subtitle to the spec.,2024-06-11T15:08:49Z,annevk
2160993489,whatwg/html,"Hola @domenic ,  We've updated the document `app-title` feature. I've discussed the feature with o",https://github.com/whatwg/html/issues/8909#issuecomment-2160993489,https://github.com/whatwg/html/issues/8909,Adding document subtitle to the spec.,2024-06-11T15:02:50Z,diekus
2160963643,mozilla/standards-positions,I've been in support of this proposal when paired with source phase imports. It could help improve t,https://github.com/mozilla/standards-positions/issues/1038#issuecomment-2160963643,https://github.com/mozilla/standards-positions/issues/1038,WebAssembly ESM Integration,2024-06-11T14:50:37Z,eqrion
2160930947,mozilla/standards-positions,"Hola @zcorpan,  I've updated the [explainer for `app-title`](https://github.com/WebKit/standards-p",https://github.com/mozilla/standards-positions/issues/749#issuecomment-2160930947,https://github.com/mozilla/standards-positions/issues/749,Position request for adding a meta tag `name` value of `subtitle` (Document Subtitle),2024-06-11T14:36:39Z,diekus
2160877601,mozilla/standards-positions,"FWIW, I do think it's worth standardizing how ""failure"" happens. Especially if it happens after the ",https://github.com/mozilla/standards-positions/issues/436#issuecomment-2160877601,https://github.com/mozilla/standards-positions/issues/436,Heavy Ad Intervention,2024-06-11T14:13:56Z,annevk
2160833538,whatwg/html,> We'll want to ensure https://github.com/w3c/webappsec-csp/pull/650 is merged around the same time.,https://github.com/whatwg/html/pull/10204#issuecomment-2160833538,https://github.com/whatwg/html/pull/10204,Update HostEnsureCanCompileStrings definition,2024-06-11T13:55:53Z,lukewarlow
2160825497,whatwg/html,@zcorpan @annevk is this ready to be merged now it's rebased?,https://github.com/whatwg/html/pull/10286#issuecomment-2160825497,https://github.com/whatwg/html/pull/10286,Switch trusted types sinks to use union type,2024-06-11T13:52:30Z,lukewarlow
2160710976,w3ctag/design-reviews,"Hola TAG,   We've [updated the explainer](https://github.com/WICG/manifest-incubations/blob/gh-pag",https://github.com/w3ctag/design-reviews/issues/875#issuecomment-2160710976,https://github.com/w3ctag/design-reviews/issues/875,TAG review for web app `scope_extensions`,2024-06-11T13:02:01Z,diekus
2160641401,webkit/standards-positions,This may be a duplicate of https://github.com/WebKit/standards-positions/issues/193 â€“ could be worth,https://github.com/WebKit/standards-positions/issues/302#issuecomment-2160641401,https://github.com/WebKit/standards-positions/issues/302,Cross-Document View Transitions,2024-06-11T12:30:25Z,ryantownsend
2160636113,webkit/standards-positions,Now that Safari 18 beta has View Transitions Level 1 implemented and Mozilla have stated their posit,https://github.com/WebKit/standards-positions/issues/193#issuecomment-2160636113,https://github.com/WebKit/standards-positions/issues/193,CSS same-origin cross-document view-transition,2024-06-11T12:27:53Z,ryantownsend
2160395313,whatwg/dom,"> I see, you want to polyfill new global attributes basically.  That's one use case. Or new native",https://github.com/whatwg/dom/issues/1287#issuecomment-2160395313,https://github.com/whatwg/dom/issues/1287,`MutationObserver` flag to observe mutations in (open) shadow trees to facilitate polyfills of HTML syntax,2024-06-11T10:30:46Z,LeaVerou
2160304357,whatwg/html,"> Just to summarize, here are the non-presentational rationales for this attribute: >  > 1. Semant",https://github.com/whatwg/html/pull/9144#issuecomment-2160304357,https://github.com/whatwg/html/pull/9144,Add anchor attribute,2024-06-11T09:50:09Z,josepharhar
2160282200,mozilla/standards-positions,> The spec draft link above points to a malicious site.  https://github.com/mozilla/standards-posi,https://github.com/mozilla/standards-positions/issues/117#issuecomment-2160282200,https://github.com/mozilla/standards-positions/issues/117,Network Information API,2024-06-11T09:41:52Z,tomayac
2160148728,w3ctag/design-reviews,"@backkem, @anssiko, @wangw-1991, @simoneonofri: I sent out an invite last week, and I have replies f",https://github.com/w3ctag/design-reviews/issues/932#issuecomment-2160148728,https://github.com/w3ctag/design-reviews/issues/932,Local Peer-to-Peer API,2024-06-11T08:47:47Z,matatk
2160059231,whatwg/dom,"I see, you want to polyfill new global attributes basically.",https://github.com/whatwg/dom/issues/1287#issuecomment-2160059231,https://github.com/whatwg/dom/issues/1287,`MutationObserver` flag to observe mutations in (open) shadow trees to facilitate polyfills of HTML syntax,2024-06-11T08:04:05Z,smaug----
2160009121,mozilla/standards-positions,"@johnivdel, it's been a while since you looked at this.  Is this still a going concern?  My reacti",https://github.com/mozilla/standards-positions/issues/436#issuecomment-2160009121,https://github.com/mozilla/standards-positions/issues/436,Heavy Ad Intervention,2024-06-11T07:37:13Z,martinthomson
2159946794,w3ctag/design-reviews,"> So how was your weekend?  Good. You? :)  > @yoavweiss, do you think that you could fill in mor",https://github.com/w3ctag/design-reviews/issues/964#issuecomment-2159946794,https://github.com/w3ctag/design-reviews/issues/964,`noopener-allow-popups` value in COOP,2024-06-11T07:02:30Z,yoavweiss
2159890268,w3ctag/design-reviews,"So how was your weekend?  @yoavweiss, do you think that you could fill in more of the details we'r",https://github.com/w3ctag/design-reviews/issues/964#issuecomment-2159890268,https://github.com/w3ctag/design-reviews/issues/964,`noopener-allow-popups` value in COOP,2024-06-11T06:23:03Z,martinthomson
2159818221,whatwg/dom,"Over in the thread where I originally became confused, I found a solution for the case there, that a",https://github.com/whatwg/dom/issues/1112#issuecomment-2159818221,https://github.com/whatwg/dom/issues/1112,Requirement for AbortSignal argument to be named 'signal' can be confusing for some APIs.,2024-06-11T05:23:07Z,mk-pmb
2159545894,whatwg/html,good,https://github.com/whatwg/html/issues/10396#issuecomment-2159545894,https://github.com/whatwg/html/issues/10396,"Use align-content for form control centering instead of html ""magic""",2024-06-11T00:27:38Z,Pol2507
2159542402,whatwg/html,"If I may chime in, first it's great to see WebKit came back on this, thanks for your hard work.   ",https://github.com/whatwg/html/pull/9537#issuecomment-2159542402,https://github.com/whatwg/html/pull/9537,Add a layer and filter interface in the 2D canvas,2024-06-11T00:23:43Z,Kaiido
2159535787,whatwg/html,> Is this no longer a concern?  I think without implementing the layers we already have a problem.,https://github.com/whatwg/html/pull/9537#issuecomment-2159535787,https://github.com/whatwg/html/pull/9537,Add a layer and filter interface in the 2D canvas,2024-06-11T00:17:17Z,shallawa
2159418714,webkit/standards-positions,"I don't know of any posts or articles discussing dynamic prioritization. It was something that came ",https://github.com/WebKit/standards-positions/issues/361#issuecomment-2159418714,https://github.com/WebKit/standards-positions/issues/361,Prioritized Task Scheduling,2024-06-10T22:31:14Z,shaseley
2159340815,w3ctag/design-reviews,"@torgo, a challenge here is that WebNN supports more than just GPU compute. What @RafaelCintron ment",https://github.com/w3ctag/design-reviews/issues/933#issuecomment-2159340815,https://github.com/w3ctag/design-reviews/issues/933,Updated review of WebNN API,2024-06-10T21:44:32Z,reillyeon
2159311268,mozilla/standards-positions,Gecko maintains consistent behavior between the legacy and async APIs on `read()` for built-in types,https://github.com/mozilla/standards-positions/issues/769#issuecomment-2159311268,https://github.com/mozilla/standards-positions/issues/769,Unsanitized HTML read/write in Async Clipboard API,2024-06-10T21:25:44Z,EdgarChen
2159111864,whatwg/dom,Uniformity across the platform in AbortSignal integration & naming I think is a good enough reason.,https://github.com/whatwg/dom/issues/1112#issuecomment-2159111864,https://github.com/whatwg/dom/issues/1112,Requirement for AbortSignal argument to be named 'signal' can be confusing for some APIs.,2024-06-10T19:13:51Z,domfarolino
2159102376,whatwg/html,"OK, thanks. Let's close this without changing the spec then. ðŸ™‚",https://github.com/whatwg/html/issues/6761#issuecomment-2159102376,https://github.com/whatwg/html/issues/6761,Web compat: don't run async scripts between adjacent sync <script>s,2024-06-10T19:07:31Z,zcorpan
2159087833,whatwg/dom,@domfarolino Could you expand on your ðŸ‘Ž vote? Do you see a benefit in restricting the property name,https://github.com/whatwg/dom/issues/1112#issuecomment-2159087833,https://github.com/whatwg/dom/issues/1112,Requirement for AbortSignal argument to be named 'signal' can be confusing for some APIs.,2024-06-10T18:58:54Z,mk-pmb
2159043056,whatwg/dom,I just discovered this and fully agree with the original author that a restriction to use the generi,https://github.com/whatwg/dom/issues/1112#issuecomment-2159043056,https://github.com/whatwg/dom/issues/1112,Requirement for AbortSignal argument to be named 'signal' can be confusing for some APIs.,2024-06-10T18:36:10Z,mk-pmb
2159024659,mozilla/standards-positions,"https://mozilla.github.io/standards-positions/#scheduling-api entry exists, this is an addition. No ",https://github.com/mozilla/standards-positions/issues/1039#issuecomment-2159024659,https://github.com/mozilla/standards-positions/issues/1039,Prioritized Task Scheduling: scheduler.yield(),2024-06-10T18:26:18Z,zcorpan
2158891968,whatwg/html,It's obviously a point lost to history at this point but do you consider `<button type=submit>` vs `,https://github.com/whatwg/html/issues/9625#issuecomment-2158891968,https://github.com/whatwg/html/issues/9625,[Proposal] Invoker Buttons - allowing popover/dialog and more to be invoked without JS,2024-06-10T17:09:14Z,keithamus
2158884954,w3c/pointerevents,@smaug---- @flackr @mustaqahmed I have updated this PR to introduce `persistentDeviceId`. Please tak,https://github.com/w3c/pointerevents/pull/495#issuecomment-2158884954,https://github.com/w3c/pointerevents/pull/495,Add persistentDeviceId to PointerEvent,2024-06-10T17:05:14Z,sahirv
2158883898,mozilla/standards-positions,"I think the task ordering can still be discussed, but generally we are positive for this. ",https://github.com/mozilla/standards-positions/issues/1039#issuecomment-2158883898,https://github.com/mozilla/standards-positions/issues/1039,Prioritized Task Scheduling: scheduler.yield(),2024-06-10T17:04:35Z,sefeng211
2158862562,whatwg/html,"Sorry for the confusion. I meant that the `filter` state is a global state that applies to all draw ",https://github.com/whatwg/html/pull/9537#issuecomment-2158862562,https://github.com/whatwg/html/pull/9537,Add a layer and filter interface in the 2D canvas,2024-06-10T16:52:10Z,graveljp
2158841703,whatwg/html,"@yoavweiss I think once we have agreement for this PR, that could be a separate PR as well (to be la",https://github.com/whatwg/html/pull/10394#issuecomment-2158841703,https://github.com/whatwg/html/pull/10394,Add a `noopener-allow-popups` value to COOP,2024-06-10T16:40:12Z,annevk
2158810178,w3ctag/design-reviews,Thanks!,https://github.com/w3ctag/design-reviews/pull/968#issuecomment-2158810178,https://github.com/w3ctag/design-reviews/pull/968,Fix a typo,2024-06-10T16:21:56Z,LeaVerou
2158779194,whatwg/html,I was somewhat bitten by this today: I made the mistake of assuming that a returning `Response.redir,https://github.com/whatwg/html/issues/3624#issuecomment-2158779194,https://github.com/whatwg/html/issues/3624,Add a note why module map uses request URLs,2024-06-10T16:09:52Z,aapoalas
2158767428,whatwg/html,"> I think one change I'd like to see is that we drop ""cross-origin"" from the internal naming scheme ",https://github.com/whatwg/html/pull/10394#issuecomment-2158767428,https://github.com/whatwg/html/pull/10394,Add a `noopener-allow-popups` value to COOP,2024-06-10T16:05:36Z,yoavweiss
2158754443,whatwg/html,@graveljp I'm not sure I understand. Wouldn't the changes @shallawa suggested make `filter` no longe,https://github.com/whatwg/html/pull/9537#issuecomment-2158754443,https://github.com/whatwg/html/pull/9537,Add a layer and filter interface in the 2D canvas,2024-06-10T16:00:47Z,annevk
2158720800,whatwg/html,> Where is the specs that says the scaling transforms do not apply to the drop-shadow filter and the,https://github.com/whatwg/html/pull/9537#issuecomment-2158720800,https://github.com/whatwg/html/pull/9537,Add a layer and filter interface in the 2D canvas,2024-06-10T15:48:48Z,graveljp
2158663246,whatwg/html,The general problem that we see is that when you have `<button commandtarget=x>` it's very much uncl,https://github.com/whatwg/html/issues/9625#issuecomment-2158663246,https://github.com/whatwg/html/issues/9625,[Proposal] Invoker Buttons - allowing popover/dialog and more to be invoked without JS,2024-06-10T15:29:00Z,annevk
2158525534,whatwg/html,The [button layout magic](https://html.spec.whatwg.org/#button-layout-2) covers more than safe cente,https://github.com/whatwg/html/issues/10396#issuecomment-2158525534,https://github.com/whatwg/html/issues/10396,"Use align-content for form control centering instead of html ""magic""",2024-06-10T14:29:13Z,zcorpan
2158346475,mozilla/standards-positions,"I think it's here: https://tomayac.github.io/netinfo/ ",https://github.com/mozilla/standards-positions/issues/117#issuecomment-2158346475,https://github.com/mozilla/standards-positions/issues/117,Network Information API,2024-06-10T13:12:27Z,jesup
2158267188,mozilla/standards-positions,The spec draft link above points to a malicious site.,https://github.com/mozilla/standards-positions/issues/117#issuecomment-2158267188,https://github.com/mozilla/standards-positions/issues/117,Network Information API,2024-06-10T12:53:30Z,paco-sparta
2158246334,whatwg/html,"Seems like a decent idea. ",https://github.com/whatwg/html/issues/10396#issuecomment-2158246334,https://github.com/whatwg/html/issues/10396,"Use align-content for form control centering instead of html ""magic""",2024-06-10T12:43:32Z,nt1m
2158203109,whatwg/html,"Sounds nice!  cc @pxlcoder @nt1m @whatwg/forms ",https://github.com/whatwg/html/issues/10396#issuecomment-2158203109,https://github.com/whatwg/html/issues/10396,"Use align-content for form control centering instead of html ""magic""",2024-06-10T12:23:10Z,annevk
2158198437,whatwg/html,Thanks for updating @Ms2ger!  I'm comfortable with landing this given the state of things explaine,https://github.com/whatwg/html/pull/9038#issuecomment-2158198437,https://github.com/whatwg/html/pull/9038,Add the HostSystemUTCEpochNanoseconds abstract operation,2024-06-10T12:20:50Z,annevk
2158063415,webkit/standards-positions,Curious if there are other posts similar to https://medium.com/airbnb-engineering/building-a-faster-,https://github.com/WebKit/standards-positions/issues/361#issuecomment-2158063415,https://github.com/WebKit/standards-positions/issues/361,Prioritized Task Scheduling,2024-06-10T11:15:35Z,annevk
2158017942,whatwg/html,"cc @domenic ",https://github.com/whatwg/html/issues/10386#issuecomment-2158017942,https://github.com/whatwg/html/issues/10386,setTimeout() nesting levels: browsers do not match specification,2024-06-10T10:51:25Z,annevk
2158005957,whatwg/html,"Well spotted!  How about instead of removing the entry, we set its value to null? And then update ",https://github.com/whatwg/html/issues/10387#issuecomment-2158005957,https://github.com/whatwg/html/issues/10387,Bug in timer initialisation steps: the id's of cleared but still live timers can be reused,2024-06-10T10:45:02Z,annevk
2157960172,whatwg/html,It seems we could accomplish the implicit anchor aspect of https://github.com/whatwg/html/pull/9144#,https://github.com/whatwg/html/pull/9144#issuecomment-2157960172,https://github.com/whatwg/html/pull/9144,Add anchor attribute,2024-06-10T10:23:44Z,annevk
2157825155,w3ctag/design-reviews,Hi @RafaelCintron - thanks for this detailed response. We're just discussing in our TAG breakout tod,https://github.com/w3ctag/design-reviews/issues/933#issuecomment-2157825155,https://github.com/w3ctag/design-reviews/issues/933,Updated review of WebNN API,2024-06-10T09:25:54Z,torgo
2157705322,whatwg/html,> (We follow these guidelines for commit messages: https://github.com/whatwg/meta/blob/main/COMMITTI,https://github.com/whatwg/html/pull/10403#issuecomment-2157705322,https://github.com/whatwg/html/pull/10403,docs: remove redundant â€œtoâ€,2024-06-10T08:32:10Z,j9t
2157490256,whatwg/dom,It seems this is a duplicate of #1225.,https://github.com/whatwg/dom/issues/1285#issuecomment-2157490256,https://github.com/whatwg/dom/issues/1285,Proposal: SelectorObserver,2024-06-10T07:00:35Z,annevk
2156782220,whatwg/dom,This would be super handy. Especially for subscribing to the open/close state of popovers.   Unlik,https://github.com/whatwg/dom/issues/1225#issuecomment-2156782220,https://github.com/whatwg/dom/issues/1225,matchMedia-like API for element matches,2024-06-09T20:43:47Z,codebycarlos
2156097859,mozilla/standards-positions,"> > Given the revised position on Web Serial is Mozilla similarly open to implementations of WebHID,",https://github.com/mozilla/standards-positions/issues/720#issuecomment-2156097859,https://github.com/mozilla/standards-positions/issues/720,Revisiting negative positions through Add-On Gating,2024-06-08T16:38:14Z,FroggMaster
2156023391,webkit/standards-positions,For ease of linking between them https://github.com/mozilla/standards-positions/issues/849 is the mo,https://github.com/WebKit/standards-positions/issues/231#issuecomment-2156023391,https://github.com/WebKit/standards-positions/issues/231,css-ui `field-sizing` property,2024-06-08T12:42:26Z,lukewarlow
2132407864,whatwg/html,"@Krinkle, apologies for the delay; my understanding of the modulepreload side of the problem is this",https://github.com/whatwg/html/issues/7854#issuecomment-2132407864,https://github.com/whatwg/html/issues/7854,Early hints and `modulepreload`,2024-05-26T21:55:59Z,zqianem
1985984078,whatwg/html,"As I mentioned in Mozilla's s-p, it would be good to think whether the features would apply to other",https://github.com/whatwg/html/issues/9373#issuecomment-1985984078,https://github.com/whatwg/html/issues/9373,Add light dismiss functionality to `<dialog>`,2024-03-08T16:17:50Z,smaug----
898389422,mozilla/standards-positions,"I have rebooted the Network Information API based on long-going discussions with @yoavweiss (who is ",https://github.com/mozilla/standards-positions/issues/117#issuecomment-898389422,https://github.com/mozilla/standards-positions/issues/117,Network Information API,2021-08-13T11:25:54Z,tomayac