id,repo,body,url,issue_url,issue_title,created_at,user
2994229115,whatwg/html,"should i start working on it @alexkeng ",https://github.com/whatwg/html/issues/11390#issuecomment-2994229115,https://github.com/whatwg/html/issues/11390,Use a static property instead of ElementInternals.type for declaring native behaviors,2025-06-22T13:56:06Z,Ayushsaxena0227
2993930407,whatwg/html,I was gonna post a new feature request but found a bunch of related issues:  - https://github.com/ds,https://github.com/whatwg/html/issues/6107#issuecomment-2993930407,https://github.com/whatwg/html/issues/6107,Transferable resolve/reject,2025-06-22T04:33:46Z,jimmywarting
2993790517,w3c/pointerevents,> Add secure context criteria to pointerrawupdate event and getCoalescedEvents APIs to reduce its ex,https://github.com/w3c/pointerevents/pull/318#issuecomment-2993790517,https://github.com/w3c/pointerevents/pull/318,Add secure context criteria to pointerrawupdate and getCoalescedEvents,2025-06-21T22:03:33Z,szmarczak
2993713877,webkit/standards-positions,"> Hey, I'm currently experiencing problems with this on Safari Version 18.5 (20621.2.5.11.8) The sou",https://github.com/WebKit/standards-positions/issues/190#issuecomment-2993713877,https://github.com/WebKit/standards-positions/issues/190,Re-introduction of Media Queries (and srcset/sizes) in Source Elements,2025-06-21T18:33:44Z,nt1m
2993622135,webkit/standards-positions,"Hey, I'm currently experiencing problems with this on Safari Version 18.5 (20621.2.5.11.8) The sourc",https://github.com/WebKit/standards-positions/issues/190#issuecomment-2993622135,https://github.com/WebKit/standards-positions/issues/190,Re-introduction of Media Queries (and srcset/sizes) in Source Elements,2025-06-21T14:58:12Z,Ghostavio
2993599146,whatwg/dom,I found [this discussion at the CSSWG](https://github.com/w3c/csswg-drafts/issues/6205) and [this ex,https://github.com/whatwg/dom/issues/1383#issuecomment-2993599146,https://github.com/whatwg/dom/issues/1383,Proposal: matchContainer API,2025-06-21T14:02:36Z,ddamato
2993444199,w3ctag/design-reviews,@christianliebel: The monkey-patching draft at https://explainers-by-googlers.github.io/script-block,https://github.com/w3ctag/design-reviews/issues/1114#issuecomment-2993444199,https://github.com/w3ctag/design-reviews/issues/1114,Script Blocking (in Incognito mode),2025-06-21T07:49:36Z,mikewest
2993327967,whatwg/html,"Yes, you have correctly described how HTML works!",https://github.com/whatwg/html/issues/11391#issuecomment-2993327967,https://github.com/whatwg/html/issues/11391,Script Execution Order and `body.className,2025-06-21T04:55:13Z,domenic
2992592435,whatwg/html,">Perhaps instead, ""type"" behavior should be configured similar to formAssociated via a static proper",https://github.com/whatwg/html/issues/11061#issuecomment-2992592435,https://github.com/whatwg/html/issues/11061,Proposal: Customized built-in elements via `elementInternals.type`,2025-06-20T19:21:25Z,alexkeng
2992525887,whatwg/html,"> By virtue of the fact modal dialogs close open popovers, yes. (Might not close manual ones though)",https://github.com/whatwg/html/issues/3567#issuecomment-2992525887,https://github.com/whatwg/html/issues/3567,Have some way of opening `<dialog>` elements without JavaScript,2025-06-20T18:47:26Z,martpet
2992510331,w3c/editing,Adding my thoughts based on current ongoing and future considerations:  - ClipboardChange event - we,https://github.com/w3c/editing/issues/487#issuecomment-2992510331,https://github.com/w3c/editing/issues/487,TPAC 2025 - should we have a meeting?,2025-06-20T18:41:32Z,ragoulik
2992205011,whatwg/html,"> Is `document.write()` really bad? From what I understand, the bad bit is when it's called while ne",https://github.com/whatwg/html/issues/7977#issuecomment-2992205011,https://github.com/whatwg/html/issues/7977,Mark `document.write()` as obsolete,2025-06-20T16:30:50Z,gsnedders
2992189341,whatwg/html,"By virtue of the fact modal dialogs close open popovers, yes. (Might not close manual ones though)",https://github.com/whatwg/html/issues/3567#issuecomment-2992189341,https://github.com/whatwg/html/issues/3567,Have some way of opening `<dialog>` elements without JavaScript,2025-06-20T16:23:18Z,lukewarlow
2991900744,whatwg/html,Can command/commandfor open a dialog AND close a popover at the same time?,https://github.com/whatwg/html/issues/3567#issuecomment-2991900744,https://github.com/whatwg/html/issues/3567,Have some way of opening `<dialog>` elements without JavaScript,2025-06-20T14:44:58Z,martpet
2991578172,w3ctag/design-reviews,@xiaochengh I added a note to the spec in https://github.com/w3c/csswg-drafts/commit/50ea52c173b317e,https://github.com/w3ctag/design-reviews/issues/1073#issuecomment-2991578172,https://github.com/w3ctag/design-reviews/issues/1073,Column wrapping for multicol,2025-06-20T13:11:37Z,rachelandrew
2990795640,w3ctag/design-reviews,"Hi @andypaicu,  Thanks for this submission, this looks to be a promising area to investigate. It see",https://github.com/w3ctag/design-reviews/issues/1079#issuecomment-2990795640,https://github.com/w3ctag/design-reviews/issues/1079,Page-Embedded Permission Controls,2025-06-20T10:20:48Z,lolaodelola
2990337032,whatwg/html,"Is `document.write()` really bad? From what I understand, the bad bit is when it's called while netw",https://github.com/whatwg/html/issues/7977#issuecomment-2990337032,https://github.com/whatwg/html/issues/7977,Mark `document.write()` as obsolete,2025-06-20T08:55:28Z,jakearchibald
2989852466,whatwg/html,Thanks for fixing this!,https://github.com/whatwg/html/pull/11384#issuecomment-2989852466,https://github.com/whatwg/html/pull/11384,Discourage `document.writeln()` like `document.write()`,2025-06-20T05:37:16Z,annevk
2989709773,w3ctag/design-reviews,"Dear Payments Working Group,  Thank you for sharing the draft charter with the TAG for review. Apolo",https://github.com/w3ctag/design-reviews/issues/1080#issuecomment-2989709773,https://github.com/w3ctag/design-reviews/issues/1080,[wg/payments] Web Payments Working Group Charter,2025-06-20T03:41:32Z,marcoscaceres
2988535935,w3ctag/design-reviews,"@xiaochengh, note that you already posted that comment, and Domenic replied to it.",https://github.com/w3ctag/design-reviews/issues/1089#issuecomment-2988535935,https://github.com/w3ctag/design-reviews/issues/1089,Extended lifetime shared workers,2025-06-19T15:42:43Z,jyasskin
2988113325,w3ctag/design-reviews,"<details> <summary>repost by mistake</summary> Hi @domenic, thanks for pointing out the hidden resou",https://github.com/w3ctag/design-reviews/issues/1089#issuecomment-2988113325,https://github.com/w3ctag/design-reviews/issues/1089,Extended lifetime shared workers,2025-06-19T13:31:29Z,xiaochengh
2975084078,w3ctag/design-reviews,Thank you Martin for thoughtful feedback.  > The question is then only whether to delay (at the brow,https://github.com/w3ctag/design-reviews/issues/1052#issuecomment-2975084078,https://github.com/w3ctag/design-reviews/issues/1052,Early Design Review for Device Bound Session Credentials,2025-06-16T04:42:49Z,arnar
2970932993,webkit/standards-positions,"WebKit is lagging behind with all new (and super useful) apis. Wasm Apis, Ai apis, and a lot more (N",https://github.com/WebKit/standards-positions/issues/422#issuecomment-2970932993,https://github.com/WebKit/standards-positions/issues/422,JavaScript Promise Integration (JSPI),2025-06-13T16:43:10Z,ApoloApps