id,repo,body,url,issue_url,issue_title,created_at,user
2922927616,whatwg/html,"No, that's all you need to do. And in the future there's no need to leave a comment on an issue eith",https://github.com/whatwg/html/issues/4140#issuecomment-2922927616,https://github.com/whatwg/html/issues/4140,Editorial: cleanup postMessage() invocation for dedicated workers,2025-05-30T17:13:49Z,annevk
2922907540,whatwg/html," Hi @annevk, I would like to work on this issue!  I’ve read through the description and understand t",https://github.com/whatwg/html/issues/4140#issuecomment-2922907540,https://github.com/whatwg/html/issues/4140,Editorial: cleanup postMessage() invocation for dedicated workers,2025-05-30T17:03:20Z,kritikaat
2922853397,whatwg/html,"The issue is already closed but the update is that escaping ""<"" and "">"" is now enabled for everyone ",https://github.com/whatwg/html/issues/6235#issuecomment-2922853397,https://github.com/whatwg/html/issues/6235,"Escape ""<"" and "">"" in attributes when serializing HTML",2025-05-30T16:35:32Z,securityMB
2922189095,whatwg/html,"@fantasai OK, that is fair enough. It indeed seems unlikely that the current behavior is required fo",https://github.com/whatwg/html/issues/3494#issuecomment-2922189095,https://github.com/whatwg/html/issues/3494,Define <meta name=viewport>,2025-05-30T11:54:31Z,zcorpan
2921485425,mozilla/standards-positions,Research going back at least about two decades has shown that variable bitrate presents a data priva,https://github.com/mozilla/standards-positions/issues/414#issuecomment-2921485425,https://github.com/mozilla/standards-positions/issues/414,Constant bitrate audio encoding with MediaRecorder,2025-05-30T07:35:22Z,TheDocTrier
2921239314,mozilla/standards-positions,Thanks again for stating your concerns clearly. It sounds like the crux is that we're confident that,https://github.com/mozilla/standards-positions/issues/1067#issuecomment-2921239314,https://github.com/mozilla/standards-positions/issues/1067,Writing Assistance APIs,2025-05-30T05:03:20Z,domenic
2921215917,whatwg/html,"Got it, I see the bug now.  I think the precedent we want to look to for better layering is [navigat",https://github.com/whatwg/html/issues/11340#issuecomment-2921215917,https://github.com/whatwg/html/issues/11340,WorkerGlobal scope's URL accessed for fetch blob partitioning before being set,2025-05-30T04:46:12Z,domenic
2921013698,webkit/standards-positions,"HI @youennf, (CC: @domenic)  We would love to get official support for this so that we can merge htt",https://github.com/WebKit/standards-positions/issues/354#issuecomment-2921013698,https://github.com/WebKit/standards-positions/issues/354,Timing Info for ServiceWorker static routing API,2025-05-30T01:56:43Z,quasi-mod
2920856977,mozilla/standards-positions,I was asked to clarify my proposed `negative` position by highlighting what remains objectionable wi,https://github.com/mozilla/standards-positions/issues/1061#issuecomment-2920856977,https://github.com/mozilla/standards-positions/issues/1061,Captured Surface Control,2025-05-30T00:10:51Z,jan-ivar
2920834542,whatwg/html,Seems like the same problem exists for the `accessor` context. Here’s a way we’ve been hitting it in,https://github.com/whatwg/html/issues/10192#issuecomment-2920834542,https://github.com/whatwg/html/issues/10192,"""check if an access between two browsing contexts should be reported"" can be called with null browsing context but doesn't handle it",2025-05-29T23:54:50Z,awesomekling
2920820484,whatwg/html,Just chatted in WHATNOT and there weren't any immediate deal-breakers but some more exploration need,https://github.com/whatwg/html/issues/8143#issuecomment-2920820484,https://github.com/whatwg/html/issues/8143,"CORS, CORP, TAO & ""public static resource"" metadata",2025-05-29T23:42:15Z,pmeenan
2920722511,whatwg/html,"> The `pushState` problem is actually a parsing time issue.  FWIW, I agree with this, and I think it",https://github.com/whatwg/html/issues/11286#issuecomment-2920722511,https://github.com/whatwg/html/issues/11286,Expanding the concept of internal resource links,2025-05-29T22:28:14Z,smaug----
2920671124,whatwg/html,"@pmeenan oops, sorry!  I added it to the agenda and forgot to add the agenda+ label.  Done.",https://github.com/whatwg/html/issues/11328#issuecomment-2920671124,https://github.com/whatwg/html/issues/11328,Upcoming WHATNOT meeting on 2025-05-29,2025-05-29T21:53:24Z,cwilso
2920643757,whatwg/html,"Just checking to see if I should add the agenda+ label or if the editors will if it is accepted for ",https://github.com/whatwg/html/issues/11328#issuecomment-2920643757,https://github.com/whatwg/html/issues/11328,Upcoming WHATNOT meeting on 2025-05-29,2025-05-29T21:36:13Z,pmeenan
2920632755,whatwg/html,Here is a PR for improved retargeting: https://github.com/whatwg/html/pull/11345  I looked at rela,https://github.com/whatwg/html/pull/11255#issuecomment-2920632755,https://github.com/whatwg/html/pull/11255,Make command events not composed,2025-05-29T21:29:59Z,josepharhar
2920607206,whatwg/html,"> Also, I haven't yet done a final check that all updated algorithms match all their call sites. It ",https://github.com/whatwg/html/pull/11186#issuecomment-2920607206,https://github.com/whatwg/html/pull/11186,Add ToggleEvent.source,2025-05-29T21:16:14Z,josepharhar
2920540526,whatwg/html,"> Ohh I see that's what Keith's promise was doing. Sounds good to me, looks a simple enough change t",https://github.com/whatwg/html/pull/11255#issuecomment-2920540526,https://github.com/whatwg/html/pull/11255,Make command events not composed,2025-05-29T20:43:38Z,keithamus
2920390972,whatwg/html,"Ohh I see that's what Keith's promise was doing. Sounds good to me, looks a simple enough change to ",https://github.com/whatwg/html/pull/11255#issuecomment-2920390972,https://github.com/whatwg/html/pull/11255,Make command events not composed,2025-05-29T19:36:49Z,lukewarlow
2920349214,whatwg/html,"The current getter retargets against currentTarget if currentTarget is present, and otherwise just r",https://github.com/whatwg/html/pull/11255#issuecomment-2920349214,https://github.com/whatwg/html/pull/11255,Make command events not composed,2025-05-29T19:17:38Z,josepharhar
2920301847,mozilla/standards-positions,> we already have a pretty large and diverse cohort of developers stating that the current design is,https://github.com/mozilla/standards-positions/issues/1067#issuecomment-2920301847,https://github.com/mozilla/standards-positions/issues/1067,Writing Assistance APIs,2025-05-29T18:57:04Z,bgrins
2920286041,mozilla/standards-positions,> I promised [@mfreed7](https://github.com/mfreed7) that the team would discuss each of the given op,https://github.com/mozilla/standards-positions/issues/1181#issuecomment-2920286041,https://github.com/mozilla/standards-positions/issues/1181,The `interestfor` attribute,2025-05-29T18:51:14Z,mfreed7
2920231643,whatwg/html,Could you explain what the difference is with that and why the existing retarget doesn't work? A spe,https://github.com/whatwg/html/pull/11255#issuecomment-2920231643,https://github.com/whatwg/html/pull/11255,Make command events not composed,2025-05-29T18:29:07Z,lukewarlow
2920221482,w3ctag/design-reviews,"> Can you give us a bit more information on what user need you're meeting, and how this will change ",https://github.com/w3ctag/design-reviews/issues/1050#issuecomment-2920221482,https://github.com/w3ctag/design-reviews/issues/1050,Permissions Policy reports for iframes,2025-05-29T18:24:41Z,shhnjk
2919868227,mozilla/standards-positions,"I promised @mfreed7 that the team would discuss each of the given options as if it were the finally ",https://github.com/mozilla/standards-positions/issues/1181#issuecomment-2919868227,https://github.com/mozilla/standards-positions/issues/1181,The `interestfor` attribute,2025-05-29T16:02:17Z,keithamus
2919844574,whatwg/html,"Based on discussion just now I'm going to go ahead and close this and the associated PR, as it's not",https://github.com/whatwg/html/issues/11130#issuecomment-2919844574,https://github.com/whatwg/html/issues/11130,File upload control rendering should specify the button element to use.,2025-05-29T15:53:38Z,lukewarlow
2919842021,whatwg/html,The CSS Working Group just discussed `File upload control rendering should specify the button elemen,https://github.com/whatwg/html/issues/11130#issuecomment-2919842021,https://github.com/whatwg/html/issues/11130,File upload control rendering should specify the button element to use.,2025-05-29T15:52:46Z,css-meeting-bot
2919774741,webkit/standards-positions,Quite disappointed that JSPI is not considered as important for WebKit team. Our product uses 2 engi,https://github.com/WebKit/standards-positions/issues/422#issuecomment-2919774741,https://github.com/WebKit/standards-positions/issues/422,JavaScript Promise Integration (JSPI),2025-05-29T15:33:59Z,Honya2000
2919212885,whatwg/html,"This seems desirable as a goal, but I see a potential difficulty with getting it implemented in a wa",https://github.com/whatwg/html/issues/11333#issuecomment-2919212885,https://github.com/whatwg/html/issues/11333,Need for programmatic detection of flashing content in <video> elements (accessibility safety concern),2025-05-29T12:12:11Z,pshaughn
2919055337,whatwg/html,"I'll work on this, but it will take a few weeks",https://github.com/whatwg/html/issues/11338#issuecomment-2919055337,https://github.com/whatwg/html/issues/11338,fetch the descendants of and link a module script only handles [[ParseError]] case,2025-05-29T11:00:58Z,nicolo-ribaudo
2918917304,w3ctag/design-reviews,@aamuley Thank you for reaching out. We think it makes sense to rename the methods to distinguish be,https://github.com/w3ctag/design-reviews/issues/1087#issuecomment-2918917304,https://github.com/w3ctag/design-reviews/issues/1087,Renaming the Storage Access handle methods for non-cookie StorageAccessAPI,2025-05-29T10:03:44Z,christianliebel
2918550278,whatwg/html,"Ah, that comment has made me dig into our representation of outside settings representation in Ladyb",https://github.com/whatwg/html/issues/11340#issuecomment-2918550278,https://github.com/whatwg/html/issues/11340,WorkerGlobal scope's URL accessed for fetch blob partitioning before being set,2025-05-29T07:22:29Z,shannonbooth
2918414185,whatwg/dom,"Here is a start of a concrete proposal:  - All events have an ""init properties"" map. Its keys are pr",https://github.com/whatwg/dom/issues/1328#issuecomment-2918414185,https://github.com/whatwg/dom/issues/1328,Missing machinery for associated Event data,2025-05-29T06:12:10Z,domenic
2918378315,whatwg/dom,Note that this is specifically a problem for properties where we want  ```js const event = new XEven,https://github.com/whatwg/dom/issues/1328#issuecomment-2918378315,https://github.com/whatwg/dom/issues/1328,Missing machinery for associated Event data,2025-05-29T05:50:24Z,domenic
2918343711,whatwg/html,"> However, that origin getter and worker global scope URL is accessed early on in the fetch for blob",https://github.com/whatwg/html/issues/11340#issuecomment-2918343711,https://github.com/whatwg/html/issues/11340,WorkerGlobal scope's URL accessed for fetch blob partitioning before being set,2025-05-29T05:34:35Z,domenic
2918325415,whatwg/html,"Yes, I think that was the intended behavior. If you are able to fix that back to how it was previous",https://github.com/whatwg/html/issues/11338#issuecomment-2918325415,https://github.com/whatwg/html/issues/11338,fetch the descendants of and link a module script only handles [[ParseError]] case,2025-05-29T05:20:59Z,domenic
2918292997,whatwg/html,"Let me close this as we seem to be happy with where this landed, and the reasoning above makes sense",https://github.com/whatwg/html/issues/10276#issuecomment-2918292997,https://github.com/whatwg/html/issues/10276,Module script dependencies and fetch priority,2025-05-29T04:55:12Z,domenic
2918138031,w3ctag/design-reviews,"Hi @svgeesus, the TAG discussed this and are happy with this proposal with various concerns addresse",https://github.com/w3ctag/design-reviews/issues/1057#issuecomment-2918138031,https://github.com/w3ctag/design-reviews/issues/1057,Incremental Font Transfer,2025-05-29T03:30:12Z,xiaochengh
2917926215,whatwg/dom,"Yes, thank you for the catch. I will update.",https://github.com/whatwg/dom/pull/1079#issuecomment-2917926215,https://github.com/whatwg/dom/pull/1079,Allow more characters when creating various nodes,2025-05-29T00:46:20Z,domenic
2917921385,whatwg/html,"`<details>` is not interactive. The `<summary>` header is interactive, and thus #2272, but details i",https://github.com/whatwg/html/issues/11342#issuecomment-2917921385,https://github.com/whatwg/html/issues/11342,Interactive elements allowed inside details?,2025-05-29T00:41:56Z,domenic
2917834067,whatwg/dom,The OP says this:   > I did not change validation for createProcessingInstruction() or createDocum,https://github.com/whatwg/dom/pull/1079#issuecomment-2917834067,https://github.com/whatwg/dom/pull/1079,Allow more characters when creating various nodes,2025-05-28T23:27:27Z,josepharhar
2917832830,whatwg/dom,"Thanks, I am implementing the doctype changes",https://github.com/whatwg/dom/issues/1373#issuecomment-2917832830,https://github.com/whatwg/dom/issues/1373,Consider more name validation loosening,2025-05-28T23:26:22Z,josepharhar
2917774080,whatwg/html,"I found the same issue that keith mentioned, here is a chromium patch that addresses it. I can make ",https://github.com/whatwg/html/pull/11255#issuecomment-2917774080,https://github.com/whatwg/html/pull/11255,Make command events not composed,2025-05-28T22:41:10Z,josepharhar
2917761172,whatwg/html,"> The issue is that the popover is opened on pointer down, then when the user releases it fires the ",https://github.com/whatwg/html/issues/8973#issuecomment-2917761172,https://github.com/whatwg/html/issues/8973,Why does hide popover not have a cancelable event?,2025-05-28T22:31:11Z,josepharhar
2917539889,w3c/resource-timing,"The PR to fetch spec is merged.  This PR is updated accordingly, and it's ready for review.  Thank",https://github.com/w3c/resource-timing/pull/411#issuecomment-2917539889,https://github.com/w3c/resource-timing/pull/411,"Expose a filtered content-encoding value to resource timing ",2025-05-28T20:32:32Z,guohuideng2024
2917450107,w3ctag/design-reviews,Sorry for the late response! The filtered value was changed to `@unknown` in the last two weeks afte,https://github.com/w3ctag/design-reviews/issues/1064#issuecomment-2917450107,https://github.com/w3ctag/design-reviews/issues/1064,Expose contentEncoding in resourceTiming,2025-05-28T19:53:23Z,guohuideng2024
2917441410,w3ctag/design-reviews,> Thanks for sharing this with us. Aside from [@torgo](https://github.com/torgo)'s comment about exp,https://github.com/w3ctag/design-reviews/issues/1064#issuecomment-2917441410,https://github.com/w3ctag/design-reviews/issues/1064,Expose contentEncoding in resourceTiming,2025-05-28T19:49:15Z,guohuideng2024
2917437213,w3ctag/design-reviews,> Just a quick request - can you please amend the explainer to be clearer about the _user need_? Thi,https://github.com/w3ctag/design-reviews/issues/1064#issuecomment-2917437213,https://github.com/w3ctag/design-reviews/issues/1064,Expose contentEncoding in resourceTiming,2025-05-28T19:47:14Z,guohuideng2024
2917433505,whatwg/html,"@zcorpan I ... don't think that makes any sense. If browsers didn't respond to any changes, that wou",https://github.com/whatwg/html/issues/3494#issuecomment-2917433505,https://github.com/whatwg/html/issues/3494,Define <meta name=viewport>,2025-05-28T19:45:37Z,fantasai
2917408568,whatwg/html,"My suspicion is that it's entirely unsupported, but `src` or `srcset` being required would be equall",https://github.com/whatwg/html/issues/11313#issuecomment-2917408568,https://github.com/whatwg/html/issues/11313,Make <img> src and srcset attributes optional if the source set can be generated from previous sibling <source> elements,2025-05-28T19:36:17Z,zcorpan
2917031448,w3ctag/design-reviews,"After more discussion, we're seeing the IWA effort as an attempt to build an OS whose APIs 1. integr",https://github.com/w3ctag/design-reviews/issues/842#issuecomment-2917031448,https://github.com/w3ctag/design-reviews/issues/842,Isolated Web Apps,2025-05-28T17:04:50Z,jyasskin
2916948523,w3c/resource-timing,This needs to be updated.,https://github.com/w3c/resource-timing/pull/411#issuecomment-2916948523,https://github.com/w3c/resource-timing/pull/411,"Expose a filtered content-encoding value to resource timing ",2025-05-28T16:31:25Z,annevk
2916832735,w3ctag/design-reviews,"That's strange, it now works for me -- even clicking the link in my comment works. It was previously",https://github.com/w3ctag/design-reviews/issues/906#issuecomment-2916832735,https://github.com/w3ctag/design-reviews/issues/906,Extending Storage Access API (SAA) to non-cookie storage,2025-05-28T15:50:23Z,lolaodelola
2916823219,w3ctag/design-reviews,"hmm thats super strange, thats part of the public github repo for [non-cookie SAA](https://github.co",https://github.com/w3ctag/design-reviews/issues/906#issuecomment-2916823219,https://github.com/w3ctag/design-reviews/issues/906,Extending Storage Access API (SAA) to non-cookie storage,2025-05-28T15:46:55Z,aamuley
2916821909,w3ctag/design-reviews,You're saying this link doesn't work?  https://github.com/privacycg/saa-non-cookie-storage/blob/main,https://github.com/w3ctag/design-reviews/issues/906#issuecomment-2916821909,https://github.com/w3ctag/design-reviews/issues/906,Extending Storage Access API (SAA) to non-cookie storage,2025-05-28T15:46:27Z,arichiv
2916814360,w3ctag/design-reviews,"Hi @aamuley and @arichiv, I can't access the [Explainer: Extending Storage Access API (SAA) to Share",https://github.com/w3ctag/design-reviews/issues/906#issuecomment-2916814360,https://github.com/w3ctag/design-reviews/issues/906,Extending Storage Access API (SAA) to non-cookie storage,2025-05-28T15:43:52Z,lolaodelola
2916150501,w3ctag/design-reviews,"@jyasskin wrote: > It's meant to fix w3ctag/explainer-explainer#19, but I still need to go back thr",https://github.com/w3ctag/design-reviews/pull/1102#issuecomment-2916150501,https://github.com/w3ctag/design-reviews/pull/1102,Rethink the TAG's review intake process.,2025-05-28T12:35:15Z,msporny
2916140536,whatwg/html,The issue I filed for https://github.com/whatwg/html/issues/9181 was resolved and I can file another,https://github.com/whatwg/html/issues/11313#issuecomment-2916140536,https://github.com/whatwg/html/issues/11313,Make <img> src and srcset attributes optional if the source set can be generated from previous sibling <source> elements,2025-05-28T12:32:35Z,foolip
2915214348,whatwg/html,"@alexpetros I don't think the change you're suggesting is going to be easy to implement/deploy, but ",https://github.com/whatwg/html/issues/3577#issuecomment-2915214348,https://github.com/whatwg/html/issues/3577,"HTML forms do not support the PUT, PATCH and DELETE methods",2025-05-28T07:08:07Z,jub0bs
2898304991,w3c/pointerevents,Looking at annotating the editor's draft with WPT info: https://github.com/speced/respec/issues/4966,https://github.com/w3c/pointerevents/issues/445#issuecomment-2898304991,https://github.com/w3c/pointerevents/issues/445,Meta-issue: update WPT to cover Pointer Events Level 3,2025-05-21T15:06:07Z,plehegar
2897873140,w3ctag/design-reviews,P.S. Perhaps it might help to post this here too... I looked at the current HR process. Actually acc,https://github.com/w3ctag/design-reviews/pull/1088#issuecomment-2897873140,https://github.com/w3ctag/design-reviews/pull/1088,Add an accessibility self-review to TAG design reviews.,2025-05-21T12:56:08Z,matatk
2790384808,WICG/webcomponents,"Control structures fit very naturally into this model, as they already fit into implicit schedulers ",https://github.com/WICG/webcomponents/issues/1055#issuecomment-2790384808,https://github.com/WICG/webcomponents/issues/1055,Idea: A tree-aware task scheduler,2025-04-09T16:54:36Z,justinfagnani
2599861729,WICG/webcomponents,I think [Open Issue #5](https://github.com/MicrosoftEdge/MSEdgeExplainers/blob/main/AtSheet/explaine,https://github.com/WICG/webcomponents/issues/939#issuecomment-2599861729,https://github.com/WICG/webcomponents/issues/939,Declarative CSS Module Scripts,2025-01-18T20:09:12Z,nolanlawson