id,repo,body,url,issue_url,issue_title,created_at,user
4603811192,w3ctag/design-reviews,"Thanks very much for the review! I appreciate the thoughtfulness of the response, and I will take th",https://github.com/w3ctag/design-reviews/issues/1058#issuecomment-4603811192,https://github.com/w3ctag/design-reviews/issues/1058,The `interesttarget` attribute,2026-06-02T15:10:42Z,mfreed7
4603636441,whatwg/html,https://github.com/Igalia/webengineshackfest/issues/80#issuecomment-4603115922  > We're proposing [W,https://github.com/whatwg/html/issues/12441#issuecomment-4603636441,https://github.com/whatwg/html/issues/12441,Extraordinary WHATNOT meeting on 2026-06-17,2026-06-02T14:51:55Z,lukewarlow
4603449554,whatwg/html,Thanks! Good to know it's more or less complete.  The existence of an enterprise policy suggests t,https://github.com/whatwg/html/pull/7617#issuecomment-4603449554,https://github.com/whatwg/html/pull/7617,Change Origin-Agent-Cluster HTTP header default,2026-06-02T14:32:21Z,annevk
4603352711,whatwg/html,Oh it seems there's tests for this: https://wpt.live/dom/nodes/moveBefore/script-move-before.html an,https://github.com/whatwg/html/issues/12512#issuecomment-4603352711,https://github.com/whatwg/html/issues/12512,Inconsistent cross-browser behaviour with moveBefore and script elements.,2026-06-02T14:21:54Z,lukewarlow
4603324431,whatwg/html,"cc @smaug---- and @domfarolino ",https://github.com/whatwg/html/issues/12512#issuecomment-4603324431,https://github.com/whatwg/html/issues/12512,Inconsistent cross-browser behaviour with moveBefore and script elements.,2026-06-02T14:18:49Z,lukewarlow
4603004916,w3ctag/design-reviews,Replied in https://github.com/w3c/strategy/issues/508#issuecomment-4603001765.,https://github.com/w3ctag/design-reviews/issues/1209#issuecomment-4603004916,https://github.com/w3ctag/design-reviews/issues/1209,[wg/ag] Accessibility Guidelines Group Charter,2026-06-02T13:45:08Z,jyasskin
4603004154,w3ctag/design-reviews,"Hi folks, we're closing this as timed out. Feel free to re-open when you're ready.",https://github.com/w3ctag/design-reviews/issues/1128#issuecomment-4603004154,https://github.com/w3ctag/design-reviews/issues/1128,Other Spec Review: Extend CSP script-src hashes,2026-06-02T13:45:03Z,lolaodelola
4602993561,w3ctag/design-reviews,"Hi folks, how is this going?",https://github.com/w3ctag/design-reviews/issues/1157#issuecomment-4602993561,https://github.com/w3ctag/design-reviews/issues/1157,WG New Spec: DID Resolution,2026-06-02T13:43:56Z,lolaodelola
4602988717,w3ctag/design-reviews,"Hi folks, we're closing this as timed out. Feel free to re-open when you're ready",https://github.com/w3ctag/design-reviews/issues/1041#issuecomment-4602988717,https://github.com/w3ctag/design-reviews/issues/1041,Signature-Based Integrity.,2026-06-02T13:43:30Z,lolaodelola
4602931377,w3c/editcontext,"Even with some caret association API, it would be nice to have reasonable default behavior so that w",https://github.com/w3c/edit-context/issues/132#issuecomment-4602931377,https://github.com/w3c/edit-context/issues/132,BiDi input handling is difficult with DOM-based EditContext,2026-06-02T13:37:29Z,ltenmoz
4602914157,w3ctag/design-reviews,The explainer's [pitch](https://open-ui.org/components/interest-invokers.explainer/#the-pitch) is th,https://github.com/w3ctag/design-reviews/issues/1058#issuecomment-4602914157,https://github.com/w3ctag/design-reviews/issues/1058,The `interesttarget` attribute,2026-06-02T13:35:26Z,matatk
4602760453,whatwg/html,> To set expectations: Stage 3 has requirements on specification text that I don't think are met for,https://github.com/whatwg/html/issues/12510#issuecomment-4602760453,https://github.com/whatwg/html/issues/12510,Upcoming WHATNOT meeting on 2026-06-04,2026-06-02T13:17:06Z,dandclark
4602637816,mozilla/standards-positions,Note that this includes several sub-features:  - Positional methods (`beforeHTML` etc) - {`runScript,https://github.com/mozilla/standards-positions/issues/1370#issuecomment-4602637816,https://github.com/mozilla/standards-positions/issues/1370,HTML streaming & revamped DOM parsing,2026-06-02T13:02:01Z,noamr
4601837606,whatwg/html,"> I'm curious what the current status of this change is in Chromium, including what kind of opt-outs",https://github.com/whatwg/html/pull/7617#issuecomment-4601837606,https://github.com/whatwg/html/pull/7617,Change Origin-Agent-Cluster HTTP header default,2026-06-02T11:17:12Z,otherdaniel
4601595572,whatwg/html,@kojiishi the tests link points to existing tests in wpt.fyi that are not marked tentative. Is ther,https://github.com/whatwg/html/pull/12444#issuecomment-4601595572,https://github.com/whatwg/html/pull/12444,"Add `<meta name=""responsive-embedded-sizing"">`",2026-06-02T10:43:32Z,noamr
4601276793,whatwg/html,"I think ""moved"" needs to be added to the ""removed"" conditions also.  Maybe the logic around *pointer",https://github.com/whatwg/html/issues/12500#issuecomment-4601276793,https://github.com/whatwg/html/issues/12500,Inconsistent cross-browser behavior for mutating child <source>s of a <video>,2026-06-02T10:01:26Z,zcorpan
4600920988,whatwg/html,Why would that depend on `appearance: auto`? You'd also need that when the `button` element is not u,https://github.com/whatwg/html/issues/12509#issuecomment-4600920988,https://github.com/whatwg/html/issues/12509,Customizable Select: Updating selected option's content does not clone into selectedcontent,2026-06-02T09:17:20Z,annevk
4600001030,whatwg/html,"I'm curious what the current status of this change is in Chromium, including what kind of opt-outs a",https://github.com/whatwg/html/pull/7617#issuecomment-4600001030,https://github.com/whatwg/html/pull/7617,Change Origin-Agent-Cluster HTTP header default,2026-06-02T07:59:42Z,annevk
4599875089,whatwg/html,"In theory it seems okay, but I thought that Document Policy had failed to gain traction due to the m",https://github.com/whatwg/html/pull/12026#issuecomment-4599875089,https://github.com/whatwg/html/pull/12026,Add document policy to the policy container,2026-06-02T07:41:21Z,annevk
4599836710,whatwg/html,To set expectations: Stage 3 has requirements on specification text that I don't think are met for R,https://github.com/whatwg/html/issues/12510#issuecomment-4599836710,https://github.com/whatwg/html/issues/12510,Upcoming WHATNOT meeting on 2026-06-04,2026-06-02T07:36:18Z,annevk
4598260519,webkit/standards-positions,@weinig I see that WebKit has already implemented this in https://github.com/WebKit/WebKit/pull/6612,https://github.com/WebKit/standards-positions/issues/657#issuecomment-4598260519,https://github.com/WebKit/standards-positions/issues/657,Relative Alpha Colors,2026-06-02T02:45:00Z,yisibl
4597757498,whatwg/html,We'd like to add these to this week's agenda:  - https://github.com/whatwg/html/pull/12409 (this mis,https://github.com/whatwg/html/issues/12510#issuecomment-4597757498,https://github.com/whatwg/html/issues/12510,Upcoming WHATNOT meeting on 2026-06-04,2026-06-02T01:00:14Z,leotlee
4597736969,whatwg/html,"> Kooky idea: Perhaps a native html template tag could work to mark a string as HTML, and as a bonus",https://github.com/whatwg/html/issues/11669#issuecomment-4597736969,https://github.com/whatwg/html/issues/11669,Coherent story for HTML-setting methods,2026-06-02T00:56:18Z,trusktr
4597222267,whatwg/html,"At a risk of adding more imprecision to the explanation, I've added some clarifications to https://g",https://github.com/whatwg/html/issues/12445#issuecomment-4597222267,https://github.com/whatwg/html/issues/12445,Request for feedback: user activation design in Attribution,2026-06-01T23:10:47Z,martinthomson
4597058431,whatwg/html,"Yeah, for appearance:auto we register a mutation observer on the selected option in chromium due to ",https://github.com/whatwg/html/issues/12509#issuecomment-4597058431,https://github.com/whatwg/html/issues/12509,Customizable Select: Updating selected option's content does not clone into selectedcontent,2026-06-01T22:37:43Z,josepharhar
4596592414,whatwg/html,It's hard to tell. Here's what I was able to find:  - There's no MDN documentation: https://github.,https://github.com/whatwg/html/pull/12026#issuecomment-4596592414,https://github.com/whatwg/html/pull/12026,Add document policy to the policy container,2026-06-01T21:17:42Z,domfarolino
4596121184,whatwg/html,"I suppose the question becomes: ""How does a developer replicate the native select, which reacts to m",https://github.com/whatwg/html/issues/12509#issuecomment-4596121184,https://github.com/whatwg/html/issues/12509,Customizable Select: Updating selected option's content does not clone into selectedcontent,2026-06-01T20:13:35Z,keithamus
4596037309,whatwg/html,The bug is that appearance: auto is showing a different label altogether. Not that selectedcontent i,https://github.com/whatwg/html/issues/12509#issuecomment-4596037309,https://github.com/whatwg/html/issues/12509,Customizable Select: Updating selected option's content does not clone into selectedcontent,2026-06-01T20:02:40Z,annevk
4595966745,whatwg/html,"Yeah that was my point with the comment above, that the test-case's label changes depending on wheth",https://github.com/whatwg/html/issues/12509#issuecomment-4595966745,https://github.com/whatwg/html/issues/12509,Customizable Select: Updating selected option's content does not clone into selectedcontent,2026-06-01T19:52:49Z,emilio
4595745521,whatwg/html,"FWIW `appearance:auto` _does_ change the label based on element mutations (`data:text/html,<select><",https://github.com/whatwg/html/issues/12509#issuecomment-4595745521,https://github.com/whatwg/html/issues/12509,Customizable Select: Updating selected option's content does not clone into selectedcontent,2026-06-01T19:20:55Z,keithamus
4595588504,w3c/pointerevents,This PR [was discussed](https://www.w3.org/2026/02/11-pointerevents-minutes.html#6a6e) in the Februa,https://github.com/w3c/pointerevents/pull/637#issuecomment-4595588504,https://github.com/w3c/pointerevents/pull/637,Allow pointerup-activated elements to set click target differently.,2026-06-01T18:59:15Z,dbaron
4595243316,whatwg/html,"I know we decided to wait for the UIEvents spec to be updated, but I'd rather not make users keep wa",https://github.com/whatwg/html/pull/11536#issuecomment-4595243316,https://github.com/whatwg/html/pull/11536,Change light dismiss to use click events,2026-06-01T18:09:49Z,josepharhar
4595194975,whatwg/html,I don't think there was any web compat issues driving this behavior. Making it possible to use `<but,https://github.com/whatwg/html/issues/12474#issuecomment-4595194975,https://github.com/whatwg/html/issues/12474,Properly define <select><button> semantics,2026-06-01T18:02:52Z,josepharhar
4595167431,whatwg/html,"Yes as Anne mentioned, it was decided that we wouldn't update the selectedcontent element in respons",https://github.com/whatwg/html/issues/12509#issuecomment-4595167431,https://github.com/whatwg/html/issues/12509,Customizable Select: Updating selected option's content does not clone into selectedcontent,2026-06-01T17:58:56Z,josepharhar
4594795272,whatwg/html,I created https://github.com/whatwg/dom/pull/1469 to make `AbstractRange` empty a couple of days ago,https://github.com/whatwg/html/issues/11478#issuecomment-4594795272,https://github.com/whatwg/html/issues/11478,OpaqueRange Interface,2026-06-01T17:07:55Z,annevk
4594774278,whatwg/html,The behavior shouldn't depend on `appearance`. I think that's in the specification. I did notice thi,https://github.com/whatwg/html/issues/12509#issuecomment-4594774278,https://github.com/whatwg/html/issues/12509,Customizable Select: Updating selected option's content does not clone into selectedcontent,2026-06-01T17:05:22Z,annevk
4594626849,whatwg/html,"@smaug----, @keithamus, @annevk, @LeaVerou: Quick check on what was discussed at the 5/28 meeting be",https://github.com/whatwg/html/issues/11478#issuecomment-4594626849,https://github.com/whatwg/html/issues/11478,OpaqueRange Interface,2026-06-01T16:44:26Z,stephanieyzhang
4594609841,whatwg/html,"Should it match in `appearance: auto` mode, then?",https://github.com/whatwg/html/issues/12509#issuecomment-4594609841,https://github.com/whatwg/html/issues/12509,Customizable Select: Updating selected option's content does not clone into selectedcontent,2026-06-01T16:42:04Z,emilio
4594234795,whatwg/html,Minutes from this meeting:  - Opaque Range Interface: Stephanie Zhang recapped the Opaque Range prop,https://github.com/whatwg/html/issues/12476#issuecomment-4594234795,https://github.com/whatwg/html/issues/12476,Upcoming WHATNOT meeting on 2026-05-28,2026-06-01T15:51:55Z,jstenback
4593922473,w3ctag/design-reviews,"The start and end dates are clearly wrong, but other than that - seems pretty good?",https://github.com/w3ctag/design-reviews/issues/1220#issuecomment-4593922473,https://github.com/w3ctag/design-reviews/issues/1220,[wg/wasm] WebAssembly WG rechartering,2026-06-01T15:12:55Z,bkardell
4593547656,whatwg/html,What is the standardization story for Document Policy at this point?,https://github.com/whatwg/html/pull/12026#issuecomment-4593547656,https://github.com/whatwg/html/pull/12026,Add document policy to the policy container,2026-06-01T14:30:24Z,annevk
4593507133,whatwg/html,Ok...,https://github.com/whatwg/html/issues/12507#issuecomment-4593507133,https://github.com/whatwg/html/issues/12507,save lines for browsers,2026-06-01T14:25:35Z,blueskyusf-code
4593493526,whatwg/html,"Right, but if we later want to add `legend` to another existing element like we did with `optgroup`,",https://github.com/whatwg/html/issues/12485#issuecomment-4593493526,https://github.com/whatwg/html/issues/12485,"Relaxing the ""`legend` must be the first child of `fieldset`"" requirement",2026-06-01T14:23:59Z,annevk
4593470816,whatwg/html,or guard-rail it so that and `optgroup` `legend` is excluded from bubbling up to becoming the `legen,https://github.com/whatwg/html/issues/12485#issuecomment-4593470816,https://github.com/whatwg/html/issues/12485,"Relaxing the ""`legend` must be the first child of `fieldset`"" requirement",2026-06-01T14:21:18Z,patrickhlauke
4593462220,whatwg/html,"No, we decided that we'd only do updates at a select few points in time, mainly when the selected op",https://github.com/whatwg/html/issues/12509#issuecomment-4593462220,https://github.com/whatwg/html/issues/12509,Customizable Select: Updating selected option's content does not clone into selectedcontent,2026-06-01T14:20:18Z,annevk
4593368372,whatwg/html,"I think we shouldn't change this to allow for descendant `legend` because that would make it harder ",https://github.com/whatwg/html/issues/12485#issuecomment-4593368372,https://github.com/whatwg/html/issues/12485,"Relaxing the ""`legend` must be the first child of `fieldset`"" requirement",2026-06-01T14:09:19Z,zcorpan
4593296197,whatwg/html,"Agreed. Are there any other cases that should count as ""not possible""?",https://github.com/whatwg/html/issues/12494#issuecomment-4593296197,https://github.com/whatwg/html/issues/12494,Explicitly discuss the adjusted insertion location being a descendant of the node itself,2026-06-01T14:00:44Z,zcorpan
4593221809,mozilla/standards-positions,"WebMCP provides a way for websites to provide in-content actions with natural language descriptions ",https://github.com/mozilla/standards-positions/issues/1412#issuecomment-4593221809,https://github.com/mozilla/standards-positions/issues/1412,WebMCP,2026-06-01T13:51:59Z,bvandersloot-mozilla
4593184240,whatwg/html,I'm curious as to more of the motivation for this change. Why are we pointing towards using inline s,https://github.com/whatwg/html/issues/12378#issuecomment-4593184240,https://github.com/whatwg/html/issues/12378,cachehint attribute of <script> for inline script caching,2026-06-01T13:47:28Z,keithamus
4592397640,whatwg/html,cc @nt1m @annevk too,https://github.com/whatwg/html/issues/12509#issuecomment-4592397640,https://github.com/whatwg/html/issues/12509,Customizable Select: Updating selected option's content does not clone into selectedcontent,2026-06-01T12:04:12Z,emilio
4592396285,whatwg/html,In general shouldn't any mutation in the subtree cause an update?,https://github.com/whatwg/html/issues/12509#issuecomment-4592396285,https://github.com/whatwg/html/issues/12509,Customizable Select: Updating selected option's content does not clone into selectedcontent,2026-06-01T12:04:01Z,emilio
4592358737,whatwg/html,"Sorry for the delay @monica-ch, I'm happy to help drive this to completion.  > @hiroshige-g Thanks",https://github.com/whatwg/html/pull/12026#issuecomment-4592358737,https://github.com/whatwg/html/pull/12026,Add document policy to the policy container,2026-06-01T11:58:47Z,domfarolino
4591861025,whatwg/html,@josepharhar do you know about the webcompat story for this? I had made the assumption this was desi,https://github.com/whatwg/html/issues/12474#issuecomment-4591861025,https://github.com/whatwg/html/issues/12474,Properly define <select><button> semantics,2026-06-01T10:48:41Z,keithamus
4591711830,whatwg/html,"I'm not quite sure I understand the current definition ""When the API is successfully used, the API i",https://github.com/whatwg/html/issues/12445#issuecomment-4591711830,https://github.com/whatwg/html/issues/12445,Request for feedback: user activation design in Attribution,2026-06-01T10:26:17Z,smaug----
4591590620,whatwg/html,"Looking over the past notes I am not sure this was discussed, at least I couldn't find a resolution,",https://github.com/whatwg/html/issues/12274#issuecomment-4591590620,https://github.com/whatwg/html/issues/12274,Passing the scoped custom element registry to the fragment parser has non-obvious side effects,2026-06-01T10:08:40Z,keithamus
4590951087,webkit/standards-positions,> Should we organize another call in the context of the Web Apps WG? I'll be at the [Web Engine hack,https://github.com/WebKit/standards-positions/issues/619#issuecomment-4590951087,https://github.com/WebKit/standards-positions/issues/619,BeforeInstallPromptEvent,2026-06-01T08:43:55Z,tomayac
4590922663,webkit/standards-positions,"> Would love it if folks like @adactio and others could become Invited Experts for the Web Apps WG, ",https://github.com/WebKit/standards-positions/issues/619#issuecomment-4590922663,https://github.com/WebKit/standards-positions/issues/619,BeforeInstallPromptEvent,2026-06-01T08:39:35Z,adactio
4589764055,whatwg/html,This sounds best discussed in a community like https://wicg.io first.,https://github.com/whatwg/html/issues/12507#issuecomment-4589764055,https://github.com/whatwg/html/issues/12507,save lines for browsers,2026-06-01T05:19:11Z,annevk
4589728012,whatwg/html,"They can create custom objects, but those won't work with the Highlight API or other APIs consuming ",https://github.com/whatwg/html/issues/11478#issuecomment-4589728012,https://github.com/whatwg/html/issues/11478,OpaqueRange Interface,2026-06-01T05:10:59Z,annevk
4589041906,webkit/standards-positions,Thanks everyone for the counter arguments/points. This is really helpful and insightful.   Should we,https://github.com/WebKit/standards-positions/issues/619#issuecomment-4589041906,https://github.com/WebKit/standards-positions/issues/619,BeforeInstallPromptEvent,2026-06-01T02:11:37Z,marcoscaceres
4588166569,whatwg/html,"Addressed those, thanks @annevk! :)",https://github.com/whatwg/html/pull/12506#issuecomment-4588166569,https://github.com/whatwg/html/pull/12506,Define that <video> and <audio> have a shadow tree with no slots.,2026-05-31T21:33:56Z,emilio
4588063313,whatwg/html,I really want to emphasise this again:  > I'll stress: ultimately all of this design is not somethin,https://github.com/whatwg/html/issues/11478#issuecomment-4588063313,https://github.com/whatwg/html/issues/11478,OpaqueRange Interface,2026-05-31T20:55:00Z,keithamus
4586948765,mozilla/standards-positions,"Two distinctions worth separating, since the ""malware on the device = game over, so why bother"" fram",https://github.com/mozilla/standards-positions/issues/912#issuecomment-4586948765,https://github.com/mozilla/standards-positions/issues/912,Device Bound Session Credentials,2026-05-31T14:03:40Z,Liwindo
4585907721,mozilla/standards-positions,"I do not think that ""if you're 'on someone's computer', it's game over"" is a threat model that's sui",https://github.com/mozilla/standards-positions/issues/912#issuecomment-4585907721,https://github.com/mozilla/standards-positions/issues/912,Device Bound Session Credentials,2026-05-31T06:19:01Z,KyeRussell
4585802706,whatwg/fs,"In the case of OPFS, I would expect any symlinks to be virtualised, that is, they wouldn't exist on ",https://github.com/whatwg/fs/issues/54#issuecomment-4585802706,https://github.com/whatwg/fs/issues/54,Symbolic link support,2026-05-31T05:23:58Z,TerrorBite
4585635779,whatwg/html,"> There is also the question of CSS custom properties (var(--)), which no browser support.  I think,",https://github.com/whatwg/html/issues/12505#issuecomment-4585635779,https://github.com/whatwg/html/issues/12505,[canvas] How are context dependent values resolved in canvas colors,2026-05-31T03:53:15Z,Calme1709
4585123649,whatwg/html,"> ### Aký je problém so štandardom HTML? > Keď sú farby (t. j. `fillStyle`, `strokeStyle`a `shadowCo",https://github.com/whatwg/html/issues/12505#issuecomment-4585123649,https://github.com/whatwg/html/issues/12505,[canvas] How are context dependent values resolved in canvas colors,2026-05-30T23:17:13Z,patrron
4584256483,whatwg/html,"In canvas rendering, **context-dependent color values** are usually resolved at the moment the color",https://github.com/whatwg/html/issues/12505#issuecomment-4584256483,https://github.com/whatwg/html/issues/12505,[canvas] How are context dependent values resolved in canvas colors,2026-05-30T19:49:06Z,SaffronDuke
4583519991,mozilla/standards-positions,how about linux?  this app bound stuff is not implemented in Linux. neither chrome based neither gec,https://github.com/mozilla/standards-positions/issues/912#issuecomment-4583519991,https://github.com/mozilla/standards-positions/issues/912,Device Bound Session Credentials,2026-05-30T17:11:49Z,aamaanaa
4581915168,whatwg/html,"@dandclark thanks, for 1) I think our assessment is that websites are highly unlikely to rely on the",https://github.com/whatwg/html/pull/10995#issuecomment-4581915168,https://github.com/whatwg/html/pull/10995,Add reference target,2026-05-30T06:07:25Z,annevk
4580728158,whatwg/html,"@annevk I think this basically makes sense. There are a couple details I'm unclear on about setting ",https://github.com/whatwg/html/pull/10995#issuecomment-4580728158,https://github.com/whatwg/html/pull/10995,Add reference target,2026-05-29T23:51:15Z,dandclark
4580190678,whatwg/html,Update: [WebVTT PR #523](https://github.com/w3c/webvtt/pull/523/files#r2348659042) is now superseded,https://github.com/whatwg/html/issues/11665#issuecomment-4580190678,https://github.com/whatwg/html/issues/11665,"Allow out-of-band text tracks to source kind, label, language from the text track format",2026-05-29T21:56:30Z,cookiecrook
4580074851,whatwg/html,I saw [Jake's](https://bsky.app/profile/jakearchibald.com/post/3mmt7ixfsek2v) [posts](https://mastod,https://github.com/whatwg/html/issues/10911#issuecomment-4580074851,https://github.com/whatwg/html/issues/10911,Specify the ability to scroll to increase/decrease <input type=number>,2026-05-29T21:39:03Z,kirk-loretz-fsn
4577808821,whatwg/html,> Can the calendar entry be adjusted so the meeting duration is 50min just like the WHATNOT meeting?,https://github.com/whatwg/html/issues/12503#issuecomment-4577808821,https://github.com/whatwg/html/issues/12503,Meeting 44 for joint OpenUI-WHATWG/HTML-CSSWG task force on styleable form controls,2026-05-29T17:06:00Z,mfreed7
4577723111,whatwg/html,I sent some tests in https://github.com/web-platform-tests/wpt/pull/60281.,https://github.com/whatwg/html/issues/3748#issuecomment-4577723111,https://github.com/whatwg/html/issues/3748,"UA shadow roots are observable via inheritance. ",2026-05-29T16:55:36Z,emilio
4576504851,whatwg/html,I think using the text content (or the variant thereof we have for `option` elements) makes the most,https://github.com/whatwg/html/issues/12474#issuecomment-4576504851,https://github.com/whatwg/html/issues/12474,Properly define <select><button> semantics,2026-05-29T14:51:31Z,annevk
4576424979,whatwg/html,Thanks for bringing this up. I didn't make the button do anything for appearance:auto because it did,https://github.com/whatwg/html/issues/12474#issuecomment-4576424979,https://github.com/whatwg/html/issues/12474,Properly define <select><button> semantics,2026-05-29T14:43:32Z,josepharhar
4575838939,whatwg/html,Indeed -- I made both of the above fixes which makes things simpler.,https://github.com/whatwg/html/pull/12504#issuecomment-4575838939,https://github.com/whatwg/html/pull/12504,Make select/option content model clearer about children versus descendants,2026-05-29T13:38:32Z,dbaron
4575286814,whatwg/html,Can the calendar entry be adjusted so the meeting duration is 50min just like the WHATNOT meeting? T,https://github.com/whatwg/html/issues/12503#issuecomment-4575286814,https://github.com/whatwg/html/issues/12503,Meeting 44 for joint OpenUI-WHATWG/HTML-CSSWG task force on styleable form controls,2026-05-29T12:56:58Z,annevk
4575170452,webkit/standards-positions,[Jetbrains' Compose Multiplatform was also considering using this API](https://youtrack.jetbrains.co,https://github.com/WebKit/standards-positions/issues/506#issuecomment-4575170452,https://github.com/WebKit/standards-positions/issues/506,Local Font Access API,2026-05-29T12:46:05Z,ApoloApps
4575136928,whatwg/html,"cc @whatwg/canvas  Regarding `currentColor`, there was https://github.com/whatwg/html/issues/9940 wh",https://github.com/whatwg/html/issues/12505#issuecomment-4575136928,https://github.com/whatwg/html/issues/12505,[canvas] How are context dependent values resolved in canvas colors,2026-05-29T12:43:16Z,Kaiido
