id,repo,body,url,issue_url,issue_title,created_at,user
2313828935,whatwg/webidl,"How would you suggest I modify step 4?  The relationship to #732, as I understand it (but may inde",https://github.com/whatwg/webidl/pull/1421#issuecomment-2313828935,https://github.com/whatwg/webidl/pull/1421,add [[ErrorData]] slot to DOMExceptions,2024-08-28T00:31:41Z,ljharb
2313810604,whatwg/html,> High-level of what I think should happen: when parsing option or optgroup start tag: check that se,https://github.com/whatwg/html/pull/10557#issuecomment-2313810604,https://github.com/whatwg/html/pull/10557,Relax `<select>` parser,2024-08-28T00:26:31Z,josepharhar
2313738853,whatwg/webidl,Seems fine directionally. In general we want `DOMException` to behave as if its constructor had a `s,https://github.com/whatwg/webidl/pull/1421#issuecomment-2313738853,https://github.com/whatwg/webidl/pull/1421,add [[ErrorData]] slot to DOMExceptions,2024-08-27T23:16:12Z,domenic
2313737869,whatwg/html,"`<code type=""text/x-pascalâ€>...</code>`  Valid MIME type string is defined, type attribute is alre",https://github.com/whatwg/html/issues/7869#issuecomment-2313737869,https://github.com/whatwg/html/issues/7869,More semantic way to represent the computer language in `code` element,2024-08-27T23:15:08Z,Sudrien
2313608659,whatwg/webidl,"ping @domenic @annevk, this proposal is on the agenda for advancement next plenary, and i'd love to ",https://github.com/whatwg/webidl/pull/1421#issuecomment-2313608659,https://github.com/whatwg/webidl/pull/1421,add [[ErrorData]] slot to DOMExceptions,2024-08-27T21:26:20Z,ljharb
2313376349,whatwg/html,"Proposed agenda: - Update on specs   - Going to create an HTML PR for the next part of the big ""dr",https://github.com/whatwg/html/issues/10582#issuecomment-2313376349,https://github.com/whatwg/html/issues/10582,Meeting 7 for joint OpenUI-WHATWG/HTML-CSSWG task force on styleable form controls,2024-08-27T19:46:00Z,josepharhar
2313366616,whatwg/html,Next meeting: https://github.com/whatwg/html/issues/10582,https://github.com/whatwg/html/issues/10568#issuecomment-2313366616,https://github.com/whatwg/html/issues/10568,Meeting 6 for joint OpenUI-WHATWG/HTML-CSSWG task force on styleable form controls,2024-08-27T19:39:54Z,josepharhar
2313349163,whatwg/html,Dupe of https://github.com/whatwg/html/issues/7869.,https://github.com/whatwg/html/issues/10580#issuecomment-2313349163,https://github.com/whatwg/html/issues/10580,Add code-lang attribute to code element,2024-08-27T19:29:31Z,domenic
2313105799,whatwg/html,"There are some tests of uploading images with ""strange"" colorspaces in https://github.com/KhronosGro",https://github.com/whatwg/html/issues/10578#issuecomment-2313105799,https://github.com/whatwg/html/issues/10578,"createImageBitmap: Clarify treatment of colorSpaceConversion:""none"" ImageBitmaps",2024-08-27T17:11:12Z,kenrussell
2313080746,whatwg/html,Good call. We should add at least one example to the `button` element section. And maybe two to demo,https://github.com/whatwg/html/pull/9841#issuecomment-2313080746,https://github.com/whatwg/html/pull/9841,Add invoker commands (commandfor & command),2024-08-27T16:58:16Z,annevk
2313072164,whatwg/dom,"I don't know if this is useful extra use case or implementation detail, but:  > Perhaps a timeout ",https://github.com/whatwg/dom/issues/1308#issuecomment-2313072164,https://github.com/whatwg/dom/issues/1308,Proposal: asynchronous event listeners,2024-08-27T16:53:55Z,WebReflection
2313033851,whatwg/html,are examples (similar or complementing/expanding what was added for popover) going to be added to th,https://github.com/whatwg/html/pull/9841#issuecomment-2313033851,https://github.com/whatwg/html/pull/9841,Add invoker commands (commandfor & command),2024-08-27T16:34:24Z,scottaohara
2312993127,whatwg/dom,"Here is one short list of use cases for what ""async events"" might mean to folks, each with potential",https://github.com/whatwg/dom/issues/1308#issuecomment-2312993127,https://github.com/whatwg/dom/issues/1308,Proposal: asynchronous event listeners,2024-08-27T16:14:33Z,mmocny
2312921886,whatwg/dom,"@mmocny to clarify, I am :+1: on this proposal ... literally anything that will start tackling how t",https://github.com/whatwg/dom/issues/1308#issuecomment-2312921886,https://github.com/whatwg/dom/issues/1308,Proposal: asynchronous event listeners,2024-08-27T15:45:30Z,WebReflection
2312913505,whatwg/dom,"That makes total sense to me, and overlaps with the ""lazy-loaded event listener"" use case I mentione",https://github.com/whatwg/dom/issues/1308#issuecomment-2312913505,https://github.com/whatwg/dom/issues/1308,Proposal: asynchronous event listeners,2024-08-27T15:41:39Z,mmocny
2312897026,webkit/standards-positions,"Hi, @annevk Shall we give this more time to others to comment or resolve it as ""position: support""?",https://github.com/WebKit/standards-positions/issues/367#issuecomment-2312897026,https://github.com/WebKit/standards-positions/issues/367,SVG favicons,2024-08-27T15:35:05Z,nileshprajapati
2312895052,whatwg/dom,"> (But, I don't quite see how waitUntil should help make the initial event dispatch async...)  exa",https://github.com/whatwg/dom/issues/1308#issuecomment-2312895052,https://github.com/whatwg/dom/issues/1308,Proposal: asynchronous event listeners,2024-08-27T15:34:15Z,WebReflection
2312867094,whatwg/dom,> I wonder if there is an opportunity to integrate the [Prioritized Task Scheduling API](https://wic,https://github.com/whatwg/dom/issues/1308#issuecomment-2312867094,https://github.com/whatwg/dom/issues/1308,Proposal: asynchronous event listeners,2024-08-27T15:22:51Z,mmocny
2312760885,whatwg/html,"Are there tests covering this?  cc @whatwg/canvas ",https://github.com/whatwg/html/issues/10578#issuecomment-2312760885,https://github.com/whatwg/html/issues/10578,"createImageBitmap: Clarify treatment of colorSpaceConversion:""none"" ImageBitmaps",2024-08-27T14:40:50Z,annevk
2312739046,whatwg/html,tagging @whatwg/canvas but it seems that there was already consensus on the WebGL meeting around thi,https://github.com/whatwg/html/issues/10577#issuecomment-2312739046,https://github.com/whatwg/html/issues/10577,createImageBitmap: Apply img and blob colorSpaceConversion to all sources.,2024-08-27T14:31:45Z,fserb
2312661899,whatwg/html,> I'm making an HTML specification patch. My current thought is: >  > * input element as a text en,https://github.com/whatwg/html/issues/6807#issuecomment-2312661899,https://github.com/whatwg/html/issues/6807,Allow <textarea> to size to its contents like <div contenteditable>,2024-08-27T14:04:10Z,mangelozzi
2312302851,whatwg/html,"> @yoavweiss did you open a PR already to drop ""cross origin"" from the internal concepts?  Was out",https://github.com/whatwg/html/pull/10394#issuecomment-2312302851,https://github.com/whatwg/html/pull/10394,Add a `noopener-allow-popups` value to COOP,2024-08-27T11:28:03Z,yoavweiss
2312092066,whatwg/dom,FYI I've proposed to expose `event.waitUntil` when a listener is asynchronous as there's previous wo,https://github.com/whatwg/dom/issues/1308#issuecomment-2312092066,https://github.com/whatwg/dom/issues/1308,Proposal: asynchronous event listeners,2024-08-27T10:01:48Z,WebReflection
2312045361,whatwg/dom,"I just ran into this. At Shopify, we want to take an event that happened in the document, and repres",https://github.com/whatwg/dom/issues/76#issuecomment-2312045361,https://github.com/whatwg/dom/issues/76,Should EventInit contain 'timestamp'?,2024-08-27T09:40:33Z,jakearchibald
2312011069,whatwg/dom,"> It seems like this API raises a lot of open questions.  Sure, happy to work through them and fle",https://github.com/whatwg/dom/issues/1255#issuecomment-2312011069,https://github.com/whatwg/dom/issues/1255,Atomic move operation for element reparenting & reordering,2024-08-27T09:26:04Z,noamr
2311896423,whatwg/html,"I removed all the ""before unloading"" and used ""while unloading"" if applicable. PTAL again, thanks!",https://github.com/whatwg/html/pull/10154#issuecomment-2311896423,https://github.com/whatwg/html/pull/10154,Add may-block reasons to NotRestoredReasons,2024-08-27T08:32:49Z,rubberyuzu
2311803044,whatwg/html,Hi Team  What is the current status of this feature ? Any updates for discussion or implementatio,https://github.com/whatwg/html/pull/9144#issuecomment-2311803044,https://github.com/whatwg/html/pull/9144,Add anchor attribute,2024-08-27T07:47:04Z,Jxck
2311520975,whatwg/html,"Per this discussion, I've [added a section](https://alexanderpetros.com/triptych/form-http-methods#o",https://github.com/whatwg/html/issues/3577#issuecomment-2311520975,https://github.com/whatwg/html/issues/3577,"HTML forms do not support the PUT, PATCH and DELETE methods",2024-08-27T03:57:38Z,alexpetros
2311225818,w3ctag/design-reviews,"As noted in <https://github.com/w3c/csswg-drafts/issues/10785>, it's been a year since the original ",https://github.com/w3ctag/design-reviews/issues/864#issuecomment-2311225818,https://github.com/w3ctag/design-reviews/issues/864,text-wrap: pretty,2024-08-26T22:35:39Z,tabatkins
2311149254,whatwg/dom,> Presumably animation & transition states should only be preserved if the element that got atomical,https://github.com/whatwg/dom/issues/1255#issuecomment-2311149254,https://github.com/whatwg/dom/issues/1255,Atomic move operation for element reparenting & reordering,2024-08-26T21:40:44Z,domfarolino
2311142750,whatwg/dom,"**amend** ... I've said *throw an error* but for fallback sake I would say: if any input, select, et",https://github.com/whatwg/dom/issues/1255#issuecomment-2311142750,https://github.com/whatwg/dom/issues/1255,Atomic move operation for element reparenting & reordering,2024-08-26T21:36:08Z,WebReflection
2311122516,whatwg/dom,"> What does it mean, for example, for focus to be preserved. Would it mean that the focused element ",https://github.com/whatwg/dom/issues/1255#issuecomment-2311122516,https://github.com/whatwg/dom/issues/1255,Atomic move operation for element reparenting & reordering,2024-08-26T21:22:34Z,WebReflection
2311116512,w3ctag/design-reviews,I've filed https://github.com/w3c/csswg-drafts/issues/10785 to encourage the CSSWG to discuss the na,https://github.com/w3ctag/design-reviews/issues/864#issuecomment-2311116512,https://github.com/w3ctag/design-reviews/issues/864,text-wrap: pretty,2024-08-26T21:18:42Z,jyasskin
2311100307,whatwg/dom,It seems like this API raises a lot of open questions.  Presumably animation & transition states s,https://github.com/whatwg/dom/issues/1255#issuecomment-2311100307,https://github.com/whatwg/dom/issues/1255,Atomic move operation for element reparenting & reordering,2024-08-26T21:08:17Z,rniwa
2310971779,whatwg/html,> Something I've just thought of. Would it be worth exposing this on datalist elements? They're kind,https://github.com/whatwg/html/pull/10126#issuecomment-2310971779,https://github.com/whatwg/html/pull/10126,Add the :open and :closed pseudo-selectors,2024-08-26T19:56:55Z,josepharhar
2310834720,whatwg/dom,The animation state is preserved. It does not act as if the node were removed and then inserted back,https://github.com/whatwg/dom/issues/1255#issuecomment-2310834720,https://github.com/whatwg/dom/issues/1255,Atomic move operation for element reparenting & reordering,2024-08-26T18:40:32Z,domfarolino
2310814364,whatwg/dom,What happens to ongoing (CSS or SVG) animations? Do they behave like the node was removed then inser,https://github.com/whatwg/dom/issues/1255#issuecomment-2310814364,https://github.com/whatwg/dom/issues/1255,Atomic move operation for element reparenting & reordering,2024-08-26T18:28:35Z,rniwa
2310680568,w3ctag/design-reviews,"@kojiishi @bfgeek @fantasai, has there been any further discussion of the above issue in the CSS WG?",https://github.com/w3ctag/design-reviews/issues/864#issuecomment-2310680568,https://github.com/w3ctag/design-reviews/issues/864,text-wrap: pretty,2024-08-26T17:12:56Z,hober
2310663670,whatwg/dom,"> I merged the HTML PR, but reopening per the latest comment.  Thanks!  > It also occurred to me",https://github.com/whatwg/dom/issues/305#issuecomment-2310663670,https://github.com/whatwg/dom/issues/305,Define mutation events,2024-08-26T17:03:33Z,mfreed7
2310651779,w3ctag/design-reviews,"We appreciate you bringing this to us. We see that Chromium has already shipped this API, so this co",https://github.com/w3ctag/design-reviews/issues/846#issuecomment-2310651779,https://github.com/w3ctag/design-reviews/issues/846,Private Aggregation API,2024-08-26T16:56:54Z,hober
2310414208,whatwg/html,> Thinking about this from a user-centric angle using guidance like https://web.dev/articles/rail an,https://github.com/whatwg/html/issues/10513#issuecomment-2310414208,https://github.com/whatwg/html/issues/10513,Consider adding `view-transition` as a token for `blocking`,2024-08-26T14:54:01Z,noamr
2310387816,WICG/webcomponents,I agree with others' concerns that signals + template literals make a poor fit with current semantic,https://github.com/WICG/webcomponents/issues/1069#issuecomment-2310387816,https://github.com/WICG/webcomponents/issues/1069,[templates] A declarative JavaScript templating API,2024-08-26T14:42:23Z,littledan
2310261816,whatwg/html,"Note for future reference: the relevant [""Lazy loading attributes"" spec currently lives here](https:",https://github.com/whatwg/html/issues/5250#issuecomment-2310261816,https://github.com/whatwg/html/issues/5250,Clarify then the check whether script is disabled for lazy-load,2024-08-26T13:47:31Z,hackademix
2310101903,whatwg/webidl,I like the option where we just handle this in the union.,https://github.com/whatwg/webidl/pull/1397#issuecomment-2310101903,https://github.com/whatwg/webidl/pull/1397,Add `async iterable<T>` type to WebIDL,2024-08-26T12:33:09Z,lucacasonato
2310027415,whatwg/webidl,"That also seems reasonable, but the problem is that any API currently accepting a string would need ",https://github.com/whatwg/webidl/pull/1397#issuecomment-2310027415,https://github.com/whatwg/webidl/pull/1397,Add `async iterable<T>` type to WebIDL,2024-08-26T11:56:00Z,annevk
2309960562,whatwg/webidl,In TC39 [we went the other direction](https://github.com/tc39/how-we-work/blob/main/normative-conven,https://github.com/whatwg/webidl/pull/1397#issuecomment-2309960562,https://github.com/whatwg/webidl/pull/1397,Add `async iterable<T>` type to WebIDL,2024-08-26T11:16:36Z,bakkot
2309874588,whatwg/webidl,Copying over [a thought](https://github.com/whatwg/fetch/issues/1291#issuecomment-2309803657) from @,https://github.com/whatwg/webidl/pull/1397#issuecomment-2309874588,https://github.com/whatwg/webidl/pull/1397,Add `async iterable<T>` type to WebIDL,2024-08-26T10:25:08Z,lucacasonato
2309871652,whatwg/dom,@tsutsu thanks for the detailed use case and proposals! I can see how the `moveBefore` proposal is c,https://github.com/whatwg/dom/issues/1255#issuecomment-2309871652,https://github.com/whatwg/dom/issues/1255,Atomic move operation for element reparenting & reordering,2024-08-26T10:23:27Z,noamr
2309798759,whatwg/webidl,"So during an experiment we ran for `new Response(async iterable<Uint8Array>)`, we discovered [anothe",https://github.com/whatwg/webidl/pull/1397#issuecomment-2309798759,https://github.com/whatwg/webidl/pull/1397,Add `async iterable<T>` type to WebIDL,2024-08-26T09:45:32Z,lucacasonato
2309787117,whatwg/html,"It should also be clarified that YUV to RGB conversions **will** be performed (it's the rest of the ",https://github.com/whatwg/html/issues/10578#issuecomment-2309787117,https://github.com/whatwg/html/issues/10578,"createImageBitmap: Clarify treatment of colorSpaceConversion:""none"" ImageBitmaps",2024-08-26T09:39:39Z,ccameron-chromium
2309727199,whatwg/dom,"@tsutsu I proposed 5 years ago a persistent *DocumentFragment* that would solve your ""*need to re-pa",https://github.com/whatwg/dom/issues/1255#issuecomment-2309727199,https://github.com/whatwg/dom/issues/1255,Atomic move operation for element reparenting & reordering,2024-08-26T09:09:06Z,WebReflection
2309724839,whatwg/html,I ran into the same issue this week while trying to get a long running project updated with a new mo,https://github.com/whatwg/html/issues/9936#issuecomment-2309724839,https://github.com/whatwg/html/issues/9936,A popover on top of a modal dialog should be interactable,2024-08-26T09:07:59Z,Neunerlei
2309447123,whatwg/html,> The [seeking algorithm](https://html.spec.whatwg.org/#dom-media-seek) already determines a _new pl,https://github.com/whatwg/html/issues/9742#issuecomment-2309447123,https://github.com/whatwg/html/issues/9742,Make the currentTime setter clamp to duration,2024-08-26T06:41:18Z,jyavenard
2309443283,whatwg/html,"The spec for seeking is quite explicit https://html.spec.whatwg.org/multipage/media.html#seeking ",https://github.com/whatwg/html/issues/9742#issuecomment-2309443283,https://github.com/whatwg/html/issues/9742,Make the currentTime setter clamp to duration,2024-08-26T06:38:48Z,jyavenard
2309302857,whatwg/html,> It's not entirely clear to me why this would be needed as you can already include `<meta name>` el,https://github.com/whatwg/html/issues/3328#issuecomment-2309302857,https://github.com/whatwg/html/issues/3328,Feature Request: Adding a <tail> to HTML documents,2024-08-26T04:42:10Z,alecgargett
2309207540,whatwg/dom,"I merged the HTML PR, but reopening per the latest comment.  It also occurred to me that we should",https://github.com/whatwg/dom/issues/305#issuecomment-2309207540,https://github.com/whatwg/dom/issues/305,Define mutation events,2024-08-26T03:01:44Z,domenic
2309054613,whatwg/html,"> Is there a reason to skip the view-transition, vs just running it with whatever elements are enabl",https://github.com/whatwg/html/issues/10513#issuecomment-2309054613,https://github.com/whatwg/html/issues/10513,Consider adding `view-transition` as a token for `blocking`,2024-08-26T00:02:21Z,khushalsagar
2308886073,whatwg/html,"  à¸”à¸²à¸§à¸™à¹Œà¹‚à¸«à¸¥à¸” Outlook for iOS<https://aka.ms/o0ukef> ________________________________ à¸ˆà¸²à¸: Gabilab",https://github.com/whatwg/html/issues/2177#issuecomment-2308886073,https://github.com/whatwg/html/issues/2177,Setting headers for EventSource,2024-08-25T15:01:05Z,RIGHTHOOD
2308766955,whatwg/html,Soon 8 years later and this is still needed here.  Websocket or Fetch didn't replace EventSource a,https://github.com/whatwg/html/issues/2177#issuecomment-2308766955,https://github.com/whatwg/html/issues/2177,Setting headers for EventSource,2024-08-25T10:21:36Z,Gabilabrebi
2308679426,whatwg/webidl,I can't tell if this is fixed.  The current spec seems to have been changed at least once since th,https://github.com/whatwg/webidl/issues/607#issuecomment-2308679426,https://github.com/whatwg/webidl/issues/607,Named properties object / named property visibility algorithm with property on Window.prototype,2024-08-25T06:48:25Z,domenic
2308637588,whatwg/html,"Parallel downloading is already possible today using the `async=""""` attribute.  This also seems to",https://github.com/whatwg/html/issues/10576#issuecomment-2308637588,https://github.com/whatwg/html/issues/10576,syntax for defining blocks of javascript files,2024-08-25T03:21:33Z,domenic
2308190657,whatwg/html,"I would like to work on this, is this still open ?? ",https://github.com/whatwg/html/issues/4518#issuecomment-2308190657,https://github.com/whatwg/html/issues/4518,"Make ""as a download"" and ""obtaining a file name"" more explicit",2024-08-24T08:27:07Z,gitclonegaurang
2308157991,whatwg/html,"We should also clarify what happens with negative values. Probably clamped to 0?  cc @jyavenard ",https://github.com/whatwg/html/issues/9742#issuecomment-2308157991,https://github.com/whatwg/html/issues/9742,Make the currentTime setter clamp to duration,2024-08-24T06:59:23Z,annevk
2307842928,whatwg/html,"Thinking about this from a user-centric angle using guidance like https://web.dev/articles/rail and ",https://github.com/whatwg/html/issues/10513#issuecomment-2307842928,https://github.com/whatwg/html/issues/10513,Consider adding `view-transition` as a token for `blocking`,2024-08-23T21:37:42Z,nickcoury
2307834081,whatwg/dom,Here is the relevant code:  https://github.com/bigskysoftware/htmx/blob/b4048ebb59e122208af4d2620c,https://github.com/whatwg/dom/issues/1255#issuecomment-2307834081,https://github.com/whatwg/dom/issues/1255,Atomic move operation for element reparenting & reordering,2024-08-23T21:28:42Z,1cg
2307829836,whatwg/dom,"@tsutsu yes, I faced this issue when using the `moveBefore()` method to improve the `hx-preserve` at",https://github.com/whatwg/dom/issues/1255#issuecomment-2307829836,https://github.com/whatwg/dom/issues/1255,Atomic move operation for element reparenting & reordering,2024-08-23T21:24:15Z,1cg
2307744333,whatwg/dom,"While on the subject of atomic reparenting, I would like to point out a stumbling block that would c",https://github.com/whatwg/dom/issues/1255#issuecomment-2307744333,https://github.com/whatwg/dom/issues/1255,Atomic move operation for element reparenting & reordering,2024-08-23T20:10:15Z,tsutsu
2307726627,whatwg/html,"@RokeJulianLockhart content inside of comments isn't sanitized either. a `-->` or `--!>` will break ",https://github.com/whatwg/html/issues/10153#issuecomment-2307726627,https://github.com/whatwg/html/issues/10153,"Allow comment tags (`<!`, `--`, and `>`) to be nested.",2024-08-23T19:56:16Z,dmsnell
2307723086,whatwg/html,"> https://github.com/whatwg/html/issues/10153#issuecomment-2307719958  @dmsnell, thanks. Is all co",https://github.com/whatwg/html/issues/10153#issuecomment-2307723086,https://github.com/whatwg/html/issues/10153,"Allow comment tags (`<!`, `--`, and `>`) to be nested.",2024-08-23T19:53:25Z,RokeJulianLockhart
2307719958,whatwg/html,"> I know solely that Google, Mozilla, and Apple are stakeholders in this, so do you know of any impl",https://github.com/whatwg/html/issues/10153#issuecomment-2307719958,https://github.com/whatwg/html/issues/10153,"Allow comment tags (`<!`, `--`, and `>`) to be nested.",2024-08-23T19:50:52Z,dmsnell
2307589954,whatwg/notifications,"Hmmmm, in that case I would be interested to learn more about the tab selection algorithm.",https://github.com/whatwg/notifications/pull/213#issuecomment-2307589954,https://github.com/whatwg/notifications/pull/213,Allow notifications and actions to specify a navigable URL,2024-08-23T18:20:55Z,saschanaz
2307572238,whatwg/html,"> Yeah, I think Gecko and WebKit can get an implementation bug when we decide the whatwg/dom issue i",https://github.com/whatwg/html/pull/10573#issuecomment-2307572238,https://github.com/whatwg/html/pull/10573,Remove mutation events from the spec,2024-08-23T18:08:16Z,mfreed7
2307547325,whatwg/notifications,Brady pointed out to me that we already reuse an existing tab if there is one. I don't think HTML ha,https://github.com/whatwg/notifications/pull/213#issuecomment-2307547325,https://github.com/whatwg/notifications/pull/213,Allow notifications and actions to specify a navigable URL,2024-08-23T17:51:27Z,annevk
2307460275,whatwg/html,> https://github.com/whatwg/html/issues/10153#issuecomment-1997032536  Thanks for all of your inpu,https://github.com/whatwg/html/issues/10153#issuecomment-2307460275,https://github.com/whatwg/html/issues/10153,"Allow comment tags (`<!`, `--`, and `>`) to be nested.",2024-08-23T16:52:57Z,RokeJulianLockhart
2307424269,whatwg/html,"Yeah, I think Gecko and WebKit can get an implementation bug when we decide the whatwg/dom issue is ",https://github.com/whatwg/html/pull/10573#issuecomment-2307424269,https://github.com/whatwg/html/pull/10573,Remove mutation events from the spec,2024-08-23T16:31:15Z,annevk
2307408925,whatwg/html,> [ ] [Implementation bugs](https://github.com/whatwg/meta/blob/main/MAINTAINERS.md#handling-pull-re,https://github.com/whatwg/html/pull/10573#issuecomment-2307408925,https://github.com/whatwg/html/pull/10573,Remove mutation events from the spec,2024-08-23T16:21:52Z,mfreed7
2307398121,whatwg/dom,"> I have a couple of concerns given the existence of the ""reverse origin trial"": >  > * It's not t",https://github.com/whatwg/dom/issues/305#issuecomment-2307398121,https://github.com/whatwg/dom/issues/305,Define mutation events,2024-08-23T16:14:34Z,mfreed7
2307338259,whatwg/notifications,Yeah we'll think about it and are of course also happy to consider concrete proposals. I suspect tha,https://github.com/whatwg/notifications/pull/213#issuecomment-2307338259,https://github.com/whatwg/notifications/pull/213,Allow notifications and actions to specify a navigable URL,2024-08-23T15:37:25Z,annevk
2307328929,whatwg/notifications,"We should probably also consider not always opening a new tab for declarative push, btw.",https://github.com/whatwg/notifications/pull/213#issuecomment-2307328929,https://github.com/whatwg/notifications/pull/213,Allow notifications and actions to specify a navigable URL,2024-08-23T15:31:56Z,saschanaz
2307293666,mozilla/standards-positions,Looks like this is on the WebRTC WG agenda for Tuesday. Looking forward to learning more then. cc @m,https://github.com/mozilla/standards-positions/issues/1061#issuecomment-2307293666,https://github.com/mozilla/standards-positions/issues/1061,Captured Surface Control,2024-08-23T15:13:19Z,jan-ivar
2307105206,whatwg/html,"cc @nt1m @pxlcoder @whatwg/css ",https://github.com/whatwg/html/issues/10569#issuecomment-2307105206,https://github.com/whatwg/html/issues/10569,Specify primitive appearance for <meter>,2024-08-23T13:32:26Z,annevk
2307060860,whatwg/html,"I wouldn't want to have to add `<wbr hyphen=""á­ "">` to every word that needs a soft hyphen.  Apart fro",https://github.com/whatwg/html/issues/6326#issuecomment-2307060860,https://github.com/whatwg/html/issues/6326,Add hyphenation-hint as HTML-element,2024-08-23T13:08:09Z,r12a
