id,repo,body,url,issue_url,issue_title,created_at,user
2526795435,whatwg/html,> So it seems like the path of least resistance is:  This sounds great to me! Thanks for the thoro,https://github.com/whatwg/html/issues/10099#issuecomment-2526795435,https://github.com/whatwg/html/issues/10099,Navigation: DocumentState request referrer is not set for about:srcdoc,2024-12-09T03:43:36Z,domenic
2526582069,w3c/pointerevents,> > the boundary events should fire after a layout change >  > I think an important caveat here is,https://github.com/w3c/pointerevents/issues/529#issuecomment-2526582069,https://github.com/w3c/pointerevents/issues/529,Mouse and Pointer events from a stationary mouse,2024-12-09T01:16:03Z,masayuki-nakano
2526400788,whatwg/html,"> but per your test results you mean Firefox and Safari are not, right? Chrome is?  Actually no! I",https://github.com/whatwg/html/issues/10099#issuecomment-2526400788,https://github.com/whatwg/html/issues/10099,Navigation: DocumentState request referrer is not set for about:srcdoc,2024-12-08T21:57:38Z,domfarolino
2525399924,whatwg/html,"This appears to be a question about how to write web apps, instead of a bug report about the HTML St",https://github.com/whatwg/html/issues/10834#issuecomment-2525399924,https://github.com/whatwg/html/issues/10834,"Calling replaceState before pushState messes up with the state, so when I go back, it does go back, but it should not",2024-12-08T03:27:40Z,domenic
2525364725,whatwg/html,"> https://github.com/whatwg/html/issues/10153#issuecomment-2525354233  @dmsnell, many thanks. That",https://github.com/whatwg/html/issues/10153#issuecomment-2525364725,https://github.com/whatwg/html/issues/10153,"Allow comment tags (`<!`, `--`, and `>`) to be nested.",2024-12-08T00:59:31Z,RokeJulianLockhart
2525354233,whatwg/html,"@RokeJulianLockhart HTML was never SGML-compliant, though some HTML2/3/4 may have been. The DTD’s, i",https://github.com/whatwg/html/issues/10153#issuecomment-2525354233,https://github.com/whatwg/html/issues/10153,"Allow comment tags (`<!`, `--`, and `>`) to be nested.",2024-12-08T00:18:20Z,dmsnell
2525322431,mozilla/standards-positions,Firefox 134 [release notes](https://developer.mozilla.org/en-US/docs/Mozilla/Firefox/Releases/134#cs,https://github.com/mozilla/standards-positions/issues/941#issuecomment-2525322431,https://github.com/mozilla/standards-positions/issues/941,CSS Box Alignment Module Level 3,2024-12-07T21:57:37Z,o-t-w
2525286917,whatwg/html,"> https://github.com/whatwg/html/issues/10153#issuecomment-2307460275  I have learnt of something ",https://github.com/whatwg/html/issues/10153#issuecomment-2525286917,https://github.com/whatwg/html/issues/10153,"Allow comment tags (`<!`, `--`, and `>`) to be nested.",2024-12-07T19:29:47Z,RokeJulianLockhart
2525275511,whatwg/html,"@josepharhar Are the test changes in https://github.com/html5lib/html5lib-tests/pull/178 up to date ",https://github.com/whatwg/html/pull/10557#issuecomment-2525275511,https://github.com/whatwg/html/pull/10557,Relax `<select>` parser,2024-12-07T18:47:13Z,flavorjones
2525127401,whatwg/html,"I’ve reached out directly to three peers (some on the thread) but, unfortunately, couldn’t get to mo",https://github.com/whatwg/html/issues/10691#issuecomment-2525127401,https://github.com/whatwg/html/issues/10691,“a start tag must never be omitted if it has any attributes”,2024-12-07T13:40:19Z,j9t
2525107447,whatwg/html,"> https://github.com/whatwg/html/issues/10835#issue-2724585372  Ah, this is a duplicate of https:/",https://github.com/whatwg/html/issues/10835#issuecomment-2525107447,https://github.com/whatwg/html/issues/10835,Add an `<h>` element to replace `<h1-n>`.,2024-12-07T13:05:43Z,RokeJulianLockhart
2524982771,whatwg/html,"Oh I see, `<body>` is one of the few things that can sniff as HTML as per https://mimesniff.spec.wha",https://github.com/whatwg/html/issues/10827#issuecomment-2524982771,https://github.com/whatwg/html/issues/10827,Browsers are not interoperable on navigating to no-Content-Type blob: URLs,2024-12-07T07:15:02Z,annevk
2524825594,whatwg/html,We usually do pull requests for that purpose.,https://github.com/whatwg/html/issues/8909#issuecomment-2524825594,https://github.com/whatwg/html/issues/8909,Adding document subtitle to the spec.,2024-12-07T02:53:57Z,domenic
2524624751,whatwg/html,Is the an incubations repository for html that will let us submit the spec somewhere for reference?,https://github.com/whatwg/html/issues/8909#issuecomment-2524624751,https://github.com/whatwg/html/issues/8909,Adding document subtitle to the spec.,2024-12-06T23:34:37Z,dmurph
2524227165,whatwg/html,> > but Chrome and Safari navigate to about:blank (and fire `load`). >  > Probably the most import,https://github.com/whatwg/html/issues/1895#issuecomment-2524227165,https://github.com/whatwg/html/issues/1895,Iframe with initial javascript: source needs to fire the load event in various cases,2024-12-06T21:41:23Z,natechapin
2524122892,whatwg/html,"Ok, for now I'm going to make option element activation not use activation behavior and look for ""mo",https://github.com/whatwg/html/issues/10762#issuecomment-2524122892,https://github.com/whatwg/html/issues/10762,How to spec user interaction for select,2024-12-06T20:33:24Z,josepharhar
2524112508,whatwg/html,My naming is poor and wouldn't be the final syntax but I did mean to suggest a declarative form of w,https://github.com/whatwg/html/issues/10831#issuecomment-2524112508,https://github.com/whatwg/html/issues/10831,Detect UA transitions on same-origin cross-document navigations,2024-12-06T20:31:54Z,nickcoury
2523988375,whatwg/html,"  > I think this is missing a required spec change: https://html.spec.whatwg.org/multipage/parsing",https://github.com/whatwg/html/pull/10557#issuecomment-2523988375,https://github.com/whatwg/html/pull/10557,Relax `<select>` parser,2024-12-06T19:15:11Z,josepharhar
2523961711,whatwg/html,"> It would also be nice to have a declarative API for this, e.g. >  > ``` > @view-transition { >",https://github.com/whatwg/html/issues/10831#issuecomment-2523961711,https://github.com/whatwg/html/issues/10831,Detect UA transitions on same-origin cross-document navigations,2024-12-06T18:57:52Z,bramus
2523882767,whatwg/html,We only did it as a CSS `text-transform` because we were playing around with other possible presenta,https://github.com/whatwg/html/issues/10824#issuecomment-2523882767,https://github.com/whatwg/html/issues/10824,"""timer initialization steps"" perform EnsureCSPDoesNotBlockStringCompilation with undefined timer value",2024-12-06T18:09:01Z,michaelficarra
2523836864,whatwg/html,It looks like Firefox is only sniffing because [our Blob channel inherits from a base channel implem,https://github.com/whatwg/html/issues/10827#issuecomment-2523836864,https://github.com/whatwg/html/issues/10827,Browsers are not interoperable on navigating to no-Content-Type blob: URLs,2024-12-06T17:45:02Z,asutherland
2523715348,WICG/webcomponents,"to have the DCE viable, it have to have sufficient functionality to build full blown web app. With d",https://github.com/WICG/webcomponents/issues/1090#issuecomment-2523715348,https://github.com/WICG/webcomponents/issues/1090,[declarative-custom-elements] do we need DOM parts or any template mechanism in spec?,2024-12-06T16:46:57Z,sashafirsov
2523700194,whatwg/html,I forget why we decided to use a text transform instead of just making it actually uppercase to begi,https://github.com/whatwg/html/issues/10824#issuecomment-2523700194,https://github.com/whatwg/html/issues/10824,"""timer initialization steps"" perform EnsureCSPDoesNotBlockStringCompilation with undefined timer value",2024-12-06T16:38:30Z,bakkot
2523692033,whatwg/html,I guess I'd be fine with actually typing uppercase. Looping in other 262 editors @bakkot and @michae,https://github.com/whatwg/html/issues/10824#issuecomment-2523692033,https://github.com/whatwg/html/issues/10824,"""timer initialization steps"" perform EnsureCSPDoesNotBlockStringCompilation with undefined timer value",2024-12-06T16:33:57Z,syg
2523688586,w3ctag/design-reviews," >  > This still puts a lot of responsibility on whatever consent screen appears behind that popup",https://github.com/w3ctag/design-reviews/issues/975#issuecomment-2523688586,https://github.com/w3ctag/design-reviews/issues/975,Fenced frames with local unpartitioned data access,2024-12-06T16:32:02Z,shivanigithub
2523675193,w3ctag/design-reviews,"@JoshTumath Sorry, it's  <img width=""400"" alt=""Several rows of cat pictures, with rows scaled so th",https://github.com/w3ctag/design-reviews/issues/1003#issuecomment-2523675193,https://github.com/w3ctag/design-reviews/issues/1003,CSS Masonry Layout,2024-12-06T16:25:17Z,jyasskin
2523666965,whatwg/html,I have a slight preference for treating it the same way as any other response. (Fixing #4362 will li,https://github.com/whatwg/html/issues/10827#issuecomment-2523666965,https://github.com/whatwg/html/issues/10827,Browsers are not interoperable on navigating to no-Content-Type blob: URLs,2024-12-06T16:22:08Z,annevk
2523656947,w3ctag/design-reviews,"@jyasskin Your link to the 'Flickr-style grid' doesn't seem to work; I get a 404. Would you be able ",https://github.com/w3ctag/design-reviews/issues/1003#issuecomment-2523656947,https://github.com/w3ctag/design-reviews/issues/1003,CSS Masonry Layout,2024-12-06T16:19:26Z,JoshTumath
2523650699,mozilla/standards-positions,@sukima This feature is being discussed in https://github.com/w3c/webcrypto/issues/73. Nobody is dis,https://github.com/mozilla/standards-positions/issues/637#issuecomment-2523650699,https://github.com/mozilla/standards-positions/issues/637,Streams for the Web Cryptography API,2024-12-06T16:18:14Z,twiss
2523602063,w3c/pointerevents,> the boundary events should fire after a layout change  I think an important caveat here is not w,https://github.com/w3c/pointerevents/issues/529#issuecomment-2523602063,https://github.com/w3c/pointerevents/issues/529,Mouse and Pointer events from a stationary mouse,2024-12-06T16:08:49Z,flackr
2523592916,whatwg/html,I misunderstood you then. Sorry. Do we agree on the desired behavior though?,https://github.com/whatwg/html/issues/10495#issuecomment-2523592916,https://github.com/whatwg/html/issues/10495,"createPattern does not define how to resolve images without defined natural dimensions (e.g. some SVG images)  ",2024-12-06T16:06:06Z,schenney-chromium
2523554927,whatwg/html,"Chrome uses the size of the canvas at the pattern's *creation* time, not at its use time.   Here is",https://github.com/whatwg/html/issues/10495#issuecomment-2523554927,https://github.com/whatwg/html/issues/10495,"createPattern does not define how to resolve images without defined natural dimensions (e.g. some SVG images)  ",2024-12-06T15:53:46Z,Kaiido
2523539706,w3ctag/design-reviews," > If the content shown can affect whether a click occurs, then the embedding context gains informa",https://github.com/w3ctag/design-reviews/issues/975#issuecomment-2523539706,https://github.com/w3ctag/design-reviews/issues/975,Fenced frames with local unpartitioned data access,2024-12-06T15:48:50Z,shivanigithub
2523536451,mozilla/standards-positions,Another use case is that any data that is to be compressed then encrypted requires converting data t,https://github.com/mozilla/standards-positions/issues/637#issuecomment-2523536451,https://github.com/mozilla/standards-positions/issues/637,Streams for the Web Cryptography API,2024-12-06T15:47:35Z,sukima
2523531090,whatwg/html,"Yes, it is Copenhagen. I must have overlooked it on the signup form. Sorry about that.",https://github.com/whatwg/html/pull/10817#issuecomment-2523531090,https://github.com/whatwg/html/pull/10817,"Editorial: fix typo in ""adoption agency"" algorithm",2024-12-06T15:45:20Z,kspangsege
2523519479,mozilla/standards-positions,"I can understand peoples reservations in this regard but from a JS Dev's perspective I can say that ",https://github.com/mozilla/standards-positions/issues/637#issuecomment-2523519479,https://github.com/mozilla/standards-positions/issues/637,Streams for the Web Cryptography API,2024-12-06T15:39:31Z,sukima
2523469430,whatwg/html,"Coming back to this, I like the argument above that in canvas drawImage() we should always ignore CS",https://github.com/whatwg/html/issues/10492#issuecomment-2523469430,https://github.com/whatwg/html/issues/10492,Should orientation metadata (such as exif) be used when drawing HTMLImageElements/SVGImageElements to canvas?,2024-12-06T15:15:21Z,schenney-chromium
2523463389,whatwg/html,"It would also be nice to have a declarative API for this, e.g.  ``` @view-transition {   navigat",https://github.com/whatwg/html/issues/10831#issuecomment-2523463389,https://github.com/whatwg/html/issues/10831,Detect UA transitions on same-origin cross-document navigations,2024-12-06T15:12:11Z,nickcoury
2523445349,whatwg/html,"> The issue here is that there is no output bitmap for a CanvasPattern: these objects are ""canvas-ne",https://github.com/whatwg/html/issues/10495#issuecomment-2523445349,https://github.com/whatwg/html/issues/10495,"createPattern does not define how to resolve images without defined natural dimensions (e.g. some SVG images)  ",2024-12-06T15:03:24Z,schenney-chromium
2523440406,mozilla/standards-positions,See also https://github.com/WICG/proposals/issues/124 I believe,https://github.com/mozilla/standards-positions/issues/1139#issuecomment-2523440406,https://github.com/mozilla/standards-positions/issues/1139,Signature-based Integrity,2024-12-06T15:00:58Z,tomrittervg
2523437781,mozilla/standards-positions,@beurdouche,https://github.com/mozilla/standards-positions/issues/1139#issuecomment-2523437781,https://github.com/mozilla/standards-positions/issues/1139,Signature-based Integrity,2024-12-06T14:59:42Z,tomrittervg
2523320274,whatwg/html,"Depending on what browser you copy from, you might get lowercase or uppercase text, for instance. If",https://github.com/whatwg/html/issues/10824#issuecomment-2523320274,https://github.com/whatwg/html/issues/10824,"""timer initialization steps"" perform EnsureCSPDoesNotBlockStringCompilation with undefined timer value",2024-12-06T14:03:22Z,annevk
2523290249,whatwg/html,"I'm not sure the semantics/experience is significantly different... the end effect that, e.g., AT or",https://github.com/whatwg/html/issues/10824#issuecomment-2523290249,https://github.com/whatwg/html/issues/10824,"""timer initialization steps"" perform EnsureCSPDoesNotBlockStringCompilation with undefined timer value",2024-12-06T13:46:09Z,domenic
2523256193,mozilla/standards-positions,This would now require further changes to the new gh-data.py script to also support the new template,https://github.com/mozilla/standards-positions/pull/793#issuecomment-2523256193,https://github.com/mozilla/standards-positions/pull/793,chore: port GitHub issue form from Webkit,2024-12-06T13:26:59Z,zcorpan
2523249578,whatwg/html,Actually I don’t think this one’s a backward compat thing. Chromium behaves according to the require,https://github.com/whatwg/html/issues/10828#issuecomment-2523249578,https://github.com/whatwg/html/issues/10828,Iframe insertion steps violate rules for what insertion steps are allowed to do,2024-12-06T13:23:22Z,domfarolino
2523242741,whatwg/html,Does this actually need any chages to aam? https://w3c.github.io/html-aam/#att-popover - the existin,https://github.com/whatwg/html/pull/9778#issuecomment-2523242741,https://github.com/whatwg/html/pull/9778,Add popover=hint,2024-12-06T13:19:26Z,lukewarlow
2523228470,mozilla/standards-positions,"> Is the goal to eventually list them all there?  No, going forward we'll only add entries to that",https://github.com/mozilla/standards-positions/pull/1034#issuecomment-2523228470,https://github.com/mozilla/standards-positions/pull/1034,Map mozilla positions to web-features IDs,2024-12-06T13:11:45Z,zcorpan
2523198663,whatwg/html,It seems like this embedded signal should be coordinated with the page-wide and site-wide signals be,https://github.com/whatwg/html/issues/10519#issuecomment-2523198663,https://github.com/whatwg/html/issues/10519,Proposal: Element 'sensitive' attribute,2024-12-06T12:59:00Z,jyasskin
2523015456,WICG/webcomponents,"> As for templating, there are ways to perform templating without special markup, just in a declarat",https://github.com/WICG/webcomponents/issues/1090#issuecomment-2523015456,https://github.com/WICG/webcomponents/issues/1090,[declarative-custom-elements] do we need DOM parts or any template mechanism in spec?,2024-12-06T11:47:16Z,bahrus
2522756442,whatwg/html,I worry a bit about implications for things like https://html.spec.whatwg.org/#activation. We'd have,https://github.com/whatwg/html/issues/10762#issuecomment-2522756442,https://github.com/whatwg/html/issues/10762,How to spec user interaction for select,2024-12-06T10:22:40Z,annevk
2522738562,whatwg/html,> Just dropping this as an FYI: :read-only is defined as :not(:read-write)  Isn't that from before t,https://github.com/whatwg/html/pull/10126#issuecomment-2522738562,https://github.com/whatwg/html/pull/10126,Add the :open pseudo-class,2024-12-06T10:14:40Z,lukewarlow
2522658279,whatwg/html,"/ping @jakearchibald ",https://github.com/whatwg/html/issues/10831#issuecomment-2522658279,https://github.com/whatwg/html/issues/10831,Detect UA transitions on same-origin cross-document navigations,2024-12-06T09:40:45Z,bramus
2522626168,whatwg/html,"I did look at this when reviewing, but the problem is that they use `<emu-const>` with `text-transfo",https://github.com/whatwg/html/issues/10824#issuecomment-2522626168,https://github.com/whatwg/html/issues/10824,"""timer initialization steps"" perform EnsureCSPDoesNotBlockStringCompilation with undefined timer value",2024-12-06T09:23:24Z,annevk
2522542479,whatwg/html,"@lukewarlow good catch! Right now the end tag is handled by ""Any other end tag"", which will ignore t",https://github.com/whatwg/html/pull/10557#issuecomment-2522542479,https://github.com/whatwg/html/pull/10557,Relax `<select>` parser,2024-12-06T08:51:30Z,zcorpan
2522414299,whatwg/html,It's true but it's also an old backwards compat thing. I wonder though why the iframe steps are not,https://github.com/whatwg/html/issues/10828#issuecomment-2522414299,https://github.com/whatwg/html/issues/10828,Iframe insertion steps violate rules for what insertion steps are allowed to do,2024-12-06T07:56:09Z,noamr
2522305710,whatwg/notifications,"> just opens the origin URL  From all the things this is the weirdest behavior listed to me, but w",https://github.com/whatwg/notifications/issues/204#issuecomment-2522305710,https://github.com/whatwg/notifications/issues/204,Should a non-persistent notification be auto-closed or not?,2024-12-06T07:21:32Z,annevk
2522289548,whatwg/html,I have not enabled the lossy setting so the savings are found elsewhere.,https://github.com/whatwg/html/pull/10823#issuecomment-2522289548,https://github.com/whatwg/html/pull/10823,Meta: run images through ImageOptim,2024-12-06T07:08:44Z,annevk
2522081477,whatwg/html,Seems like https://github.com/whatwg/html/issues/10828 should be addressed here too?,https://github.com/whatwg/html/pull/10657#issuecomment-2522081477,https://github.com/whatwg/html/pull/10657,State-preserving atomic move integration,2024-12-06T04:10:22Z,domenic
2522072858,whatwg/html,"I will plan to merge this once we have a html-aam PR adding hint as a sibling of auto and manual. ",https://github.com/whatwg/html/pull/9778#issuecomment-2522072858,https://github.com/whatwg/html/pull/9778,Add popover=hint,2024-12-06T04:01:39Z,domenic
2522072856,whatwg/html,"The insertion steps also handle the about:blank case which involves firing events, which is another ",https://github.com/whatwg/html/issues/10828#issuecomment-2522072856,https://github.com/whatwg/html/issues/10828,Iframe insertion steps violate rules for what insertion steps are allowed to do,2024-12-06T04:01:38Z,jdm
2522069965,whatwg/html,I took a bit more of a look at this. It's messier than it first appears.  There's kind of a genera,https://github.com/whatwg/html/issues/10796#issuecomment-2522069965,https://github.com/whatwg/html/issues/10796,"""create navigation params by fetching"" invokes ""should navigation request of type be blocked by Content Security Policy?"" without setting the policy container",2024-12-06T03:58:05Z,domenic
2521942342,whatwg/webidl,I believe so. We might have just forgot to close this.,https://github.com/whatwg/webidl/issues/84#issuecomment-2521942342,https://github.com/whatwg/webidl/issues/84,provide clearer advice about USVString vs. DOMString,2024-12-06T02:19:46Z,cynthia
2521934716,whatwg/html,> > Why wouldn't we use activation behavior for option? >  > I think that using activation behavio,https://github.com/whatwg/html/issues/10762#issuecomment-2521934716,https://github.com/whatwg/html/issues/10762,How to spec user interaction for select,2024-12-06T02:12:04Z,domenic
2521930909,whatwg/notifications,Chrome and Safari (haven't tested Firefox) violate the next line as well:  > User agents should no,https://github.com/whatwg/notifications/issues/204#issuecomment-2521930909,https://github.com/whatwg/notifications/issues/204,Should a non-persistent notification be auto-closed or not?,2024-12-06T02:08:28Z,reillyeon
2521907942,WICG/webcomponents,"I see the WPT tests assert that IDL attributes _do_ follow `referenceTarget` references, e.g.:  ht",https://github.com/WICG/webcomponents/issues/1089#issuecomment-2521907942,https://github.com/WICG/webcomponents/issues/1089,Reference Target: What about IDL attributes?,2024-12-06T01:45:22Z,alice
2521898863,whatwg/html,"I would indeed prefer to match ES's formatting and use ""TIMER"". I guess we should do all the enums a",https://github.com/whatwg/html/issues/10824#issuecomment-2521898863,https://github.com/whatwg/html/issues/10824,"""timer initialization steps"" perform EnsureCSPDoesNotBlockStringCompilation with undefined timer value",2024-12-06T01:37:08Z,domenic
2521897581,whatwg/html,> but Chrome and Safari navigate to about:blank (and fire `load`).  Probably the most important qu,https://github.com/whatwg/html/issues/1895#issuecomment-2521897581,https://github.com/whatwg/html/issues/1895,Iframe with initial javascript: source needs to fire the load event in various cases,2024-12-06T01:35:51Z,domenic
2521848917,WICG/webcomponents,"As for templating, there are ways to perform templating without special markup, just in a declarativ",https://github.com/WICG/webcomponents/issues/1090#issuecomment-2521848917,https://github.com/WICG/webcomponents/issues/1090,[declarative-custom-elements] do we need DOM parts or any template mechanism in spec?,2024-12-06T00:55:47Z,mildred
2521840313,WICG/webcomponents,To answer some of #1009 questions:  * Declaration      * How are attributes and properties decla,https://github.com/WICG/webcomponents/issues/1090#issuecomment-2521840313,https://github.com/WICG/webcomponents/issues/1090,[declarative-custom-elements] do we need DOM parts or any template mechanism in spec?,2024-12-06T00:47:56Z,mildred
2521745072,WICG/webcomponents,> Something that still needs to be considered for HTML modules is how to manage [base urls](https://,https://github.com/WICG/webcomponents/issues/1059#issuecomment-2521745072,https://github.com/WICG/webcomponents/issues/1059,Exploration: HTML Module Imports and Exports,2024-12-05T23:52:53Z,mildred
2521643627,whatwg/html,"During the joint CSSWG+HTML meeting, we [discussed this issue again](https://github.com/whatwg/html/",https://github.com/whatwg/html/issues/10642#issuecomment-2521643627,https://github.com/whatwg/html/issues/10642,tabindex vs reading-flow property,2024-12-05T22:51:32Z,dizhang168
2521521276,whatwg/html,I added paragraphs for opening the picker and moving focus between options,https://github.com/whatwg/html/pull/10629#issuecomment-2521521276,https://github.com/whatwg/html/pull/10629,Define base appearance for <select>,2024-12-05T21:46:46Z,josepharhar
2521520284,whatwg/html,"Based on the discussion at whatnot I added the paragraph I mentioned earlier in this thread as well ",https://github.com/whatwg/html/issues/10762#issuecomment-2521520284,https://github.com/whatwg/html/issues/10762,How to spec user interaction for select,2024-12-05T21:46:15Z,josepharhar
2521399519,whatwg/html,Btw I think [this](https://wpt.live//html/semantics/forms/the-select-element/select-value.html) test,https://github.com/whatwg/html/pull/10557#issuecomment-2521399519,https://github.com/whatwg/html/pull/10557,Relax `<select>` parser,2024-12-05T20:59:21Z,lukewarlow
2521348416,whatwg/html,Thank you all for attending the meeting today and a special thank you to Chris for taking meeting no,https://github.com/whatwg/html/issues/10805#issuecomment-2521348416,https://github.com/whatwg/html/issues/10805,Upcoming WHATNOT meeting on 2024-12-05,2024-12-05T20:38:34Z,past
2521154432,w3c/pointerevents,"One important point is that any click-like event fired before the very last button-up action has no ",https://github.com/w3c/pointerevents/issues/530#issuecomment-2521154432,https://github.com/w3c/pointerevents/issues/530,Interop: major browsers fire click/auxclick events differently for chorded buttons,2024-12-05T18:44:27Z,mustaqahmed
2521028029,mozilla/standards-positions,I want my Yubikey to work with my favorite browser,https://github.com/mozilla/standards-positions/issues/798#issuecomment-2521028029,https://github.com/mozilla/standards-positions/issues/798,WebAuthn PRF extension,2024-12-05T17:39:43Z,gurgl
2520975889,mozilla/standards-positions,To update this the latest PR is at https://github.com/whatwg/html/pull/10737,https://github.com/mozilla/standards-positions/issues/998#issuecomment-2520975889,https://github.com/mozilla/standards-positions/issues/998,Dialog light dismiss,2024-12-05T17:24:13Z,lukewarlow
