id,repo,body,url,issue_url,issue_title,created_at,user
2853050168,whatwg/html," > ```js > const prop = 'class' > const value = { red:true } >  > if( prop in node ) { >   node[prop",https://github.com/whatwg/html/issues/9379#issuecomment-2853050168,https://github.com/whatwg/html/issues/9379,Add `class` & `for` aliases for `className` and `htmlFor`,2025-05-06T01:59:56Z,trusktr
2853035214,whatwg/html,"> `className` is currently defined on `Element`, but `SVGElement` overrides it.  Nice, this means `.",https://github.com/whatwg/html/issues/9379#issuecomment-2853035214,https://github.com/whatwg/html/issues/9379,Add `class` & `for` aliases for `className` and `htmlFor`,2025-05-06T01:55:58Z,trusktr
2852552253,w3c/clipboard-apis,"> In the following steps, iterating over `itemList`: >  > https://w3c.github.io/clipboard-apis/#dom-",https://github.com/w3c/clipboard-apis/issues/237#issuecomment-2852552253,https://github.com/w3c/clipboard-apis/issues/237,Questions about implementing `clipboard.write`,2025-05-05T22:47:58Z,EdgarChen
2852480261,whatwg/html,Considering the WHATNOT discussion in #11233 about links to links:  >Luke: I remember we discussed b,https://github.com/whatwg/html/issues/11019#issuecomment-2852480261,https://github.com/whatwg/html/issues/11019,Support fragment references in the `<link>` tag's `href` attribute,2025-05-05T22:21:47Z,robglidden
2852387257,whatwg/html,"No, I am brainstorming how this could break something.   However, this svelte code comes very close:",https://github.com/whatwg/html/issues/9379#issuecomment-2852387257,https://github.com/whatwg/html/issues/9379,Add `class` & `for` aliases for `className` and `htmlFor`,2025-05-05T21:32:29Z,titoBouzout
2852345632,whatwg/html,"I would love this to become a reality ",https://github.com/whatwg/html/issues/2791#issuecomment-2852345632,https://github.com/whatwg/html/issues/2791,Client side include feature for HTML,2025-05-05T21:09:28Z,DanielTate
2852295948,whatwg/html,@bkardell That's pretty much just a subset of my `<number>` proposal.,https://github.com/whatwg/html/issues/4630#issuecomment-2852295948,https://github.com/whatwg/html/issues/4630,Port the ECMAScript Intl API as declarative elements,2025-05-05T20:46:58Z,dead-claudia
2852256198,w3c/clipboard-apis,> Regarding the last steps: >  > > 1. For each systemClipboardItem in data: > >    ... > > 2. [Rejec,https://github.com/w3c/clipboard-apis/issues/236#issuecomment-2852256198,https://github.com/w3c/clipboard-apis/issues/236,Clarifying `clipboard.readText()` behaviour,2025-05-05T20:28:49Z,EdgarChen
2852250960,whatwg/dom,"@WebReflection that's a good question, I expect that the `fragment` would never disappear from the t",https://github.com/whatwg/dom/issues/736#issuecomment-2852250960,https://github.com/whatwg/dom/issues/736,Proposal: a DocumentFragment whose nodes do not get removed once inserted,2025-05-05T20:26:15Z,robbiespeed
2852229024,w3c/clipboard-apis,"> > Related, for these steps: > >  > > ``` > > 2. Let representationDataPromise be the representatio",https://github.com/w3c/clipboard-apis/issues/236#issuecomment-2852229024,https://github.com/w3c/clipboard-apis/issues/236,Clarifying `clipboard.readText()` behaviour,2025-05-05T20:15:54Z,Gae24
2852181789,w3c/clipboard-apis,"> Related, for these steps: >  > ``` > 2. Let representationDataPromise be the representation’s data",https://github.com/w3c/clipboard-apis/issues/236#issuecomment-2852181789,https://github.com/w3c/clipboard-apis/issues/236,Clarifying `clipboard.readText()` behaviour,2025-05-05T19:54:10Z,EdgarChen
2852111444,whatwg/html,also related? https://github.com/openui/open-ui/issues/499,https://github.com/whatwg/html/issues/4630#issuecomment-2852111444,https://github.com/whatwg/html/issues/4630,Port the ECMAScript Intl API as declarative elements,2025-05-05T19:27:39Z,bkardell
2852036259,w3c/clipboard-apis,"> How can it be ""text/plain""? Shouldn't we check the essence of `mimeType`, which is: >  > > 1. Let ",https://github.com/w3c/clipboard-apis/issues/236#issuecomment-2852036259,https://github.com/w3c/clipboard-apis/issues/236,Clarifying `clipboard.readText()` behaviour,2025-05-05T19:00:54Z,EdgarChen
2851835395,whatwg/html,"well opening a tab in background, there isnt a general api for that, i know thats because would be a",https://github.com/whatwg/html/issues/10751#issuecomment-2851835395,https://github.com/whatwg/html/issues/10751,Way to close stale window with null reference that browser opens after a blocked popup was allowed by user,2025-05-05T17:44:34Z,tathastu871
2851732318,whatwg/html,Thanks!,https://github.com/whatwg/html/pull/11277#issuecomment-2851732318,https://github.com/whatwg/html/pull/11277,[autofocus] Remove cross-origin check step for autofocus candidates,2025-05-05T17:26:04Z,annevk
2851685092,whatwg/html,"Thanks @annevk, I just managed to solve the Participation issue. Now it seems like all checks pass.",https://github.com/whatwg/html/pull/11277#issuecomment-2851685092,https://github.com/whatwg/html/pull/11277,[autofocus] Remove cross-origin check step for autofocus candidates,2025-05-05T17:09:25Z,ffiori
2851294473,whatwg/html,"> If `<template/>` elements allowed for a `src` attribute, includes would be already possible using ",https://github.com/whatwg/html/issues/2791#issuecomment-2851294473,https://github.com/whatwg/html/issues/2791,Client side include feature for HTML,2025-05-05T15:01:42Z,justinfagnani
2851278993,whatwg/html,"Firefox plans to ship `webkitdirectory` on Android soon (it has been shipping on desktop for a long ",https://github.com/whatwg/html/issues/217#issuecomment-2851278993,https://github.com/whatwg/html/issues/217,"Merge ""File and Directory Entries API"" into HTML",2025-05-05T14:56:55Z,zcorpan
2851251385,whatwg/html,I think https://github.com/whatwg/html/issues/2142 may be a necessary primitive for this feature.,https://github.com/whatwg/html/issues/2791#issuecomment-2851251385,https://github.com/whatwg/html/issues/2791,Client side include feature for HTML,2025-05-05T14:47:16Z,zcorpan
2851235267,whatwg/html,"@keithamus ",https://github.com/whatwg/html/issues/11246#issuecomment-2851235267,https://github.com/whatwg/html/issues/11246,Make popover implicit anchor and invoker match,2025-05-05T14:41:45Z,smaug----
2851229315,whatwg/html,What is the use case to open a popup window when there isn't a transient user activation to consume?,https://github.com/whatwg/html/issues/10751#issuecomment-2851229315,https://github.com/whatwg/html/issues/10751,Way to close stale window with null reference that browser opens after a blocked popup was allowed by user,2025-05-05T14:39:45Z,smaug----
2851111205,whatwg/html,Thanks Scott! I added a note here: https://github.com/whatwg/html/pull/10633/commits/bcd9669f81aa551,https://github.com/whatwg/html/pull/10633#issuecomment-2851111205,https://github.com/whatwg/html/pull/10633,Define the `<selectedcontent>` element,2025-05-05T14:01:21Z,josepharhar
2850980937,webkit/standards-positions,"Thank you for the update! As no other concerns have come in I once again suggest resolving this as """,https://github.com/WebKit/standards-positions/issues/292#issuecomment-2850980937,https://github.com/WebKit/standards-positions/issues/292,Observable,2025-05-05T13:17:35Z,annevk
2850943982,whatwg/html,"That appears sufficient, yes. In that case I think we should just consider this a bug fix on top of ",https://github.com/whatwg/html/pull/11277#issuecomment-2850943982,https://github.com/whatwg/html/pull/11277,[autofocus] Remove cross-origin check step for autofocus candidates,2025-05-05T13:03:58Z,annevk
2850933099,whatwg/html,I noticed another error while fixing a wrapping issue. _chosen_ is introduced at the start of this a,https://github.com/whatwg/html/pull/11284#issuecomment-2850933099,https://github.com/whatwg/html/pull/11284,Fix variable name in #the-rules-for-choosing-a-navigable,2025-05-05T13:00:54Z,annevk
2850854390,mozilla/standards-positions,"@jfkthame ",https://github.com/mozilla/standards-positions/issues/1222#issuecomment-2850854390,https://github.com/mozilla/standards-positions/issues/1222,Ignore Letter Spacing in Cursive Scripts,2025-05-05T12:35:24Z,smaug----
2850842341,whatwg/html,"Thanks for the discussion here, everyone. It looks like there is not real interest in changing the w",https://github.com/whatwg/html/issues/10875#issuecomment-2850842341,https://github.com/whatwg/html/issues/10875,Are all uses of the `title` attribute discouraged?,2025-05-05T12:30:27Z,ddbeck
2850592956,whatwg/html,"Oh, thanks for catching the issue. I opened a PR to fix it.",https://github.com/whatwg/html/issues/11282#issuecomment-2850592956,https://github.com/whatwg/html/issues/11282,Rules for choosing a navigable use a non-existent `targetNavigable` variable,2025-05-05T10:41:01Z,vinhill
2850458142,whatwg/html,@titoBouzout do you know of a JS library or so that does that?,https://github.com/whatwg/html/issues/9379#issuecomment-2850458142,https://github.com/whatwg/html/issues/9379,Add `class` & `for` aliases for `className` and `htmlFor`,2025-05-05T09:40:59Z,zcorpan
2850373106,whatwg/html,"If `<template/>` elements allowed for a `src` attribute, includes would be already possible using th",https://github.com/whatwg/html/issues/2791#issuecomment-2850373106,https://github.com/whatwg/html/issues/2791,Client side include feature for HTML,2025-05-05T09:10:20Z,mildred
2850207677,whatwg/dom,@robbiespeed about this:  > Fragments children would be replaced once loaded  does this happens only,https://github.com/whatwg/dom/issues/736#issuecomment-2850207677,https://github.com/whatwg/dom/issues/736,Proposal: a DocumentFragment whose nodes do not get removed once inserted,2025-05-05T08:00:59Z,WebReflection
2849404655,whatwg/dom,"I was originally pretty sceptical of the idea of a wrapper element that appears as a true parent in ",https://github.com/whatwg/dom/issues/736#issuecomment-2849404655,https://github.com/whatwg/dom/issues/736,Proposal: a DocumentFragment whose nodes do not get removed once inserted,2025-05-04T20:30:37Z,robbiespeed
2849304121,whatwg/html,Related: https://github.com/whatwg/html/issues/4630#issuecomment-2849303093,https://github.com/whatwg/html/issues/2404#issuecomment-2849304121,https://github.com/whatwg/html/issues/2404,A tag to display date and/or time to the user in his preferred format.,2025-05-04T16:34:21Z,dead-claudia
2849303682,WICG/webcomponents,Related: https://github.com/whatwg/html/issues/4630#issuecomment-2849303093,https://github.com/WICG/webcomponents/issues/1064#issuecomment-2849303682,https://github.com/WICG/webcomponents/issues/1064,Simplified custom element definition,2025-05-04T16:33:25Z,dead-claudia
2849303093,whatwg/html,"Okay, https://github.com/w3c/csswg-drafts/issues/12146 got me searching here, and I have a concrete ",https://github.com/whatwg/html/issues/4630#issuecomment-2849303093,https://github.com/whatwg/html/issues/4630,Port the ECMAScript Intl API as declarative elements,2025-05-04T16:31:51Z,dead-claudia
2849243035,whatwg/html,This will break code that assumed `class` doesnt exists. Such  ```js const prop = 'class' const valu,https://github.com/whatwg/html/issues/9379#issuecomment-2849243035,https://github.com/whatwg/html/issues/9379,Add `class` & `for` aliases for `className` and `htmlFor`,2025-05-04T14:11:58Z,titoBouzout
2849129445,w3c/pointerevents,piss off,https://github.com/w3c/pointerevents/pull/549#issuecomment-2849129445,https://github.com/w3c/pointerevents/pull/549,UbjbCreate SECURITY.mdkkonk,2025-05-04T10:21:32Z,patrickhlauke
2849090089,w3c/pointerevents,Bbk,https://github.com/w3c/pointerevents/pull/549#issuecomment-2849090089,https://github.com/w3c/pointerevents/pull/549,UbjbCreate SECURITY.mdkkonk,2025-05-04T08:49:25Z,ayala170424
2848794533,w3c/pointerevents,Hello. Sorry to bump this issue. I have an Android tablet from Samsung with a pen digitizer that rep,https://github.com/w3c/pointerevents/issues/469#issuecomment-2848794533,https://github.com/w3c/pointerevents/issues/469,"Support for pens that report ""hover distance""",2025-05-03T20:29:26Z,wareya
2848612922,whatwg/html,"cc: @vinhill as this was introduced in your PR #11208 ",https://github.com/whatwg/html/issues/11282#issuecomment-2848612922,https://github.com/whatwg/html/issues/11282,Rules for choosing a navigable use a non-existent `targetNavigable` variable,2025-05-03T12:44:23Z,AtkinsSJ
2848592071,whatwg/html,"Yeah I agree this should not be closed, or at least a separate issue should be open to sort this out",https://github.com/whatwg/html/issues/11244#issuecomment-2848592071,https://github.com/whatwg/html/issues/11244,"cloneNode with nodes with resources such as <link rel=""stylesheet"">",2025-05-03T11:58:38Z,emilio
2848451122,whatwg/html,> I figured implementation-specific bugs should be tracked in their own bug databases  It's not an i,https://github.com/whatwg/html/issues/11244#issuecomment-2848451122,https://github.com/whatwg/html/issues/11244,"cloneNode with nodes with resources such as <link rel=""stylesheet"">",2025-05-03T05:52:21Z,annevk
2848281996,whatwg/html,I was referring to same-document. The potential bug is that `Cache-Control: no-store` is ignored wit,https://github.com/whatwg/html/issues/11244#issuecomment-2848281996,https://github.com/whatwg/html/issues/11244,"cloneNode with nodes with resources such as <link rel=""stylesheet"">",2025-05-02T23:42:42Z,KurtCattiSchmidt
2848262077,whatwg/html,"Hi @annevk, thanks for your review! There are already a couple WPT tests about the interaction of au",https://github.com/whatwg/html/pull/11277#issuecomment-2848262077,https://github.com/whatwg/html/pull/11277,[autofocus] Remove cross-origin check step for autofocus candidates,2025-05-02T23:16:40Z,ffiori
2848177052,whatwg/html,"Cache-  > > Yeah, I made the cache work across documents in https://bugzilla.mozilla.org/show_bug.cg",https://github.com/whatwg/html/issues/11244#issuecomment-2848177052,https://github.com/whatwg/html/issues/11244,"cloneNode with nodes with resources such as <link rel=""stylesheet"">",2025-05-02T21:50:09Z,emilio
2848100156,whatwg/html,"It's unlikely to be problematic from a back-compat perspective, it's just of extremely minimal value",https://github.com/whatwg/html/issues/11240#issuecomment-2848100156,https://github.com/whatwg/html/issues/11240,"Proposal: Shorthand syntax for external stylesheets (<style src=""..."">)",2025-05-02T20:52:08Z,tabatkins
2847881528,mozilla/standards-positions,"Awesome, thank you very much for the detailed feedback. That gives me a lot of concrete stuff to go ",https://github.com/mozilla/standards-positions/issues/1181#issuecomment-2847881528,https://github.com/mozilla/standards-positions/issues/1181,The `interesttarget` attribute,2025-05-02T18:51:44Z,mfreed7
2847839555,w3ctag/design-reviews,"(to add) At the moment WebAuthn does not support or define a behavior for the ""silent"" mediation opt",https://github.com/w3ctag/design-reviews/issues/1052#issuecomment-2847839555,https://github.com/w3ctag/design-reviews/issues/1052,Early Design Review for Device Bound Session Credentials,2025-05-02T18:27:13Z,arnar
2847698111,whatwg/html,> I'm not sure why you closed this. There's definitely still a difference between implementations an,https://github.com/whatwg/html/issues/11244#issuecomment-2847698111,https://github.com/whatwg/html/issues/11244,"cloneNode with nodes with resources such as <link rel=""stylesheet"">",2025-05-02T17:04:09Z,KurtCattiSchmidt
2847692169,whatwg/html,"> Yeah, I made the cache work across documents in https://bugzilla.mozilla.org/show_bug.cgi?id=15991",https://github.com/whatwg/html/issues/11244#issuecomment-2847692169,https://github.com/whatwg/html/issues/11244,"cloneNode with nodes with resources such as <link rel=""stylesheet"">",2025-05-02T17:00:51Z,KurtCattiSchmidt
2847661683,whatwg/html,Stumbled across [this](https://drafts.csswg.org/css-values/#relative-urls) too: > Style sheets embed,https://github.com/whatwg/html/issues/11281#issuecomment-2847661683,https://github.com/whatwg/html/issues/11281,"Style sheets created from `<style>` elements have no location, which breaks CSS fetch algorithms",2025-05-02T16:43:26Z,AtkinsSJ
2847626371,whatwg/html,"I suppose I'll defer to @smaug---- on that, though generally we don't want the specification to be i",https://github.com/whatwg/html/pull/11255#issuecomment-2847626371,https://github.com/whatwg/html/pull/11255,Make command events not composed,2025-05-02T16:24:32Z,annevk
2847620334,whatwg/html,Do we need to work out the specifics to that before we change the composedness?  I think it'd be goo,https://github.com/whatwg/html/pull/11255#issuecomment-2847620334,https://github.com/whatwg/html/pull/11255,Make command events not composed,2025-05-02T16:21:11Z,lukewarlow
2847593330,w3ctag/design-reviews,Re reusing a WebAuthn key and any potential/future mediation=silent API:  WebAuthn's primary use cas,https://github.com/w3ctag/design-reviews/issues/1052#issuecomment-2847593330,https://github.com/w3ctag/design-reviews/issues/1052,Early Design Review for Device Bound Session Credentials,2025-05-02T16:06:48Z,arnar
2847387972,whatwg/html,"I have UseCounters for this which haven't reached stable yet, and I am working with accessibility fo",https://github.com/whatwg/html/pull/10557#issuecomment-2847387972,https://github.com/whatwg/html/pull/10557,Relax `<select>` parser,2025-05-02T14:47:10Z,josepharhar
2847353840,whatwg/html,That doesn't answer the more significant question. (And I don't really have the data to pick between,https://github.com/whatwg/html/pull/10557#issuecomment-2847353840,https://github.com/whatwg/html/pull/10557,Relax `<select>` parser,2025-05-02T14:30:54Z,annevk
2847348994,whatwg/html,"Good point, I'd be OK with doing the `<input>` closing `<select>` logic when encountering `<input>`,",https://github.com/whatwg/html/pull/10557#issuecomment-2847348994,https://github.com/whatwg/html/pull/10557,Relax `<select>` parser,2025-05-02T14:28:32Z,josepharhar
2847304296,whatwg/html,"its about adding official method to check if popup permission given, else explicitely ask  Currently",https://github.com/whatwg/html/issues/10751#issuecomment-2847304296,https://github.com/whatwg/html/issues/10751,Way to close stale window with null reference that browser opens after a blocked popup was allowed by user,2025-05-02T14:10:44Z,tathastu871
2847206911,w3c/pointerevents,"An other data point, just in case: the draft Process retires the stage ""[Proposed Recommendation](ht",https://github.com/w3c/pointerevents/issues/471#issuecomment-2847206911,https://github.com/w3c/pointerevents/issues/471,Making PointerEvents a living standard after v3?,2025-05-02T13:29:12Z,plehegar
2847190233,w3c/pointerevents,"one update here: a few groups, more prominently the Web Applications Working Group, have moved away ",https://github.com/w3c/pointerevents/issues/471#issuecomment-2847190233,https://github.com/w3c/pointerevents/issues/471,Making PointerEvents a living standard after v3?,2025-05-02T13:21:16Z,plehegar
2847093540,whatwg/html,That would mean `<select><option><input>` and `<select><optgroup><input>` would also not pop the `op,https://github.com/whatwg/html/pull/10557#issuecomment-2847093540,https://github.com/whatwg/html/pull/10557,Relax `<select>` parser,2025-05-02T12:29:18Z,annevk
2847052106,whatwg/html,"@bburns , yes `<object>`, that is how I load my HTML document fragments with [my solution to this pr",https://github.com/whatwg/html/issues/2791#issuecomment-2847052106,https://github.com/whatwg/html/issues/2791,Client side include feature for HTML,2025-05-02T12:05:17Z,maherbo
2846994491,mozilla/standards-positions,"> So it'd be very helpful to me if you could expand on this a bit. Your comment says ""without a stor",https://github.com/mozilla/standards-positions/issues/1181#issuecomment-2846994491,https://github.com/mozilla/standards-positions/issues/1181,The `interesttarget` attribute,2025-05-02T11:30:07Z,keithamus
2846870264,mozilla/standards-positions,"I think this looks good, and is well motivated. It's a small low complexity feature that adds ergono",https://github.com/mozilla/standards-positions/issues/1220#issuecomment-2846870264,https://github.com/mozilla/standards-positions/issues/1220,ToggleEvent source attribute,2025-05-02T10:18:30Z,keithamus
2846836710,whatwg/html,"Thank you!  This looks good to me, but we should add some test coverage for the combination of thi",https://github.com/whatwg/html/pull/11277#issuecomment-2846836710,https://github.com/whatwg/html/pull/11277,[autofocus] Remove cross-origin check step for autofocus candidates,2025-05-02T09:59:03Z,annevk
2846725023,whatwg/html,"Adding ""do not merge yet"" as it seems like we need to figure out to what extent we need the same mod",https://github.com/whatwg/html/pull/11255#issuecomment-2846725023,https://github.com/whatwg/html/pull/11255,Make command events not composed,2025-05-02T09:06:22Z,annevk
2846700645,whatwg/html," > @trusktr Wouldn't it be easier to simply run existing HTML parser logic on the included HTML with",https://github.com/whatwg/html/issues/2791#issuecomment-2846700645,https://github.com/whatwg/html/issues/2791,Client side include feature for HTML,2025-05-02T08:52:53Z,bburns
2846627713,whatwg/html,"Right, #6110 is about how the memory cache is much larger than the spec's existing ""list of availabl",https://github.com/whatwg/html/issues/11244#issuecomment-2846627713,https://github.com/whatwg/html/issues/11244,"cloneNode with nodes with resources such as <link rel=""stylesheet"">",2025-05-02T08:13:39Z,domenic
2846531639,whatwg/html,"Well, but this is clearly a different case from images.",https://github.com/whatwg/html/issues/11244#issuecomment-2846531639,https://github.com/whatwg/html/issues/11244,"cloneNode with nodes with resources such as <link rel=""stylesheet"">",2025-05-02T07:14:24Z,annevk
2846524942,whatwg/html,"I mean, I'm not sure what we would retitle it as. We determined after eventual root-cause analysis t",https://github.com/whatwg/html/issues/11244#issuecomment-2846524942,https://github.com/whatwg/html/issues/11244,"cloneNode with nodes with resources such as <link rel=""stylesheet"">",2025-05-02T07:09:26Z,domenic
2846522604,whatwg/html,"That seems fine, but we might want to retitle that issue then. And in that case we shouldn't close t",https://github.com/whatwg/html/issues/11244#issuecomment-2846522604,https://github.com/whatwg/html/issues/11244,"cloneNode with nodes with resources such as <link rel=""stylesheet"">",2025-05-02T07:07:53Z,annevk
2846513162,whatwg/html,"There is, but we can roll it into #6110, right?",https://github.com/whatwg/html/issues/11244#issuecomment-2846513162,https://github.com/whatwg/html/issues/11244,"cloneNode with nodes with resources such as <link rel=""stylesheet"">",2025-05-02T07:01:18Z,domenic
2846485916,whatwg/html,"I'm not sure why you closed this. There's definitely still a difference between implementations and ",https://github.com/whatwg/html/issues/11244#issuecomment-2846485916,https://github.com/whatwg/html/issues/11244,"cloneNode with nodes with resources such as <link rel=""stylesheet"">",2025-05-02T06:41:31Z,annevk
2846291376,whatwg/html,Using a generated passwords are very common among normal users and it is very frustrating to know th,https://github.com/whatwg/html/issues/3518#issuecomment-2846291376,https://github.com/whatwg/html/issues/3518,Proposal: HTML passwordrules attribute,2025-05-02T04:32:49Z,shaheennamboori
2845898836,whatwg/html,@edbaafi   > [@justinfagnani](https://github.com/justinfagnani) Sorry I missed this. Could you expla,https://github.com/whatwg/html/issues/11202#issuecomment-2845898836,https://github.com/whatwg/html/issues/11202,Allow importing and exporting from inline module scripts,2025-05-01T22:16:43Z,justinfagnani
2845807651,whatwg/html,"I'm not aware of any justification for this, although Mason implemented it in chromium so he might k",https://github.com/whatwg/html/issues/11246#issuecomment-2845807651,https://github.com/whatwg/html/issues/11246,Make popover implicit anchor and invoker match,2025-05-01T21:20:46Z,josepharhar
2845792794,whatwg/html,> No strong opinions. I guess I'd think maybe it should be summary in the case that that's the sourc,https://github.com/whatwg/html/issues/9111#issuecomment-2845792794,https://github.com/whatwg/html/issues/9111,Popover does not know what triggered it,2025-05-01T21:14:08Z,josepharhar
2845778005,whatwg/html,"It turns out the Chromium issue only happens with local files, due to a proprietary behavior to alwa",https://github.com/whatwg/html/issues/11244#issuecomment-2845778005,https://github.com/whatwg/html/issues/11244,"cloneNode with nodes with resources such as <link rel=""stylesheet"">",2025-05-01T21:06:09Z,KurtCattiSchmidt
2845638663,mozilla/standards-positions,FYI there’s a caniuse.com URL now https://caniuse.com/mdn-css_types_calc-size,https://github.com/mozilla/standards-positions/issues/1022#issuecomment-2845638663,https://github.com/mozilla/standards-positions/issues/1022,CSS interpolate-size property and calc-size() function,2025-05-01T19:58:29Z,tedw
2845466074,w3c/pointerevents,Merci Philippe,https://github.com/w3c/pointerevents/pull/547#issuecomment-2845466074,https://github.com/w3c/pointerevents/pull/547,Backports #545 #546,2025-05-01T18:44:30Z,patrickhlauke
2845439104,w3c/pointerevents,> should this also be ported to v3?  All done.,https://github.com/w3c/pointerevents/pull/545#issuecomment-2845439104,https://github.com/w3c/pointerevents/pull/545,Pretty tables and dark mode,2025-05-01T18:30:40Z,plehegar
2845430135,whatwg/html,Thanks luke! I put your links in the description,https://github.com/whatwg/html/pull/11255#issuecomment-2845430135,https://github.com/whatwg/html/pull/11255,Make command events not composed,2025-05-01T18:25:59Z,josepharhar
