id,repo,body,url,issue_url,issue_title,created_at,user
4617999351,mozilla/standards-positions,Да уж да какой-то информации в этом аккаунте Я никогда шёл и решил что получается ты посижу ещё на у,https://github.com/mozilla/standards-positions/issues/1372#issuecomment-4617999351,https://github.com/mozilla/standards-positions/issues/1372,CSS ruby-overhang,2026-06-04T00:55:41Z,lochpedko-netizen
4617907064,whatwg/html,Heads-up that this call will be chaired by @thejohnjansen,https://github.com/whatwg/html/issues/12503#issuecomment-4617907064,https://github.com/whatwg/html/issues/12503,Meeting 44 for joint OpenUI-WHATWG/HTML-CSSWG task force on styleable form controls,2026-06-04T00:39:15Z,astearns
4617644547,whatwg/html,"After the last discussions about filterable select, I feel that there are too many issues with nesti",https://github.com/whatwg/html/issues/12050#issuecomment-4617644547,https://github.com/whatwg/html/issues/12050,Filtering support for customizable select,2026-06-03T23:46:17Z,josepharhar
4617527634,whatwg/html,"> [@anaskim](https://github.com/anaskim) I think the ""alternative 3"" thing is maybe a bit of an over",https://github.com/whatwg/html/issues/12150#issuecomment-4617527634,https://github.com/whatwg/html/issues/12150,Platform-Provided Behaviors for Custom Elements,2026-06-03T23:24:40Z,anaskim
4617461881,whatwg/html,"> I'm also not really sure how this attribute thing plays into the design. If you want your element ",https://github.com/whatwg/html/issues/12150#issuecomment-4617461881,https://github.com/whatwg/html/issues/12150,Platform-Provided Behaviors for Custom Elements,2026-06-03T23:11:23Z,justinfagnani
4617281696,whatwg/html,@gregwhitworth send a preferred email address for the invite to jstenback@google.com please.,https://github.com/whatwg/html/issues/12510#issuecomment-4617281696,https://github.com/whatwg/html/issues/12510,Upcoming WHATNOT meeting on 2026-06-04,2026-06-03T22:36:14Z,jstenback
4616543708,whatwg/html,"Okay, I have marked this as undraft, as I'm now thinking that this may be the correct fix and it's r",https://github.com/whatwg/html/pull/12421#issuecomment-4616543708,https://github.com/whatwg/html/pull/12421,Don't update active document too early for same-origin navigations,2026-06-03T20:43:25Z,shannonbooth
4616312124,w3c/editcontext,"Thanks for clarifying about all that, definitely helped me understand this better!  :)  Maybe we can",https://github.com/w3c/edit-context/issues/132#issuecomment-4616312124,https://github.com/w3c/edit-context/issues/132,BiDi input handling is difficult with DOM-based EditContext,2026-06-03T20:11:14Z,ltenmoz
4616272039,w3ctag/design-reviews,"Yep, exactly. `::interest-button` can't just _be_ the 'UA-provided ""show details"" button', and the C",https://github.com/w3ctag/design-reviews/issues/1058#issuecomment-4616272039,https://github.com/w3ctag/design-reviews/issues/1058,The `interesttarget` attribute,2026-06-03T20:05:54Z,jyasskin
4616264174,w3c/pointerevents,"Also, after some further investigation I think capturing during mouseup is going to be a better appr",https://github.com/w3c/pointerevents/pull/637#issuecomment-4616264174,https://github.com/w3c/pointerevents/pull/637,Allow pointerup-activated elements to set click target differently.,2026-06-03T20:04:50Z,dbaron
4615449950,whatwg/html,I would like to attend this meeting,https://github.com/whatwg/html/issues/12510#issuecomment-4615449950,https://github.com/whatwg/html/issues/12510,Upcoming WHATNOT meeting on 2026-06-04,2026-06-03T18:17:32Z,gregwhitworth
4615425737,whatwg/html,> > To set expectations: Stage 3 has requirements on specification text that I don't think are met f,https://github.com/whatwg/html/issues/12510#issuecomment-4615425737,https://github.com/whatwg/html/issues/12510,Upcoming WHATNOT meeting on 2026-06-04,2026-06-03T18:14:50Z,dandclark
4614844824,whatwg/dom,Oh good call. Per https://dontcallmedom.github.io/webdex/a.html#AbstractRange%40%40%40%40interface a,https://github.com/whatwg/dom/pull/1469#issuecomment-4614844824,https://github.com/whatwg/dom/pull/1469,Add a BoundaryPointsRange mixin,2026-06-03T17:02:17Z,annevk
4614722189,w3ctag/design-reviews,Thanks @robertlin-chromium for the reply.  We agree that a JavaScript object model for speculation r,https://github.com/w3ctag/design-reviews/issues/1192#issuecomment-4614722189,https://github.com/w3ctag/design-reviews/issues/1192,Incubation: speculation rules `form_submission` field for prerendering,2026-06-03T16:46:39Z,dandclark
4614716845,whatwg/dom,lgtm - thanks for creating this! I'll rebase [#1404](https://github.com/whatwg/dom/pull/1404) on top,https://github.com/whatwg/dom/pull/1469#issuecomment-4614716845,https://github.com/whatwg/dom/pull/1469,Add a BoundaryPointsRange mixin,2026-06-03T16:45:58Z,stephanieyzhang
4614676937,whatwg/html,Thanks @josepharhar. Some final points:  - Now that we have changed https://github.com/whatwg/html,https://github.com/whatwg/html/pull/12201#issuecomment-4614676937,https://github.com/whatwg/html/pull/12201,Define option and optgroup base appearance rendering,2026-06-03T16:40:58Z,annevk
4614606673,whatwg/html,"@domfarolino You are right!  For all local-scheme URLs, DocumentLoader::CreateDocumentPolicy() uni",https://github.com/whatwg/html/pull/12026#issuecomment-4614606673,https://github.com/whatwg/html/pull/12026,Add document policy to the policy container,2026-06-03T16:32:28Z,monica-ch
4614519800,whatwg/html,cc @fantasai  I think _at the very least_ the counter name should have a `-ua-` prefix. But using `c,https://github.com/whatwg/html/issues/12516#issuecomment-4614519800,https://github.com/whatwg/html/issues/12516,"Let's bikeshed `counter(fake-counter-name, disclosure-open)`",2026-06-03T16:22:13Z,emilio
4614517598,whatwg/html,"@anaskim I think the ""alternative 3"" thing is maybe a bit of an overkill, as it needs to support mul",https://github.com/whatwg/html/issues/12150#issuecomment-4614517598,https://github.com/whatwg/html/issues/12150,Platform-Provided Behaviors for Custom Elements,2026-06-03T16:21:59Z,noamr
4614510572,whatwg/html,"> When revisiting a decision, please find the relevant changes & issues. It does seem that from a qu",https://github.com/whatwg/html/issues/12516#issuecomment-4614510572,https://github.com/whatwg/html/issues/12516,"Let's bikeshed `counter(fake-counter-name, disclosure-open)`",2026-06-03T16:21:08Z,keithamus
4614453988,whatwg/html,I'm also not really sure how this attribute thing plays into the design. If you want your element ty,https://github.com/whatwg/html/issues/12150#issuecomment-4614453988,https://github.com/whatwg/html/issues/12150,Platform-Provided Behaviors for Custom Elements,2026-06-03T16:14:15Z,annevk
4614244065,whatwg/html,"When revisiting a decision, please find the relevant changes & issues. It does seem that from a quic",https://github.com/whatwg/html/issues/12516#issuecomment-4614244065,https://github.com/whatwg/html/issues/12516,"Let's bikeshed `counter(fake-counter-name, disclosure-open)`",2026-06-03T15:50:35Z,annevk
4614184524,whatwg/html,> There is still the question as to whether it's okay that same-origin redirects end up exposed with,https://github.com/whatwg/html/pull/12513#issuecomment-4614184524,https://github.com/whatwg/html/pull/12513,Expose redirectCount for TAO opted-in redirect chains,2026-06-03T15:44:09Z,yoavweiss
4614138569,w3ctag/design-reviews,"Thanks, @bkardell !!",https://github.com/w3ctag/design-reviews/issues/1221#issuecomment-4614138569,https://github.com/w3ctag/design-reviews/issues/1221,WG Revision: Selectors 4,2026-06-03T15:39:29Z,svgeesus
4614056000,whatwg/html,I decided to merge as I agree that a more substantial revision is probably easier to review on top o,https://github.com/whatwg/html/pull/12504#issuecomment-4614056000,https://github.com/whatwg/html/pull/12504,Make select/option content model clearer about children versus descendants,2026-06-03T15:30:47Z,annevk
4613790531,whatwg/html,"Yeah that looks correct. I think there are still issues with it, but this is not one of them. There ",https://github.com/whatwg/html/pull/12513#issuecomment-4613790531,https://github.com/whatwg/html/pull/12513,Expose redirectCount for TAO opted-in redirect chains,2026-06-03T15:04:52Z,annevk
4613766795,whatwg/html,"> Actually, I just noticed that we have explicit steps like this further below: >  > > If configurat",https://github.com/whatwg/html/issues/12515#issuecomment-4613766795,https://github.com/whatwg/html/issues/12515,Canonicalizing each member in the SanitizerConfig seems too loosely defined,2026-06-03T15:02:31Z,noamr
4613713736,whatwg/html,"> I don't actually know if that works well for navigations.  A bit of Claude-assisted digging got ",https://github.com/whatwg/html/pull/12513#issuecomment-4613713736,https://github.com/whatwg/html/pull/12513,Expose redirectCount for TAO opted-in redirect chains,2026-06-03T14:56:55Z,yoavweiss
4613661842,whatwg/html,"Actually, I just noticed that we have explicit steps like this further below: > If configuration[""[r",https://github.com/whatwg/html/issues/12515#issuecomment-4613661842,https://github.com/whatwg/html/issues/12515,Canonicalizing each member in the SanitizerConfig seems too loosely defined,2026-06-03T14:51:27Z,evilpie
4613344603,w3c/pointerevents,timeline: making sure we know about the plan by TPAC,https://github.com/w3c/pointerevents/issues/644#issuecomment-4613344603,https://github.com/w3c/pointerevents/issues/644,Remove any remaining references to old UI Events spec from PE,2026-06-03T14:20:24Z,plehegar
4613332705,w3c/pointerevents,@plehegar  should investigate with moving keyboard events into the Web Editing working Group.,https://github.com/w3c/pointerevents/issues/644#issuecomment-4613332705,https://github.com/w3c/pointerevents/issues/644,Remove any remaining references to old UI Events spec from PE,2026-06-03T14:19:15Z,plehegar
4613319039,w3c/navigation-timing,That decision predates my involvement as well.  It seems somewhat different than https://fetch.spec.,https://github.com/w3c/navigation-timing/issues/215#issuecomment-4613319039,https://github.com/w3c/navigation-timing/issues/215,"(Re-)Expose redirectCount, redirectStart and redirectEnd for TAO opted-in cross-origin redirects",2026-06-03T14:17:56Z,yoavweiss
4613278752,w3c/pointerevents,"Fixed by republishing PE3. with thanks to @plehegar, closing",https://github.com/w3c/pointerevents/issues/641#issuecomment-4613278752,https://github.com/w3c/pointerevents/issues/641,Broken links in Pointer Events,2026-06-03T14:13:50Z,patrickhlauke
4613240459,whatwg/html,"No, TAO check only looks at a single response. There's https://fetch.spec.whatwg.org/#concept-respon",https://github.com/whatwg/html/pull/12513#issuecomment-4613240459,https://github.com/whatwg/html/pull/12513,Expose redirectCount for TAO opted-in redirect chains,2026-06-03T14:09:49Z,annevk
4613161016,whatwg/html,> I don't understand how this works. What if one redirect allows it and one doesn't?  I may have g,https://github.com/whatwg/html/pull/12513#issuecomment-4613161016,https://github.com/whatwg/html/pull/12513,Expose redirectCount for TAO opted-in redirect chains,2026-06-03T14:02:06Z,yoavweiss
4613116444,w3c/performance-timeline,"Those principals sound good to me as well.  Intuitively, I think I'd expect RT before the interactio",https://github.com/w3c/performance-timeline/issues/182#issuecomment-4613116444,https://github.com/w3c/performance-timeline/issues/182,"API shape for monitoring new navigation-like entries such as App History, BFCache, etc",2026-06-03T13:58:07Z,nicjansma
4613112609,w3c/navigation-timing,> I don't understand the same-origin check behavior. Who decided it was okay to expose redirects sam,https://github.com/w3c/navigation-timing/issues/215#issuecomment-4613112609,https://github.com/w3c/navigation-timing/issues/215,"(Re-)Expose redirectCount, redirectStart and redirectEnd for TAO opted-in cross-origin redirects",2026-06-03T13:57:45Z,noamr
4613110544,w3c/editcontext,"Yeah, caret positions are inherently ambiguous in bidi contexts, when they fall on a direction bound",https://github.com/w3c/edit-context/issues/132#issuecomment-4613110544,https://github.com/w3c/edit-context/issues/132,BiDi input handling is difficult with DOM-based EditContext,2026-06-03T13:57:33Z,jfkthame
4612738283,whatwg/html,"Just to add that, anecdotally, I come across the problem here often when auditing content for access",https://github.com/whatwg/html/issues/12485#issuecomment-4612738283,https://github.com/whatwg/html/issues/12485,"Relaxing the ""`legend` must be the first child of `fieldset`"" requirement",2026-06-03T13:19:29Z,patrickhlauke
4612678393,w3ctag/design-reviews,"I agree it's possible, but I think it would require some fairly novel design work on the CSS side. `",https://github.com/w3ctag/design-reviews/issues/1058#issuecomment-4612678393,https://github.com/w3ctag/design-reviews/issues/1058,The `interesttarget` attribute,2026-06-03T13:13:13Z,annevk
4612626916,w3c/navigation-timing,I don't understand the same-origin check behavior. Who decided it was okay to expose redirects same-,https://github.com/w3c/navigation-timing/issues/215#issuecomment-4612626916,https://github.com/w3c/navigation-timing/issues/215,"(Re-)Expose redirectCount, redirectStart and redirectEnd for TAO opted-in cross-origin redirects",2026-06-03T13:07:38Z,annevk
4612602408,whatwg/html,@nicolo-ribaudo,https://github.com/whatwg/html/pull/12511#issuecomment-4612602408,https://github.com/whatwg/html/pull/12511,Handle media <source> moves around the pointer,2026-06-03T13:05:18Z,zcorpan
4611822993,whatwg/html,@smaug----  any chances you can take a look? (not sure whats the process is; to move on),https://github.com/whatwg/html/pull/12219#issuecomment-4611822993,https://github.com/whatwg/html/pull/12219,Expand disabled form control event handling spec text,2026-06-03T11:26:25Z,hjanuschka
4610615419,mozilla/standards-positions,"ping @zcorpan @hsivonen ",https://github.com/mozilla/standards-positions/issues/1370#issuecomment-4610615419,https://github.com/mozilla/standards-positions/issues/1370,HTML streaming & revamped DOM parsing,2026-06-03T08:49:21Z,noamr
4610174210,whatwg/dom,"Ah yes, sorry. Well, I'm not aware of any SO questions but a use-case I have right now is [Stimulus ",https://github.com/whatwg/dom/issues/1081#issuecomment-4610174210,https://github.com/whatwg/dom/issues/1081,Element.matches and :scope,2026-06-03T07:46:53Z,christophehenry
4609850076,whatwg/dom,"Answering the questions raised in https://github.com/whatwg/dom/issues/1081#issuecomment-1133069415 ",https://github.com/whatwg/dom/issues/1081#issuecomment-4609850076,https://github.com/whatwg/dom/issues/1081,Element.matches and :scope,2026-06-03T06:56:28Z,annevk
4609313160,whatwg/html,@noamr  > the tests link points to existing tests in wpt.fyi that are not marked tentative.  I re,https://github.com/whatwg/html/pull/12444#issuecomment-4609313160,https://github.com/whatwg/html/pull/12444,"Add `<meta name=""responsive-embedded-sizing"">`",2026-06-03T05:18:54Z,kojiishi
4608966811,webkit/standards-positions,@nt1m Thanks!,https://github.com/WebKit/standards-positions/issues/657#issuecomment-4608966811,https://github.com/WebKit/standards-positions/issues/657,Relative Alpha Colors,2026-06-03T04:04:21Z,yisibl
4608634168,w3ctag/design-reviews,The TAG reviewed the Charter changes and is satisfied with no concerns or additional comments. Thank,https://github.com/w3ctag/design-reviews/issues/1230#issuecomment-4608634168,https://github.com/w3ctag/design-reviews/issues/1230,[wg/browser-tools-testing] Browser Testing and Tools Working Group Charter,2026-06-03T02:41:53Z,marcoscaceres
4608432694,webkit/standards-positions,WebKit is **opposed** to this proposal due to the following concerns:  - Although browser-integrated,https://github.com/WebKit/standards-positions/issues/670#issuecomment-4608432694,https://github.com/WebKit/standards-positions/issues/670,WebMCP,2026-06-03T01:57:22Z,mwyrzykowski
4608097145,w3ctag/design-reviews,The TAG discussed this today in our breakout and we are satisfied with the charter (other than the d,https://github.com/w3ctag/design-reviews/issues/1220#issuecomment-4608097145,https://github.com/w3ctag/design-reviews/issues/1220,[wg/wasm] WebAssembly WG rechartering,2026-06-03T00:36:15Z,bkardell
4608087057,w3ctag/design-reviews,"The TAG is satisfied with this, having reviewed several of the changes earlier in the process and gi",https://github.com/w3ctag/design-reviews/issues/1221#issuecomment-4608087057,https://github.com/w3ctag/design-reviews/issues/1221,WG Revision: Selectors 4,2026-06-03T00:33:43Z,bkardell
4608084653,w3ctag/design-reviews,"Thanks for sending us this review. We were concerned that you might be re-inventing semantic MathML,",https://github.com/w3ctag/design-reviews/issues/1205#issuecomment-4608084653,https://github.com/w3ctag/design-reviews/issues/1205,WG Revision: MathML 4,2026-06-03T00:33:05Z,jyasskin
4608033622,w3ctag/design-reviews,Hello! Sorry that it took us a long time to get back to you.  We do have consensus that the `shadowr,https://github.com/w3ctag/design-reviews/issues/1195#issuecomment-4608033622,https://github.com/w3ctag/design-reviews/issues/1195,Question: should `shadowrootadoptedstylesheets` perform a fetch?,2026-06-03T00:20:47Z,jyasskin
4608030153,whatwg/html,I think if would make for really bad developer experience if anything here required that `attachInte,https://github.com/whatwg/html/issues/12150#issuecomment-4608030153,https://github.com/whatwg/html/issues/12150,Platform-Provided Behaviors for Custom Elements,2026-06-03T00:20:04Z,justinfagnani
4607825887,whatwg/html,"@annevk Ok, I pushed those changes to this and the DOM spec PR (https://github.com/whatwg/dom/pull/1",https://github.com/whatwg/html/pull/10995#issuecomment-4607825887,https://github.com/whatwg/html/pull/10995,Add reference target,2026-06-02T23:34:03Z,dandclark
4607738491,whatwg/html,Some things: - Is a placeholder option for size=1 web compatible? - for single-select the placeholde,https://github.com/whatwg/html/issues/12246#issuecomment-4607738491,https://github.com/whatwg/html/issues/12246,change of the condition under which select element must have placeholder label option,2026-06-02T23:14:55Z,sb3nder
4607565297,whatwg/html,"The ""top-level site"" thing is a bit loose.  You might reasonably say I'm going with this being OK on",https://github.com/whatwg/html/issues/12445#issuecomment-4607565297,https://github.com/whatwg/html/issues/12445,Request for feedback: user activation design in Attribution,2026-06-02T22:40:51Z,martinthomson
4607501536,whatwg/dom,"Even though it may look like a fringe use-case, I am surprised this proposition hasn't received more",https://github.com/whatwg/dom/issues/1081#issuecomment-4607501536,https://github.com/whatwg/dom/issues/1081,Element.matches and :scope,2026-06-02T22:28:39Z,christophehenry
4607355889,whatwg/html,All of the checkboxes in the OP are checked. Is there anything else I can do to get this merged?,https://github.com/whatwg/html/pull/12069#issuecomment-4607355889,https://github.com/whatwg/html/pull/12069,Define base appearance for select multiple drop-down,2026-06-02T22:01:47Z,josepharhar
4607119090,whatwg/html,"> [@noamr](https://github.com/noamr), thanks for testing that. I'd like to hear your thoughts on [Al",https://github.com/whatwg/html/issues/12150#issuecomment-4607119090,https://github.com/whatwg/html/issues/12150,Platform-Provided Behaviors for Custom Elements,2026-06-02T21:21:48Z,noamr
4607077939,whatwg/html,"@noamr, thanks for testing that. I'd like to hear your thoughts on [Alternative API design 3](https:",https://github.com/whatwg/html/issues/12150#issuecomment-4607077939,https://github.com/whatwg/html/issues/12150,Platform-Provided Behaviors for Custom Elements,2026-06-02T21:15:57Z,anaskim
4606819827,whatwg/html,@anaskim  > 1. On the mutability framing: the set of behaviors attached to an element is static afte,https://github.com/whatwg/html/issues/12150#issuecomment-4606819827,https://github.com/whatwg/html/issues/12150,Platform-Provided Behaviors for Custom Elements,2026-06-02T20:38:25Z,noamr
4606737951,whatwg/html,"Thanks @noamr, @annevk, and @lukewarlow for the discussion on the WHATWG matrix. I updated the expla",https://github.com/whatwg/html/issues/12150#issuecomment-4606737951,https://github.com/whatwg/html/issues/12150,Platform-Provided Behaviors for Custom Elements,2026-06-02T20:27:17Z,anaskim
4606389242,whatwg/html,Re @mtrootyy's https://github.com/whatwg/html/pull/12504#issuecomment-4604263481:  I wrote earlier,https://github.com/whatwg/html/pull/12504#issuecomment-4606389242,https://github.com/whatwg/html/pull/12504,Make select/option content model clearer about children versus descendants,2026-06-02T19:40:13Z,dbaron
4605643341,w3c/pointerevents,"Or, alternatively, I now see @smaug---- 's comment that ""capturing on the up might work?"", so maybe ",https://github.com/w3c/pointerevents/pull/637#issuecomment-4605643341,https://github.com/w3c/pointerevents/pull/637,Allow pointerup-activated elements to set click target differently.,2026-06-02T18:08:26Z,dbaron
4605467535,whatwg/html,"Right, yeah it isn't when its appearance:auto, its when there is no author replaced button: https://",https://github.com/whatwg/html/issues/12509#issuecomment-4605467535,https://github.com/whatwg/html/issues/12509,Customizable Select: Updating selected option's content does not clone into selectedcontent,2026-06-02T17:51:44Z,josepharhar
4605399645,whatwg/html,"I think that helps, thanks. (Not sure top-level site is defined anywhere, so maybe there there is so",https://github.com/whatwg/html/issues/12445#issuecomment-4605399645,https://github.com/whatwg/html/issues/12445,Request for feedback: user activation design in Attribution,2026-06-02T17:46:23Z,smaug----
4605104324,webkit/standards-positions,Will mark this as positive a week from now pending objections.,https://github.com/WebKit/standards-positions/issues/658#issuecomment-4605104324,https://github.com/WebKit/standards-positions/issues/658,CSS light-dark() with image values,2026-06-02T17:24:39Z,nt1m
4605057675,webkit/standards-positions,I'll mark this as positive a week from now pending objections. Seems like there are some unspecified,https://github.com/WebKit/standards-positions/issues/657#issuecomment-4605057675,https://github.com/WebKit/standards-positions/issues/657,Relative Alpha Colors,2026-06-02T17:20:51Z,nt1m
4604666100,w3c/navigation-timing,Aligning with webkit on this works for me.,https://github.com/w3c/navigation-timing/issues/215#issuecomment-4604666100,https://github.com/w3c/navigation-timing/issues/215,"(Re-)Expose redirectCount, redirectStart and redirectEnd for TAO opted-in cross-origin redirects",2026-06-02T16:47:21Z,noamr
4604313668,w3ctag/design-reviews,"@annevk In the simplest mechanism, the browser can show its own button on gaze, using the same Visio",https://github.com/w3ctag/design-reviews/issues/1058#issuecomment-4604313668,https://github.com/w3ctag/design-reviews/issues/1058,The `interesttarget` attribute,2026-06-02T16:07:52Z,jyasskin
4604263481,whatwg/html,I propose doing the following.    In 4.4.16 The div element; ``` Categories:     Flow content,https://github.com/whatwg/html/pull/12504#issuecomment-4604263481,https://github.com/whatwg/html/pull/12504,Make select/option content model clearer about children versus descendants,2026-06-02T16:01:43Z,mtrootyy
4604235781,whatwg/html,"oh, wait, the test isn't testing script move, like the name hints. Anyhow, fixing",https://github.com/whatwg/html/issues/12512#issuecomment-4604235781,https://github.com/whatwg/html/issues/12512,Inconsistent cross-browser behaviour with moveBefore and script elements.,2026-06-02T15:58:19Z,smaug----
4604221649,webkit/standards-positions,Thanks @mfreed7. Let me reopen this and remove our prior position. The attribute inclusive of this n,https://github.com/WebKit/standards-positions/issues/464#issuecomment-4604221649,https://github.com/WebKit/standards-positions/issues/464,The `interestfor` attribute,2026-06-02T15:56:34Z,annevk
4604206073,w3ctag/design-reviews,"> Note that `::interest-button` might not need to be shown by default on platforms where a gaze can ",https://github.com/w3ctag/design-reviews/issues/1058#issuecomment-4604206073,https://github.com/w3ctag/design-reviews/issues/1058,The `interesttarget` attribute,2026-06-02T15:54:45Z,annevk
4604055938,whatwg/html,"FF is not doing children changed,  but post connection steps. Indeed it should not. Fixing",https://github.com/whatwg/html/issues/12512#issuecomment-4604055938,https://github.com/whatwg/html/issues/12512,Inconsistent cross-browser behaviour with moveBefore and script elements.,2026-06-02T15:37:48Z,smaug----
4603857315,webkit/standards-positions,Posting here for visibility: the TAG just completed its review of the overall interest invokers feat,https://github.com/WebKit/standards-positions/issues/464#issuecomment-4603857315,https://github.com/WebKit/standards-positions/issues/464,The `interestfor` attribute,2026-06-02T15:15:04Z,mfreed7
4603853368,mozilla/standards-positions,Posting here for visibility: the TAG just completed its review of the overall interest invokers feat,https://github.com/mozilla/standards-positions/issues/1181#issuecomment-4603853368,https://github.com/mozilla/standards-positions/issues/1181,The `interestfor` attribute,2026-06-02T15:14:38Z,mfreed7
4603828076,w3c/editcontext,"@dandclark ",https://github.com/w3c/edit-context/issues/132#issuecomment-4603828076,https://github.com/w3c/edit-context/issues/132,BiDi input handling is difficult with DOM-based EditContext,2026-06-02T15:12:00Z,smaug----
