id,repo,body,url,issue_url,issue_title,created_at,user
2299789506,whatwg/html,"without getting too much into it, if this were even something people would consider, i'd submit ther",https://github.com/whatwg/html/issues/2272#issuecomment-2299789506,https://github.com/whatwg/html/issues/2272,Disallow interactive content in <summary>,2024-08-20T21:22:42Z,scottaohara
2299789425,w3ctag/design-reviews,"## Request and Response Header  For multiple sub-domains included from the web app manifest using ",https://github.com/w3ctag/design-reviews/issues/875#issuecomment-2299789425,https://github.com/w3ctag/design-reviews/issues/875,TAG review for web app `scope_extensions`,2024-08-20T21:22:38Z,LuHuangMSFT
2299777013,whatwg/html,I think this is now ready to land.  I've already merged most of the test changes and the rest should,https://github.com/whatwg/html/pull/10561#issuecomment-2299777013,https://github.com/whatwg/html/pull/10561,Fix incorrect recursion for dir=auto special cases.,2024-08-20T21:13:26Z,dbaron
2299762904,w3ctag/design-reviews,## Specifying `scope` in the association file  I've looked at the following options to give the as,https://github.com/w3ctag/design-reviews/issues/875#issuecomment-2299762904,https://github.com/w3ctag/design-reviews/issues/875,TAG review for web app `scope_extensions`,2024-08-20T21:04:27Z,LuHuangMSFT
2299754260,WICG/webcomponents,+1. We use `event.composedPath()[0]` a whole bunch.,https://github.com/WICG/webcomponents/issues/1070#issuecomment-2299754260,https://github.com/WICG/webcomponents/issues/1070,event.composedPath()[0] can be very slow: add event.composedTarget?,2024-08-20T20:58:51Z,dbatiste
2299752155,whatwg/dom,@annevk bugs filed and checkboxes updated!,https://github.com/whatwg/dom/pull/1295#issuecomment-2299752155,https://github.com/whatwg/dom/pull/1295,Mark dependent abort signals as aborted before firing events,2024-08-20T20:57:32Z,shaseley
2299745266,webkit/standards-positions,This spec text is also relevant for rendering suppression: [While a Documentâ€™s rendering suppression,https://github.com/WebKit/standards-positions/issues/245#issuecomment-2299745266,https://github.com/WebKit/standards-positions/issues/245,Document Render Blocking,2024-08-20T20:53:03Z,khushalsagar
2299712711,WICG/webcomponents,"+1 to this. I hadn't seen the perf issue, but this is a very common pattern with `composedPath()` an",https://github.com/WICG/webcomponents/issues/1070#issuecomment-2299712711,https://github.com/WICG/webcomponents/issues/1070,event.composedPath()[0] can be very slow: add event.composedTarget?,2024-08-20T20:31:31Z,EisenbergEffect
2299700478,whatwg/html,"@alexpetros:   > Another way to resolve this is just to add an `httpmethod` field, and also add su",https://github.com/whatwg/html/issues/3577#issuecomment-2299700478,https://github.com/whatwg/html/issues/3577,"HTML forms do not support the PUT, PATCH and DELETE methods",2024-08-20T20:23:44Z,06b
2299677601,whatwg/html,> @dev-nicolaos re: >  > > I worry making the disclosure triangle (::marker) the only thing to tri,https://github.com/whatwg/html/issues/2272#issuecomment-2299677601,https://github.com/whatwg/html/issues/2272,Disallow interactive content in <summary>,2024-08-20T20:09:09Z,dev-nicolaos
2299600987,whatwg/html,@mamund: > adding here that it would be a good idea to consider how the ETag and Last-Modifed heade,https://github.com/whatwg/html/issues/3577#issuecomment-2299600987,https://github.com/whatwg/html/issues/3577,"HTML forms do not support the PUT, PATCH and DELETE methods",2024-08-20T19:24:05Z,alexpetros
2299454723,whatwg/dom,LGTM from Mozilla. We can reuse https://bugzilla.mozilla.org/show_bug.cgi?id=1903676 as an implement,https://github.com/whatwg/dom/pull/1295#issuecomment-2299454723,https://github.com/whatwg/dom/pull/1295,Mark dependent abort signals as aborted before firing events,2024-08-20T18:12:16Z,saschanaz
2299324154,whatwg/webidl,"I'd be curious to hear @littledan's take, but this seems reasonable to me. Thanks for filing!",https://github.com/whatwg/webidl/issues/1426#issuecomment-2299324154,https://github.com/whatwg/webidl/issues/1426,Intent use number / bigint union type,2024-08-20T16:56:41Z,annevk
2299283811,whatwg/webidl,CC @littledan who added the wording about these union types.,https://github.com/whatwg/webidl/issues/1426#issuecomment-2299283811,https://github.com/whatwg/webidl/issues/1426,Intent use number / bigint union type,2024-08-20T16:34:40Z,sbc100
2299160527,whatwg/html,"@dev-nicolaos re: >I worry making the disclosure triangle (::marker) the only thing to trigger the ",https://github.com/whatwg/html/issues/2272#issuecomment-2299160527,https://github.com/whatwg/html/issues/2272,Disallow interactive content in <summary>,2024-08-20T15:38:24Z,scottaohara
2299105623,whatwg/html,"AFAICT, an underscore in the domain part currently results in `.validity` reporting `typeMismatch: t",https://github.com/whatwg/html/pull/10522#issuecomment-2299105623,https://github.com/whatwg/html/pull/10522,Add support for internationalized email addresses,2024-08-20T15:12:39Z,hsivonen
2299007803,webkit/standards-positions,Thanks for the nudge:  1. This is a repository to determine the position of the WebKit community o,https://github.com/WebKit/standards-positions/issues/264#issuecomment-2299007803,https://github.com/WebKit/standards-positions/issues/264,"""command"" and ""commandfor"" attributes",2024-08-20T14:30:25Z,annevk
2298977286,webkit/standards-positions,I think solving https://github.com/whatwg/html/issues/313 first would be a good first step here. The,https://github.com/WebKit/standards-positions/issues/383#issuecomment-2298977286,https://github.com/WebKit/standards-positions/issues/383,Future browsing context group dependency hint,2024-08-20T14:17:14Z,annevk
2298800610,WICG/webcomponents,Out of date.,https://github.com/WICG/webcomponents/pull/632#issuecomment-2298800610,https://github.com/WICG/webcomponents/pull/632,fix example so that attachShadow does not throw an exception,2024-08-20T12:58:47Z,Westbrook
2298772921,webkit/standards-positions,There's an indication that this might impact the end user and therefore end user consent is importan,https://github.com/WebKit/standards-positions/issues/380#issuecomment-2298772921,https://github.com/WebKit/standards-positions/issues/380,Call stacks in crash reports from unresponsive web pages,2024-08-20T12:45:18Z,annevk
2298749103,whatwg/html,"Deleted my previous comment because the suggestion was clearly half-baked. But I still reiterate my ",https://github.com/whatwg/html/issues/3577#issuecomment-2298749103,https://github.com/whatwg/html/issues/3577,"HTML forms do not support the PUT, PATCH and DELETE methods",2024-08-20T12:33:40Z,jlunman
2298696472,webkit/standards-positions,See https://github.com/whatwg/html/pull/6284#issuecomment-2210961241 for some progress on evaluating,https://github.com/WebKit/standards-positions/issues/368#issuecomment-2298696472,https://github.com/WebKit/standards-positions/issues/368,Temporal - structured clone,2024-08-20T12:06:31Z,annevk
2298650333,webkit/standards-positions,"I suggest resolving this as ""position: support"" one week from now.  While it's not entirely clear ",https://github.com/WebKit/standards-positions/issues/367#issuecomment-2298650333,https://github.com/WebKit/standards-positions/issues/367,SVG favicons,2024-08-20T11:41:12Z,annevk
2298641725,webkit/standards-positions,"I suggest we mark this as ""opposed"" one week from now, per the rationale stated above.",https://github.com/WebKit/standards-positions/issues/289#issuecomment-2298641725,https://github.com/WebKit/standards-positions/issues/289,New 'onmove' event handler for the Window object,2024-08-20T11:36:29Z,annevk
2298334962,whatwg/html,> I looked a bit more at not using the host parser: >  > * We end up passing _beStrict_ is true (a,https://github.com/whatwg/html/pull/10522#issuecomment-2298334962,https://github.com/whatwg/html/pull/10522,Add support for internationalized email addresses,2024-08-20T08:56:15Z,hsivonen
2298309839,whatwg/html,"I looked a bit more at not using the host parser:  - We end up passing _beStrict_ is true (aside: ",https://github.com/whatwg/html/pull/10522#issuecomment-2298309839,https://github.com/whatwg/html/pull/10522,Add support for internationalized email addresses,2024-08-20T08:43:58Z,annevk
2298289538,whatwg/html,"Oh, and let's surface the only comment I put in the code:  Do we want to support TLDs with MX reco",https://github.com/whatwg/html/pull/10522#issuecomment-2298289538,https://github.com/whatwg/html/pull/10522,Add support for internationalized email addresses,2024-08-20T08:33:57Z,hsivonen
2298286089,whatwg/html,"[Demo of the above-described algorithm for experimentation](https://hsivonen.com/test/emaildemo/) ",https://github.com/whatwg/html/pull/10522#issuecomment-2298286089,https://github.com/whatwg/html/pull/10522,Add support for internationalized email addresses,2024-08-20T08:32:17Z,hsivonen
2298145178,whatwg/html,"> In Firefox I cannot find evidence of this being in the UA stylesheet, but instead these properties",https://github.com/whatwg/html/issues/10569#issuecomment-2298145178,https://github.com/whatwg/html/issues/10569,Specify primitive appearance for <meter>,2024-08-20T07:19:36Z,tcaptan-cr
2297985546,whatwg/html,cc @whatwg/css @fantasai,https://github.com/whatwg/html/issues/10251#issuecomment-2297985546,https://github.com/whatwg/html/issues/10251,Improve handling of malformed unicode bidi control characters,2024-08-20T05:17:45Z,annevk
2297970034,whatwg/html,"Thanks for the review and sorry for the delay (I was out sick for two months). PTAL again :) ",https://github.com/whatwg/html/pull/10154#issuecomment-2297970034,https://github.com/whatwg/html/pull/10154,Add may-block reasons to NotRestoredReasons,2024-08-20T05:01:31Z,rubberyuzu
2297555354,whatwg/html,> Shouldn't this behavior be tied to the CSS style `unicode-bidi: isolate`? The intention is to isol,https://github.com/whatwg/html/issues/10251#issuecomment-2297555354,https://github.com/whatwg/html/issues/10251,Improve handling of malformed unicode bidi control characters,2024-08-19T22:12:42Z,jamiebuilds
2297488729,whatwg/html,"> Thanks! Given that rationale I think it's good to couple the changes, but that should be in the co",https://github.com/whatwg/html/pull/10557#issuecomment-2297488729,https://github.com/whatwg/html/pull/10557,Relax `<select>` parser,2024-08-19T21:28:14Z,josepharhar
2297376531,whatwg/html,@JAWS-test  > I think summary and details are good for accordion. Especially since the name attribu,https://github.com/whatwg/html/issues/2272#issuecomment-2297376531,https://github.com/whatwg/html/issues/2272,Disallow interactive content in <summary>,2024-08-19T20:18:38Z,aardrian
2297353724,whatwg/html,@alexpetros  :   happy to see this proposal.   adding here that it would be a good idea to consi,https://github.com/whatwg/html/issues/3577#issuecomment-2297353724,https://github.com/whatwg/html/issues/3577,"HTML forms do not support the PUT, PATCH and DELETE methods",2024-08-19T20:05:43Z,mamund
2297248861,whatwg/html,I think summary and details are good for accordion. Especially since the name attribute combines the,https://github.com/whatwg/html/issues/2272#issuecomment-2297248861,https://github.com/whatwg/html/issues/2272,Disallow interactive content in <summary>,2024-08-19T19:05:33Z,JAWS-test
2297198805,whatwg/html,"We have ""palpable content"", but it might not be correct for `option` (for example an `img` with empt",https://github.com/whatwg/html/issues/10317#issuecomment-2297198805,https://github.com/whatwg/html/issues/10317,Content model and 'what' to render for stylable `<select>` elements,2024-08-19T18:37:32Z,zcorpan
2297048139,whatwg/html,I posted the [first half](https://chromium-review.googlesource.com/c/chromium/src/+/5796604) and [se,https://github.com/whatwg/html/pull/10561#issuecomment-2297048139,https://github.com/whatwg/html/pull/10561,Fix incorrect recursion for dir=auto special cases.,2024-08-19T17:12:11Z,dbaron
2297038602,w3ctag/design-reviews,@nhiroki any updates to the above questions?,https://github.com/w3ctag/design-reviews/issues/931#issuecomment-2297038602,https://github.com/w3ctag/design-reviews/issues/931,Speculation rules: target_hint field,2024-08-19T17:06:41Z,plinss
2296994055,whatwg/html,Proposed agenda: - https://github.com/w3c/csswg-drafts/issues/10758 - https://github.com/w3c/csswg,https://github.com/whatwg/html/issues/10568#issuecomment-2296994055,https://github.com/whatwg/html/issues/10568,Meeting 6 for joint OpenUI-WHATWG/HTML-CSSWG task force on styleable form controls,2024-08-19T16:41:14Z,josepharhar
2296964053,whatwg/html,FYI: I am likely going to remove the author-provided datalist and fallback UA button in this PR soon,https://github.com/whatwg/html/pull/10548#issuecomment-2296964053,https://github.com/whatwg/html/pull/10548,Complete draft spec for customizable `<select>`,2024-08-19T16:23:57Z,josepharhar
2296958582,whatwg/html,Next meeting here: https://github.com/whatwg/html/issues/10568,https://github.com/whatwg/html/issues/10536#issuecomment-2296958582,https://github.com/whatwg/html/issues/10536,Meeting 5 for joint OpenUI-WHATWG/HTML-CSSWG task force on styleable form controls,2024-08-19T16:20:58Z,josepharhar
2296916927,whatwg/html,This doesn't define optional tags for `</option>` and `</optgroup>` correctly.  The definition for,https://github.com/whatwg/html/pull/10557#issuecomment-2296916927,https://github.com/whatwg/html/pull/10557,Relax `<select>` parser,2024-08-19T15:59:08Z,zcorpan
2296907347,webkit/standards-positions,@esprehn are you still planning to file that feedback?,https://github.com/WebKit/standards-positions/issues/292#issuecomment-2296907347,https://github.com/WebKit/standards-positions/issues/292,Observable,2024-08-19T15:53:59Z,annevk
2296674538,whatwg/html,One further note here:  there are effectively two sub-parts to the change:  1. skipping the exclud,https://github.com/whatwg/html/pull/10561#issuecomment-2296674538,https://github.com/whatwg/html/pull/10561,Fix incorrect recursion for dir=auto special cases.,2024-08-19T14:09:19Z,dbaron
2296625910,whatwg/html,"> Oh, I missed that you don't run the host parser on the final argument. Why is that?  Two reasons",https://github.com/whatwg/html/pull/10522#issuecomment-2296625910,https://github.com/whatwg/html/pull/10522,Add support for internationalized email addresses,2024-08-19T13:48:16Z,hsivonen
2295854067,whatwg/html,"@smaug---- @masayuki-nakano I think this is ready now, but happy to wait a bit so you can take a loo",https://github.com/whatwg/html/pull/5841#issuecomment-2295854067,https://github.com/whatwg/html/pull/5841,Add the autocorrect attribute,2024-08-19T07:28:30Z,annevk
2295386694,webkit/standards-positions,"In practice, the browser default behavior is already `dynamic-range-limit: high` on Chrome on macOS ",https://github.com/WebKit/standards-positions/issues/312#issuecomment-2295386694,https://github.com/WebKit/standards-positions/issues/312,CSS dynamic-range-limit property,2024-08-18T20:52:53Z,ariofrio
2295379913,WICG/webcomponents,@EisenbergEffect I would hope that any JS template API could take advantage of future changes to Jav,https://github.com/WICG/webcomponents/issues/1069#issuecomment-2295379913,https://github.com/WICG/webcomponents/issues/1069,[templates] A declarative JavaScript templating API,2024-08-18T20:24:26Z,justinfagnani
2295378878,WICG/webcomponents,Getting back to the issue that @NullVoxPopuli raises...what if we could introduce the idea of lazy e,https://github.com/WICG/webcomponents/issues/1069#issuecomment-2295378878,https://github.com/WICG/webcomponents/issues/1069,[templates] A declarative JavaScript templating API,2024-08-18T20:19:47Z,EisenbergEffect
2295377324,WICG/webcomponents,"@NullVoxPopuli if there's any appetite for this idea, we can go into a lot of detail about how signa",https://github.com/WICG/webcomponents/issues/1069#issuecomment-2295377324,https://github.com/WICG/webcomponents/issues/1069,[templates] A declarative JavaScript templating API,2024-08-18T20:14:09Z,justinfagnani
2295373258,WICG/webcomponents,@o-t-w JSX would require major changes to JavaScript via TC39. A tagged template literal based syste,https://github.com/WICG/webcomponents/issues/1069#issuecomment-2295373258,https://github.com/WICG/webcomponents/issues/1069,[templates] A declarative JavaScript templating API,2024-08-18T19:59:58Z,justinfagnani
2295309152,whatwg/html,"As a FACE (form-associated custom element) library author, I would assume `autocomplete` has nothing",https://github.com/whatwg/html/issues/9019#issuecomment-2295309152,https://github.com/whatwg/html/issues/9019,Resetting forms on document reactivation,2024-08-18T15:55:45Z,clshortfuse
2295285617,WICG/webcomponents,JSX syntax has proven to be a lot more popular among developers than template literal ${} syntax. Th,https://github.com/WICG/webcomponents/issues/1069#issuecomment-2295285617,https://github.com/WICG/webcomponents/issues/1069,[templates] A declarative JavaScript templating API,2024-08-18T14:38:33Z,o-t-w
2295178645,WICG/webcomponents,Usage of `Computed` with signals is not strictly necessary. The main advantage they provide is memo,https://github.com/WICG/webcomponents/issues/1069#issuecomment-2295178645,https://github.com/WICG/webcomponents/issues/1069,[templates] A declarative JavaScript templating API,2024-08-18T08:36:30Z,brunnerh
2295099646,WICG/webcomponents,"> ```js > class Cat { >   get name() { >     return `${this.givenName}, the cat`; >   } > } > ",https://github.com/WICG/webcomponents/issues/1069#issuecomment-2295099646,https://github.com/WICG/webcomponents/issues/1069,[templates] A declarative JavaScript templating API,2024-08-18T03:50:18Z,au5ton
2295055999,WICG/webcomponents,"I have a concern, but I'm not sure _where_ it belongs -- but with reactive rendering w/ Signals -- a",https://github.com/WICG/webcomponents/issues/1069#issuecomment-2295055999,https://github.com/WICG/webcomponents/issues/1069,[templates] A declarative JavaScript templating API,2024-08-18T01:37:46Z,NullVoxPopuli
2295031073,WICG/webcomponents,You may also want to pursue this via https://github.com/w3c/csswg-drafts,https://github.com/WICG/webcomponents/issues/1037#issuecomment-2295031073,https://github.com/WICG/webcomponents/issues/1037,Modify :is() and :where() to support selecting derived node types,2024-08-17T23:47:46Z,Westbrook
2295029510,WICG/webcomponents,Feels closed by https://github.com/WICG/webcomponents/blob/gh-pages/proposals/reference-target-expla,https://github.com/WICG/webcomponents/issues/1020#issuecomment-2295029510,https://github.com/WICG/webcomponents/issues/1020,RFC: Element Handles for Cross-root ARIA (cross-post from wicg/aom),2024-08-17T23:43:22Z,Westbrook
2295025621,WICG/webcomponents,Feels like some of this is closed by https://github.com/WICG/webcomponents/blob/gh-pages/proposals/r,https://github.com/WICG/webcomponents/issues/917#issuecomment-2295025621,https://github.com/WICG/webcomponents/issues/917,RfC: API design for aria delegation mechanism,2024-08-17T23:29:58Z,Westbrook
2295025278,WICG/webcomponents,With the advent of https://github.com/WICG/webcomponents/blob/gh-pages/proposals/reference-target-ex,https://github.com/WICG/webcomponents/issues/916#issuecomment-2295025278,https://github.com/WICG/webcomponents/issues/916,Add delegatesLabel and a content attribute to specify the label element within a shadow tree,2024-08-17T23:28:09Z,Westbrook
2295023954,WICG/webcomponents,Is this appropriate superseded by https://github.com/WICG/webcomponents/blob/gh-pages/proposals/refe,https://github.com/WICG/webcomponents/issues/898#issuecomment-2295023954,https://github.com/WICG/webcomponents/issues/898,RfC: An alternative approach to accessibility across shadow boundaries,2024-08-17T23:21:25Z,Westbrook
2295022461,WICG/webcomponents,URLs not currently public.,https://github.com/WICG/webcomponents/issues/869#issuecomment-2295022461,https://github.com/WICG/webcomponents/issues/869,odd custom element placement,2024-08-17T23:12:26Z,Westbrook
2295022130,WICG/webcomponents,Page no longer exists.,https://github.com/WICG/webcomponents/issues/818#issuecomment-2295022130,https://github.com/WICG/webcomponents/issues/818,Deprecation warning misleading.,2024-08-17T23:10:28Z,Westbrook
2295019982,WICG/webcomponents,"https://developer.mozilla.org/en-US/docs/Web/CSS/:state is now Baseline, closing. ðŸ¥³ ",https://github.com/WICG/webcomponents/issues/738#issuecomment-2295019982,https://github.com/WICG/webcomponents/issues/738,Custom pseudo-classes for host elements via shadow roots (:state),2024-08-17T23:00:36Z,Westbrook
2295019283,WICG/webcomponents,"With `customElements.getName(constructor)` shipped x-browser, looks like this is DONE!",https://github.com/WICG/webcomponents/issues/566#issuecomment-2295019283,https://github.com/WICG/webcomponents/issues/566,registry: Add an API to retrieve the localName given a custom element constructor,2024-08-17T22:56:46Z,Westbrook
2294960284,whatwg/html,My personal use case for this would be to be able to add my own custom primitives that can be passed,https://github.com/whatwg/html/issues/7428#issuecomment-2294960284,https://github.com/whatwg/html/issues/7428,Allow objects to customize serialization / deserialization for structured clone,2024-08-17T19:56:37Z,Offroaders123
2294931398,whatwg/html,"Hi everyone,  [Carson Gross](https://bigsky.software/cv/) and I have been working on a proposal to",https://github.com/whatwg/html/issues/3577#issuecomment-2294931398,https://github.com/whatwg/html/issues/3577,"HTML forms do not support the PUT, PATCH and DELETE methods",2024-08-17T18:09:12Z,alexpetros
2294912338,whatwg/dom,"@shaseley from my perspective this is good to land, modulo checking the checkboxes in OP.",https://github.com/whatwg/dom/pull/1295#issuecomment-2294912338,https://github.com/whatwg/dom/pull/1295,Mark dependent abort signals as aborted before firing events,2024-08-17T16:55:59Z,annevk
2294670546,whatwg/html,To me that sounds like we should just add the quotes. Parenthesis to me signals that something is op,https://github.com/whatwg/html/pull/10564#issuecomment-2294670546,https://github.com/whatwg/html/pull/10564,Editorial: consistently format the empty string keyword,2024-08-17T06:10:23Z,annevk
2294659333,whatwg/html,"I see your point, but these tables are a bit different since we omit the quotes around the keyword s",https://github.com/whatwg/html/pull/10564#issuecomment-2294659333,https://github.com/whatwg/html/pull/10564,Editorial: consistently format the empty string keyword,2024-08-17T05:59:58Z,domenic
2294649600,whatwg/html,"But that is how we do it elsewhere? E.g., when we compare a variable to a potential value.",https://github.com/whatwg/html/pull/10564#issuecomment-2294649600,https://github.com/whatwg/html/pull/10564,Editorial: consistently format the empty string keyword,2024-08-17T05:51:19Z,annevk
2294642766,whatwg/html,It makes it a bit clearer that it's not a keyword; otherwise they're only distinguished by code font,https://github.com/whatwg/html/pull/10564#issuecomment-2294642766,https://github.com/whatwg/html/pull/10564,Editorial: consistently format the empty string keyword,2024-08-17T05:44:56Z,domenic
2294636135,whatwg/html,"I can live with the lowercase t (we have both lowercase and uppercase at the moment), but why the pa",https://github.com/whatwg/html/pull/10564#issuecomment-2294636135,https://github.com/whatwg/html/pull/10564,Editorial: consistently format the empty string keyword,2024-08-17T05:35:27Z,annevk
2294631933,whatwg/html,Hmm I liked `(the empty string)` and that was what I encouraged in the past...,https://github.com/whatwg/html/pull/10564#issuecomment-2294631933,https://github.com/whatwg/html/pull/10564,Editorial: consistently format the empty string keyword,2024-08-17T05:17:54Z,domenic
2294489345,WICG/webcomponents,Re: DOM Parts. I wrote down one of the things I was thinking of as a motivation for DOM Parts outsid,https://github.com/WICG/webcomponents/issues/1065#issuecomment-2294489345,https://github.com/WICG/webcomponents/issues/1065,2024 TPAC planning,2024-08-17T00:23:15Z,justinfagnani
2294465541,WICG/webcomponents,"I know that Google's internal security team has replaced a bunch of innerHTML calls in our internal ",https://github.com/WICG/webcomponents/issues/1069#issuecomment-2294465541,https://github.com/WICG/webcomponents/issues/1069,[templates] A declarative JavaScript templating API,2024-08-17T00:04:04Z,rictic
2294149279,webkit/standards-positions,"I'm not particularly worried about the 'cheating' aspect, as developers can simply choose not to use",https://github.com/WebKit/standards-positions/issues/355#issuecomment-2294149279,https://github.com/WebKit/standards-positions/issues/355,New `trusted-types-eval` keyword for CSP script-src,2024-08-16T19:59:15Z,lweichselbaum
2293942093,WICG/webcomponents,"While having the full initial HTML for a page is great, the DOM includes a lot of imperative, dynami",https://github.com/WICG/webcomponents/issues/1069#issuecomment-2293942093,https://github.com/WICG/webcomponents/issues/1069,[templates] A declarative JavaScript templating API,2024-08-16T18:09:55Z,justinfagnani
2293938075,WICG/webcomponents,"> These days, I'm highly focused on declarative patterns that don't require JS for initial render. I",https://github.com/WICG/webcomponents/issues/1069#issuecomment-2293938075,https://github.com/WICG/webcomponents/issues/1069,[templates] A declarative JavaScript templating API,2024-08-16T18:07:01Z,JRJurman
2293924284,WICG/webcomponents,> Can we have an in-HTML equivalent that doesn't require JS? Pretty please.  I just think that thi,https://github.com/WICG/webcomponents/issues/1069#issuecomment-2293924284,https://github.com/WICG/webcomponents/issues/1069,[templates] A declarative JavaScript templating API,2024-08-16T17:56:15Z,justinfagnani
