id,repo,body,url,issue_url,issue_title,created_at,user
4181177908,whatwg/html,"So I implemented all of your proposals in Chromium, and played around with it a bit. The new behavio",https://github.com/whatwg/html/issues/12304#issuecomment-4181177908,https://github.com/whatwg/html/issues/12304,popover=hint has multiple weird and inconsistent behaviours,2026-04-03T00:38:41Z,mfreed7
4181080300,w3c/payment-request,"We could definitely add a big red note to the spec here, as I think this is a really important issue",https://github.com/w3c/payment-request/pull/1066#issuecomment-4181080300,https://github.com/w3c/payment-request/pull/1066,fix: restore transient activation requirement in show(),2026-04-03T00:03:43Z,marcoscaceres
4181051622,whatwg/html,We had [a discussion about this in OpenUI](https://github.com/openui/open-ui/issues/847#issuecomment,https://github.com/whatwg/html/issues/12050#issuecomment-4181051622,https://github.com/whatwg/html/issues/12050,Filtering support for customizable select,2026-04-02T23:52:39Z,josepharhar
4180700304,w3ctag/design-reviews,"We are doing the human review. At first glance, I personally reached the same conclusions as the AI ",https://github.com/w3ctag/design-reviews/issues/1198#issuecomment-4180700304,https://github.com/w3ctag/design-reviews/issues/1198,Incubation: CPU Performance API,2026-04-02T21:56:14Z,marcoscaceres
4180363102,whatwg/html,Is there a CSSWG issue for the proposed inset value? It seems like it should be easy enough to speci,https://github.com/whatwg/html/issues/12286#issuecomment-4180363102,https://github.com/whatwg/html/issues/12286,outline and ::picker(select),2026-04-02T20:40:20Z,lukewarlow
4179703963,webkit/standards-positions,"Some [discussion in the ARIA WG meeting](https://www.w3.org/2026/04/02-aria-minutes.html#b300) this ",https://github.com/WebKit/standards-positions/issues/630#issuecomment-4179703963,https://github.com/WebKit/standards-positions/issues/630,[HTML] html-in-canvas,2026-04-02T18:33:04Z,cookiecrook
4179501571,whatwg/streams,"https://speced.github.io/bikeshed/#dfn-contract  >  If neither is provided, ""dfn"" type definitions d",https://github.com/whatwg/streams/issues/1365#issuecomment-4179501571,https://github.com/whatwg/streams/issues/1365,Do not mark abstract operations with `data-export`,2026-04-02T17:55:59Z,saschanaz
4179176302,w3ctag/design-reviews,"> What do you think?  Personally, I think this is getting tedious. I'd like to see a broader, meta d",https://github.com/w3ctag/design-reviews/issues/1198#issuecomment-4179176302,https://github.com/w3ctag/design-reviews/issues/1198,Incubation: CPU Performance API,2026-04-02T16:56:35Z,domfarolino
4178990220,whatwg/html,TODO for me: Spin out a new issue for weirdness 5.,https://github.com/whatwg/html/issues/12304#issuecomment-4178990220,https://github.com/whatwg/html/issues/12304,popover=hint has multiple weird and inconsistent behaviours,2026-04-02T16:21:23Z,jakearchibald
4178949684,WICG/webcomponents,Thanks @alice for the deep investigation on this and @jakearchibald for raising the issue.  I was wo,https://github.com/WICG/webcomponents/issues/1098#issuecomment-4178949684,https://github.com/WICG/webcomponents/issues/1098,Reference Target: How to handle events fired on the reference target by related elements?,2026-04-02T16:13:42Z,dandclark
4178928679,w3ctag/design-reviews,"@domfarolino do you have your prompt still for assessing the assessment? That’s key. ",https://github.com/w3ctag/design-reviews/issues/1198#issuecomment-4178928679,https://github.com/w3ctag/design-reviews/issues/1198,Incubation: CPU Performance API,2026-04-02T16:10:10Z,marcoscaceres
4178902541,mozilla/standards-positions,This is [being explored as the mechanism to control access to the WebMCP API among frames](https://g,https://github.com/mozilla/standards-positions/issues/327#issuecomment-4178902541,https://github.com/mozilla/standards-positions/issues/327,Document Policy,2026-04-02T16:05:41Z,bvandersloot-mozilla
4178892802,w3ctag/design-reviews,Oh! I love this “assessment of the assessment”! 😍 because then it begs the question what is the cor,https://github.com/w3ctag/design-reviews/issues/1198#issuecomment-4178892802,https://github.com/w3ctag/design-reviews/issues/1198,Incubation: CPU Performance API,2026-04-02T16:04:09Z,marcoscaceres
4178863002,whatwg/html,"cc @josepharhar ",https://github.com/whatwg/html/issues/12328#issuecomment-4178863002,https://github.com/whatwg/html/issues/12328,[Customizable select] Define UA behavior for interactive content inside <option>,2026-04-02T15:58:52Z,annevk
4178854281,webkit/standards-positions,"Friendly ping for a position, let me know if you have any questions or need any additional informati",https://github.com/WebKit/standards-positions/issues/171#issuecomment-4178854281,https://github.com/WebKit/standards-positions/issues/171,focusgroup attribute,2026-04-02T15:57:19Z,janewman
4178848670,mozilla/standards-positions,"@zcorpan PTAL when you get the chance, I'd love to get Mozzilla's take on this feature. cc @smaug---",https://github.com/mozilla/standards-positions/issues/1348#issuecomment-4178848670,https://github.com/mozilla/standards-positions/issues/1348,Focusgroup,2026-04-02T15:56:24Z,janewman
4178836893,mozilla/standards-positions,"I can't edit the issue itself, but a couple link clarifications:  ## Specification URL https://githu",https://github.com/mozilla/standards-positions/issues/1348#issuecomment-4178836893,https://github.com/mozilla/standards-positions/issues/1348,Focusgroup,2026-04-02T15:54:25Z,janewman
4178761443,w3c/ServiceWorker,I'm pretty sure cache.addAll() functions the same as if you had your script run fetch() directly.  S,https://github.com/w3c/ServiceWorker/issues/1718#issuecomment-4178761443,https://github.com/w3c/ServiceWorker/issues/1718,"Request's initiator can't be ""fetch""",2026-04-02T15:40:38Z,wanderview
4178442212,w3c/ServiceWorker,@wanderview or @jakearchibald might know.,https://github.com/w3c/ServiceWorker/issues/1718#issuecomment-4178442212,https://github.com/w3c/ServiceWorker/issues/1718,"Request's initiator can't be ""fetch""",2026-04-02T14:49:22Z,annevk
4178149477,whatwg/html,I disagree with your assertion that the issue of removing XSLT has run its course.   I continue to w,https://github.com/whatwg/html/issues/12103#issuecomment-4178149477,https://github.com/whatwg/html/issues/12103,Re: Issue #11523 Removal of XSLT from the web platform,2026-04-02T14:07:52Z,jjwhitmore
4178040956,w3c/payment-request,"Hey Marcos; thanks for filing this and #1064 . Totally agree that what's in the spec right now is a ",https://github.com/w3c/payment-request/pull/1066#issuecomment-4178040956,https://github.com/w3c/payment-request/pull/1066,fix: restore transient activation requirement in show(),2026-04-02T13:50:34Z,stephenmcgruer
4177804082,whatwg/html,Thanks! I'll check in a couple of months when there's data in httparchive.,https://github.com/whatwg/html/issues/10879#issuecomment-4177804082,https://github.com/whatwg/html/issues/10879,Audit and fix innerHTML scripting disabled parsing behavior for template,2026-04-02T13:16:45Z,zcorpan
4177792233,whatwg/html,"My initial reaction is that it feels weird if 'is' changes the behavior. But I don't yet understand ",https://github.com/whatwg/html/issues/12327#issuecomment-4177792233,https://github.com/whatwg/html/issues/12327,disallow customized builtin elements from being on the list of active formatting elements,2026-04-02T13:14:34Z,smaug----
4177546931,w3ctag/design-reviews,"Thanks. I fed it to Gemini so it could scrutinize the AI-generated critique you provided above. Let ",https://github.com/w3ctag/design-reviews/issues/1198#issuecomment-4177546931,https://github.com/w3ctag/design-reviews/issues/1198,Incubation: CPU Performance API,2026-04-02T12:33:21Z,domfarolino
4177439807,whatwg/notifications,`tag` is exactly for this purpose. See the examples in the spec: https://notifications.spec.whatwg.o,https://github.com/whatwg/notifications/issues/243#issuecomment-4177439807,https://github.com/whatwg/notifications/issues/243,Update existing web notification,2026-04-02T12:19:27Z,saschanaz
4177102664,w3ctag/design-reviews,"That is correct. It's covered by this bit of the explainer:  ``` It should be noted the speculation ",https://github.com/w3ctag/design-reviews/issues/1192#issuecomment-4177102664,https://github.com/w3ctag/design-reviews/issues/1192,Incubation: speculation rules `form_submission` field for prerendering,2026-04-02T11:51:23Z,tunetheweb
4176242151,whatwg/html,"oh wow, oops. Edited.",https://github.com/whatwg/html/issues/12304#issuecomment-4176242151,https://github.com/whatwg/html/issues/12304,popover=hint has multiple weird and inconsistent behaviours,2026-04-02T10:30:13Z,jakearchibald
4176218142,whatwg/html,"> For weirdness 5, to explain opening an auto popover within a hint popover: > > Currently: Showing ",https://github.com/whatwg/html/issues/12304#issuecomment-4176218142,https://github.com/whatwg/html/issues/12304,popover=hint has multiple weird and inconsistent behaviours,2026-04-02T10:25:28Z,lukewarlow
4176210880,mozilla/standards-positions,"Cheers! I do want to stress that I like this API aside from those details. I just wanted to avoid a ",https://github.com/mozilla/standards-positions/issues/945#issuecomment-4176210880,https://github.com/mozilla/standards-positions/issues/945,Observable,2026-04-02T10:24:03Z,jakearchibald
4176196029,w3ctag/design-reviews,"@robertlin-chromium Thanks for response! Let me double check if my understanding is correct.  > The ",https://github.com/w3ctag/design-reviews/issues/1192#issuecomment-4176196029,https://github.com/w3ctag/design-reviews/issues/1192,Incubation: speculation rules `form_submission` field for prerendering,2026-04-02T10:20:54Z,xiaochengh
4175651351,webkit/standards-positions,"Hi @annevk, @youennf,  Following up on our earlier discussion by @domenic, I'd like to share the key",https://github.com/WebKit/standards-positions/issues/492#issuecomment-4175651351,https://github.com/WebKit/standards-positions/issues/492,Extended lifetime shared workers,2026-04-02T08:42:52Z,yoshisatoyanagisawa
4175349794,whatwg/html,"@mfreed7 thanks for thinking all this through & providing feedback. I know it's frustrating opening ",https://github.com/whatwg/html/issues/12304#issuecomment-4175349794,https://github.com/whatwg/html/issues/12304,popover=hint has multiple weird and inconsistent behaviours,2026-04-02T07:49:18Z,jakearchibald
4175111838,whatwg/html,@josepharhar I’m with you on Solution 3 being the strongest.  It gives author flexibility. It’s prac,https://github.com/whatwg/html/issues/12050#issuecomment-4175111838,https://github.com/whatwg/html/issues/12050,Filtering support for customizable select,2026-04-02T06:58:30Z,JamieKnight
4174037062,whatwg/notifications,"Interesting, Chrome should not fail these. I filed https://issues.chromium.org/498745938.  We can ",https://github.com/whatwg/notifications/pull/244#issuecomment-4174037062,https://github.com/whatwg/notifications/pull/244,Add top-level origin check,2026-04-02T01:31:25Z,johannhof
4173774924,w3c/ServiceWorker,"Similarly, in that same step, there isn't a ""subresource"" destination listed here: https://fetch.spe",https://github.com/w3c/ServiceWorker/issues/1718#issuecomment-4173774924,https://github.com/w3c/ServiceWorker/issues/1718,"Request's initiator can't be ""fetch""",2026-04-02T00:33:26Z,trflynn89
4173605501,WICG/webcomponents,Hey folks! I maintain a [modest frontend framework](https://github.com/lustre-labs/lustre) for a pro,https://github.com/WICG/webcomponents/issues/909#issuecomment-4173605501,https://github.com/WICG/webcomponents/issues/909,"""open-stylable"" Shadow Roots",2026-04-01T23:41:32Z,hayleigh-dot-dev
4173351100,webkit/standards-positions,"Tagging on, CORP/COEP enables powerful features, but breaks third-party embeds. DIP solves this prob",https://github.com/WebKit/standards-positions/issues/399#issuecomment-4173351100,https://github.com/WebKit/standards-positions/issues/399,Document-Isolation-Policy,2026-04-01T22:32:28Z,tommygaessler
4173327372,mozilla/standards-positions,"Tagging on, CORP/COEP enables powerful features, but breaks third-party embeds. DIP solves this prob",https://github.com/mozilla/standards-positions/issues/1074#issuecomment-4173327372,https://github.com/mozilla/standards-positions/issues/1074,Document-Isolation-Policy,2026-04-01T22:26:18Z,tommygaessler
4173265182,whatwg/html,"> 1. What's the use case for this? You claim you need to book-keep top layer items, I'm curious as t",https://github.com/whatwg/html/issues/12300#issuecomment-4173265182,https://github.com/whatwg/html/issues/12300,Allow clean distinction of popover vs dialog.show() vs dialog.showModal() toggle events,2026-04-01T22:10:59Z,teetotum
4173177421,w3ctag/design-reviews,"Sure (Gemini 3)... ran it a few times, gets the same result:  <details> # CPU Performance API - Crit",https://github.com/w3ctag/design-reviews/issues/1198#issuecomment-4173177421,https://github.com/w3ctag/design-reviews/issues/1198,Incubation: CPU Performance API,2026-04-01T21:51:31Z,marcoscaceres
4173002767,whatwg/html,> Me and [@keithamus](https://github.com/keithamus) went through the pseudo-spec in [#12304 (comment,https://github.com/whatwg/html/issues/12304#issuecomment-4173002767,https://github.com/whatwg/html/issues/12304,popover=hint has multiple weird and inconsistent behaviours,2026-04-01T21:13:27Z,mfreed7
4172366174,w3ctag/design-reviews,Timely post by @torgo on some of this ...  https://www.torgo.com/blog/2026/03/yes-but-is-it-the-web.,https://github.com/w3ctag/design-reviews/issues/1202#issuecomment-4172366174,https://github.com/w3ctag/design-reviews/issues/1202,"Question: Could the TAG help define ""The Web Platform"" vs ""The Web"" or some other useful distinctions?",2026-04-01T19:07:29Z,bkardell
4171693434,whatwg/html,"Just FYI, I created a related ticket for the Fetch API here: https://github.com/whatwg/fetch/issues/",https://github.com/whatwg/html/issues/5744#issuecomment-4171693434,https://github.com/whatwg/html/issues/5744,Add an API to opt-out of back-forward cache?,2026-04-01T17:21:04Z,KthProg
4171665843,whatwg/html,> [@zcorpan](https://github.com/zcorpan) would you mind taking a look at https://crrev.com/c/7667359,https://github.com/whatwg/html/issues/10879#issuecomment-4171665843,https://github.com/whatwg/html/issues/10879,Audit and fix innerHTML scripting disabled parsing behavior for template,2026-04-01T17:17:37Z,mfreed7
4171252281,whatwg/fs,If we are all agreed on then I'm fine with it too. Maybe would be nice to check known usages like in,https://github.com/whatwg/fs/pull/182#issuecomment-4171252281,https://github.com/whatwg/fs/pull/182,fs: Remove nullable markers from WriteParams members,2026-04-01T16:22:15Z,saschanaz
4171095298,whatwg/fs,"This seems like a reasonable change, and is certainly what the spec should have said from the beginn",https://github.com/whatwg/fs/pull/182#issuecomment-4171095298,https://github.com/whatwg/fs/pull/182,fs: Remove nullable markers from WriteParams members,2026-04-01T15:59:28Z,mkruisselbrink
4171021429,WICG/webcomponents,"Another year gone, lets keep the topic alive.  FYI, that **&lt;last-element-in-lightDOM>** _""solutio",https://github.com/WICG/webcomponents/issues/551#issuecomment-4171021429,https://github.com/WICG/webcomponents/issues/551,connectedCallback timing when the document parser creates custom elements,2026-04-01T15:47:13Z,Danny-Engelman
4170926975,whatwg/html,This has been solved by the aforementioned PR.,https://github.com/whatwg/html/issues/12285#issuecomment-4170926975,https://github.com/whatwg/html/issues/12285,Creating an iframe's child navigable as written is impossible.,2026-04-01T15:32:09Z,Psychpsyo
4170811822,whatwg/html,Based on @annevk's feedback [here](https://github.com/whatwg/html/issues/12227#issuecomment-40108370,https://github.com/whatwg/html/issues/12050#issuecomment-4170811822,https://github.com/whatwg/html/issues/12050,Filtering support for customizable select,2026-04-01T15:15:26Z,josepharhar
4170714773,whatwg/html,"Adding code blocks to the examples above inline is hard, so here are code examples:  Solution 1, All",https://github.com/whatwg/html/issues/12050#issuecomment-4170714773,https://github.com/whatwg/html/issues/12050,Filtering support for customizable select,2026-04-01T15:00:23Z,josepharhar
4170046208,mozilla/standards-positions,Thanks. I'm not 100% sure the response would ACTUALLY be readable given the constraints of the clien,https://github.com/mozilla/standards-positions/issues/1381#issuecomment-4170046208,https://github.com/mozilla/standards-positions/issues/1381,Compression Dictionary support for cross-origin no-cors requests,2026-04-01T13:18:26Z,pmeenan
4170011046,w3ctag/design-reviews,"Can you share the output of your Gemini prompt? I'm surprised the prompt reduces things a ""pass/fail",https://github.com/w3ctag/design-reviews/issues/1198#issuecomment-4170011046,https://github.com/w3ctag/design-reviews/issues/1198,Incubation: CPU Performance API,2026-04-01T13:12:48Z,domfarolino
4169897054,mozilla/standards-positions,Thanks for the feedback @jakearchibald! I promise I've been meaning to catch up on that thread to se,https://github.com/mozilla/standards-positions/issues/945#issuecomment-4169897054,https://github.com/mozilla/standards-positions/issues/945,Observable,2026-04-01T12:54:01Z,domfarolino
4169131877,w3ctag/design-reviews,"Hi @andruud, the TAG discussed this at a Breakout today and are generally happy with it.  There's al",https://github.com/w3ctag/design-reviews/issues/1193#issuecomment-4169131877,https://github.com/w3ctag/design-reviews/issues/1193,Other Spec Review: The revert-rule keyword,2026-04-01T10:35:31Z,xiaochengh
4168927920,whatwg/html,I'm in favor of anything that will allow us to match the poster image with the video source 🚀    Th,https://github.com/whatwg/html/issues/10378#issuecomment-4168927920,https://github.com/whatwg/html/issues/10378,HTML Video: Allow a child IMG (with an optional Picture Element wrapper) to Control the Video Poster Image,2026-04-01T09:58:11Z,johannesodland
4168657289,whatwg/html,"> > I'm not sure exactly what you're proposing, but a tracking `hintStackParent` seems to solve it: ",https://github.com/whatwg/html/issues/12304#issuecomment-4168657289,https://github.com/whatwg/html/issues/12304,popover=hint has multiple weird and inconsistent behaviours,2026-04-01T09:08:51Z,jakearchibald
4168513592,w3ctag/design-reviews,"> Thanks [@noamr](https://github.com/noamr), this is helpful in understanding the context for the sw",https://github.com/w3ctag/design-reviews/issues/1134#issuecomment-4168513592,https://github.com/w3ctag/design-reviews/issues/1134,Incubation: patching (interleaved out-of-order streaming),2026-04-01T08:45:13Z,noamr
4168498889,w3ctag/design-reviews,> [@noamr](https://github.com/noamr) Thanks for updating the explainer. We had a look again at our T,https://github.com/w3ctag/design-reviews/issues/1177#issuecomment-4168498889,https://github.com/w3ctag/design-reviews/issues/1177,Incubation: seamless page transition with deferred commit,2026-04-01T08:42:40Z,noamr
4168042346,whatwg/html,"Small bump on this, I (think) this should be good to go now",https://github.com/whatwg/html/pull/12127#issuecomment-4168042346,https://github.com/whatwg/html/pull/12127,Editorial: Clarify return value of Storage property accessor,2026-04-01T07:15:00Z,shannonbooth
4167978405,whatwg/notifications,There's a tentative test https://wpt.fyi/results/notifications/cross-origin-nested.tentative.https.s,https://github.com/whatwg/notifications/pull/244#issuecomment-4167978405,https://github.com/whatwg/notifications/pull/244,Add top-level origin check,2026-04-01T07:01:24Z,saschanaz
4167532657,w3ctag/design-reviews,"@nickie, just wondering if you've fed this to Gemini for a review?... it confirmed a lot of concerns",https://github.com/w3ctag/design-reviews/issues/1198#issuecomment-4167532657,https://github.com/w3ctag/design-reviews/issues/1198,Incubation: CPU Performance API,2026-04-01T05:20:21Z,marcoscaceres
4167175488,mozilla/standards-positions,"Hi @pmeenan, the general idea seems solid, but I wanted to explore a little bit about how this works",https://github.com/mozilla/standards-positions/issues/1381#issuecomment-4167175488,https://github.com/mozilla/standards-positions/issues/1381,Compression Dictionary support for cross-origin no-cors requests,2026-04-01T03:29:48Z,martinthomson
4166992652,webkit/standards-positions,"I suggest we add ""oppose"" to this feature one week from now for the reasons stated above.",https://github.com/WebKit/standards-positions/issues/645#issuecomment-4166992652,https://github.com/WebKit/standards-positions/issues/645,Device Memory,2026-04-01T02:26:03Z,rniwa
4166764664,w3c/editing,The full list of commands which are supported Firefox is here: https://searchfox.org/firefox-main/re,https://github.com/w3c/editing/issues/530#issuecomment-4166764664,https://github.com/w3c/editing/issues/530,execCommand commands listed in MDN but not in the spec,2026-04-01T01:21:11Z,masayuki-nakano
4166581568,w3ctag/design-reviews,"We haven't finished discussing this, but one thing we're skeptical about is the idea of leaving the ",https://github.com/w3ctag/design-reviews/issues/1198#issuecomment-4166581568,https://github.com/w3ctag/design-reviews/issues/1198,Incubation: CPU Performance API,2026-04-01T00:28:36Z,jyasskin
4166574874,w3ctag/design-reviews,"Thanks @noamr, this is helpful in understanding the context for the switch to ProcessingInstructions",https://github.com/w3ctag/design-reviews/issues/1134#issuecomment-4166574874,https://github.com/w3ctag/design-reviews/issues/1134,Incubation: patching (interleaved out-of-order streaming),2026-04-01T00:26:32Z,dandclark
4165989997,whatwg/html,I think this can have agenda+ removed?,https://github.com/whatwg/html/issues/11694#issuecomment-4165989997,https://github.com/whatwg/html/issues/11694,Popover: Implicit anchor element removed too early,2026-03-31T22:26:35Z,cwilso
4165717350,whatwg/html,I see. We could try using the post-connection steps of the option element instead of insertion steps,https://github.com/whatwg/html/issues/12096#issuecomment-4165717350,https://github.com/whatwg/html/issues/12096,selectedcontent removing steps vs pagehide (and unload),2026-03-31T21:31:17Z,josepharhar
4165055744,whatwg/html,"> Couldn't it just be `source` like `showPopover`?  Yes, sorry, I meant `source`. In my head it is s",https://github.com/whatwg/html/issues/12319#issuecomment-4165055744,https://github.com/whatwg/html/issues/12319,Showing a <dialog> should take its source into account when hiding popovers,2026-03-31T19:48:18Z,mfreed7
4164824045,whatwg/html,Couldn't it just be `source` like `showPopover`?,https://github.com/whatwg/html/issues/12319#issuecomment-4164824045,https://github.com/whatwg/html/issues/12319,Showing a <dialog> should take its source into account when hiding popovers,2026-03-31T19:09:28Z,jakearchibald
4164560377,whatwg/fs,@fergald can someone from your team take a look please?,https://github.com/whatwg/fs/pull/182#issuecomment-4164560377,https://github.com/whatwg/fs/pull/182,fs: Remove nullable markers from WriteParams members,2026-03-31T18:25:32Z,noamr
4164515503,whatwg/html,"I can see in chrome that the focus ring is partially clipped by the picker, I never noticed before b",https://github.com/whatwg/html/issues/12286#issuecomment-4164515503,https://github.com/whatwg/html/issues/12286,outline and ::picker(select),2026-03-31T18:16:35Z,josepharhar
4164349201,w3c/performance-timeline,It may be useful to consider the difference between the global Performance Timeline buffer (`perform,https://github.com/w3c/performance-timeline/issues/224#issuecomment-4164349201,https://github.com/w3c/performance-timeline/issues/224,"Consider changing sorted ordering of performance entry to be based on ""end time"" rather than startTime.",2026-03-31T17:47:26Z,nicjansma
4164307557,whatwg/notifications,"It's implementation-defined for shared/service workers only so I guess your question is what should ",https://github.com/whatwg/notifications/pull/244#issuecomment-4164307557,https://github.com/whatwg/notifications/pull/244,Add top-level origin check,2026-03-31T17:40:41Z,annevk
4164096447,whatwg/html,A few related issues/PRs: - https://github.com/whatwg/html/issues/9998 - https://github.com/whatwg/h,https://github.com/whatwg/html/issues/12319#issuecomment-4164096447,https://github.com/whatwg/html/issues/12319,Showing a <dialog> should take its source into account when hiding popovers,2026-03-31T17:02:16Z,mfreed7
4163870074,whatwg/notifications,"What is ""top level"" here? [HTML](https://html.spec.whatwg.org/#concept-environment-top-level-origin)",https://github.com/whatwg/notifications/pull/244#issuecomment-4163870074,https://github.com/whatwg/notifications/pull/244,Add top-level origin check,2026-03-31T16:24:35Z,saschanaz
4163831578,w3c/performance-timeline,Alternative: `getEntriesByPaint()` (returning a list of [`PerformanceEntryList`](https://www.w3.org/,https://github.com/w3c/performance-timeline/issues/228#issuecomment-4163831578,https://github.com/w3c/performance-timeline/issues/228,"Add PerformanceObserver option for ""per-paint"" reporting.",2026-03-31T16:18:53Z,mmocny
4163651515,whatwg/html,"> Hmm, looks like the invite from the CSSWG calendar dropped off a while back. The only calendar ite",https://github.com/whatwg/html/issues/12291#issuecomment-4163651515,https://github.com/whatwg/html/issues/12291,Meeting 39 for joint OpenUI-WHATWG/HTML-CSSWG task force on styleable form controls,2026-03-31T15:50:51Z,mfreed7
