id,repo,body,url,issue_url,issue_title,created_at,user
2872318809,whatwg/html,"> This should be a prime classic example which supports this idea, from nearly 30 years ago.     Tha",https://github.com/whatwg/html/issues/9126#issuecomment-2872318809,https://github.com/whatwg/html/issues/9126,"Consider allowing <hr> within list elements (ol, ul, menu)",2025-05-12T12:13:39Z,Lampe2020
2872281360,whatwg/html,@foolip @zcorpan Any updates on this issue?,https://github.com/whatwg/html/issues/9181#issuecomment-2872281360,https://github.com/whatwg/html/issues/9181,Make <img> src attribute optional if srcset is present,2025-05-12T12:00:11Z,johannesodland
2872279538,whatwg/html,> Looks like there's some kind of auto-formatting that is going on that has changed nearly every lin,https://github.com/whatwg/html/pull/11299#issuecomment-2872279538,https://github.com/whatwg/html/pull/11299,EDIT: FIXING THE TITLE CASE ISSUE,2025-05-12T11:59:28Z,F4ngYu
2872242421,whatwg/html,"Looks like there's some kind of auto-formatting that is going on that has changed nearly every line,",https://github.com/whatwg/html/pull/11299#issuecomment-2872242421,https://github.com/whatwg/html/pull/11299,EDIT: FIXING THE TITLE CASE ISSUE,2025-05-12T11:45:30Z,keithamus
2872207180,whatwg/html,This is my first time contributing to anything. So Didn't quite understand what to do. Did according,https://github.com/whatwg/html/pull/11299#issuecomment-2872207180,https://github.com/whatwg/html/pull/11299,EDIT: FIXING THE TITLE CASE ISSUE,2025-05-12T11:39:23Z,F4ngYu
2872184124,webkit/standards-positions,This is great to hear! I'm going to fold this into #262 as I don't think we need to consider this se,https://github.com/WebKit/standards-positions/issues/491#issuecomment-2872184124,https://github.com/WebKit/standards-positions/issues/491,Renaming Storage Access Handle methods for non-cookie Storage Access API,2025-05-12T11:31:32Z,annevk
2871971450,whatwg/html,"I don't really understand what ""live with these gotchas"" means or why `<base>` alone is problematic ",https://github.com/whatwg/html/issues/11286#issuecomment-2871971450,https://github.com/whatwg/html/issues/11286,Expanding the concept of internal resource links,2025-05-12T10:26:02Z,annevk
2871960953,WICG/webcomponents,"From a user point of view, self closing custom elements is a no brainer, it would make our lifes bet",https://github.com/WICG/webcomponents/issues/624#issuecomment-2871960953,https://github.com/WICG/webcomponents/issues/624,Custom 'void' or self-closing elements (HTML parser changes),2025-05-12T10:22:59Z,oelmekki
2871698116,whatwg/html,"> Since this feature is intended to support [#11019](https://github.com/whatwg/html/issues/11019), i",https://github.com/whatwg/html/issues/11286#issuecomment-2871698116,https://github.com/whatwg/html/issues/11286,Expanding the concept of internal resource links,2025-05-12T09:12:26Z,noamr
2871535146,webkit/standards-positions,`rel=prefetch` is not a feature that's enabled by default and this behavior is already required by F,https://github.com/WebKit/standards-positions/issues/493#issuecomment-2871535146,https://github.com/WebKit/standards-positions/issues/493,Send Sec-Purpose header for link type prefetch (rel=prefetch),2025-05-12T08:47:32Z,annevk
2871319722,mozilla/standards-positions,Firefox already switched to Sec-Purpose for rel=prefetch in [1836328 - Replace X-Moz Prefetch with S,https://github.com/mozilla/standards-positions/issues/1228#issuecomment-2871319722,https://github.com/mozilla/standards-positions/issues/1228,Send Sec-Purpose header for link type prefetch (rel=prefetch),2025-05-12T08:02:01Z,valenting
2870517774,mozilla/standards-positions,NOTE: It was shared at the April 2025 TC39 meeting that the AsyncContext specification has been upda,https://github.com/mozilla/standards-positions/issues/1187#issuecomment-2870517774,https://github.com/mozilla/standards-positions/issues/1187,TC39 AsyncContext,2025-05-12T02:06:43Z,petamoriken
2870492777,mozilla/standards-positions,I (and likely the TAG) would appreciate some of the explainer material being moved to the specificat,https://github.com/mozilla/standards-positions/issues/1229#issuecomment-2870492777,https://github.com/mozilla/standards-positions/issues/1229,env(preferred-text-scale),2025-05-12T01:55:21Z,martinthomson
2870491306,mozilla/standards-positions,Honestly it's pretty disappointing that such a valuable feature - which pretty much every modern fro,https://github.com/mozilla/standards-positions/issues/1187#issuecomment-2870491306,https://github.com/mozilla/standards-positions/issues/1187,TC39 AsyncContext,2025-05-12T01:53:50Z,AlbertMarashi
2870453384,whatwg/html,"Could you please elaborate further on the `restartable` flag? Specifically, what happens if a Shared",https://github.com/whatwg/html/issues/11205#issuecomment-2870453384,https://github.com/whatwg/html/issues/11205,"Discuss out-of-memory etc. agent cluster killing, especially for shared workers?",2025-05-12T01:15:38Z,yoshisatoyanagisawa
2869217357,whatwg/html,"@js-choi That use case makes sense, although the concern with too small of a pointer target still re",https://github.com/whatwg/html/issues/2272#issuecomment-2869217357,https://github.com/whatwg/html/issues/2272,Disallow interactive content in <summary>,2025-05-10T23:30:32Z,dev-nicolaos
2869058212,whatwg/html,"<img width=""355"" alt=""Image"" src=""https://github.com/user-attachments/assets/e0ace3e5-0c01-4909-ac01",https://github.com/whatwg/html/issues/2272#issuecomment-2869058212,https://github.com/whatwg/html/issues/2272,Disallow interactive content in <summary>,2025-05-10T17:43:38Z,js-choi
2869007000,whatwg/html,I can confirm with Chrome 136.0.7103.93 (Official Build) (arm64) on macOS 15.4.1 (24E263) – test rep,https://github.com/whatwg/html/issues/9278#issuecomment-2869007000,https://github.com/whatwg/html/issues/9278,Keep sharedWorker alive durning reload / next-page,2025-05-10T16:35:34Z,jdeepwell
2868974757,whatwg/html,Related to https://github.com/w3c/ServiceWorker/issues/955,https://github.com/whatwg/html/issues/11295#issuecomment-2868974757,https://github.com/whatwg/html/issues/11295,expose `Clients` to `SharedWorker`,2025-05-10T15:37:56Z,wanderview
2868834861,whatwg/html,Here is a more slimed down 1 file version: ```html <?php // Enabling these headers will result in th,https://github.com/whatwg/html/issues/9278#issuecomment-2868834861,https://github.com/whatwg/html/issues/9278,Keep sharedWorker alive durning reload / next-page,2025-05-10T12:55:10Z,jimmywarting
2868783843,w3c/pointerevents,"> Oh, but how do you handle this case?  I think pending pointer capture element which is becoming ne",https://github.com/w3c/pointerevents/issues/551#issuecomment-2868783843,https://github.com/w3c/pointerevents/issues/551,Clarify how to handle removed pointer capture element,2025-05-10T12:11:08Z,masayuki-nakano
2868773293,mozilla/standards-positions,"I think `pem` units need more discussion, but the `env()` variable seems reasonable given the curren",https://github.com/mozilla/standards-positions/issues/1229#issuecomment-2868773293,https://github.com/mozilla/standards-positions/issues/1229,env(preferred-text-scale),2025-05-10T11:40:58Z,emilio
2868570532,w3c/pointerevents,"Ah, so, unclear scenario is:  1. `A.setPointerCapture(n)` 2. `B.setPointerCapture(n)` 3. `lostpointe",https://github.com/w3c/pointerevents/issues/551#issuecomment-2868570532,https://github.com/w3c/pointerevents/issues/551,Clarify how to handle removed pointer capture element,2025-05-10T07:15:04Z,masayuki-nakano
2868566966,w3c/pointerevents,(But web app developers may expect that the new pending element should override it immediately.),https://github.com/w3c/pointerevents/issues/550#issuecomment-2868566966,https://github.com/w3c/pointerevents/issues/550,Clarify what happens if capturing element is changed in a `lostpointercapture` listener,2025-05-10T07:06:37Z,masayuki-nakano
2868563753,w3c/pointerevents,"Oh, this is partially tested by [a WPT](pointerevents/pointerevent_capture_mouse_and_release_and_cap",https://github.com/w3c/pointerevents/issues/550#issuecomment-2868563753,https://github.com/w3c/pointerevents/issues/550,Clarify what happens if capturing element is changed in a `lostpointercapture` listener,2025-05-10T07:01:28Z,masayuki-nakano
2868521732,w3c/pointerevents,"Oh, I didn't know the API in @smaug---- 's comment, yeah, moving a node should be a pair of ""remove""",https://github.com/w3c/pointerevents/issues/551#issuecomment-2868521732,https://github.com/w3c/pointerevents/issues/551,Clarify how to handle removed pointer capture element,2025-05-10T06:41:42Z,masayuki-nakano
2868495670,whatwg/html,"> I'm hoping the discussion also keeps a distinction between ""combobox"" as conceptually a text input",https://github.com/whatwg/html/issues/11288#issuecomment-2868495670,https://github.com/whatwg/html/issues/11288,Filterable `<select>` via `<input>` (native combobox & more),2025-05-10T06:26:40Z,brandonmcconnell
2868491564,whatwg/html,> We can move this discussion to OpenUI but I'm curious why you don't consider input + datalist to b,https://github.com/whatwg/html/issues/11288#issuecomment-2868491564,https://github.com/whatwg/html/issues/11288,Filterable `<select>` via `<input>` (native combobox & more),2025-05-10T06:24:20Z,brandonmcconnell
2868457786,whatwg/html,"This is already included in the spec. In fact, the spec requires `Sec-Purpose: prefetch`, and does n",https://github.com/whatwg/html/issues/11294#issuecomment-2868457786,https://github.com/whatwg/html/issues/11294,Can we include what header(s) get sent with link type prefetch?,2025-05-10T06:10:01Z,domenic
2868146175,whatwg/html,"> It's unlikely to be problematic from a back-compat perspective, it's just of extremely minimal val",https://github.com/whatwg/html/issues/11240#issuecomment-2868146175,https://github.com/whatwg/html/issues/11240,"Proposal: Shorthand syntax for external stylesheets (<style src=""..."">)",2025-05-10T00:31:33Z,bburns
2868120822,whatwg/html,"> * while hiding a popover, the [invoker is cleared](https://source.chromium.org/chromium/chromium/s",https://github.com/whatwg/html/issues/11246#issuecomment-2868120822,https://github.com/whatwg/html/issues/11246,Make popover implicit anchor and invoker match,2025-05-10T00:02:48Z,mfreed7
2867823098,whatwg/html,"Since this feature is intended to support https://github.com/whatwg/html/issues/11019, it should spe",https://github.com/whatwg/html/issues/11286#issuecomment-2867823098,https://github.com/whatwg/html/issues/11286,Expanding the concept of internal resource links,2025-05-09T20:36:35Z,sorvell
2867787418,whatwg/html,> It's difficult to go from inline stylesheets to external stylesheets - the syntax goes from this >,https://github.com/whatwg/html/issues/11240#issuecomment-2867787418,https://github.com/whatwg/html/issues/11240,"Proposal: Shorthand syntax for external stylesheets (<style src=""..."">)",2025-05-09T20:15:37Z,1jj
2867456841,whatwg/html,The 1a [current spec text](https://html.spec.whatwg.org/#link-type-expect:~:text=equal%20doc's%20URL,https://github.com/whatwg/html/issues/11286#issuecomment-2867456841,https://github.com/whatwg/html/issues/11286,Expanding the concept of internal resource links,2025-05-09T17:47:00Z,robglidden
2867309887,whatwg/html,> I think the Chromium use counter has some amount of false positives because some sites have a flas,https://github.com/whatwg/html/issues/7867#issuecomment-2867309887,https://github.com/whatwg/html/issues/7867,Remove UA style for h1-h6 in section (et. al.) and hgroup,2025-05-09T17:03:27Z,mfreed7
2867231169,w3c/resource-timing,"Closing out, I don't see any action needed in the Resource Timing spec.  If you continue to see issu",https://github.com/w3c/resource-timing/issues/413#issuecomment-2867231169,https://github.com/w3c/resource-timing/issues/413,Big difference between `redirectEnd` and `fetchStart`,2025-05-09T16:42:13Z,nicjansma
2867131561,w3c/resource-timing,"This is different from ""initiator info"" I am working on but I am happy to take care of this one soon",https://github.com/w3c/resource-timing/issues/364#issuecomment-2867131561,https://github.com/w3c/resource-timing/issues/364,List of initiatorType types,2025-05-09T16:16:18Z,guohuideng2024
2866838443,whatwg/html,"Per [UIEvents DOMActivate](https://w3c.github.io/uievents/#event-type-DOMActivate), implementers sho",https://github.com/whatwg/html/issues/10431#issuecomment-2866838443,https://github.com/whatwg/html/issues/10431,Should clicking a label contained in a button with popovertarget toggle the popover?,2025-05-09T14:46:48Z,vinhill
2866771424,whatwg/html,"No implementer being against it is good, but not sufficient. Is any implementer interested in doing ",https://github.com/whatwg/html/pull/6284#issuecomment-2866771424,https://github.com/whatwg/html/pull/6284,Temporal proposal HTML serialization support,2025-05-09T14:29:49Z,annevk
2866678139,whatwg/html,Reading @domenic's proposal for [extended life SharedWorker](https://gist.github.com/domenic/c5bd383,https://github.com/whatwg/html/issues/11205#issuecomment-2866678139,https://github.com/whatwg/html/issues/11205,"Discuss out-of-memory etc. agent cluster killing, especially for shared workers?",2025-05-09T14:03:42Z,wanderview
2866563542,w3c/pointerevents,"move is in my mind only https://dom.spec.whatwg.org/#dom-parentnode-movebefore, these days at least ",https://github.com/w3c/pointerevents/issues/551#issuecomment-2866563542,https://github.com/w3c/pointerevents/issues/551,Clarify how to handle removed pointer capture element,2025-05-09T13:32:03Z,smaug----
2866518790,w3c/pointerevents,"In my interpretation, ""moving an element"" means removing the element first then appending it elsewhe",https://github.com/w3c/pointerevents/issues/551#issuecomment-2866518790,https://github.com/w3c/pointerevents/issues/551,Clarify how to handle removed pointer capture element,2025-05-09T13:20:36Z,mustaqahmed
2866332390,whatwg/html,It seems that is now https://groups.google.com/a/chromium.org/g/blink-dev/c/gE6K8-jDWyE/m/NrI8h2fFAA,https://github.com/whatwg/html/issues/6235#issuecomment-2866332390,https://github.com/whatwg/html/issues/6235,"Escape ""<"" and "">"" in attributes when serializing HTML",2025-05-09T12:17:01Z,annevk
2865749617,whatwg/dom,"@WebReflection @rniwa Ok, I agree, what should be our next steps?",https://github.com/whatwg/dom/issues/736#issuecomment-2865749617,https://github.com/whatwg/dom/issues/736,Proposal: a DocumentFragment whose nodes do not get removed once inserted,2025-05-09T09:00:30Z,FrameMuse
2865567853,whatwg/html,Still need to add some more tests based on the Live DOM Viewer demos.,https://github.com/whatwg/html/pull/10957#issuecomment-2865567853,https://github.com/whatwg/html/pull/10957,Fire a load event for javascript: URL non-strings,2025-05-09T08:04:29Z,zcorpan
2865539783,whatwg/html,"I think the Chromium use counter has some amount of false positives because some sites have a flash ",https://github.com/whatwg/html/issues/7867#issuecomment-2865539783,https://github.com/whatwg/html/issues/7867,Remove UA style for h1-h6 in section (et. al.) and hgroup,2025-05-09T07:55:50Z,zcorpan
2865504555,whatwg/html,> One thing I didn't realize until reading the minutes from [#11278](https://github.com/whatwg/html/,https://github.com/whatwg/html/issues/11286#issuecomment-2865504555,https://github.com/whatwg/html/issues/11286,Expanding the concept of internal resource links,2025-05-09T07:44:00Z,noamr
2865402401,whatwg/html,I've created an explainer for this change at https://gist.github.com/domenic/c5bd38339f33b49120ae11b,https://github.com/whatwg/html/issues/10997#issuecomment-2865402401,https://github.com/whatwg/html/issues/10997,A new API for work during unload,2025-05-09T07:10:59Z,domenic
2865205490,w3c/editing,"Additionally, there is another issue of handling consecutive white-spaces. If `white-space` is `norm",https://github.com/w3c/editing/issues/419#issuecomment-2865205490,https://github.com/w3c/editing/issues/419,Behavior of insert* commands for contenteditable=plaintext-only,2025-05-09T05:50:38Z,masayuki-nakano
2865199698,w3c/editing,The Chrome/Chromium's behavior violates the CSS rules and the style override hack seems odd if `whit,https://github.com/w3c/editing/issues/419#issuecomment-2865199698,https://github.com/w3c/editing/issues/419,Behavior of insert* commands for contenteditable=plaintext-only,2025-05-09T05:46:32Z,masayuki-nakano
2865127655,whatwg/html,Making step 7 check for _noopener_ seems straightforward. I think that would fix it?,https://github.com/whatwg/html/issues/11291#issuecomment-2865127655,https://github.com/whatwg/html/issues/11291,"""rules for choosing a navigable"" allows named targeting with noopener",2025-05-09T05:05:14Z,annevk
2865074974,whatwg/html,"It sounds like there's some browser bugs here worth filing on Chrome and Firefox.  Separately, https",https://github.com/whatwg/html/issues/9278#issuecomment-2865074974,https://github.com/whatwg/html/issues/9278,Keep sharedWorker alive durning reload / next-page,2025-05-09T04:39:01Z,domenic
2865001802,mozilla/standards-positions,"> > Personally, I think the best way to implement WebUSB, Web Bluetooth, and other interfaces is wit",https://github.com/mozilla/standards-positions/issues/95#issuecomment-2865001802,https://github.com/mozilla/standards-positions/issues/95,Web Bluetooth,2025-05-09T03:43:45Z,DemiMarie
2864764238,whatwg/html,One thing I didn't realize until reading the minutes from #11278 was that (1) might be proposing two,https://github.com/whatwg/html/issues/11286#issuecomment-2864764238,https://github.com/whatwg/html/issues/11286,Expanding the concept of internal resource links,2025-05-09T00:26:57Z,domenic
2864679179,whatwg/html,"I'm hoping the discussion also keeps a distinction between ""combobox"" as conceptually a text input w",https://github.com/whatwg/html/issues/11288#issuecomment-2864679179,https://github.com/whatwg/html/issues/11288,Filterable `<select>` via `<input>` (native combobox & more),2025-05-08T23:26:35Z,rajsite
2864550127,whatwg/html,"> This makes perfect sense to me. Would you be willing to work on a spec PR?  Possibly! I suspect I ",https://github.com/whatwg/html/issues/11287#issuecomment-2864550127,https://github.com/whatwg/html/issues/11287,"Spec text for naturalWidth and naturalHeight behavior isn't web-compatible, for cases where attributes are missing",2025-05-08T22:12:53Z,dholbert
2864308630,w3ctag/design-reviews,"> To be more specific, will IFT introduce new security risks? For example, significantly lowering th",https://github.com/w3ctag/design-reviews/issues/1057#issuecomment-2864308630,https://github.com/w3ctag/design-reviews/issues/1057,Incremental Font Transfer,2025-05-08T21:04:54Z,svgeesus
2863974715,mozilla/standards-positions,> I'm curious where our community and developer sentiment currently lies.  Something clearly changed,https://github.com/mozilla/standards-positions/issues/1212#issuecomment-2863974715,https://github.com/mozilla/standards-positions/issues/1212,HTML <a> ping attribute,2025-05-08T18:47:15Z,dveditz
2863921116,whatwg/html,Thank you all for attending the meeting today and a special thank you to Chris Wilson for taking mee,https://github.com/whatwg/html/issues/11278#issuecomment-2863921116,https://github.com/whatwg/html/issues/11278,Upcoming WHATNOT meeting on 2025-05-08,2025-05-08T18:30:14Z,past
2863834685,whatwg/html,Sorry I don't actually remember discussing serialization of Temporal objects. At this time I can't r,https://github.com/whatwg/html/pull/6284#issuecomment-2863834685,https://github.com/whatwg/html/pull/6284,Temporal proposal HTML serialization support,2025-05-08T17:53:49Z,syg
2863780446,whatwg/html,"The timing generally makes sense to me, with a caveat on when the effect of the relevant determinati",https://github.com/whatwg/html/issues/11210#issuecomment-2863780446,https://github.com/whatwg/html/issues/11210,CSS content-visibility content relevancy section should be in the HTML spec.,2025-05-08T17:30:14Z,vmpstr
2863690438,whatwg/html,"From today's WHATNOT:  > Simon: in last comment linked, I porosed using a formal validation mechanis",https://github.com/whatwg/html/issues/5312#issuecomment-2863690438,https://github.com/whatwg/html/issues/5312,"Form Submission: Fix the ""Double Submit problem"" at the spec level",2025-05-08T16:49:13Z,zcorpan
2863668402,whatwg/html,"Given the above concerns I'm leaning towards rejecting this as an idea, without concrete use cases t",https://github.com/whatwg/html/issues/11275#issuecomment-2863668402,https://github.com/whatwg/html/issues/11275,Dispatch CloseWatcher's cancel event for popovers also,2025-05-08T16:40:01Z,lukewarlow
2863589241,whatwg/html,> I heard that V8 doesn't want to add this per the latest TC39 meeting  @annevk could you point to,https://github.com/whatwg/html/pull/6284#issuecomment-2863589241,https://github.com/whatwg/html/pull/6284,Temporal proposal HTML serialization support,2025-05-08T16:09:12Z,controversial
2863557506,whatwg/html,Here's at least one relevant openui issue fwiw: https://github.com/openui/open-ui/issues/847,https://github.com/whatwg/html/issues/11288#issuecomment-2863557506,https://github.com/whatwg/html/issues/11288,Filterable `<select>` via `<input>` (native combobox & more),2025-05-08T15:57:41Z,lukewarlow
2863540744,whatwg/html,"We can move this discussion to OpenUI but I'm curious why you don't consider input + datalist to be ",https://github.com/whatwg/html/issues/11288#issuecomment-2863540744,https://github.com/whatwg/html/issues/11288,Filterable `<select>` via `<input>` (native combobox & more),2025-05-08T15:51:24Z,lukewarlow
2863467053,whatwg/html,Sent out an Intent: https://groups.google.com/a/chromium.org/g/blink-dev/c/Ja6CAb7u8rI,https://github.com/whatwg/html/issues/6235#issuecomment-2863467053,https://github.com/whatwg/html/issues/6235,"Escape ""<"" and "">"" in attributes when serializing HTML",2025-05-08T15:30:19Z,securityMB
2863412307,whatwg/html,This makes sense to me but deferring to @vmpstr as the subject matter expert.,https://github.com/whatwg/html/issues/11210#issuecomment-2863412307,https://github.com/whatwg/html/issues/11210,CSS content-visibility content relevancy section should be in the HTML spec.,2025-05-08T15:11:20Z,noamr
2863315328,mozilla/standards-positions,"This is an improvement in clarity to developers! We haven't shipped it yet, so I see no issue on our",https://github.com/mozilla/standards-positions/issues/1226#issuecomment-2863315328,https://github.com/mozilla/standards-positions/issues/1226,Renaming Storage Access Handle methods for non-cookie Storage Access API,2025-05-08T14:43:16Z,bvandersloot-mozilla
2863306712,w3c/editing,"OK, though forcing computed style is ""magic"". Maybe it's enough to have a normal UA style rule?  ```",https://github.com/w3c/editing/issues/419#issuecomment-2863306712,https://github.com/w3c/editing/issues/419,Behavior of insert* commands for contenteditable=plaintext-only,2025-05-08T14:40:20Z,zcorpan
2862928488,mozilla/standards-positions,"I don't think `<a ping>` undermines our current bounce tracking protections, especially if we issue ",https://github.com/mozilla/standards-positions/issues/1212#issuecomment-2862928488,https://github.com/mozilla/standards-positions/issues/1212,HTML <a> ping attribute,2025-05-08T12:44:40Z,bvandersloot-mozilla
2862781228,mozilla/standards-positions,"Right. Since `ping` is just a fetch, and sites are not blocked from performing any other kind of fet",https://github.com/mozilla/standards-positions/issues/1212#issuecomment-2862781228,https://github.com/mozilla/standards-positions/issues/1212,HTML <a> ping attribute,2025-05-08T11:58:02Z,zcorpan
2862770543,w3ctag/design-reviews,> The term devicePixelRatio is typically used to denote the ratio between physical and logical pixel,https://github.com/w3ctag/design-reviews/issues/1060#issuecomment-2862770543,https://github.com/w3ctag/design-reviews/issues/1060,Physical and logical resolution for screen-capture MediaStreamTracks,2025-05-08T11:53:33Z,guidou
2862361607,whatwg/dom,"> we can iterate on more things _after_ such primitive landed, right?  True, totally get it. I will ",https://github.com/whatwg/dom/issues/736#issuecomment-2862361607,https://github.com/whatwg/dom/issues/736,Proposal: a DocumentFragment whose nodes do not get removed once inserted,2025-05-08T09:22:36Z,DeepDoge
2862315115,whatwg/html,"Status update: the change has been rolled out to 5% of Firefox 138 release since April 29. Still no ",https://github.com/whatwg/html/issues/7867#issuecomment-2862315115,https://github.com/whatwg/html/issues/7867,Remove UA style for h1-h6 in section (et. al.) and hgroup,2025-05-08T09:06:46Z,zcorpan
2862292464,w3ctag/design-reviews,"> but as far as I can tell this is not specific to IFT.  To be more specific, will IFT introduce new",https://github.com/w3ctag/design-reviews/issues/1057#issuecomment-2862292464,https://github.com/w3ctag/design-reviews/issues/1057,Incremental Font Transfer,2025-05-08T08:58:34Z,xiaochengh
2862240227,whatwg/dom,"I, personally, don't need/care about connected/disconnected events and I feel like it's entirely out",https://github.com/whatwg/dom/issues/736#issuecomment-2862240227,https://github.com/whatwg/dom/issues/736,Proposal: a DocumentFragment whose nodes do not get removed once inserted,2025-05-08T08:40:34Z,WebReflection
2862135484,mozilla/standards-positions,"I eagerly await more details about the integrity and transparency features you mention. I'd like to ",https://github.com/mozilla/standards-positions/issues/799#issuecomment-2862135484,https://github.com/mozilla/standards-positions/issues/799,Isolated Web Apps,2025-05-08T08:01:40Z,reillyeon
