id,repo,body,url,issue_url,issue_title,created_at,user
4163578677,whatwg/html,We decided to close #3580 partially because of risk and partially because nobody is picking it up. O,https://github.com/whatwg/html/pull/12017#issuecomment-4163578677,https://github.com/whatwg/html/pull/12017,Fix ordering of lifecycle callbacks to match implementations,2026-03-31T15:39:29Z,annevk
4163565657,whatwg/html,"Hmm, looks like the invite from the CSSWG calendar dropped off a while back. The only calendar item ",https://github.com/whatwg/html/issues/12291#issuecomment-4163565657,https://github.com/whatwg/html/issues/12291,Meeting 39 for joint OpenUI-WHATWG/HTML-CSSWG task force on styleable form controls,2026-03-31T15:37:26Z,astearns
4163540523,whatwg/html,> > This behavior was the result of the discussions on the issue and the PR. I started with a separa,https://github.com/whatwg/html/issues/12304#issuecomment-4163540523,https://github.com/whatwg/html/issues/12304,popover=hint has multiple weird and inconsistent behaviours,2026-03-31T15:34:08Z,mfreed7
4163503305,whatwg/html,"Nothing has happened here, and https://github.com/whatwg/html/pull/12017 is moving perhaps even to a",https://github.com/whatwg/html/issues/3580#issuecomment-4163503305,https://github.com/whatwg/html/issues/3580,window.customElements.define retrieves the lifetime callbacks in an odd order,2026-03-31T15:28:33Z,smaug----
4163453265,whatwg/notifications,Do you happen to know if we have any test coverage for this?,https://github.com/whatwg/notifications/pull/244#issuecomment-4163453265,https://github.com/whatwg/notifications/pull/244,Add top-level origin check,2026-03-31T15:20:47Z,annevk
4163437544,mozilla/standards-positions,I'd like to propose https://github.com/mozilla/standards-positions/labels/position%3A%20negative for,https://github.com/mozilla/standards-positions/issues/945#issuecomment-4163437544,https://github.com/mozilla/standards-positions/issues/945,Observable,2026-03-31T15:18:26Z,jakearchibald
4163397042,whatwg/html,"We'd like to discuss this again at the WHATNOT on April 2, to request stage 2. (Please leave the age",https://github.com/whatwg/html/issues/10650#issuecomment-4163397042,https://github.com/whatwg/html/issues/10650,HTML-in-Canvas,2026-03-31T15:12:39Z,foolip
4163296768,whatwg/html,> I’ll move the calendar invite to the 9th tomorrow as long as there are no objections raised by the,https://github.com/whatwg/html/issues/12291#issuecomment-4163296768,https://github.com/whatwg/html/issues/12291,Meeting 39 for joint OpenUI-WHATWG/HTML-CSSWG task force on styleable form controls,2026-03-31T14:59:04Z,mfreed7
4163174410,w3ctag/design-reviews,"Status update: to implement the TAG's request that ""each document's support level should be in its S",https://github.com/w3ctag/design-reviews/issues/1187#issuecomment-4163174410,https://github.com/w3ctag/design-reviews/issues/1187,[wg/das] Devices and Sensors Working Group 2026 Charter,2026-03-31T14:43:12Z,marcoscaceres
4163084348,whatwg/html,Changing Gecko seems reasonable. But it seems error values also result in a hint for `border-bottom-,https://github.com/whatwg/html/issues/12320#issuecomment-4163084348,https://github.com/whatwg/html/issues/12320,<hr size> integer parsing interop,2026-03-31T14:30:55Z,zcorpan
4162951124,whatwg/html,Curious how folks feel about this one now? I think a child img element (with an optional picture ele,https://github.com/whatwg/html/issues/10378#issuecomment-4162951124,https://github.com/whatwg/html/issues/10378,HTML Video: Allow a child IMG (with an optional Picture Element wrapper) to Control the Video Poster Image,2026-03-31T14:10:59Z,scottjehl
4162679487,whatwg/html,cc @mfreed7 (but I don't think this is as pressing as #12304),https://github.com/whatwg/html/issues/12319#issuecomment-4162679487,https://github.com/whatwg/html/issues/12319,Showing a <dialog> should take its source into account when hiding popovers,2026-03-31T13:32:36Z,jakearchibald
4162459913,whatwg/html,"We used to have blog entries for this ""This week in HTML"" and if anyone was up for writing those I'd",https://github.com/whatwg/html/issues/12324#issuecomment-4162459913,https://github.com/whatwg/html/issues/12324,Provide regular release notes or information how to keep oneself up-to-date on HTML spec changes,2026-03-31T12:57:18Z,annevk
4162340776,whatwg/html,I've signed the participation agreement now.,https://github.com/whatwg/html/pull/12294#issuecomment-4162340776,https://github.com/whatwg/html/pull/12294,Properly set visibility state for nested documents,2026-03-31T12:37:17Z,Psychpsyo
4161755804,whatwg/html,"Friendly ping that whether the spec or WPT/implementations need changing, it'd be nice to get a deci",https://github.com/whatwg/html/pull/12017#issuecomment-4161755804,https://github.com/whatwg/html/pull/12017,Fix ordering of lifecycle callbacks to match implementations,2026-03-31T10:56:21Z,AtkinsSJ
4161643623,whatwg/html,Dupe of https://github.com/whatwg/html/issues/6451 I think.,https://github.com/whatwg/html/issues/12325#issuecomment-4161643623,https://github.com/whatwg/html/issues/12325,Disallow fragment navigations from `<meta http-equiv=refresh>`,2026-03-31T10:38:54Z,domenic
4161022362,whatwg/html,> This behavior was the result of the discussions on the issue and the PR. I started with a separate,https://github.com/whatwg/html/issues/12304#issuecomment-4161022362,https://github.com/whatwg/html/issues/12304,popover=hint has multiple weird and inconsistent behaviours,2026-03-31T08:58:04Z,jakearchibald
4159936835,w3ctag/design-reviews,"Following up on the request that [""each document's support level should be in its SotD section""](htt",https://github.com/w3ctag/design-reviews/issues/1187#issuecomment-4159936835,https://github.com/w3ctag/design-reviews/issues/1187,[wg/das] Devices and Sensors Working Group 2026 Charter,2026-03-31T05:12:02Z,marcoscaceres
4159591593,whatwg/dom,> I don't think there is much appetite for introducing a new element which changes the behavior of H,https://github.com/whatwg/dom/issues/736#issuecomment-4159591593,https://github.com/whatwg/dom/issues/736,Proposal: a DocumentFragment whose nodes do not get removed once inserted,2026-03-31T03:21:42Z,jonathandewitt-dev
4159572602,webkit/standards-positions,Not WebKitten. I see they landed support earlier in last month.  https://github.com/WebKit/WebKit/pu,https://github.com/WebKit/standards-positions/issues/643#issuecomment-4159572602,https://github.com/WebKit/standards-positions/issues/643,Transferable streams,2026-03-31T03:15:57Z,myakura
4158421376,whatwg/html,> Just as a point: weirdness 1 and 2 are largely due to the fact that hint popovers are _promoted to,https://github.com/whatwg/html/issues/12304#issuecomment-4158421376,https://github.com/whatwg/html/issues/12304,popover=hint has multiple weird and inconsistent behaviours,2026-03-30T21:56:38Z,mfreed7
4158023171,whatwg/fs,"I’m attaching this to indicate that Chrome requires the PR to be merged first. <img width=""907"" hei",https://github.com/whatwg/fs/pull/182#issuecomment-4158023171,https://github.com/whatwg/fs/pull/182,fs: Remove nullable markers from WriteParams members,2026-03-30T20:37:00Z,usamanadeemdeveloper
4157574696,whatwg/html,I’ll move the calendar invite to the 9th tomorrow as long as there are no objections raised by then.,https://github.com/whatwg/html/issues/12291#issuecomment-4157574696,https://github.com/whatwg/html/issues/12291,Meeting 39 for joint OpenUI-WHATWG/HTML-CSSWG task force on styleable form controls,2026-03-30T19:23:51Z,astearns
4157378676,whatwg/html,"It's been pointed out that this week is the CSSWG F2F, which means it might be tough for many CSS fo",https://github.com/whatwg/html/issues/12291#issuecomment-4157378676,https://github.com/whatwg/html/issues/12291,Meeting 39 for joint OpenUI-WHATWG/HTML-CSSWG task force on styleable form controls,2026-03-30T18:53:18Z,mfreed7
4156996631,w3c/pointerevents,"@smaug----: I sent out https://github.com/mdn/content/pull/43396 to fix MDN, ptal.",https://github.com/w3c/pointerevents/issues/642#issuecomment-4156996631,https://github.com/w3c/pointerevents/issues/642,Should click.isTrusted always be false?,2026-03-30T17:56:25Z,mustaqahmed
4156758284,whatwg/html,https://github.com/w3c/csswg-drafts/issues/10775,https://github.com/whatwg/html/issues/12291#issuecomment-4156758284,https://github.com/whatwg/html/issues/12291,Meeting 39 for joint OpenUI-WHATWG/HTML-CSSWG task force on styleable form controls,2026-03-30T17:20:41Z,mfreed7
4156662386,whatwg/html,I would like to discuss the proposed fetch behavior of https://github.com/whatwg/html/pull/11687,https://github.com/whatwg/html/issues/12322#issuecomment-4156662386,https://github.com/whatwg/html/issues/12322,Upcoming WHATNOT meeting on 2026-04-02,2026-03-30T17:06:43Z,KurtCattiSchmidt
4156132737,WICG/webcomponents,"We tried it out and it worked just as expected. There's nothing we expect it to handle differently, ",https://github.com/WICG/webcomponents/issues/1120#issuecomment-4156132737,https://github.com/WICG/webcomponents/issues/1120,Reference Target: feedback from developers,2026-03-30T15:54:51Z,parkerpierpont
4155439498,whatwg/html,"Three comments about the ""screenshots"" take: - I previously had to use the CDP to take screenshots f",https://github.com/whatwg/html/issues/10650#issuecomment-4155439498,https://github.com/whatwg/html/issues/10650,HTML-in-Canvas,2026-03-30T14:21:03Z,AutoSponge
4155344754,whatwg/html,"Thanks for filing the issue! The spec is a living document, so having semantic versions goes against",https://github.com/whatwg/html/issues/12324#issuecomment-4155344754,https://github.com/whatwg/html/issues/12324,Provide regular release notes or information how to keep oneself up-to-date on HTML spec changes,2026-03-30T14:09:03Z,keithamus
4154773781,webkit/standards-positions,"Hi @rniwa ,  Nice to meet you. I understand the risk of websites abusing the event to disable autofi",https://github.com/WebKit/standards-positions/issues/431#issuecomment-4154773781,https://github.com/WebKit/standards-positions/issues/431,Autofill Event,2026-03-30T12:45:05Z,theindra
4154616503,whatwg/html,Not editorial as this could have confused someone when implementing.,https://github.com/whatwg/html/pull/12313#issuecomment-4154616503,https://github.com/whatwg/html/pull/12313,Editorial: Fix missing document argument when calling check popover validity wit…,2026-03-30T12:19:26Z,annevk
4153566120,whatwg/html,I'd like to make sure we get to https://github.com/whatwg/html/issues/12304 this time.,https://github.com/whatwg/html/issues/12322#issuecomment-4153566120,https://github.com/whatwg/html/issues/12322,Upcoming WHATNOT meeting on 2026-04-02,2026-03-30T09:28:35Z,jakearchibald
4153444153,w3ctag/design-reviews,^^ @mustaqahmed,https://github.com/w3ctag/design-reviews/issues/1213#issuecomment-4153444153,https://github.com/w3ctag/design-reviews/issues/1213,Question: Capability Delegation stalled -- specs are implementing local workarounds,2026-03-30T09:08:43Z,yoavweiss
4153320328,w3c/payment-request,"For context, this is part of a platform-wide pattern -- raised with the TAG at https://github.com/w3",https://github.com/w3c/payment-request/issues/1064#issuecomment-4153320328,https://github.com/w3c/payment-request/issues/1064,Revert activation relaxation in show() -- find a general platform solution instead,2026-03-30T08:47:14Z,marcoscaceres
4152617548,whatwg/html,"FWIW, Shopify is highly supportive of this API. One use case it solves for us is the ability to take",https://github.com/whatwg/html/issues/10650#issuecomment-4152617548,https://github.com/whatwg/html/issues/10650,HTML-in-Canvas,2026-03-30T06:35:11Z,yoavweiss
4151564860,w3c/resource-timing,Hi - just wondering if there has been any progress on this. Happy to help test or anything else in m,https://github.com/w3c/resource-timing/issues/263#issuecomment-4151564860,https://github.com/w3c/resource-timing/issues/263,Resource initiator information to enable creation of dependency trees,2026-03-30T01:20:13Z,martinalderson
4150647462,whatwg/html,"Six years later, I ended-up using TLA+ to formalize the algorithm I had implemented in Servo in Rust",https://github.com/whatwg/html/issues/5078#issuecomment-4150647462,https://github.com/whatwg/html/issues/5078,MessagePort underspecified?,2026-03-29T17:32:28Z,gterzian
4150518637,whatwg/html,"In the explainer, what you're calling the `<canvas>` fallback others have used to build the semantic",https://github.com/whatwg/html/pull/11588#issuecomment-4150518637,https://github.com/whatwg/html/pull/11588,Add HTML-in-Canvas APIs,2026-03-29T16:39:25Z,AutoSponge
4148963555,whatwg/fs,One thing worth considering in the design: `walk()` should also expose the folder path for each entr,https://github.com/whatwg/fs/issues/184#issuecomment-4148963555,https://github.com/whatwg/fs/issues/184,Proposal: Add FileSystemDirectoryHandle.walk() for memory-safe recursive directory traversal,2026-03-28T22:55:17Z,usamanadeemdeveloper
4148911173,whatwg/html,"> Can we get a canvas method that renders CSS anchors at (X,Y) positions as shadowdom elements? Then",https://github.com/whatwg/html/pull/11588#issuecomment-4148911173,https://github.com/whatwg/html/pull/11588,Add HTML-in-Canvas APIs,2026-03-28T22:14:22Z,progers
4148619749,whatwg/html,"Can we get a canvas method that renders CSS anchors at (X,Y) positions as shadowdom elements? Then, ",https://github.com/whatwg/html/pull/11588#issuecomment-4148619749,https://github.com/whatwg/html/pull/11588,Add HTML-in-Canvas APIs,2026-03-28T18:57:37Z,AutoSponge
4147397866,whatwg/html,I'd like to keep this about `popover=hint` and how it relates to `popover=auto`. Hopefully discussio,https://github.com/whatwg/html/issues/12304#issuecomment-4147397866,https://github.com/whatwg/html/issues/12304,popover=hint has multiple weird and inconsistent behaviours,2026-03-28T06:36:00Z,jakearchibald
4146422213,whatwg/html,Another weirdness [I raised in open ui](https://github.com/openui/open-ui/issues/1354) but never hea,https://github.com/whatwg/html/issues/12304#issuecomment-4146422213,https://github.com/whatwg/html/issues/12304,popover=hint has multiple weird and inconsistent behaviours,2026-03-28T02:30:44Z,Jamesernator
4146099733,whatwg/html,"Minutes:  - **Discussion of Issue 12274:** Scope Custom Element Registry Side Effects: Chris Wilson ",https://github.com/whatwg/html/issues/12317#issuecomment-4146099733,https://github.com/whatwg/html/issues/12317,Upcoming WHATNOT meeting on 2026-03-26,2026-03-28T00:20:54Z,cwilso
4145470520,whatwg/webidl,As to test coverage... there is [some](https://github.com/tc39/proposal-thenable-curtailment/issues/,https://github.com/whatwg/webidl/issues/1584#issuecomment-4145470520,https://github.com/whatwg/webidl/issues/1584,Can we change promise resolution behaviour to reduce security issues,2026-03-27T21:40:06Z,mgaudet
4145452803,whatwg/webidl,"Not just a specific instance, but anything with the `then` property on the prototype chain. e.g. exp",https://github.com/whatwg/webidl/issues/1584#issuecomment-4145452803,https://github.com/whatwg/webidl/issues/1584,Can we change promise resolution behaviour to reduce security issues,2026-03-27T21:37:34Z,mgaudet
4145372001,whatwg/webidl,So you're saying that if the `Animation` instance was turned into a thenable and then you invoke its,https://github.com/whatwg/webidl/issues/1584#issuecomment-4145372001,https://github.com/whatwg/webidl/issues/1584,Can we change promise resolution behaviour to reduce security issues,2026-03-27T21:25:13Z,annevk
4144795092,whatwg/webidl,"So spec verbiage, like the ['pause' steps here](https://drafts.csswg.org/web-animations-1/#animation",https://github.com/whatwg/webidl/issues/1584#issuecomment-4144795092,https://github.com/whatwg/webidl/issues/1584,Can we change promise resolution behaviour to reduce security issues,2026-03-27T19:32:18Z,mgaudet
4144772283,whatwg/html,"I've read through this thread, and read parts of it multiple times. Largely I agree with Jake here; ",https://github.com/whatwg/html/issues/12304#issuecomment-4144772283,https://github.com/whatwg/html/issues/12304,popover=hint has multiple weird and inconsistent behaviours,2026-03-27T19:28:10Z,frehner
4144771784,whatwg/webidl,"Concretely it would be anything which uses the WebIDL resolve steps. The problem isn't so much that ",https://github.com/whatwg/webidl/issues/1584#issuecomment-4144771784,https://github.com/whatwg/webidl/issues/1584,Can we change promise resolution behaviour to reduce security issues,2026-03-27T19:28:03Z,mgaudet
4144662601,whatwg/html,I tried solving **my** issue directly in the userstyle; maybe this could work:  ```css outline-width,https://github.com/whatwg/html/issues/12286#issuecomment-4144662601,https://github.com/whatwg/html/issues/12286,outline and ::picker(select),2026-03-27T19:05:30Z,sb3nder
4144398993,whatwg/html,Are you saying users who want large :focus-visible outlines should accept the downsides of outline-o,https://github.com/whatwg/html/issues/12286#issuecomment-4144398993,https://github.com/whatwg/html/issues/12286,outline and ::picker(select),2026-03-27T18:15:00Z,sb3nder
4144340950,whatwg/html,In all the other cases you have direct control over the width.,https://github.com/whatwg/html/issues/12286#issuecomment-4144340950,https://github.com/whatwg/html/issues/12286,outline and ::picker(select),2026-03-27T18:05:03Z,annevk
4144327667,whatwg/html,It's not only for auto values,https://github.com/whatwg/html/issues/12286#issuecomment-4144327667,https://github.com/whatwg/html/issues/12286,outline and ::picker(select),2026-03-27T18:02:23Z,sb3nder
4144323521,whatwg/webidl,"It would be interesting to have some example APIs that are impacted by this. Maybe it is everything ",https://github.com/whatwg/webidl/issues/1584#issuecomment-4144323521,https://github.com/whatwg/webidl/issues/1584,Can we change promise resolution behaviour to reduce security issues,2026-03-27T18:01:33Z,annevk
4144296337,whatwg/html,That seems like way too much complexity just for the auto value which all user agents have at 3px or,https://github.com/whatwg/html/issues/12286#issuecomment-4144296337,https://github.com/whatwg/html/issues/12286,outline and ::picker(select),2026-03-27T17:56:19Z,annevk
4144262391,whatwg/webidl,Actually more accurately it defers if **any** part of the algorithm _could_ run user code (e.g. reso,https://github.com/whatwg/webidl/issues/1584#issuecomment-4144262391,https://github.com/whatwg/webidl/issues/1584,Can we change promise resolution behaviour to reduce security issues,2026-03-27T17:49:43Z,mgaudet
4144228497,whatwg/html,"> I fixed auto outline zoom the other day, so no.  Thanks! Now waiting for the other `outline-width`",https://github.com/whatwg/html/issues/12286#issuecomment-4144228497,https://github.com/whatwg/html/issues/12286,outline and ::picker(select),2026-03-27T17:42:48Z,sb3nder
4144104724,whatwg/html,This seems ok from the i18n working group perspective. The question related to calendars has more to,https://github.com/whatwg/html/pull/6284#issuecomment-4144104724,https://github.com/whatwg/html/pull/6284,Temporal proposal HTML serialization support,2026-03-27T17:20:06Z,jsahleen
4143398830,whatwg/html,"I fixed auto outline zoom the other day, so no.  I'm not really sure what you're trying to say with ",https://github.com/whatwg/html/issues/12286#issuecomment-4143398830,https://github.com/whatwg/html/issues/12286,outline and ::picker(select),2026-03-27T15:24:12Z,annevk
4142840384,w3ctag/design-reviews,"@ylafon and I discussed this in the Atlantic breakout today and kind of sketched out (I hope that I ",https://github.com/w3ctag/design-reviews/issues/1202#issuecomment-4142840384,https://github.com/w3ctag/design-reviews/issues/1202,"Question: Could the TAG help define ""The Web Platform"" vs ""The Web"" or some other useful distinctions?",2026-03-27T14:02:39Z,bkardell
4142622284,w3c/payment-request,"haha, totally not. Don't worry... this is going to be a long discussion :)   We have the PR templa",https://github.com/w3c/payment-request/pull/1066#issuecomment-4142622284,https://github.com/w3c/payment-request/pull/1066,fix: restore transient activation requirement in show(),2026-03-27T13:35:31Z,marcoscaceres
4142604019,whatwg/html,"> That seems like a bug to fix  Thanks!, this answer a question I asked in https://github.com/w3c/cs",https://github.com/whatwg/html/issues/12286#issuecomment-4142604019,https://github.com/whatwg/html/issues/12286,outline and ::picker(select),2026-03-27T13:33:03Z,sb3nder
4142396199,whatwg/html,I would like to discuss https://github.com/whatwg/html/issues/12286,https://github.com/whatwg/html/issues/12291#issuecomment-4142396199,https://github.com/whatwg/html/issues/12291,Meeting 39 for joint OpenUI-WHATWG/HTML-CSSWG task force on styleable form controls,2026-03-27T12:54:47Z,annevk
4142393750,whatwg/html,That seems like a bug to fix. Probably not too hard now that we changed some of how we handle outlin,https://github.com/whatwg/html/issues/12286#issuecomment-4142393750,https://github.com/whatwg/html/issues/12286,outline and ::picker(select),2026-03-27T12:54:19Z,annevk
4142378425,w3c/payment-request,Please don't merge until we've had an opportunity to discuss this.,https://github.com/w3c/payment-request/pull/1066#issuecomment-4142378425,https://github.com/w3c/payment-request/pull/1066,fix: restore transient activation requirement in show(),2026-03-27T12:51:19Z,ianbjacobs
4141955843,whatwg/html,"Yeah, these attributes are only allowed for `<input type=image>`.",https://github.com/whatwg/html/issues/12306#issuecomment-4141955843,https://github.com/whatwg/html/issues/12306,Replace height and width attributes for checkbox and radio inputs,2026-03-27T11:31:12Z,annevk
4141948245,whatwg/html,Kinda. The current WebKit implementation doesn't pass this test: https://wpt.fyi/results/css/css-ui/,https://github.com/whatwg/html/issues/12286#issuecomment-4141948245,https://github.com/whatwg/html/issues/12286,outline and ::picker(select),2026-03-27T11:29:31Z,sb3nder
4141879199,whatwg/html,Fixing 3 & 4 depends on knowing which `auto` popover is the `hint` stack's parent (`hintStackParent`,https://github.com/whatwg/html/issues/12304#issuecomment-4141879199,https://github.com/whatwg/html/issues/12304,popover=hint has multiple weird and inconsistent behaviours,2026-03-27T11:15:13Z,jakearchibald
4141862808,whatwg/html,That's just kinda inherent to using auto I think. It's explicitly implementation-defined.,https://github.com/whatwg/html/issues/12286#issuecomment-4141862808,https://github.com/whatwg/html/issues/12286,outline and ::picker(select),2026-03-27T11:12:11Z,annevk
4141821658,whatwg/html,"> Hints are subordinate to autos, so opening a hint shouldn't [close](https://html.spec.whatwg.org/#",https://github.com/whatwg/html/issues/12304#issuecomment-4141821658,https://github.com/whatwg/html/issues/12304,popover=hint has multiple weird and inconsistent behaviours,2026-03-27T11:03:45Z,keithamus
4141686969,whatwg/html,"@mfreed7  (I've named the weirdnesses, and included the videos again for reference. They're the same",https://github.com/whatwg/html/issues/12304#issuecomment-4141686969,https://github.com/whatwg/html/issues/12304,popover=hint has multiple weird and inconsistent behaviours,2026-03-27T10:36:52Z,jakearchibald
4141568624,w3c/geolocation,"Ok, cool. We always point to the latest:   > This document was produced by groups operating under ",https://github.com/w3c/geolocation/pull/229#issuecomment-4141568624,https://github.com/w3c/geolocation/pull/229,Editorial: update SoTD for CRD,2026-03-27T10:14:19Z,marcoscaceres
4141561951,whatwg/html,"As far as I know, that risk currently exists only in WebKit. ```css outline: auto 5px blue; outline-",https://github.com/whatwg/html/issues/12286#issuecomment-4141561951,https://github.com/whatwg/html/issues/12286,outline and ::picker(select),2026-03-27T10:12:58Z,sb3nder
4141083931,w3c/geolocation,"Thank you for your review, @rigow. We will proceed as suggested.",https://github.com/w3c/geolocation/pull/229#issuecomment-4141083931,https://github.com/w3c/geolocation/pull/229,Editorial: update SoTD for CRD,2026-03-27T08:49:04Z,anssiko
4141011012,w3c/geolocation,There was no material change from the 2020 version of the Patent Policy to the 2025 Version that wou,https://github.com/w3c/geolocation/pull/229#issuecomment-4141011012,https://github.com/w3c/geolocation/pull/229,Editorial: update SoTD for CRD,2026-03-27T08:36:20Z,rigow
4140793050,whatwg/html,"If you can’t or prefer not to refactor the iframes to use the BroadcastChannel API, there’s a simple",https://github.com/whatwg/html/issues/763#issuecomment-4140793050,https://github.com/whatwg/html/issues/763,Shadow DOM and <iframe>,2026-03-27T07:46:46Z,pstadler
4140714646,w3c/geolocation,Thanks for the updates. I've brought this to @rigow's attention.,https://github.com/w3c/geolocation/pull/229#issuecomment-4140714646,https://github.com/w3c/geolocation/pull/229,Editorial: update SoTD for CRD,2026-03-27T07:28:39Z,anssiko
4140453759,w3c/geolocation,"Hi @marcoscaceres ,  May I have your help to review this PR?  Thanks! Alvin",https://github.com/w3c/geolocation/pull/195#issuecomment-4140453759,https://github.com/w3c/geolocation/pull/195,Add support for approximate geolocation,2026-03-27T06:16:23Z,alvinjiooo
4140450805,whatwg/html,I think that risk always exists. `inset` should maybe simply be the inverse of `outline-width`.,https://github.com/whatwg/html/issues/12286#issuecomment-4140450805,https://github.com/whatwg/html/issues/12286,outline and ::picker(select),2026-03-27T06:15:41Z,annevk
4138418384,whatwg/html,One practical point about scaling: in the chromium implementation we are trying to maintain a strict,https://github.com/whatwg/html/issues/10650#issuecomment-4138418384,https://github.com/whatwg/html/issues/10650,HTML-in-Canvas,2026-03-26T21:42:01Z,szager-chromium
