id,repo,body,url,issue_url,issue_title,created_at,user
2845363478,w3ctag/design-reviews,I've updated the explainer with the changes and use cases mentioned in this thread: https://github.c,https://github.com/w3ctag/design-reviews/issues/1038#issuecomment-2845363478,https://github.com/w3ctag/design-reviews/issues/1038,On-device Web Speech API,2025-05-01T17:54:40Z,evanbliu
2845344812,whatwg/html,This spec PR currently disallows `<input>` in `<select>` by looking up all of the ancestor nodes whe,https://github.com/whatwg/html/pull/10557#issuecomment-2845344812,https://github.com/whatwg/html/pull/10557,Relax `<select>` parser,2025-05-01T17:44:14Z,josepharhar
2845330882,w3c/clipboard-apis,Regarding the last steps: > 1. For each systemClipboardItem in data: > ... > 2. [Reject](https://web,https://github.com/w3c/clipboard-apis/issues/236#issuecomment-2845330882,https://github.com/w3c/clipboard-apis/issues/236,Clarifying `clipboard.readText()` behaviour,2025-05-01T17:36:36Z,Gae24
2845294266,w3c/pointerevents,should this also be ported to v3?,https://github.com/w3c/pointerevents/pull/545#issuecomment-2845294266,https://github.com/w3c/pointerevents/pull/545,Pretty tables and dark mode,2025-05-01T17:18:12Z,patrickhlauke
2845291055,w3c/pointerevents,"oh, nice",https://github.com/w3c/pointerevents/pull/545#issuecomment-2845291055,https://github.com/w3c/pointerevents/pull/545,Pretty tables and dark mode,2025-05-01T17:16:11Z,patrickhlauke
2845262483,mozilla/standards-positions,> I've updated the labels accordingly (adding [ concerns: accessibility](https://github.com/mozilla/,https://github.com/mozilla/standards-positions/issues/1181#issuecomment-2845262483,https://github.com/mozilla/standards-positions/issues/1181,The `interesttarget` attribute,2025-05-01T17:04:48Z,mfreed7
2845029435,w3c/clipboard-apis,"Related, for these steps: ``` 2. Let representationDataPromise be the representation’s data. 3. Reac",https://github.com/w3c/clipboard-apis/issues/236#issuecomment-2845029435,https://github.com/w3c/clipboard-apis/issues/236,Clarifying `clipboard.readText()` behaviour,2025-05-01T15:08:29Z,trflynn89
2844901805,whatwg/html,One complication on the dictionary use case is that the failure mode is a hard failure unlike the ti,https://github.com/whatwg/html/issues/8143#issuecomment-2844901805,https://github.com/whatwg/html/issues/8143,"CORS, CORP, TAO & ""public static resource"" metadata",2025-05-01T14:01:34Z,pmeenan
2844845344,webkit/standards-positions,"Any update on this one?  The Mozilla standards position issue has some discussion and there is more ",https://github.com/WebKit/standards-positions/issues/417#issuecomment-2844845344,https://github.com/WebKit/standards-positions/issues/417,CSS UI caret-animation property,2025-05-01T13:26:54Z,schenney-chromium
2844833574,mozilla/standards-positions,"As I said above, there is a [spec PR](https://github.com/w3c/csswg-drafts/pull/11373) up to say that",https://github.com/mozilla/standards-positions/issues/1100#issuecomment-2844833574,https://github.com/mozilla/standards-positions/issues/1100,[CSS UI-4] caret-animation property,2025-05-01T13:18:46Z,schenney-chromium
2844680405,whatwg/html,Waiting for #11280 so I can use that here.,https://github.com/whatwg/html/pull/11045#issuecomment-2844680405,https://github.com/whatwg/html/pull/11045,Add request-close command for dialogs,2025-05-01T11:32:01Z,lukewarlow
2844677955,whatwg/html,@annevk hopefully this is roughly what you had in mind?,https://github.com/whatwg/html/pull/11280#issuecomment-2844677955,https://github.com/whatwg/html/pull/11280,Define an optional value and use it for setting dialog returnValue,2025-05-01T11:29:50Z,lukewarlow
2844607087,whatwg/html,I can't edit OP so I'll just comment the relevant links.  Chromium Implementation Bug: https://iss,https://github.com/whatwg/html/pull/11255#issuecomment-2844607087,https://github.com/whatwg/html/pull/11255,Make command events not composed,2025-05-01T10:25:58Z,lukewarlow
2844599185,whatwg/html,I think https://github.com/web-platform-tests/wpt/pull/52276 should cover the test changes?,https://github.com/whatwg/html/pull/11255#issuecomment-2844599185,https://github.com/whatwg/html/pull/11255,Make command events not composed,2025-05-01T10:19:17Z,lukewarlow
2844556540,w3ctag/design-reviews,Hi! Just noting that there is no feedback yet in either the Mozilla or Webkit standards positions th,https://github.com/w3ctag/design-reviews/issues/1073#issuecomment-2844556540,https://github.com/w3ctag/design-reviews/issues/1073,Column wrapping for multicol,2025-05-01T09:44:44Z,torgo
2844491817,w3ctag/design-reviews,"Just a quick request - can you please amend the explainer to be clearer about the *user need*? This ",https://github.com/w3ctag/design-reviews/issues/1064#issuecomment-2844491817,https://github.com/w3ctag/design-reviews/issues/1064,Expose contentEncoding in resourceTiming,2025-05-01T09:29:46Z,torgo
2844458110,w3ctag/design-reviews,"Hi @SenorBlanco, and thanks for your review request.  Generally we recommend that explainers be host",https://github.com/w3ctag/design-reviews/issues/1063#issuecomment-2844458110,https://github.com/w3ctag/design-reviews/issues/1063,WebGPU Compatibility Mode,2025-05-01T09:22:15Z,matatk
2844262609,whatwg/html,"I've made a javascript implementation using `<link rel=""simply-include"" href=""embed.html"">`--see: [h",https://github.com/whatwg/html/issues/2791#issuecomment-2844262609,https://github.com/whatwg/html/issues/2791,Client side include feature for HTML,2025-05-01T07:37:55Z,poef
2844207546,whatwg/dom,"@jamesdiacono AFAIK, `Event`s have different scheduling comparing to `MutationObserver` and they hav",https://github.com/whatwg/dom/issues/533#issuecomment-2844207546,https://github.com/whatwg/dom/issues/533,Make it possible to observe connected-ness of a node,2025-05-01T06:44:17Z,FrameMuse
2844204454,whatwg/dom,"@dead-claudia Yeah, it depends how you think about it. So let's say we both understand each other. I",https://github.com/whatwg/dom/issues/533#issuecomment-2844204454,https://github.com/whatwg/dom/issues/533,Make it possible to observe connected-ness of a node,2025-05-01T06:41:02Z,FrameMuse
2844160108,whatwg/dom,@jamesdiacono   We've been down that path before with [MutationEvents](https://developer.mozilla.org,https://github.com/whatwg/dom/issues/533#issuecomment-2844160108,https://github.com/whatwg/dom/issues/533,Make it possible to observe connected-ness of a node,2025-05-01T05:55:47Z,wessberg
2844116007,whatwg/html,My reading of [this WPT](https://github.com/web-platform-tests/wpt/blob/master/shadow-dom/Extensions,https://github.com/whatwg/html/pull/11255#issuecomment-2844116007,https://github.com/whatwg/html/pull/11255,Make command events not composed,2025-05-01T05:06:36Z,alice
2844014376,whatwg/html,> So I personally would like to see both A and D implemented. Option A is very nice for exporting be,https://github.com/whatwg/html/issues/11202#issuecomment-2844014376,https://github.com/whatwg/html/issues/11202,Allow importing and exporting from inline module scripts,2025-05-01T03:46:05Z,edbaafi
2844013384,whatwg/html,"I'd like to nominate https://github.com/WICG/view-transitions/issues/239 for discussion, although I ",https://github.com/whatwg/html/issues/11278#issuecomment-2844013384,https://github.com/whatwg/html/issues/11278,Upcoming WHATNOT meeting on 2025-05-08,2025-05-01T03:44:47Z,domenic
2843839869,w3c/editing,"Yeah, we assumed web developers didn't want `<br>`s in plaintext editing, and disallowed `white-spac",https://github.com/w3c/editing/issues/419#issuecomment-2843839869,https://github.com/w3c/editing/issues/419,Behavior of insert* commands for contenteditable=plaintext-only,2025-05-01T01:02:06Z,tkent-google
2843836477,whatwg/html,@chriscoyier coincidentally wrote about this yesterday:  [Seeking an Answer: Why can’t HTML alone do,https://github.com/whatwg/html/issues/2791#issuecomment-2843836477,https://github.com/whatwg/html/issues/2791,Client side include feature for HTML,2025-05-01T00:59:48Z,trusktr
2843829876,whatwg/html,"I like the idea of DX improvements.  This seems like it would be benign right? Or are there a bunch ",https://github.com/whatwg/html/issues/11240#issuecomment-2843829876,https://github.com/whatwg/html/issues/11240,"Proposal: Shorthand syntax for external stylesheets (<style src=""..."">)",2025-05-01T00:53:46Z,trusktr
2843822446,whatwg/html,> It would just ignore all stylesheets and scripts in the fragment.  @bburns Wouldn't it be easier t,https://github.com/whatwg/html/issues/2791#issuecomment-2843822446,https://github.com/whatwg/html/issues/2791,Client side include feature for HTML,2025-05-01T00:49:49Z,trusktr
2843818758,whatwg/html,"Some people have mentioned that using `<template>` for this is not the right semantic, and would pre",https://github.com/whatwg/html/issues/2791#issuecomment-2843818758,https://github.com/whatwg/html/issues/2791,Client side include feature for HTML,2025-05-01T00:47:57Z,trusktr
2843805525,mozilla/standards-positions,> We're supportive of the general concept of providing more accessible rich tooltips. While the keyb,https://github.com/mozilla/standards-positions/issues/1181#issuecomment-2843805525,https://github.com/mozilla/standards-positions/issues/1181,The `interesttarget` attribute,2025-05-01T00:37:49Z,mfreed7
2843803468,w3ctag/design-reviews,"> I18N has not seen the ""experimental data"". Can a pointer be provided?  Not sure why the scare quot",https://github.com/w3ctag/design-reviews/issues/1078#issuecomment-2843803468,https://github.com/w3ctag/design-reviews/issues/1078,Reduce Accept-Language,2025-05-01T00:35:59Z,miketaylr
2843795582,whatwg/html,> Synchronous fetching is a big no-no. That's not happening.  @annevk Sync fetching would be very ba,https://github.com/whatwg/html/issues/2791#issuecomment-2843795582,https://github.com/whatwg/html/issues/2791,Client side include feature for HTML,2025-05-01T00:30:17Z,trusktr
2843788120,mozilla/standards-positions,This is a good analysis.  Thanks @keithamus.  I've updated the labels accordingly (adding https://gi,https://github.com/mozilla/standards-positions/issues/1181#issuecomment-2843788120,https://github.com/mozilla/standards-positions/issues/1181,The `interesttarget` attribute,2025-05-01T00:24:31Z,martinthomson
2843777817,whatwg/dom,"Could Nodes simply emit non-bubbling ""connect"" and ""disconnect"" events? That would let us do everyth",https://github.com/whatwg/dom/issues/533#issuecomment-2843777817,https://github.com/whatwg/dom/issues/533,Make it possible to observe connected-ness of a node,2025-05-01T00:15:44Z,jamesdiacono
2843404145,whatwg/html,"(It's also Labor Day for a lot of European countries, just to note)",https://github.com/whatwg/html/issues/11258#issuecomment-2843404145,https://github.com/whatwg/html/issues/11258,Upcoming WHATNOT meeting on 2025-05-01,2025-04-30T21:53:16Z,saschanaz
2843381006,whatwg/html,"As mentioned above, I am canceling this meeting due to the lack of discussion topics.",https://github.com/whatwg/html/issues/11258#issuecomment-2843381006,https://github.com/whatwg/html/issues/11258,Upcoming WHATNOT meeting on 2025-05-01,2025-04-30T21:49:56Z,past
2843328454,whatwg/html,With Chrome [intent to prototype](https://groups.google.com/a/chromium.org/g/blink-dev/c/676KIre8ZZY,https://github.com/whatwg/html/issues/11019#issuecomment-2843328454,https://github.com/whatwg/html/issues/11019,Support fragment references in the `<link>` tag's `href` attribute,2025-04-30T21:29:51Z,robglidden
2843062245,whatwg/html,"cc @dandclark ",https://github.com/whatwg/html/pull/11277#issuecomment-2843062245,https://github.com/whatwg/html/pull/11277,[autofocus] Remove cross-origin check step for autofocus candidates,2025-04-30T19:27:27Z,ffiori
2843047744,w3ctag/design-reviews,"Hi @siliu1, and thanks for your review request.  We are supportive of this use case, and your propos",https://github.com/w3ctag/design-reviews/issues/1066#issuecomment-2843047744,https://github.com/w3ctag/design-reviews/issues/1066,'focus-without-user-activation' permissions policy,2025-04-30T19:21:14Z,matatk
2843042880,whatwg/html,Okay that gives the context that I knew existed but I couldn't think of. In that case it's at the ve,https://github.com/whatwg/html/issues/11275#issuecomment-2843042880,https://github.com/whatwg/html/issues/11275,Dispatch CloseWatcher's cancel event for popovers also,2025-04-30T19:19:11Z,lukewarlow
2843018740,whatwg/html,"cc @dandclark @domenic ",https://github.com/whatwg/html/issues/11276#issuecomment-2843018740,https://github.com/whatwg/html/issues/11276,[autofocus] Elements from cross-origins shouldn't be omitted if they pass the allow focus steps,2025-04-30T19:10:11Z,ffiori
2842985101,whatwg/dom,> > Consider that connection is when iframes and images start their initial load. >  > I don't think,https://github.com/whatwg/dom/issues/533#issuecomment-2842985101,https://github.com/whatwg/dom/issues/533,Make it possible to observe connected-ness of a node,2025-04-30T18:54:33Z,dead-claudia
2842983268,whatwg/html,"Are you suggesting that any time a popover closes, it'll fire a (cancellable) `cancel` event? If so,",https://github.com/whatwg/html/issues/11275#issuecomment-2842983268,https://github.com/whatwg/html/issues/11275,Dispatch CloseWatcher's cancel event for popovers also,2025-04-30T18:53:45Z,mfreed7
2842941521,webkit/standards-positions,"In this case, I think we can consider this position is already implemented!",https://github.com/WebKit/standards-positions/issues/485#issuecomment-2842941521,https://github.com/WebKit/standards-positions/issues/485,Request to use platform accent color for accent-color property as default option,2025-04-30T18:37:20Z,padmapriyap1
2842929506,webkit/standards-positions,"> FWIW, last time I tried this, I had to restart Safari for the color changes to take effect.    > Y",https://github.com/WebKit/standards-positions/issues/485#issuecomment-2842929506,https://github.com/WebKit/standards-positions/issues/485,Request to use platform accent color for accent-color property as default option,2025-04-30T18:31:53Z,padmapriyap1
2842893266,webkit/standards-positions,Yeah you have to restart safari and it will work. It might be worth reporting the fact it doesn't up,https://github.com/WebKit/standards-positions/issues/485#issuecomment-2842893266,https://github.com/WebKit/standards-positions/issues/485,Request to use platform accent color for accent-color property as default option,2025-04-30T18:15:43Z,lukewarlow
2842890117,whatwg/html,> [@annevk](https://github.com/annevk) - I wanted to understand your issue regarding `<base>` and `p,https://github.com/whatwg/html/issues/11019#issuecomment-2842890117,https://github.com/whatwg/html/issues/11019,Support fragment references in the `<link>` tag's `href` attribute,2025-04-30T18:14:18Z,noamr
2842866537,whatwg/html,@annevk - I wanted to understand your issue regarding `<base>` and `pushState` from https://github.c,https://github.com/whatwg/html/issues/11019#issuecomment-2842866537,https://github.com/whatwg/html/issues/11019,Support fragment references in the `<link>` tag's `href` attribute,2025-04-30T18:03:53Z,KurtCattiSchmidt
2842863665,whatwg/html,I also wonder about whether `@scope` changes the situation? `@scope` is location dependent so it mig,https://github.com/whatwg/html/issues/1605#issuecomment-2842863665,https://github.com/whatwg/html/issues/1605,style tag should be allowed in body,2025-04-30T18:02:37Z,o-t-w
2842863235,webkit/standards-positions,"FWIW, last time I tried this, I had to restart Safari for the color changes to take effect.",https://github.com/WebKit/standards-positions/issues/485#issuecomment-2842863235,https://github.com/WebKit/standards-positions/issues/485,Request to use platform accent color for accent-color property as default option,2025-04-30T18:02:25Z,g-ortuno
2842858354,webkit/standards-positions,"> > ""automatically adopt the accent color defined by the user's operating system when the ""accent-co",https://github.com/WebKit/standards-positions/issues/485#issuecomment-2842858354,https://github.com/WebKit/standards-positions/issues/485,Request to use platform accent color for accent-color property as default option,2025-04-30T18:00:34Z,padmapriyap1
2842773451,whatwg/html,"@KurtCattiSchmidt we meet every other week, so I expect this agenda will be rescheduled for May 15.",https://github.com/whatwg/html/issues/11242#issuecomment-2842773451,https://github.com/whatwg/html/issues/11242,Meeting 20 for joint OpenUI-WHATWG/HTML-CSSWG task force on styleable form controls,2025-04-30T17:29:17Z,astearns
2842710352,webkit/standards-positions,> Can you clarify how this request is different from [#136](https://github.com/WebKit/standards-posi,https://github.com/WebKit/standards-positions/issues/485#issuecomment-2842710352,https://github.com/WebKit/standards-positions/issues/485,Request to use platform accent color for accent-color property as default option,2025-04-30T17:16:11Z,padmapriyap1
2842684626,whatwg/html,"I saw this was canceled. I will be out next week for my issue - is there a chance we can reschedule ",https://github.com/whatwg/html/issues/11242#issuecomment-2842684626,https://github.com/whatwg/html/issues/11242,Meeting 20 for joint OpenUI-WHATWG/HTML-CSSWG task force on styleable form controls,2025-04-30T17:09:23Z,KurtCattiSchmidt
2842629177,webkit/standards-positions,"cc @marcoscaceres @annevk ",https://github.com/WebKit/standards-positions/issues/486#issuecomment-2842629177,https://github.com/WebKit/standards-positions/issues/486,Web Neural Network API,2025-04-30T16:50:50Z,mwyrzykowski
2842600819,whatwg/html,"Due to persistent reluctance from one engine and scepticism from another one, CSSWG resolved to give",https://github.com/whatwg/html/pull/10853#issuecomment-2842600819,https://github.com/whatwg/html/pull/10853,Integrate with the move event for window defined by CSSOM-View,2025-04-30T16:39:27Z,frivoal
2842486685,mozilla/standards-positions,We're supportive of the general concept of providing more accessible rich tooltips. While the keyboa,https://github.com/mozilla/standards-positions/issues/1181#issuecomment-2842486685,https://github.com/mozilla/standards-positions/issues/1181,The `interesttarget` attribute,2025-04-30T16:02:26Z,keithamus
2842471859,webkit/standards-positions,Any update on the position?,https://github.com/WebKit/standards-positions/issues/327#issuecomment-2842471859,https://github.com/WebKit/standards-positions/issues/327,Viewport Segments CSS and JS API,2025-04-30T15:56:35Z,darktears
2842471632,mozilla/standards-positions,Any update on the position?,https://github.com/mozilla/standards-positions/issues/883#issuecomment-2842471632,https://github.com/mozilla/standards-positions/issues/883,Viewport Segment API,2025-04-30T15:56:29Z,darktears
2842388780,webkit/standards-positions,"> ""automatically adopt the accent color defined by the user's operating system when the ""accent-colo",https://github.com/WebKit/standards-positions/issues/485#issuecomment-2842388780,https://github.com/WebKit/standards-positions/issues/485,Request to use platform accent color for accent-color property as default option,2025-04-30T15:31:58Z,lukewarlow
2842124746,whatwg/dom,"@dead-claudia > And connection is a **direct** consequence of mutations   > just not of the element ",https://github.com/whatwg/dom/issues/533#issuecomment-2842124746,https://github.com/whatwg/dom/issues/533,Make it possible to observe connected-ness of a node,2025-04-30T14:12:24Z,FrameMuse
2842089736,whatwg/html,"@KurtCattiSchmidt this might work well for #11022 - having `condition=""sheet(foo bar)""` could well s",https://github.com/whatwg/html/issues/7540#issuecomment-2842089736,https://github.com/whatwg/html/issues/7540,Allow authors to apply new css features (like cascade layers) while linking stylesheets,2025-04-30T14:00:33Z,keithamus
2842051185,mozilla/standards-positions,"FYI, we have published our own Translation API explainer: https://github.com/mozilla/explainers/blob",https://github.com/mozilla/standards-positions/issues/1015#issuecomment-2842051185,https://github.com/mozilla/standards-positions/issues/1015,Web Translation API,2025-04-30T13:47:35Z,saschanaz
2841966685,whatwg/dom,@FrameMuse His `connected` ≈ my `liveness`. I noted that browsers in practice track it via a bit.  A,https://github.com/whatwg/dom/issues/533#issuecomment-2841966685,https://github.com/whatwg/dom/issues/533,Make it possible to observe connected-ness of a node,2025-04-30T13:25:50Z,dead-claudia
2841776831,whatwg/html,At this point I would have to deduce it from first principles again as well I'm afraid.,https://github.com/whatwg/html/pull/11255#issuecomment-2841776831,https://github.com/whatwg/html/pull/11255,Make command events not composed,2025-04-30T12:11:48Z,annevk
2841504889,whatwg/html,@annevk Could you explain how relatedTarget affects dispatch in non-spec terms? I've read through th,https://github.com/whatwg/html/pull/11255#issuecomment-2841504889,https://github.com/whatwg/html/pull/11255,Make command events not composed,2025-04-30T10:19:35Z,alice
2841375132,whatwg/encoding,Upon further consideration I think supporting `[AllowResizable]` for all of these is reasonable. The,https://github.com/whatwg/encoding/issues/344#issuecomment-2841375132,https://github.com/whatwg/encoding/issues/344,Add support for [AllowResizable] inputs,2025-04-30T09:31:43Z,annevk
2841360880,whatwg/html,If we want to make it work similar to relatedTarget that would be a bit more work. See https://dom.s,https://github.com/whatwg/html/pull/11255#issuecomment-2841360880,https://github.com/whatwg/html/pull/11255,Make command events not composed,2025-04-30T09:26:59Z,annevk
2841359440,whatwg/encoding,"> it's not clear how developers sure that a SAB cannot have concurrent access and is safe to use, ca",https://github.com/whatwg/encoding/issues/344#issuecomment-2841359440,https://github.com/whatwg/encoding/issues/344,Add support for [AllowResizable] inputs,2025-04-30T09:26:27Z,ricea
2841287811,whatwg/html,I think this probably makes sense and is on the surface quite trivial. Some questions:  Was there re,https://github.com/whatwg/html/issues/11275#issuecomment-2841287811,https://github.com/whatwg/html/issues/11275,Dispatch CloseWatcher's cancel event for popovers also,2025-04-30T08:57:57Z,lukewarlow
2841252168,webkit/standards-positions,Can you elaborate?,https://github.com/WebKit/standards-positions/issues/68#issuecomment-2841252168,https://github.com/WebKit/standards-positions/issues/68,WebUSB API,2025-04-30T08:43:45Z,reillyeon
2841200669,w3c/editing,"> I've noticed that Chrome and Firefox behave differently with carriage returns(Enter key); Firefox ",https://github.com/w3c/editing/issues/419#issuecomment-2841200669,https://github.com/w3c/editing/issues/419,Behavior of insert* commands for contenteditable=plaintext-only,2025-04-30T08:23:24Z,kojiishi
2841168054,webkit/standards-positions,"There might still be security and privacy considerations, but something of that nature would at leas",https://github.com/WebKit/standards-positions/issues/68#issuecomment-2841168054,https://github.com/WebKit/standards-positions/issues/68,WebUSB API,2025-04-30T08:11:05Z,annevk
2841150375,webkit/standards-positions,The question is relevant because if we abstract the discussion away from a particular transport like,https://github.com/WebKit/standards-positions/issues/68#issuecomment-2841150375,https://github.com/WebKit/standards-positions/issues/68,WebUSB API,2025-04-30T08:04:04Z,reillyeon
2841092338,whatwg/html,"Marking ""do not merge yet"" until we get https://github.com/whatwg/fetch/pull/1821 landed and revise ",https://github.com/whatwg/html/pull/11250#issuecomment-2841092338,https://github.com/whatwg/html/pull/11250,Specify browser UI-initiated navigations better,2025-04-30T07:40:51Z,domenic
2841084362,webkit/standards-positions,Can you clarify how this request is different from #136?,https://github.com/WebKit/standards-positions/issues/485#issuecomment-2841084362,https://github.com/WebKit/standards-positions/issues/485,Request to use platform accent color for accent-color property as default option,2025-04-30T07:37:20Z,annevk
2841028669,webkit/standards-positions,Given the concerns mentioned in https://github.com/WebKit/standards-positions/issues/68#issuecomment,https://github.com/WebKit/standards-positions/issues/68#issuecomment-2841028669,https://github.com/WebKit/standards-positions/issues/68,WebUSB API,2025-04-30T07:11:28Z,annevk
2841001618,webkit/standards-positions,@annevk - The latest design is in https://github.com/w3c/webappsec-subresource-integrity/pull/133 (a,https://github.com/WebKit/standards-positions/issues/458#issuecomment-2841001618,https://github.com/WebKit/standards-positions/issues/458,`Integrity-Policy` header for scripts,2025-04-30T07:00:28Z,yoavweiss
2840950689,whatwg/html,"cc @whatwg/css ",https://github.com/whatwg/html/issues/11273#issuecomment-2840950689,https://github.com/whatwg/html/issues/11273,Should `<input type=hidden>` match `:optional`?,2025-04-30T06:35:32Z,annevk
2840902688,whatwg/dom,"@justinfagnani Maybe I got you wrong, is this how it should work? ```js const observer = new Mutatio",https://github.com/whatwg/dom/issues/533#issuecomment-2840902688,https://github.com/whatwg/dom/issues/533,Make it possible to observe connected-ness of a node,2025-04-30T06:08:00Z,FrameMuse
2840898623,w3ctag/design-reviews,"I think this proposal is suboptimal and assumes users have a ""main"" language in which they want to c",https://github.com/w3ctag/design-reviews/issues/1078#issuecomment-2840898623,https://github.com/w3ctag/design-reviews/issues/1078,Reduce Accept-Language,2025-04-30T06:05:23Z,yoavweiss
