id,repo,body,url,issue_url,issue_title,created_at,user
4552581445,whatwg/html,> I think browsers might already use the first legend element child instead of the first element chi,https://github.com/whatwg/html/issues/12485#issuecomment-4552581445,https://github.com/whatwg/html/issues/12485,"Relaxing the ""`legend` must be the first child of `fieldset`"" requirement",2026-05-27T07:54:46Z,patrickhlauke
4552552100,whatwg/html,"@annevk Taking this as an example https://codepen.io/patrickhlauke/pen/raWGgRm the problematic case ",https://github.com/whatwg/html/issues/12485#issuecomment-4552552100,https://github.com/whatwg/html/issues/12485,"Relaxing the ""`legend` must be the first child of `fieldset`"" requirement",2026-05-27T07:50:15Z,patrickhlauke
4552023435,whatwg/html,"No, `relatedTarget` is `null` in both focus going nowhere due to mousedown and manual `blur()` call.",https://github.com/whatwg/html/issues/2368#issuecomment-4552023435,https://github.com/whatwg/html/issues/2368,Mouse events & disabled form controls,2026-05-27T06:37:40Z,waterplea
4552001352,whatwg/html,I think browsers might already use the first `legend` element child instead of the first element chi,https://github.com/whatwg/html/issues/12485#issuecomment-4552001352,https://github.com/whatwg/html/issues/12485,"Relaxing the ""`legend` must be the first child of `fieldset`"" requirement",2026-05-27T06:34:53Z,annevk
4551831769,whatwg/html,"> and there's no way for us to track if we should ignore that blur event because there's no way for ",https://github.com/whatwg/html/issues/2368#issuecomment-4551831769,https://github.com/whatwg/html/issues/2368,Mouse events & disabled form controls,2026-05-27T06:04:15Z,saschanaz
4551326432,w3c/user-timing,Thanks for review. I will prepare PR soon.,https://github.com/w3c/user-timing/issues/126#issuecomment-4551326432,https://github.com/w3c/user-timing/issues/126,Add entry to the performance entry buffer in `mark()` and `measure()` seems excessive,2026-05-27T04:33:46Z,shubhamg13
4551322860,w3c/resource-timing,Thanks for review. I will prepare PR soon.,https://github.com/w3c/resource-timing/issues/433#issuecomment-4551322860,https://github.com/w3c/resource-timing/issues/433,Relation to the `PerformanceEntry` interface missing,2026-05-27T04:33:11Z,shubhamg13
4550329524,whatwg/html,Light dismiss for popovers should still work if you click a disabled button somewhere. Would that be,https://github.com/whatwg/html/issues/2368#issuecomment-4550329524,https://github.com/whatwg/html/issues/2368,Mouse events & disabled form controls,2026-05-27T01:01:44Z,josepharhar
4550299334,whatwg/html,"> > I don't think this PR should be blocked on resolving it. >  > I think I disagree on this. You ",https://github.com/whatwg/html/pull/11588#issuecomment-4550299334,https://github.com/whatwg/html/pull/11588,Add HTML-in-Canvas APIs,2026-05-27T00:54:36Z,szager-chromium
4549834356,whatwg/html,> ... Though I think in general we should find a solution to sharing styles between elements from th,https://github.com/whatwg/html/pull/11687#issuecomment-4549834356,https://github.com/whatwg/html/pull/11687,Declarative CSS Modules,2026-05-26T23:19:00Z,KurtCattiSchmidt
4549797154,whatwg/html,>  I don't think this PR should be blocked on resolving it.  I think I disagree on this.   You ca,https://github.com/whatwg/html/pull/11588#issuecomment-4549797154,https://github.com/whatwg/html/pull/11588,Add HTML-in-Canvas APIs,2026-05-26T23:12:02Z,Kaiido
4549208667,whatwg/html,One question I have stumbled across on the same topic - should adopting an already-loaded image into,https://github.com/whatwg/html/issues/8492#issuecomment-4549208667,https://github.com/whatwg/html/issues/8492,Avoid firing 'load' or 'error' events for <img> when the loaded image didn't change,2026-05-26T21:42:04Z,shannonbooth
4547876296,mozilla/standards-positions,"> @domfarolino so why isn't this thing a method on form element, something which could be triggered ",https://github.com/mozilla/standards-positions/issues/1355#issuecomment-4547876296,https://github.com/mozilla/standards-positions/issues/1355,Speculation rules: `form_submission` field,2026-05-26T19:26:37Z,domfarolino
4547210614,whatwg/html,"Grenish,  thank you for you interest about my request and time spent in putting  your mind on it. Be",https://github.com/whatwg/html/issues/12479#issuecomment-4547210614,https://github.com/whatwg/html/issues/12479,<textarea> tag reflecting indentation tabs in textarea box.,2026-05-26T18:06:08Z,sc1-moo
4547154694,whatwg/html,@jstenback can you please send me an invite? johnjansen@microsoft.com,https://github.com/whatwg/html/issues/12476#issuecomment-4547154694,https://github.com/whatwg/html/issues/12476,Upcoming WHATNOT meeting on 2026-05-28,2026-05-26T17:58:36Z,thejohnjansen
4546627508,w3c/web-performance,"Thanks for you reply, @yoavweiss !  > [@rubennorte](https://github.com/rubennorte) - I'd love to bet",https://github.com/w3c/web-performance/issues/68#issuecomment-4546627508,https://github.com/w3c/web-performance/issues/68,Discussing a potential performance.isProfiling() method,2026-05-26T17:06:25Z,rubennorte
4546251264,w3c/user-timing,Closing this as obsoleted by the work in https://github.com/w3c/user-timing/issues/111  The Chrome D,https://github.com/w3c/user-timing/issues/68#issuecomment-4546251264,https://github.com/w3c/user-timing/issues/68,Allow marks and measures to be shown in developer tooling without adding it to the performance timeline,2026-05-26T16:32:58Z,mmocny
4546182938,w3c/user-timing,"It sounds like the feature was implemented, and [documented](https://developer.chrome.com/docs/devto",https://github.com/w3c/user-timing/issues/111#issuecomment-4546182938,https://github.com/w3c/user-timing/issues/111,Add a non-normative format for the `detail` param that allows developers to customize the presentation of timings in devtools,2026-05-26T16:26:24Z,mmocny
4546166324,w3c/web-performance,@rubennorte - I'd love to better understand the use case!  Who is starting the trace here? Why can't,https://github.com/w3c/web-performance/issues/68#issuecomment-4546166324,https://github.com/w3c/web-performance/issues/68,Discussing a potential performance.isProfiling() method,2026-05-26T16:24:45Z,yoavweiss
4546123859,w3c/ServiceWorker,[In the MessageEvent WebIDL](https://html.spec.whatwg.org/multipage/comms.html#messageevent) Message,https://github.com/w3c/ServiceWorker/issues/1823#issuecomment-4546123859,https://github.com/w3c/ServiceWorker/issues/1823,Client postmessage uses MessageEvent,2026-05-26T16:20:40Z,asutherland
4545990949,w3c/resource-timing,Nit: I think the main goal here is that Resource Timing is missing definitions for things like `name,https://github.com/w3c/resource-timing/issues/433#issuecomment-4545990949,https://github.com/w3c/resource-timing/issues/433,Relation to the `PerformanceEntry` interface missing,2026-05-26T16:07:52Z,mmocny
4545636062,whatwg/html,@annevk I've made a change in https://github.com/whatwg/html/pull/11588/changes/204d6aa5a477f4d770e2,https://github.com/whatwg/html/issues/10650#issuecomment-4545636062,https://github.com/whatwg/html/issues/10650,HTML-in-Canvas,2026-05-26T15:28:46Z,foolip
4545226031,whatwg/html,Related: #11425,https://github.com/whatwg/html/issues/8557#issuecomment-4545226031,https://github.com/whatwg/html/issues/8557,ECMAScript Explicit Resource Management proposal integration with web APIs,2026-05-26T14:47:36Z,linusg
4544298766,w3c/geolocation,Is there any reason why there should be a separate geolocation-approximate permission instead of doi,https://github.com/w3c/geolocation/pull/195#issuecomment-4544298766,https://github.com/w3c/geolocation/pull/195,Add support for approximate geolocation,2026-05-26T13:10:28Z,saschanaz
4543957748,w3c/ServiceWorker,My point is rather that the source of a message event is defined at https://html.spec.whatwg.org/mul,https://github.com/w3c/ServiceWorker/issues/1823#issuecomment-4543957748,https://github.com/w3c/ServiceWorker/issues/1823,Client postmessage uses MessageEvent,2026-05-26T12:06:35Z,gterzian
4543592152,w3c/web-performance,@mmocny thanks for the references!  This issue assumes that we already have relatively low cost meth,https://github.com/w3c/web-performance/issues/68#issuecomment-4543592152,https://github.com/w3c/web-performance/issues/68,Discussing a potential performance.isProfiling() method,2026-05-26T10:47:20Z,rubennorte
4542843726,whatwg/html,Imagine you have a button with a dropdown. When dropdown is open clicking away or focusing away from,https://github.com/whatwg/html/issues/2368#issuecomment-4542843726,https://github.com/whatwg/html/issues/2368,Mouse events & disabled form controls,2026-05-26T09:29:40Z,waterplea
4542799640,webkit/standards-positions,Addition - in https://github.com/w3c/csswg-drafts/issues/13804 it was resolved that CSSPseudoElement,https://github.com/WebKit/standards-positions/issues/607#issuecomment-4542799640,https://github.com/WebKit/standards-positions/issues/607,CSSPseudoElement interface,2026-05-26T09:25:26Z,danielsakhapov
4542798650,mozilla/standards-positions,Addition - in https://github.com/w3c/csswg-drafts/issues/13804 it was resolved that CSSPseudoElement,https://github.com/mozilla/standards-positions/issues/1345#issuecomment-4542798650,https://github.com/mozilla/standards-positions/issues/1345,CSSPseudoElement interface,2026-05-26T09:25:21Z,danielsakhapov
4542769565,mozilla/standards-positions,https://github.com/WICG/crash-reporting/blob/gh-pages/crashReport-explainer.md#security-and-privacy-,https://github.com/mozilla/standards-positions/issues/1271#issuecomment-4542769565,https://github.com/mozilla/standards-positions/issues/1271,window.crashReport key-value API,2026-05-26T09:22:56Z,smaug----
4542339251,whatwg/html,Can you elaborate why you use mousedown to track focus instead of focus events?,https://github.com/whatwg/html/issues/2368#issuecomment-4542339251,https://github.com/whatwg/html/issues/2368,Mouse events & disabled form controls,2026-05-26T08:48:07Z,saschanaz
4542280861,whatwg/html,Mousedown is not triggered on disabled elements and NOT even on their parents. The mouse down DOES h,https://github.com/whatwg/html/issues/2368#issuecomment-4542280861,https://github.com/whatwg/html/issues/2368,Mouse events & disabled form controls,2026-05-26T08:43:08Z,waterplea
4541917227,w3c/ServiceWorker,I assume that clients usually use `MessageEvent` for `postMessage()`. In what specific cases would a,https://github.com/w3c/ServiceWorker/issues/1823#issuecomment-4541917227,https://github.com/w3c/ServiceWorker/issues/1823,Client postmessage uses MessageEvent,2026-05-26T08:05:58Z,yoshisatoyanagisawa
4541714747,webkit/standards-positions,I really don't understand WebKit's position here:  > If installation serves as a meaningful signal o,https://github.com/WebKit/standards-positions/issues/619#issuecomment-4541714747,https://github.com/WebKit/standards-positions/issues/619,BeforeInstallPromptEvent,2026-05-26T07:42:43Z,adactio
4541301886,whatwg/html,"It seems okay to me to organize this differently. I guess it would be @zcorpan's call. I'm not sure ",https://github.com/whatwg/html/issues/11267#issuecomment-4541301886,https://github.com/whatwg/html/issues/11267,CloseWatcher getEnabledState is a little unweildy,2026-05-26T06:48:53Z,annevk
4540092728,w3c/ServiceWorker,@monica-ch Will you review this?,https://github.com/w3c/ServiceWorker/pull/1824#issuecomment-4540092728,https://github.com/w3c/ServiceWorker/pull/1824,Editorial: fix indent,2026-05-26T04:39:36Z,yoshisatoyanagisawa
4538375772,webkit/standards-positions,"Closed via https://github.com/WebKit/standards-positions/issues/619 ",https://github.com/WebKit/standards-positions/issues/463#issuecomment-4538375772,https://github.com/WebKit/standards-positions/issues/463,Web Install API,2026-05-26T00:21:41Z,marcoscaceres
4537300286,whatwg/html,"@annevk that works for me, I've updated this PR and tests in https://crrev.com/c/7857861 to match.",https://github.com/whatwg/html/pull/12473#issuecomment-4537300286,https://github.com/whatwg/html/pull/12473,Make muted content attribute affect muted IDL attribute only once,2026-05-25T21:20:18Z,foolip
4535992349,whatwg/html,My opinion on this hasn't changed much I think the spec should be written how implementations are (i,https://github.com/whatwg/html/issues/11267#issuecomment-4535992349,https://github.com/whatwg/html/issues/11267,CloseWatcher getEnabledState is a little unweildy,2026-05-25T17:21:33Z,lukewarlow
4534911145,w3c/web-performance,Potentially related past conversations: - https://github.com/w3c/user-timing/issues/111 - https://gi,https://github.com/w3c/web-performance/issues/68#issuecomment-4534911145,https://github.com/w3c/web-performance/issues/68,Discussing a potential performance.isProfiling() method,2026-05-25T14:11:39Z,mmocny
4534605205,w3c/IndexedDB,I would add that the optimization is possible because we can check if https://w3c.github.io/IndexedD,https://github.com/w3c/IndexedDB/issues/497#issuecomment-4534605205,https://github.com/w3c/IndexedDB/issues/497,"Avoid ""converting a value to a key"" being called twice in ""Creating a request to retrieve multiple items""",2026-05-25T13:22:57Z,janvarga
4534521142,whatwg/html,"cc @otherdaniel @evilpie ",https://github.com/whatwg/html/issues/12481#issuecomment-4534521142,https://github.com/whatwg/html/issues/12481,Upstream recent changes from sanitizer API after main upstreaming,2026-05-25T13:09:27Z,noamr
4532911222,webkit/standards-positions,"- [ ] ",https://github.com/WebKit/standards-positions/issues/578#issuecomment-4532911222,https://github.com/WebKit/standards-positions/issues/578,Email Verification Protocol,2026-05-25T08:46:32Z,ninonabil2308
4532352566,whatwg/html,@annevk can you help whether the `content` attribute is required or not? It looks to me that omittin,https://github.com/whatwg/html/pull/12444#issuecomment-4532352566,https://github.com/whatwg/html/pull/12444,"Add `<meta name=""responsive-embedded-sizing"">`",2026-05-25T07:20:07Z,kojiishi
4529557573,w3ctag/design-reviews,"Duplicate of #1222 - ",https://github.com/w3ctag/design-reviews/issues/1173#issuecomment-4529557573,https://github.com/w3ctag/design-reviews/issues/1173,Incubation: Connection Allowlists,2026-05-24T18:04:15Z,roberthawkins671-pixel
4529212782,whatwg/html,I see @tharkum [added more tests](https://github.com/web-platform-tests/wpt/commit/71a2257ed707e04a7,https://github.com/whatwg/html/issues/2660#issuecomment-4529212782,https://github.com/whatwg/html/issues/2660,Canvas origin-clean resetting information disagrees with browser behaviour,2026-05-24T15:48:40Z,annevk
4527727738,whatwg/html,"cc @jakearchibald ",https://github.com/whatwg/html/issues/10988#issuecomment-4527727738,https://github.com/whatwg/html/issues/10988,The topmost popover ancestor algorithm is used for manual popovers,2026-05-24T07:33:11Z,annevk
4527703241,whatwg/html,"I see, perhaps observing the `muted` content attribute in the post-connection steps is a good altern",https://github.com/whatwg/html/pull/12473#issuecomment-4527703241,https://github.com/whatwg/html/pull/12473,Make muted content attribute affect muted IDL attribute only once,2026-05-24T07:20:48Z,annevk
4527508369,whatwg/html,"This issue is still present after the recent rewrite, my updated suggestion is: - Change step 19 fro",https://github.com/whatwg/html/issues/10988#issuecomment-4527508369,https://github.com/whatwg/html/issues/10988,The topmost popover ancestor algorithm is used for manual popovers,2026-05-24T05:33:53Z,Gingeh
4527015552,w3c/navigation-timing,[README.md](https://github.com/user-attachments/files/28185712/README.md),https://github.com/w3c/navigation-timing/issues/208#issuecomment-4527015552,https://github.com/w3c/navigation-timing/issues/208,"[Editorial] The referencing of ""not restored reasons"" is broken",2026-05-24T01:16:25Z,gabrielmamede
4523624100,whatwg/html,"Hello @sc1-moo,  I think I understand your point now.  You are not referring to indentation before t",https://github.com/whatwg/html/issues/12479#issuecomment-4523624100,https://github.com/whatwg/html/issues/12479,<textarea> tag reflecting indentation tabs in textarea box.,2026-05-23T01:02:29Z,Grenish
4522638728,w3c/IndexedDB,"I agree this looks buggy. We implemented it in Firefox so it passes WPT test suite, so updating the ",https://github.com/w3c/IndexedDB/issues/493#issuecomment-4522638728,https://github.com/w3c/IndexedDB/issues/493,"Clarification on what `range` should be in ""create-a-request-to-retrieve-multiple-items"" when `queryOrOptions` is undefined/null",2026-05-22T20:55:28Z,ArnaudBienner
4522533663,whatwg/html,"Hello Grenish,  Beware to not mistake two things: - I am not talking about then content *in between*",https://github.com/whatwg/html/issues/12479#issuecomment-4522533663,https://github.com/whatwg/html/issues/12479,<textarea> tag reflecting indentation tabs in textarea box.,2026-05-22T20:34:36Z,sc1-moo
4519097750,whatwg/html,https://github.com/GoogleChromeLabs/chromium-bidi/issues/4155,https://github.com/whatwg/html/pull/12426#issuecomment-4519097750,https://github.com/whatwg/html/pull/12426,Pass response to WebDriver BiDi donwnload events.,2026-05-22T13:27:40Z,OrKoN
4519075432,whatwg/html,I believe everything normative is now equivalent to the WICG spec.,https://github.com/whatwg/html/pull/12395#issuecomment-4519075432,https://github.com/whatwg/html/pull/12395,Upstream sanitizer api,2026-05-22T13:25:11Z,zcorpan
4518820139,whatwg/webidl,"The proposal is now stage 3, and test262 tests for it have been merged.",https://github.com/whatwg/webidl/pull/1578#issuecomment-4518820139,https://github.com/whatwg/webidl/pull/1578,Update DOMException language to reflect standardized stack accessor,2026-05-22T12:54:44Z,ljharb
4518819479,whatwg/html,"The proposal is now stage 3, and test262 tests for it have been merged.",https://github.com/whatwg/html/pull/12239#issuecomment-4518819479,https://github.com/whatwg/html/pull/12239,"HTML integration for ""Error Stack Accessor"" TC39 Proposal",2026-05-22T12:54:38Z,ljharb
4518725112,whatwg/html,"@sc1-moo   This is actually expected behavior, not a browser bug.  The content inside `<textarea>` i",https://github.com/whatwg/html/issues/12479#issuecomment-4518725112,https://github.com/whatwg/html/issues/12479,<textarea> tag reflecting indentation tabs in textarea box.,2026-05-22T12:41:08Z,Grenish
4516281492,whatwg/html,"... Though I think in general we should find a solution to sharing styles between elements from the ",https://github.com/whatwg/html/pull/11687#issuecomment-4516281492,https://github.com/whatwg/html/pull/11687,Declarative CSS Modules,2026-05-22T07:18:58Z,noamr
4515881372,whatwg/html,> Trying to merge might make the history of discussion harder to follow. I think just link to this i,https://github.com/whatwg/html/issues/10378#issuecomment-4515881372,https://github.com/whatwg/html/issues/10378,"HTML Video Poster Image: Enable Responsive Images and ALT Text for Poster ",2026-05-22T06:39:23Z,noamr
4515870920,whatwg/html,> > What like protect the specifier attribute as if it was a script? I find that confusing. >  > Not,https://github.com/whatwg/html/pull/11687#issuecomment-4515870920,https://github.com/whatwg/html/pull/11687,Declarative CSS Modules,2026-05-22T06:38:14Z,noamr
4514917020,whatwg/html,Hi! I'd like to work on this issue if it's still available.,https://github.com/whatwg/html/issues/3552#issuecomment-4514917020,https://github.com/whatwg/html/issues/3552,createImageBitmap's note is wrong,2026-05-22T04:14:23Z,Devansh232406
4514566817,whatwg/html,"> This isn't a full review, because I think some of my commentary may have broader impacts on this s",https://github.com/whatwg/html/pull/11723#issuecomment-4514566817,https://github.com/whatwg/html/pull/11723,"[focusgroup] Add the focusgroup attribute ",2026-05-22T02:51:03Z,janewman
4514563228,whatwg/html,"> It seems the Build is failing. It also seems that this PR needs significant integration work with ",https://github.com/whatwg/html/pull/11723#issuecomment-4514563228,https://github.com/whatwg/html/pull/11723,"[focusgroup] Add the focusgroup attribute ",2026-05-22T02:50:19Z,janewman
4514374187,webkit/standards-positions,See also: https://bugs.webkit.org/show_bug.cgi?id=313234 https://bugs.webkit.org/show_bug.cgi?id=314,https://github.com/WebKit/standards-positions/issues/261#issuecomment-4514374187,https://github.com/WebKit/standards-positions/issues/261,CSS Scroll State Container Queries [css-conditional-5],2026-05-22T02:14:40Z,woody-li
4513567129,whatwg/html,> What like protect the specifier attribute as if it was a script? I find that confusing.  Not spe,https://github.com/whatwg/html/pull/11687#issuecomment-4513567129,https://github.com/whatwg/html/pull/11687,Declarative CSS Modules,2026-05-21T23:24:36Z,KurtCattiSchmidt
4513038685,whatwg/html,@zcorpan done 👍   I've updated the summary up top with the `posterfromimg` attribute. Will follow u,https://github.com/whatwg/html/issues/10378#issuecomment-4513038685,https://github.com/whatwg/html/issues/10378,"HTML Video Poster Image: Enable Responsive Images and ALT Text for Poster ",2026-05-21T21:46:27Z,scottjehl
4512999646,whatwg/html,"Just a note since this issue closed when #11980 landed (which brought lazy loading for video poster ",https://github.com/whatwg/html/issues/6636#issuecomment-4512999646,https://github.com/whatwg/html/issues/6636,Lazy loading video element poster attribute,2026-05-21T21:40:12Z,scottjehl
4512910208,w3ctag/design-reviews,I've posted our comment to https://github.com/w3c/strategy/issues/509#issuecomment-4512908206.,https://github.com/w3ctag/design-reviews/issues/1215#issuecomment-4512910208,https://github.com/w3ctag/design-reviews/issues/1215,[wg/wot] Web of Things Working Group rechartering,2026-05-21T21:24:50Z,jyasskin
4512891306,whatwg/html,Trying to merge might make the history of discussion harder to follow. I think just link to this iss,https://github.com/whatwg/html/issues/10378#issuecomment-4512891306,https://github.com/whatwg/html/issues/10378,"HTML Video Poster Image: Enable Responsive Images and ALT Text for Poster ",2026-05-21T21:22:27Z,zcorpan
4512000466,whatwg/html,"Minutes:  - Meeting Opening and Agenda: Johnny Stenback opened the meeting, noted the improvements t",https://github.com/whatwg/html/issues/12456#issuecomment-4512000466,https://github.com/whatwg/html/issues/12456,Upcoming WHATNOT meeting on 2026-05-21,2026-05-21T19:18:23Z,jstenback
4511356663,WICG/webcomponents,The algorithm in the spec PR looks rather odd to me. We shouldn't be modifying _get the parent_ algo,https://github.com/WICG/webcomponents/issues/1098#issuecomment-4511356663,https://github.com/WICG/webcomponents/issues/1098,Reference Target: How to handle events fired on the reference target by related elements?,2026-05-21T18:20:01Z,smaug----
4510997234,whatwg/html,"Re: the offsets discussion today, I wrote up a proposal for the idea I suggested, since I don't thin",https://github.com/whatwg/html/issues/11478#issuecomment-4510997234,https://github.com/whatwg/html/issues/11478,OpaqueRange Interface,2026-05-21T17:49:07Z,LeaVerou
4510888831,w3c/selection-api,Am I missing something? It doesn't seem to me like Safari 16.4 and Firefox 153 behave the same for m,https://github.com/w3c/selection-api/pull/357#issuecomment-4510888831,https://github.com/w3c/selection-api/pull/357,Fix selection.modify() to use resolved text direction instead of inline base direction,2026-05-21T17:33:58Z,vinhill
4510591351,WICG/webcomponents,I should also mention that I added WPT coverage for all cases I could think of relevant to this in h,https://github.com/WICG/webcomponents/issues/1098#issuecomment-4510591351,https://github.com/WICG/webcomponents/issues/1098,Reference Target: How to handle events fired on the reference target by related elements?,2026-05-21T16:58:48Z,dandclark
4510570274,whatwg/html,"cc @whatwg/media for opinions on this. In short, the topic is how/when the `muted` content attribute",https://github.com/whatwg/html/pull/12473#issuecomment-4510570274,https://github.com/whatwg/html/pull/12473,Make muted content attribute affect muted IDL attribute only once,2026-05-21T16:56:11Z,foolip
4510540195,whatwg/html,"For Gecko, the [`MutedReasons`](https://github.com/mozilla-firefox/firefox/blob/f3695d1fd8d9f7419576",https://github.com/whatwg/html/pull/12473#issuecomment-4510540195,https://github.com/whatwg/html/pull/12473,Make muted content attribute affect muted IDL attribute only once,2026-05-21T16:52:09Z,foolip
4510529029,whatwg/html,"We discussed this in WHATNOT today and the group agreed on no-op the limit is reached, both for navi",https://github.com/whatwg/html/issues/11108#issuecomment-4510529029,https://github.com/whatwg/html/issues/11108,History API: PushState can silently fail in Chromium while Gecko/Webkit raises exception,2026-05-21T16:50:37Z,zcorpan
4510509276,mozilla/standards-positions,We are implementing this now (the meta bug: https://bugzilla.mozilla.org/show_bug.cgi?id=scroll-anim,https://github.com/mozilla/standards-positions/issues/347#issuecomment-4510509276,https://github.com/mozilla/standards-positions/issues/347,Scroll-driven Animations,2026-05-21T16:47:49Z,BorisChiou
4510401758,whatwg/html,@noamr Agreed. Happy to merge the issues in any way that helps facilitate here. Should I pull some o,https://github.com/whatwg/html/issues/10378#issuecomment-4510401758,https://github.com/whatwg/html/issues/10378,"HTML Video Poster Image: Enable Responsive Images and ALT Text for Poster ",2026-05-21T16:33:41Z,scottjehl
4510212984,whatwg/html,"@scottjehl it seems like less of a ""back story"" and more of a duplicate issue with a lot of history?",https://github.com/whatwg/html/issues/10378#issuecomment-4510212984,https://github.com/whatwg/html/issues/10378,"HTML Video Poster Image: Enable Responsive Images and ALT Text for Poster ",2026-05-21T16:11:48Z,noamr
