id,repo,body,url,issue_url,issue_title,created_at,user
4138348793,whatwg/html,"Regarding overflow clipping: the API includes ""source rect"" parameters for this purpose. If you spec",https://github.com/whatwg/html/issues/10650#issuecomment-4138348793,https://github.com/whatwg/html/issues/10650,HTML-in-Canvas,2026-03-26T21:31:36Z,szager-chromium
4138172007,whatwg/html,Drive-by comment about styling/layout of the contents of a `layoutsubtree` canvas:  Canvas being a,https://github.com/whatwg/html/pull/11588#issuecomment-4138172007,https://github.com/whatwg/html/pull/11588,Add HTML-in-Canvas APIs,2026-03-26T21:00:09Z,tabatkins
4137868252,w3c/payment-request,[ianbjacobs](https://github.com/ianbjacobs) marked as non substantive for IPR from ash-nazg.,https://github.com/w3c/payment-request/pull/1063#issuecomment-4137868252,https://github.com/w3c/payment-request/pull/1063,Tidied up document using tidy-html5,2026-03-26T20:03:34Z,w3cbot
4137829054,whatwg/html,"I imagine that, like resize controls, the controls would set `image-animation` in inline style on th",https://github.com/whatwg/html/issues/12318#issuecomment-4137829054,https://github.com/whatwg/html/issues/12318,<img controls> for animated images,2026-03-26T19:57:16Z,tabatkins
4137695922,whatwg/html,> Some high-level questions from a quick read of the explainer: >  > 1. just before the `paint` even,https://github.com/whatwg/html/issues/10650#issuecomment-4137695922,https://github.com/whatwg/html/issues/10650,HTML-in-Canvas,2026-03-26T19:34:58Z,foolip
4137659791,whatwg/html,Weirdness 2  > Let's say auto 1 is a select popover with options. And hint 2 and 3 are tooltips rela,https://github.com/whatwg/html/issues/12304#issuecomment-4137659791,https://github.com/whatwg/html/issues/12304,popover=hint has multiple weird and inconsistent behaviours,2026-03-26T19:28:27Z,lukewarlow
4137643028,whatwg/html,"> I'll go through these in detail tomorrow, but like I said, weirdness 5 is not a display:none issue",https://github.com/whatwg/html/issues/12304#issuecomment-4137643028,https://github.com/whatwg/html/issues/12304,popover=hint has multiple weird and inconsistent behaviours,2026-03-26T19:26:01Z,mfreed7
4137611400,whatwg/html,"I'll go through these in detail tomorrow, but like I said, weirdness 5 is not a display:none issue, ",https://github.com/whatwg/html/issues/12304#issuecomment-4137611400,https://github.com/whatwg/html/issues/12304,popover=hint has multiple weird and inconsistent behaviours,2026-03-26T19:21:29Z,jakearchibald
4137472009,whatwg/html,"Ok, I've now had a chance to go through the rest. Thanks for the videos with sound - that was *super",https://github.com/whatwg/html/issues/12304#issuecomment-4137472009,https://github.com/whatwg/html/issues/12304,popover=hint has multiple weird and inconsistent behaviours,2026-03-26T18:59:10Z,mfreed7
4137373875,whatwg/html,If a user applies a style that increases the size of all outlines (and applies `outline-style: solid,https://github.com/whatwg/html/issues/12286#issuecomment-4137373875,https://github.com/whatwg/html/issues/12286,outline and ::picker(select),2026-03-26T18:44:23Z,sb3nder
4137254903,whatwg/html,"Some high-level questions from a quick read of the explainer:  1. just before the `paint` event, all",https://github.com/whatwg/html/issues/10650#issuecomment-4137254903,https://github.com/whatwg/html/issues/10650,HTML-in-Canvas,2026-03-26T18:24:35Z,smfr
4137001182,whatwg/html,That sounds like the best approach. Also means people are free to use it elsewhere.,https://github.com/whatwg/html/issues/12286#issuecomment-4137001182,https://github.com/whatwg/html/issues/12286,outline and ::picker(select),2026-03-26T17:53:27Z,lukewarlow
4136852607,whatwg/html,(Edit: This is about **weirdness <span>#</span>1**.)  > [Here is where it happens in the spec](https,https://github.com/whatwg/html/issues/12304#issuecomment-4136852607,https://github.com/whatwg/html/issues/12304,popover=hint has multiple weird and inconsistent behaviours,2026-03-26T17:31:51Z,mfreed7
4136691857,whatwg/html,I think @nt1m has the right idea (elsewhere) and ideally we standardize upon  ``` select option:focu,https://github.com/whatwg/html/issues/12286#issuecomment-4136691857,https://github.com/whatwg/html/issues/12286,outline and ::picker(select),2026-03-26T17:08:37Z,annevk
4136686935,whatwg/html,"> > So, the answer to ""does opening a hint close a sibling auto popover?"" is 'sometimes', and that's",https://github.com/whatwg/html/issues/12304#issuecomment-4136686935,https://github.com/whatwg/html/issues/12304,popover=hint has multiple weird and inconsistent behaviours,2026-03-26T17:07:54Z,jakearchibald
4136643188,mozilla/standards-positions,@padenot has context around this proposal,https://github.com/mozilla/standards-positions/issues/1375#issuecomment-4136643188,https://github.com/mozilla/standards-positions/issues/1375,Add quality constraint to SpeechRecognitionOptions for on-device recognition,2026-03-26T17:01:46Z,evanbliu
4136589806,mozilla/standards-positions,"@saschanaz said: > It's not great to keep having misnamed event, when it's only ever shipped in only",https://github.com/mozilla/standards-positions/issues/1371#issuecomment-4136589806,https://github.com/mozilla/standards-positions/issues/1371,Web Application Manifest - `BeforeInstallPromptEvent`,2026-03-26T16:54:00Z,dmurph
4136541452,whatwg/html,"> However, it feels like at least a few of them, and perhaps all of them (?) are due to how `display",https://github.com/whatwg/html/issues/12304#issuecomment-4136541452,https://github.com/whatwg/html/issues/12304,popover=hint has multiple weird and inconsistent behaviours,2026-03-26T16:47:05Z,jakearchibald
4136531992,whatwg/html,"Hey @asutherland, would you mind taking a look at this (and the OP/rationale above)?",https://github.com/whatwg/html/pull/12182#issuecomment-4136531992,https://github.com/whatwg/html/pull/12182,Simplify orphan worker closing,2026-03-26T16:45:42Z,domfarolino
4136493993,whatwg/html,"So generally I think I need more time to work through all of the weirdness examples here. However, i",https://github.com/whatwg/html/issues/12304#issuecomment-4136493993,https://github.com/whatwg/html/issues/12304,popover=hint has multiple weird and inconsistent behaviours,2026-03-26T16:40:15Z,mfreed7
4136379839,webkit/standards-positions,"WebRTC also deserves to be PQ-safe :)  Well, we are looking at adding ML-KEM, ML-DSA, ChaCha20-Poly1",https://github.com/WebKit/standards-positions/issues/641#issuecomment-4136379839,https://github.com/WebKit/standards-positions/issues/641,Modern Algorithms in WebCrypto,2026-03-26T16:24:07Z,Frosne
4136353559,whatwg/html,"So one thing that might be tricky is that for canvas / etc you care about image pixels (as in, the b",https://github.com/whatwg/html/issues/11935#issuecomment-4136353559,https://github.com/whatwg/html/issues/11935,Optional destination size for `HTMLImageElement.decode()`,2026-03-26T16:20:19Z,emilio
4136244435,whatwg/html,"> > That's a fairly large ""what if"", since it requires re-thinking the entire two stack model. >  > ",https://github.com/whatwg/html/issues/12305#issuecomment-4136244435,https://github.com/whatwg/html/issues/12305,popover=auto inside popover=hint has really weird results,2026-03-26T16:05:06Z,mfreed7
4136039608,webkit/standards-positions,Maybe @Frosne can shed some light on that? I believe she is working on the implementation.,https://github.com/WebKit/standards-positions/issues/641#issuecomment-4136039608,https://github.com/WebKit/standards-positions/issues/641,Modern Algorithms in WebCrypto,2026-03-26T15:36:45Z,twiss
4135805570,webkit/standards-positions,Mozilla didn't seem enthusiastic on adding these to Web Crypto and the bug associated with their pos,https://github.com/WebKit/standards-positions/issues/641#issuecomment-4135805570,https://github.com/WebKit/standards-positions/issues/641,Modern Algorithms in WebCrypto,2026-03-26T15:07:00Z,annevk
4135624332,whatwg/html,"Thanks for the detailed response, @eemeli. This is resolved as far as I'm concerned.",https://github.com/whatwg/html/pull/11933#issuecomment-4135624332,https://github.com/whatwg/html/pull/11933,Add text imports,2026-03-26T14:51:48Z,noamr
4134641233,whatwg/html,"> That's a fairly large ""what if"", since it requires re-thinking the entire two stack model.  The th",https://github.com/whatwg/html/issues/12305#issuecomment-4134641233,https://github.com/whatwg/html/issues/12305,popover=auto inside popover=hint has really weird results,2026-03-26T13:10:58Z,lukewarlow
4134600131,whatwg/html,"Without having read the full comments here, here's my thoughts.  TLDR I agree each of those cases fe",https://github.com/whatwg/html/issues/12304#issuecomment-4134600131,https://github.com/whatwg/html/issues/12304,popover=hint has multiple weird and inconsistent behaviours,2026-03-26T13:05:52Z,lukewarlow
4134441156,whatwg/html,@yoelhawa can you update this PR so there's an open issue with a pointer to https://github.com/whatw,https://github.com/whatwg/html/pull/12151#issuecomment-4134441156,https://github.com/whatwg/html/pull/12151,Add controls attribute to img,2026-03-26T12:46:14Z,annevk
4134178228,whatwg/html,"Right. From the spec's perspective, once the attribute is defined, UAs are free to add any controls.",https://github.com/whatwg/html/issues/11856#issuecomment-4134178228,https://github.com/whatwg/html/issues/11856,`controls` attribute for `<img>` element,2026-03-26T12:15:11Z,zcorpan
4133866999,whatwg/html,"@noamr The concerns raised in tc39/proposal-import-text#8 lead to tc39/proposal-import-text#10, whic",https://github.com/whatwg/html/pull/11933#issuecomment-4133866999,https://github.com/whatwg/html/pull/11933,Add text imports,2026-03-26T11:33:11Z,eemeli
4133583397,whatwg/html,"SGTM.  https://github.com/WICG/document-picture-in-picture/pulls has 3 open PRs, and https://github.",https://github.com/whatwg/html/issues/12309#issuecomment-4133583397,https://github.com/whatwg/html/issues/12309,Upstream Document Picture-in-Picture,2026-03-26T10:50:56Z,zcorpan
4133396926,whatwg/html,"Closing this in favour of https://github.com/whatwg/html/issues/12304, since it includes details of ",https://github.com/whatwg/html/issues/12305#issuecomment-4133396926,https://github.com/whatwg/html/issues/12305,popover=auto inside popover=hint has really weird results,2026-03-26T10:24:01Z,jakearchibald
4133236126,mozilla/standards-positions,"I think the proposal doesn't yet have a great story around playback control for animated images, see",https://github.com/mozilla/standards-positions/issues/1368#issuecomment-4133236126,https://github.com/mozilla/standards-positions/issues/1368,`controls` attribute for `<img>` element,2026-03-26T10:00:33Z,zcorpan
4133157770,whatwg/html,"I think it’s only a question once a UA decides to expose controls for that scenario, right? I agree ",https://github.com/whatwg/html/issues/11856#issuecomment-4133157770,https://github.com/whatwg/html/issues/11856,`controls` attribute for `<img>` element,2026-03-26T09:47:29Z,annevk
4133080726,whatwg/html,"Summary of the weird behaviours with the current model (but there may be more):  - Unnested, opening",https://github.com/whatwg/html/issues/12304#issuecomment-4133080726,https://github.com/whatwg/html/issues/12304,popover=hint has multiple weird and inconsistent behaviours,2026-03-26T09:36:02Z,jakearchibald
4133066703,whatwg/html,It seems it's an open question how controlling animated images is expected to work. Having the contr,https://github.com/whatwg/html/issues/11856#issuecomment-4133066703,https://github.com/whatwg/html/issues/11856,`controls` attribute for `<img>` element,2026-03-26T09:33:56Z,zcorpan
4131376516,whatwg/storage,"I'm concerned by this proposal. Basically what it is saying is that storage events are not reliable ",https://github.com/whatwg/storage/issues/119#issuecomment-4131376516,https://github.com/whatwg/storage/issues/119,Session storage and changing browsing contexts,2026-03-26T03:29:08Z,fergald
4130964088,whatwg/html,"Minutes:  - **Add Shadow Root Slot Assignment:** Keith Cirkel introduced a Pull Request (PR) to add ",https://github.com/whatwg/html/issues/12275#issuecomment-4130964088,https://github.com/whatwg/html/issues/12275,Upcoming WHATNOT meeting on 2026-03-19,2026-03-26T01:45:47Z,cwilso
4130882879,mozilla/standards-positions,I split out `shadowrootadoptedstylesheets` into its [own explainer](https://github.com/MicrosoftEdge,https://github.com/mozilla/standards-positions/issues/1081#issuecomment-4130882879,https://github.com/mozilla/standards-positions/issues/1081,Declarative CSS Modules and Declarative Shadow DOM `adoptedstylesheets` attribute,2026-03-26T01:19:08Z,KurtCattiSchmidt
4130880754,webkit/standards-positions,Thanks!,https://github.com/WebKit/standards-positions/issues/640#issuecomment-4130880754,https://github.com/WebKit/standards-positions/issues/640,WebGPU: Immediates,2026-03-26T01:18:23Z,shaoboyan091
4130874751,w3ctag/design-reviews,I moved the `shadowrootadoptedstylesheets` to a [separate explainer](https://github.com/MicrosoftEdg,https://github.com/w3ctag/design-reviews/issues/1195#issuecomment-4130874751,https://github.com/w3ctag/design-reviews/issues/1195,Question: should `shadowrootadoptedstylesheets` perform a fetch?,2026-03-26T01:16:19Z,KurtCattiSchmidt
4130808275,whatwg/html,> I still think that we can have declarative CSS modules with URLs before we go down the rabbit hole,https://github.com/whatwg/html/pull/11687#issuecomment-4130808275,https://github.com/whatwg/html/pull/11687,Declarative CSS Modules,2026-03-26T00:56:36Z,KurtCattiSchmidt
4130392308,whatwg/html,Some more elaboration: The general idea behind these changes is that there's two cases to consider:,https://github.com/whatwg/html/pull/12294#issuecomment-4130392308,https://github.com/whatwg/html/pull/12294,Properly set visibility state for nested documents,2026-03-25T23:05:13Z,Psychpsyo
4129511547,w3c/user-timing,"It worked -- All checks have passed. ",https://github.com/w3c/user-timing/pull/124#issuecomment-4129511547,https://github.com/w3c/user-timing/pull/124,Sync conditional-tracing-explainer.md from gh-pages branch,2026-03-25T20:19:22Z,guohuideng2024
4129311849,w3c/user-timing,> I think you need to sync to `main` to fix the CI error btw. Unrelated to your change but it's nice,https://github.com/w3c/user-timing/pull/123#issuecomment-4129311849,https://github.com/w3c/user-timing/pull/123,"Move to an approach without ""track"" objects.",2026-03-25T19:44:36Z,guohuideng2024
4128828827,w3c/user-timing,I think you need to sync to `main` to fix the CI error btw. Unrelated to your change but it's nice t,https://github.com/w3c/user-timing/pull/123#issuecomment-4128828827,https://github.com/w3c/user-timing/pull/123,"Move to an approach without ""track"" objects.",2026-03-25T18:28:21Z,tunetheweb
4128428432,webkit/standards-positions,Based on https://github.com/WebKit/standards-positions/issues/294#issuecomment-1877411933 our positi,https://github.com/WebKit/standards-positions/issues/640#issuecomment-4128428432,https://github.com/WebKit/standards-positions/issues/640,WebGPU: Immediates,2026-03-25T17:31:40Z,mwyrzykowski
4127820311,whatwg/html,@josepharhar I think the same fundamental issue still exists with the `option` element insertion/mov,https://github.com/whatwg/html/issues/12096#issuecomment-4127820311,https://github.com/whatwg/html/issues/12096,selectedcontent removing steps vs pagehide (and unload),2026-03-25T16:04:38Z,annevk
4127696828,mozilla/standards-positions,"This makes sense, and is something we'd implement, once the details are sorted out.",https://github.com/mozilla/standards-positions/issues/1045#issuecomment-4127696828,https://github.com/mozilla/standards-positions/issues/1045,Temporal - structured clone,2026-03-25T15:49:08Z,dminor
4127575471,whatwg/html,"Coming back to this now, and sorry for anything I'm muddling up because I do not find these algorith",https://github.com/whatwg/html/issues/12209#issuecomment-4127575471,https://github.com/whatwg/html/issues/12209,HTML fragment parsing algorithm needs to set its document's custom element registry,2026-03-25T15:33:59Z,AtkinsSJ
4127268674,whatwg/html,I think this is editorial but not sure?,https://github.com/whatwg/html/pull/12313#issuecomment-4127268674,https://github.com/whatwg/html/pull/12313,Editorial: Fix missing document argument when calling check popover validity wit…,2026-03-25T14:56:03Z,lukewarlow
4125702991,whatwg/html,Confirmed that fixing that logic does work as expected. Opened #12312 to hopefully prevent confusion,https://github.com/whatwg/html/issues/12311#issuecomment-4125702991,https://github.com/whatwg/html/issues/12311,`load` event isn't fired when iframe navigation is blocked because of CSP,2026-03-25T11:13:05Z,TimvdLippe
4125055517,whatwg/html,"And just as I close my tabs, I spot step 7 of https://html.spec.whatwg.org/multipage/document-lifecy",https://github.com/whatwg/html/issues/12311#issuecomment-4125055517,https://github.com/whatwg/html/issues/12311,`load` event isn't fired when iframe navigation is blocked because of CSP,2026-03-25T09:32:09Z,TimvdLippe
4122428864,whatwg/html,"> `display:block` works just fine now too  Only in Chrome, though, so I understand the frustration. ",https://github.com/whatwg/html/issues/12308#issuecomment-4122428864,https://github.com/whatwg/html/issues/12308,Restore <center> as a non-depreciated tag,2026-03-25T00:59:17Z,Loirooriol
4121625234,webkit/standards-positions,Seems reasonable.,https://github.com/WebKit/standards-positions/issues/639#issuecomment-4121625234,https://github.com/WebKit/standards-positions/issues/639,Programmatic scroll promise,2026-03-24T21:48:48Z,smfr
4121552272,whatwg/html,"Yup, in addition to the very trivial centering you can with `display:grid` or `flex`, `display:block",https://github.com/whatwg/html/issues/12308#issuecomment-4121552272,https://github.com/whatwg/html/issues/12308,Restore <center> as a non-depreciated tag,2026-03-24T21:32:24Z,tabatkins
4120757388,whatwg/html,@eemeli can you detail how this PR addresses the concerns you've linked to in https://github.com/tc3,https://github.com/whatwg/html/pull/11933#issuecomment-4120757388,https://github.com/whatwg/html/pull/11933,Add text imports,2026-03-24T19:14:50Z,noamr
4120000430,whatwg/html,"Assuming that hint popovers are intended for hover tooltip style things, here's a set of behaviours ",https://github.com/whatwg/html/issues/12304#issuecomment-4120000430,https://github.com/whatwg/html/issues/12304,popover=hint has multiple weird and inconsistent behaviours,2026-03-24T17:20:42Z,jakearchibald
4119908632,whatwg/html,"@jasnell While that does not solve the issue of standardization, isn't it already possible to pass s",https://github.com/whatwg/html/issues/7428#issuecomment-4119908632,https://github.com/whatwg/html/issues/7428,Allow objects to customize serialization / deserialization for structured clone,2026-03-24T17:06:26Z,I-Enderlord-I
4119588363,w3c/geolocation,Thanks everyone for the huge effort in getting this done!,https://github.com/w3c/geolocation/issues/226#issuecomment-4119588363,https://github.com/w3c/geolocation/issues/226,Call for Consensus: Incorporating Proposed Amendments and Transitioning Geolocation from REC to CR,2026-03-24T16:17:20Z,alvinjiooo
4118800801,mozilla/standards-positions,"/cc @emilio ",https://github.com/mozilla/standards-positions/issues/1377#issuecomment-4118800801,https://github.com/mozilla/standards-positions/issues/1377,[css-text] `text-fit` property,2026-03-24T14:35:37Z,keithamus
4117731385,whatwg/fs,> Hi @annevk — wanted to give you a full status update and flag a couple of things that need attenti,https://github.com/whatwg/fs/pull/182#issuecomment-4117731385,https://github.com/whatwg/fs/pull/182,fs: Remove nullable markers from WriteParams members,2026-03-24T12:14:18Z,usamanadeemdeveloper
4117498985,whatwg/html,"Yeah, you're right. I don't have the opener logic in there. I deleted my shitty spec. Here's a less ",https://github.com/whatwg/html/issues/12304#issuecomment-4117498985,https://github.com/whatwg/html/issues/12304,popover=hint has multiple weird and inconsistent behaviours,2026-03-24T11:38:31Z,jakearchibald
4117231513,whatwg/html,"I looked at all the videos and to me the current behavior looks inconsistently weird indeed.  > The ",https://github.com/whatwg/html/issues/12304#issuecomment-4117231513,https://github.com/whatwg/html/issues/12304,popover=hint has multiple weird and inconsistent behaviours,2026-03-24T10:52:06Z,bramus
4117116464,whatwg/html,Thanks for the issue. Interesting request! I have a few of questions:  1. What's the use case for th,https://github.com/whatwg/html/issues/12300#issuecomment-4117116464,https://github.com/whatwg/html/issues/12300,Allow clean distinction of popover vs dialog.show() vs dialog.showModal() toggle events,2026-03-24T10:35:37Z,keithamus
4117062326,whatwg/html,"Thanks for the issue. You've used the template for bugs within the HTML standard, but this is a feat",https://github.com/whatwg/html/issues/12306#issuecomment-4117062326,https://github.com/whatwg/html/issues/12306,Replace height and width attributes for checkbox and radio inputs,2026-03-24T10:27:39Z,keithamus
4117033256,whatwg/html,Here's another bit of the behaviour that doesn't make sense to me:  https://github.com/user-attachme,https://github.com/whatwg/html/issues/12304#issuecomment-4117033256,https://github.com/whatwg/html/issues/12304,popover=hint has multiple weird and inconsistent behaviours,2026-03-24T10:23:33Z,jakearchibald
4117028141,whatwg/html,"Thanks for the issue. Next time, please to fill the template in, as it can help define the scope of ",https://github.com/whatwg/html/issues/12308#issuecomment-4117028141,https://github.com/whatwg/html/issues/12308,Restore <center> as a non-depreciated tag,2026-03-24T10:22:51Z,keithamus
4116952429,mozilla/standards-positions,"Seems fine to me, this is a straightforward piece of missing functionality.",https://github.com/mozilla/standards-positions/issues/1150#issuecomment-4116952429,https://github.com/mozilla/standards-positions/issues/1150,HTML Canvas: Add the lang IDL attribute to CanvasTextDrawingStyles,2026-03-24T10:11:21Z,jfkthame
4115938281,whatwg/html,"> But the spec and behavior were extensively discussed. Please read the hundreds of comments (each) ",https://github.com/whatwg/html/issues/12304#issuecomment-4115938281,https://github.com/whatwg/html/issues/12304,popover=hint has multiple weird and inconsistent behaviours,2026-03-24T07:15:23Z,jakearchibald
4115880988,whatwg/html,"I don't think this is a documentation issue. I think the requirements got confused along the way, or",https://github.com/whatwg/html/issues/12305#issuecomment-4115880988,https://github.com/whatwg/html/issues/12305,popover=auto inside popover=hint has really weird results,2026-03-24T07:00:50Z,jakearchibald
4115869483,whatwg/html,"So, the answer to ""does opening a hint close a sibling auto popover?"" is 'sometimes', and that's ful",https://github.com/whatwg/html/issues/12304#issuecomment-4115869483,https://github.com/whatwg/html/issues/12304,popover=hint has multiple weird and inconsistent behaviours,2026-03-24T06:57:42Z,jakearchibald
4115619467,whatwg/html,"Got it. Updated accordingly, thanks!",https://github.com/whatwg/html/pull/12302#issuecomment-4115619467,https://github.com/whatwg/html/pull/12302,Editorial: Specify `for` on two structs' properties.,2026-03-24T05:59:31Z,mikewest
4114489082,whatwg/html,See my comment here https://github.com/whatwg/html/issues/12305#issuecomment-4114487190 which I thin,https://github.com/whatwg/html/issues/12304#issuecomment-4114489082,https://github.com/whatwg/html/issues/12304,popover=hint has multiple weird and inconsistent behaviours,2026-03-24T00:04:18Z,mfreed7
4114487190,whatwg/html,"> But that's my point, it isn't very intentional. The only place I found a reference to it being wro",https://github.com/whatwg/html/issues/12305#issuecomment-4114487190,https://github.com/whatwg/html/issues/12305,popover=auto inside popover=hint has really weird results,2026-03-24T00:03:44Z,mfreed7
4113899275,whatwg/html,It might be worth focusing on https://github.com/whatwg/html/issues/12304 first. Once the nesting mo,https://github.com/whatwg/html/issues/12305#issuecomment-4113899275,https://github.com/whatwg/html/issues/12305,popover=auto inside popover=hint has really weird results,2026-03-23T21:46:30Z,jakearchibald
4113821533,whatwg/html,> But this is intentionally _not_ something the developer is supposed to be doing: nesting an `auto`,https://github.com/whatwg/html/issues/12305#issuecomment-4113821533,https://github.com/whatwg/html/issues/12305,popover=auto inside popover=hint has really weird results,2026-03-23T21:29:47Z,jakearchibald
4113650164,whatwg/html,"> What if opening an auto popover didn't close an ancestor hint popover?  That's a fairly large ""wha",https://github.com/whatwg/html/issues/12305#issuecomment-4113650164,https://github.com/whatwg/html/issues/12305,popover=auto inside popover=hint has really weird results,2026-03-23T20:55:09Z,mfreed7
4113279309,whatwg/html,"What if opening an auto popover didn't close an ancestor hint popover? ",https://github.com/whatwg/html/issues/12305#issuecomment-4113279309,https://github.com/whatwg/html/issues/12305,popover=auto inside popover=hint has really weird results,2026-03-23T19:48:54Z,jakearchibald
4113137593,whatwg/html,I think this is ready for review @annevk ?,https://github.com/whatwg/html/pull/12266#issuecomment-4113137593,https://github.com/whatwg/html/pull/12266,Set the fragment scripting mode based on the context document,2026-03-23T19:23:15Z,noamr
4113098373,whatwg/html,"> Yes. Is that… intentional? Especially considering the behaviour later in the video.  Well, obvious",https://github.com/whatwg/html/issues/12305#issuecomment-4113098373,https://github.com/whatwg/html/issues/12305,popover=auto inside popover=hint has really weird results,2026-03-23T19:16:39Z,mfreed7
