id,repo,body,url,issue_url,issue_title,created_at,user
2307048359,whatwg/html,The suggested changes make sense to me and seems in line with what CSS UI expects.  Last I checked,https://github.com/whatwg/html/issues/10569#issuecomment-2307048359,https://github.com/whatwg/html/issues/10569,Specify primitive appearance for <meter>,2024-08-23T13:01:00Z,zcorpan
2306956715,whatwg/notifications,"It seems like that might allow for determining aspects about the system. I'd rather not reveal such ",https://github.com/whatwg/notifications/issues/200#issuecomment-2306956715,https://github.com/whatwg/notifications/issues/200,Define what happens when the notification platform fails to show the notification,2024-08-23T12:07:07Z,annevk
2306947837,whatwg/notifications,Closing as this idea didn't gain traction.,https://github.com/whatwg/notifications/issues/139#issuecomment-2306947837,https://github.com/whatwg/notifications/issues/139,Improving predictability of the Notification API,2024-08-23T12:01:42Z,annevk
2306943717,whatwg/html,"The ""in select scope"" I think should be removed altogether since it assumes the stack will not have ",https://github.com/whatwg/html/pull/10557#issuecomment-2306943717,https://github.com/whatwg/html/pull/10557,Relax `<select>` parser,2024-08-23T11:58:59Z,zcorpan
2306928425,whatwg/notifications,"This feature is part of https://github.com/w3c/push-api/issues/360 to enable fully declarative push ",https://github.com/whatwg/notifications/pull/213#issuecomment-2306928425,https://github.com/whatwg/notifications/pull/213,Allow notifications and actions to specify a navigable URL,2024-08-23T11:48:49Z,annevk
2306782051,whatwg/html,"@keithamus this only works if you place the slotted content within the wrapper element, which defeat",https://github.com/whatwg/html/issues/9614#issuecomment-2306782051,https://github.com/whatwg/html/issues/9614,<teleport> element,2024-08-23T10:21:27Z,CyberAP
2306694477,whatwg/html,"Why can't you move the shadowroot to the `div class=body`?  ```html <div class=""body"">   <templa",https://github.com/whatwg/html/issues/9614#issuecomment-2306694477,https://github.com/whatwg/html/issues/9614,<teleport> element,2024-08-23T09:34:02Z,keithamus
2306516552,whatwg/html,@keithamus how you define deep slots outside of shadow root? This won't work:  ```html <tele-port,https://github.com/whatwg/html/issues/9614#issuecomment-2306516552,https://github.com/whatwg/html/issues/9614,<teleport> element,2024-08-23T07:59:16Z,CyberAP
2306506981,whatwg/html,Why would you need to style inside the shadowroot? The shadowroot just contains two slots so everyth,https://github.com/whatwg/html/issues/9614#issuecomment-2306506981,https://github.com/whatwg/html/issues/9614,<teleport> element,2024-08-23T07:53:06Z,keithamus
2306413941,whatwg/html,> Could you describe some of these?  @keithamus the main issue is styling. You have to put your pr,https://github.com/whatwg/html/issues/9614#issuecomment-2306413941,https://github.com/whatwg/html/issues/9614,<teleport> element,2024-08-23T06:51:59Z,CyberAP
2306411923,whatwg/dom,"I have a couple of concerns given the existence of the ""reverse origin trial"":  - It's not transpa",https://github.com/whatwg/dom/issues/305#issuecomment-2306411923,https://github.com/whatwg/dom/issues/305,Define mutation events,2024-08-23T06:50:24Z,annevk
2306392412,whatwg/html,"> Consensus was to wait for WebKit's feedback by next week, given this is the first time we're consi",https://github.com/whatwg/html/issues/10560#issuecomment-2306392412,https://github.com/whatwg/html/issues/10560,Upcoming WHATNOT meeting on 2024-08-22,2024-08-23T06:36:51Z,annevk
2306257921,whatwg/webidl,Per https://github.com/w3c/css-houdini-drafts/pull/1127/files#r1728342155 I don't think we should ex,https://github.com/whatwg/webidl/pull/1427#issuecomment-2306257921,https://github.com/whatwg/webidl/pull/1427,"export ""is a platform object""",2024-08-23T04:33:13Z,domenic
2306251175,w3c/pointerevents,"Okay, then, I'll update the tricky code before enabling the new behavior on Firefox.",https://github.com/w3c/pointerevents/issues/508#issuecomment-2306251175,https://github.com/w3c/pointerevents/issues/508,Clarify what event is `userEvent` to consider `click`/`auxclick` event target after `touchend` (or `pointerup`),2024-08-23T04:31:45Z,masayuki-nakano
2306077936,whatwg/html,"Replied to comments. PTAL again, thanks!",https://github.com/whatwg/html/pull/10154#issuecomment-2306077936,https://github.com/whatwg/html/pull/10154,Add may-block reasons to NotRestoredReasons,2024-08-23T02:40:34Z,rubberyuzu
2305935774,whatwg/html,> * Need to check that a `select` element is in scope so that parsing of option/optgroup tags outsid,https://github.com/whatwg/html/pull/10557#issuecomment-2305935774,https://github.com/whatwg/html/pull/10557,Relax `<select>` parser,2024-08-22T23:57:54Z,josepharhar
2305924795,webkit/standards-positions,Both Chromium and Firefox (see [here](https://searchfox.org/mozilla-central/source/dom/docs/navigati,https://github.com/WebKit/standards-positions/issues/383#issuecomment-2305924795,https://github.com/WebKit/standards-positions/issues/383,Future browsing context group dependency hint,2024-08-22T23:43:08Z,kjmcnee
2305918606,whatwg/html,"We have discussed the stage 2 entrance in the last 2 triage meetings, and we have 2 implementers sup",https://github.com/whatwg/html/issues/9799#issuecomment-2305918606,https://github.com/whatwg/html/issues/9799,Customizable `<select>` element,2024-08-22T23:35:33Z,past
2305913713,whatwg/html,Thank you all for attending the meeting today and special thanks to Chris Harrelson for taking meeti,https://github.com/whatwg/html/issues/10560#issuecomment-2305913713,https://github.com/whatwg/html/issues/10560,Upcoming WHATNOT meeting on 2024-08-22,2024-08-22T23:30:02Z,past
2305908896,whatwg/notifications,Having a way to bound to a tab might affect the API usage quite a bit.  Needing to open a tab all th,https://github.com/whatwg/notifications/pull/213#issuecomment-2305908896,https://github.com/whatwg/notifications/pull/213,Allow notifications and actions to specify a navigable URL,2024-08-22T23:24:32Z,smaug----
2305908133,whatwg/html,"@hsivonen asked: > @aphillips , What's the purpose of hosting ""."" out of utext when localpart is de",https://github.com/whatwg/html/pull/10522#issuecomment-2305908133,https://github.com/whatwg/html/pull/10522,Add support for internationalized email addresses,2024-08-22T23:23:36Z,aphillips
2305875929,WICG/webcomponents,"The behavior of the `HTMLLabelElement.control` property should also follow whatever is decided here ",https://github.com/WICG/webcomponents/issues/1072#issuecomment-2305875929,https://github.com/WICG/webcomponents/issues/1072,Reference Target: Should the `form` and `list` JavaScript attributes return the host element?,2024-08-22T22:50:25Z,dandclark
2305606998,WICG/webcomponents,I agree this is definitely something that needs to be solved. But I think it should be its own thing,https://github.com/WICG/webcomponents/issues/1068#issuecomment-2305606998,https://github.com/WICG/webcomponents/issues/1068,"Reference Target, level 2",2024-08-22T20:47:50Z,behowell
2305589112,webkit/standards-positions,"We support this. It's implemented, pending some syntax changes tracked in GitHub Issues.",https://github.com/WebKit/standards-positions/issues/377#issuecomment-2305589112,https://github.com/WebKit/standards-positions/issues/377,CSS Shape function,2024-08-22T20:38:07Z,smfr
2305587475,webkit/standards-positions,We do. Implementation is almost complete.,https://github.com/WebKit/standards-positions/issues/379#issuecomment-2305587475,https://github.com/WebKit/standards-positions/issues/379,CSS background-clip: border-area,2024-08-22T20:37:13Z,smfr
2305574660,WICG/webcomponents,"I like option 2a the best, as long as changing the return type of those attributes can be done in a ",https://github.com/WICG/webcomponents/issues/1072#issuecomment-2305574660,https://github.com/WICG/webcomponents/issues/1072,Reference Target: Should the `form` and `list` JavaScript attributes return the host element?,2024-08-22T20:29:03Z,behowell
2305565580,WICG/webcomponents,"I think Option 1a seems like the best choice. The reference is invalid, and any JS attribute that re",https://github.com/WICG/webcomponents/issues/1071#issuecomment-2305565580,https://github.com/WICG/webcomponents/issues/1071,Reference Target: How to handle invalid ID references?,2024-08-22T20:23:05Z,behowell
2305420362,whatwg/html,> There are far more reasons why JS can fail than just being deliberately disabled by users.  Grea,https://github.com/whatwg/html/issues/3577#issuecomment-2305420362,https://github.com/whatwg/html/issues/3577,"HTML forms do not support the PUT, PATCH and DELETE methods",2024-08-22T18:49:08Z,alexpetros
2305335689,whatwg/html,"@syg thanks for your summary here, that sounds like a good outline to me.  With regards to:  > G",https://github.com/whatwg/html/pull/10380#issuecomment-2305335689,https://github.com/whatwg/html/pull/10380,Latest WebAssembly ESM Integration rebase,2024-08-22T17:59:29Z,guybedford
2305168936,w3c/pointerevents,"> So, I think that in these cases, it's safe to not align the click event target to pointerdown and ",https://github.com/w3c/pointerevents/issues/508#issuecomment-2305168936,https://github.com/w3c/pointerevents/issues/508,Clarify what event is `userEvent` to consider `click`/`auxclick` event target after `touchend` (or `pointerup`),2024-08-22T16:23:52Z,mustaqahmed
2304864828,whatwg/html,> Wouldn't it make more sense to put a value attribute on the option as well?  It seems cumbersome,https://github.com/whatwg/html/issues/10317#issuecomment-2304864828,https://github.com/whatwg/html/issues/10317,Content model and 'what' to render for stylable `<select>` elements,2024-08-22T14:48:23Z,annevk
2304823834,whatwg/html,i don't see the downside of calling this out. Even if just briefly and cross linking over to https:/,https://github.com/whatwg/html/issues/10317#issuecomment-2304823834,https://github.com/whatwg/html/issues/10317,Content model and 'what' to render for stylable `<select>` elements,2024-08-22T14:30:33Z,scottaohara
2304377029,whatwg/html,Analysis of the [mXSS](https://cure53.de/fp170.pdf) risk with this change:  Current parsers will i,https://github.com/whatwg/html/issues/10310#issuecomment-2304377029,https://github.com/whatwg/html/issues/10310,HTML parser changes for stylable `<select>`,2024-08-22T10:57:36Z,zcorpan
2304149649,whatwg/html,"- Need to check that a `select` element is in scope so that parsing of option/optgroup tags outside ",https://github.com/whatwg/html/pull/10557#issuecomment-2304149649,https://github.com/whatwg/html/pull/10557,Relax `<select>` parser,2024-08-22T09:02:46Z,zcorpan
2304043562,whatwg/dom,With https://github.com/web-platform-tests/wpt/commit/e0c3477d2cff8aaaefd421ca6543198ec30dc3ef lande,https://github.com/whatwg/dom/issues/305#issuecomment-2304043562,https://github.com/whatwg/dom/issues/305,Define mutation events,2024-08-22T08:08:18Z,annevk
2303995262,webkit/standards-positions,"Taking a step back, it seems that the problem here is that Chromium started making BCG swaps that ar",https://github.com/WebKit/standards-positions/issues/383#issuecomment-2303995262,https://github.com/WebKit/standards-positions/issues/383,Future browsing context group dependency hint,2024-08-22T07:41:55Z,annevk
2303841335,w3c/editcontext,I assume that this text is going to be used by the IME system (to provide context-aware virtual keyb,https://github.com/w3c/edit-context/issues/104#issuecomment-2303841335,https://github.com/w3c/edit-context/issues/104,`EditContext.text` should not extend by default,2024-08-22T05:54:25Z,marijnh
2303831706,mozilla/standards-positions,This issue has been quiet for a while now. I see there is now an [issue](https://bugzilla.mozilla.or,https://github.com/mozilla/standards-positions/issues/199#issuecomment-2303831706,https://github.com/mozilla/standards-positions/issues/199,EditContext,2024-08-22T05:44:33Z,marijnh
2303573521,whatwg/html,"> At a high level, I think it is more important to get the API right than it is to drive immediate a",https://github.com/whatwg/html/issues/3577#issuecomment-2303573521,https://github.com/whatwg/html/issues/3577,"HTML forms do not support the PUT, PATCH and DELETE methods",2024-08-22T02:50:19Z,jlunman
2303372025,w3ctag/design-reviews,The updates have been merged in https://github.com/WICG/nav-speculation/commit/d8ce9b5586bcb079a3942,https://github.com/w3ctag/design-reviews/issues/931#issuecomment-2303372025,https://github.com/w3ctag/design-reviews/issues/931,Speculation rules: target_hint field,2024-08-22T01:03:39Z,domenic
2303309587,webkit/standards-positions,"@annevk, any conclusion from https://github.com/kyraseevers/Partitioning-visited-links-history/issue",https://github.com/WebKit/standards-positions/issues/363#issuecomment-2303309587,https://github.com/WebKit/standards-positions/issues/363,Partitioning :visited links history,2024-08-21T23:52:31Z,marcoscaceres
2303305967,webkit/standards-positions,"As this is already in the spec, presumedly it has working group consensus. Therefore closing this is",https://github.com/WebKit/standards-positions/issues/365#issuecomment-2303305967,https://github.com/WebKit/standards-positions/issues/365,WebAuthn hints parameter,2024-08-21T23:48:08Z,marcoscaceres
2303303522,webkit/standards-positions,"Pinging @anttijk @alanbaradlay for visibility. ",https://github.com/WebKit/standards-positions/issues/366#issuecomment-2303303522,https://github.com/WebKit/standards-positions/issues/366,Implement box-decoration-break:clone everywhere,2024-08-21T23:45:35Z,marcoscaceres
2303296914,webkit/standards-positions,"Adding @twilco for visibility. ",https://github.com/WebKit/standards-positions/issues/370#issuecomment-2303296914,https://github.com/WebKit/standards-positions/issues/370,ariaNotify API,2024-08-21T23:37:31Z,marcoscaceres
2303289463,webkit/standards-positions,"I don't think this needs a standards position... it's already in the spec, which theoretically means",https://github.com/WebKit/standards-positions/issues/373#issuecomment-2303289463,https://github.com/WebKit/standards-positions/issues/373,WebAuthn JSON serialization,2024-08-21T23:28:32Z,marcoscaceres
2303285395,webkit/standards-positions,"@smfr, same as the other CSS one you filed... do we ""support"" this? Is it implemented? ",https://github.com/WebKit/standards-positions/issues/377#issuecomment-2303285395,https://github.com/WebKit/standards-positions/issues/377,CSS Shape function,2024-08-21T23:23:36Z,marcoscaceres
2303283687,webkit/standards-positions,"@smfr, do we ""support"" this? Is this implemented in WebKit? ",https://github.com/WebKit/standards-positions/issues/379#issuecomment-2303283687,https://github.com/WebKit/standards-positions/issues/379,CSS background-clip: border-area,2024-08-21T23:21:36Z,marcoscaceres
2303281920,webkit/standards-positions,"@cdumez, who might be good to look at this? ",https://github.com/WebKit/standards-positions/issues/381#issuecomment-2303281920,https://github.com/WebKit/standards-positions/issues/381,Dynamic Import Maps,2024-08-21T23:19:51Z,marcoscaceres
2303281006,webkit/standards-positions,"Yup, I filed a bug on the Observables repo.",https://github.com/WebKit/standards-positions/issues/292#issuecomment-2303281006,https://github.com/WebKit/standards-positions/issues/292,Observable,2024-08-21T23:19:05Z,esprehn
2303270317,webkit/standards-positions,"As there's been no objections since last week, going ahead and closing this. ",https://github.com/WebKit/standards-positions/issues/382#issuecomment-2303270317,https://github.com/WebKit/standards-positions/issues/382,CSS query container flat tree lookup,2024-08-21T23:13:15Z,marcoscaceres
2303267621,webkit/standards-positions,"Indeed, for this proposal to be meaningful for the spec, the named targeting needs to be scoped to B",https://github.com/WebKit/standards-positions/issues/383#issuecomment-2303267621,https://github.com/WebKit/standards-positions/issues/383,Future browsing context group dependency hint,2024-08-21T23:11:49Z,kjmcnee
2303261641,whatwg/fullscreen,Firefox >= 112 removes content outside full screen elements from the accessibility tree.,https://github.com/whatwg/fullscreen/issues/197#issuecomment-2303261641,https://github.com/whatwg/fullscreen/issues/197,Clarification for Accessibility requested,2024-08-21T23:06:38Z,jcsteh
2303075742,w3ctag/design-reviews,"Thank you for your patience while waiting for us to take a look at this.    The <abbr title=""Techn",https://github.com/w3ctag/design-reviews/issues/940#issuecomment-2303075742,https://github.com/w3ctag/design-reviews/issues/940,JS String Builtins for WebAssembly,2024-08-21T21:55:07Z,plinss
2302982075,whatwg/html,> I believe there are more changes to this spec based on this comment: [#9625 (comment)](https://git,https://github.com/whatwg/html/pull/9841#issuecomment-2302982075,https://github.com/whatwg/html/pull/9841,Add invoker commands (commandfor & command),2024-08-21T20:44:54Z,mfreed7
2302979457,whatwg/fullscreen,"Yes, anytime an element is not rendered or interactive to mainstream users, I'd support it being rem",https://github.com/whatwg/fullscreen/issues/197#issuecomment-2302979457,https://github.com/whatwg/fullscreen/issues/197,Clarification for Accessibility requested,2024-08-21T20:43:08Z,cookiecrook
2302765191,whatwg/html,"No need for `custom-element`, you're right unless the enclosing element contains DOM nodes, in which",https://github.com/whatwg/html/issues/10571#issuecomment-2302765191,https://github.com/whatwg/html/issues/10571,Add src attribute to <template> to load a template from file,2024-08-21T18:58:27Z,mildred
2302614054,whatwg/html,"> Should alt text be included in the submitted value? That would be a normative change, but maybe it",https://github.com/whatwg/html/issues/10317#issuecomment-2302614054,https://github.com/whatwg/html/issues/10317,Content model and 'what' to render for stylable `<select>` elements,2024-08-21T17:31:46Z,josepharhar
2302597556,whatwg/html,Okay I think _that_ is everything.  @annevk this removes the input attributes and inlines the mixi,https://github.com/whatwg/html/pull/9841#issuecomment-2302597556,https://github.com/whatwg/html/pull/9841,Add invoker commands (commandfor & command),2024-08-21T17:21:51Z,keithamus
2302566006,whatwg/dom,"I ran into this today, it would be really nice to just be able to do  ```javascript for (textNode",https://github.com/whatwg/dom/issues/147#issuecomment-2302566006,https://github.com/whatwg/dom/issues/147,Consider support for ES2015 iterator protocol for NodeIterator,2024-08-21T17:03:08Z,nightpool
2302519993,whatwg/html,> > I just added a few additional changes based on recent decisions. As far as know this is now up t,https://github.com/whatwg/html/pull/9841#issuecomment-2302519993,https://github.com/whatwg/html/pull/9841,Add invoker commands (commandfor & command),2024-08-21T16:37:30Z,keithamus
2302512483,whatwg/html,"> I just added a few additional changes based on recent decisions. As far as know this is now up to ",https://github.com/whatwg/html/pull/9841#issuecomment-2302512483,https://github.com/whatwg/html/pull/9841,Add invoker commands (commandfor & command),2024-08-21T16:33:25Z,mfreed7
2302497570,WICG/webcomponents,@sorvell  > @EisenbergEffect >  > > what if we could introduce the idea of lazy evaluation to tag,https://github.com/WICG/webcomponents/issues/1069#issuecomment-2302497570,https://github.com/WICG/webcomponents/issues/1069,[templates] A declarative JavaScript templating API,2024-08-21T16:25:48Z,justinfagnani
2302481648,WICG/webcomponents,@mdesantis   > 1. How would this integrate with events?  Underlying all template bindings will b,https://github.com/WICG/webcomponents/issues/1069#issuecomment-2302481648,https://github.com/WICG/webcomponents/issues/1069,[templates] A declarative JavaScript templating API,2024-08-21T16:18:36Z,justinfagnani
2302435664,whatwg/dom," > Would folks be receptive to an HTML spec PR removing the ~17 mentions of ""mutation events"" at th",https://github.com/whatwg/dom/issues/305#issuecomment-2302435664,https://github.com/whatwg/dom/issues/305,Define mutation events,2024-08-21T15:57:01Z,mfreed7
2302407051,whatwg/dom,"> Knock on wood! ðŸ˜„ But yeah, so far the removal is going cautiously well. It only very recently (la",https://github.com/whatwg/dom/issues/305#issuecomment-2302407051,https://github.com/whatwg/dom/issues/305,Define mutation events,2024-08-21T15:42:54Z,mfreed7
2302371493,WICG/webcomponents,@sorvell   > it would necessarily involve a compiler and that compiler would be responsible for do,https://github.com/WICG/webcomponents/issues/1069#issuecomment-2302371493,https://github.com/WICG/webcomponents/issues/1069,[templates] A declarative JavaScript templating API,2024-08-21T15:26:00Z,NullVoxPopuli
2302314785,WICG/webcomponents,"Hello everyone, I have some (most likely) naive questions:  1. How would this integrate with event",https://github.com/WICG/webcomponents/issues/1069#issuecomment-2302314785,https://github.com/WICG/webcomponents/issues/1069,[templates] A declarative JavaScript templating API,2024-08-21T15:09:33Z,mdesantis
2302257428,WICG/webcomponents,@EisenbergEffect  > what if we could introduce the idea of lazy evaluation to tagged template liter,https://github.com/WICG/webcomponents/issues/1069#issuecomment-2302257428,https://github.com/WICG/webcomponents/issues/1069,[templates] A declarative JavaScript templating API,2024-08-21T14:54:34Z,sorvell
2302236668,WICG/webcomponents,"@NullVoxPopuli  > there is no need to know about any footguns, because there would be none (unless ",https://github.com/WICG/webcomponents/issues/1069#issuecomment-2302236668,https://github.com/WICG/webcomponents/issues/1069,[templates] A declarative JavaScript templating API,2024-08-21T14:48:00Z,sorvell
2302060018,whatwg/dom,Thanks!,https://github.com/whatwg/dom/pull/1306#issuecomment-2302060018,https://github.com/whatwg/dom/pull/1306,Corrected the variable's name from 'element' to 'result'.,2024-08-21T13:27:21Z,annevk
2301353859,w3c/clipboard-apis,Making it  > Issue: clipboard-write does not have agreement. See ... for more details.  could wo,https://github.com/w3c/clipboard-apis/pull/219#issuecomment-2301353859,https://github.com/w3c/clipboard-apis/pull/219,"Remove issues claiming ""clipboard-write"" was removed",2024-08-21T07:38:05Z,annevk
2301330450,whatwg/html,"@yoavweiss did you open a PR already to drop ""cross origin"" from the internal concepts?",https://github.com/whatwg/html/pull/10394#issuecomment-2301330450,https://github.com/whatwg/html/pull/10394,Add a `noopener-allow-popups` value to COOP,2024-08-21T07:26:27Z,annevk
2301286249,w3ctag/design-reviews,Sorry for my late action. @robertlin-chromium is now updating the explainer.,https://github.com/w3ctag/design-reviews/issues/931#issuecomment-2301286249,https://github.com/w3ctag/design-reviews/issues/931,Speculation rules: target_hint field,2024-08-21T07:02:27Z,nhiroki
2301257291,whatwg/webidl,"Just to make sure I understand correctly, this is blocked on tests and this is best tested through t",https://github.com/whatwg/webidl/pull/1397#issuecomment-2301257291,https://github.com/whatwg/webidl/pull/1397,Add `async iterable<T>` type to WebIDL,2024-08-21T06:44:05Z,annevk
2301246148,whatwg/fullscreen,"This does seem like a reasonable concern. Perhaps the non-fullscreen elements need to be treated as ",https://github.com/whatwg/fullscreen/issues/197#issuecomment-2301246148,https://github.com/whatwg/fullscreen/issues/197,Clarification for Accessibility requested,2024-08-21T06:36:18Z,annevk
2301166542,whatwg/html,"With  ```html <template shadowrootmode=""open"" src=""included/file.html""></template> ``` there is ",https://github.com/whatwg/html/issues/10571#issuecomment-2301166542,https://github.com/whatwg/html/issues/10571,Add src attribute to <template> to load a template from file,2024-08-21T05:32:49Z,sashafirsov
2300652852,whatwg/html,"This appears to be a new feature proposal, but you used the wrong issue template. Please use the ""Ne",https://github.com/whatwg/html/issues/10570#issuecomment-2300652852,https://github.com/whatwg/html/issues/10570,Proposal for adding volume attribute to the <audio> element in HTML,2024-08-21T03:50:46Z,domenic
2299898474,w3ctag/design-reviews,"Recent discussion on #838 (the overall design review of Fenced Frames) covered the ""last 4 digits"" p",https://github.com/w3ctag/design-reviews/issues/975#issuecomment-2299898474,https://github.com/w3ctag/design-reviews/issues/975,Fenced frames with local unpartitioned data access,2024-08-20T22:57:42Z,hober
2299878955,whatwg/html,I'm not too familiar with the HTML side of the module loading machinery but I think this makes mostl,https://github.com/whatwg/html/pull/10380#issuecomment-2299878955,https://github.com/whatwg/html/pull/10380,Latest WebAssembly ESM Integration rebase,2024-08-20T22:39:17Z,syg
2299856315,w3ctag/design-reviews,"I had a good conversation with @jernoble about this a few weeks ago. It does make sense for this to ",https://github.com/w3ctag/design-reviews/issues/952#issuecomment-2299856315,https://github.com/w3ctag/design-reviews/issues/952,Support Video Chapter in MediaMetadata,2024-08-20T22:17:30Z,hober
2299853094,w3ctag/design-reviews,Discussed with @hober.  This looks like it is on track.  The choices made all seem appropriate.  T,https://github.com/w3ctag/design-reviews/issues/943#issuecomment-2299853094,https://github.com/w3ctag/design-reviews/issues/943,Spec review for Snap Events,2024-08-20T22:14:38Z,martinthomson
2299799834,webkit/standards-positions," > > I would like the render blocking spec to describe the behavior of scrolling, playing media and",https://github.com/WebKit/standards-positions/issues/245#issuecomment-2299799834,https://github.com/WebKit/standards-positions/issues/245,Document Render Blocking,2024-08-20T21:30:37Z,noamr
