id,repo,body,url,issue_url,issue_title,created_at,user
4113021024,whatwg/html,"Yes. Is that… intentional? Especially considering the behaviour later in the video. ",https://github.com/whatwg/html/issues/12305#issuecomment-4113021024,https://github.com/whatwg/html/issues/12305,popover=auto inside popover=hint has really weird results,2026-03-23T19:03:14Z,jakearchibald
4112620279,whatwg/html,> It's annoying for WebKit at least as typically pull in one directory at the time.  Oh! That is ann,https://github.com/whatwg/html/issues/12183#issuecomment-4112620279,https://github.com/whatwg/html/issues/12183,:hover and :active changes for <select>,2026-03-23T17:57:34Z,mfreed7
4112592530,whatwg/html,It's annoying for WebKit at least as typically pull in one directory at the time.,https://github.com/whatwg/html/issues/12183#issuecomment-4112592530,https://github.com/whatwg/html/issues/12183,:hover and :active changes for <select>,2026-03-23T17:52:50Z,annevk
4112570128,whatwg/html,> I'm guessing because it's pulling from interestfor directory? Perhaps there's a better place to pu,https://github.com/whatwg/html/issues/12183#issuecomment-4112570128,https://github.com/whatwg/html/issues/12183,:hover and :active changes for <select>,2026-03-23T17:48:58Z,mfreed7
4112548156,whatwg/html,"I'm guessing because it's pulling from interestfor directory? Perhaps there's a better place to put ",https://github.com/whatwg/html/issues/12183#issuecomment-4112548156,https://github.com/whatwg/html/issues/12183,:hover and :active changes for <select>,2026-03-23T17:45:37Z,lukewarlow
4112528359,whatwg/html,> I also put up some tests here: [web-platform-tests/wpt#58648](https://github.com/web-platform-test,https://github.com/whatwg/html/issues/12183#issuecomment-4112528359,https://github.com/whatwg/html/issues/12183,:hover and :active changes for <select>,2026-03-23T17:42:47Z,mfreed7
4112341356,whatwg/html,"> @mfreed7 I've added tests for this now.  Cool, thanks. Given that this seems like it'll land, I'",https://github.com/whatwg/html/pull/11881#issuecomment-4112341356,https://github.com/whatwg/html/pull/11881,Make topmargin and leftmargin attributes apply to both sides,2026-03-23T17:23:29Z,mfreed7
4112338835,whatwg/dom,"I checked the behavior of equivalent APIs in Node.js out of curiosity, and the behavior is a little ",https://github.com/whatwg/dom/issues/1461#issuecomment-4112338835,https://github.com/whatwg/dom/issues/1461,`AbortSignal.timeout()` may not abort past the timeout,2026-03-23T17:23:10Z,nstepien
4112320126,whatwg/html,"I think you've hit exactly this case, right?  https://source.chromium.org/chromium/chromium/src/+/ma",https://github.com/whatwg/html/issues/12305#issuecomment-4112320126,https://github.com/whatwg/html/issues/12305,popover=auto inside popover=hint has really weird results,2026-03-23T17:20:24Z,mfreed7
4112250730,w3ctag/design-reviews,> Relying solely on HTTP redirects would prevent migrations where the URL does not change. For examp,https://github.com/w3ctag/design-reviews/issues/1164#issuecomment-4112250730,https://github.com/w3ctag/design-reviews/issues/1164,Incubation: PWA (same-site) Origin Migration,2026-03-23T17:10:19Z,Dp-Goog
4111846224,whatwg/dom,When trying out the exact example given in the spec: https://dom.spec.whatwg.org/#example-throwifabo,https://github.com/whatwg/dom/issues/1461#issuecomment-4111846224,https://github.com/whatwg/dom/issues/1461,`AbortSignal.timeout()` may not abort past the timeout,2026-03-23T16:14:36Z,nstepien
4111636416,whatwg/html,"This now has support from Gecko, WebKit, and Chromium, as far as I can tell. All boxes are ticked. I",https://github.com/whatwg/html/pull/11980#issuecomment-4111636416,https://github.com/whatwg/html/pull/11980,Add support for video and audio element lazy-loading via the loading attribute,2026-03-23T15:45:45Z,zcorpan
4111580755,whatwg/dom,>Are you suggesting that `AbortSignal.timeout()` should update the `aborted` flag from outside the t,https://github.com/whatwg/dom/issues/1461#issuecomment-4111580755,https://github.com/whatwg/dom/issues/1461,`AbortSignal.timeout()` may not abort past the timeout,2026-03-23T15:37:45Z,nstepien
4111435513,whatwg/html,"The acks section doesn’t list company names, and I believe that's intentional. That said, the contri",https://github.com/whatwg/html/pull/12292#issuecomment-4111435513,https://github.com/whatwg/html/pull/12292,Propose addition to org attribution section for contributions to media lazy loading,2026-03-23T15:18:35Z,zcorpan
4111249683,whatwg/html,@mfreed7 I've added tests for this now.,https://github.com/whatwg/html/pull/11881#issuecomment-4111249683,https://github.com/whatwg/html/pull/11881,Make topmargin and leftmargin attributes apply to both sides,2026-03-23T14:54:28Z,zcorpan
4110625478,whatwg/html,"Yes, essentially if you put all the text on a single line, we break on the spaces.",https://github.com/whatwg/html/pull/12302#issuecomment-4110625478,https://github.com/whatwg/html/pull/12302,Editorial: Specify `for` on two structs' properties.,2026-03-23T13:31:24Z,annevk
4109002143,whatwg/html,(I wasn't sure about the formatting here. Should I have broken the line inside the attribute's value,https://github.com/whatwg/html/pull/12302#issuecomment-4109002143,https://github.com/whatwg/html/pull/12302,Editorial: Specify `for` on two structs' properties.,2026-03-23T08:58:27Z,mikewest
4108631271,whatwg/dom,You should probably queue tasks to perform your work as to not block the event loop. I could maybe s,https://github.com/whatwg/dom/issues/1461#issuecomment-4108631271,https://github.com/whatwg/dom/issues/1461,`AbortSignal.timeout()` may not abort past the timeout,2026-03-23T07:47:41Z,annevk
4107835370,w3c/web-performance,This is really helpful context. I think I better understand the intent behind the change. I agree th,https://github.com/w3c/web-performance/pull/67#issuecomment-4107835370,https://github.com/w3c/web-performance/pull/67,Web Performance Working Group 2026 Charter,2026-03-23T04:04:04Z,marcoscaceres
4107536284,whatwg/dom,"@nstepien As per the current spec you quoted, the abort steps are queued as a task. This means that ",https://github.com/whatwg/dom/issues/1461#issuecomment-4107536284,https://github.com/whatwg/dom/issues/1461,`AbortSignal.timeout()` may not abort past the timeout,2026-03-23T02:06:59Z,juner
4106227691,whatwg/fs,@annevk — one small follow-up on the **Participation** check. I've already signed the individual agr,https://github.com/whatwg/fs/pull/182#issuecomment-4106227691,https://github.com/whatwg/fs/pull/182,fs: Remove nullable markers from WriteParams members,2026-03-22T13:03:32Z,usamanadeemdeveloper
4106156906,whatwg/fs,Hi @annevk — wanted to give you a full status update and flag a couple of things that need attention,https://github.com/whatwg/fs/pull/182#issuecomment-4106156906,https://github.com/whatwg/fs/pull/182,fs: Remove nullable markers from WriteParams members,2026-03-22T12:11:57Z,usamanadeemdeveloper
4103192892,w3c/payment-request,[ianbjacobs](https://github.com/ianbjacobs) marked as non substantive for IPR from ash-nazg.,https://github.com/w3c/payment-request/pull/1062#issuecomment-4103192892,https://github.com/w3c/payment-request/pull/1062,Tidied up document using tidy-html5,2026-03-21T12:02:30Z,w3cbot
4102742501,whatwg/html,A bit unfortunate your test relies on a resource from a completely different set of tests.,https://github.com/whatwg/html/issues/12183#issuecomment-4102742501,https://github.com/whatwg/html/issues/12183,:hover and :active changes for <select>,2026-03-21T07:12:37Z,annevk
4102714834,whatwg/html,I also put up some tests here: https://github.com/web-platform-tests/wpt/pull/58648,https://github.com/whatwg/html/issues/12183#issuecomment-4102714834,https://github.com/whatwg/html/issues/12183,:hover and :active changes for <select>,2026-03-21T07:04:48Z,annevk
4102283756,w3c/payment-request,> Nit: are you sure you want the “ algorithm” at the end of each export? It might make them more awk,https://github.com/w3c/payment-request/pull/1061#issuecomment-4102283756,https://github.com/w3c/payment-request/pull/1061,[Editorial] Fix exporting of three algorithms,2026-03-21T04:54:55Z,stephenmcgruer
4101562020,whatwg/html,> > I believe this is specified in https://drafts.csswg.org/selectors/#useraction-pseudos > > > [:ho,https://github.com/whatwg/html/issues/12183#issuecomment-4101562020,https://github.com/whatwg/html/issues/12183,:hover and :active changes for <select>,2026-03-21T00:15:04Z,mfreed7
4101252864,WICG/webcomponents,> Some thoughts on how slots may declaratively assign:  It feels to me like we're making a simple th,https://github.com/WICG/webcomponents/issues/967#issuecomment-4101252864,https://github.com/WICG/webcomponents/issues/967,Interaction between imperative slotting and declarative shadow DOM,2026-03-20T22:24:23Z,sorvell
4101162575,WICG/webcomponents,"> Some elements that use manual slot assignment only do so for simple heuristics, such as tag matchi",https://github.com/WICG/webcomponents/issues/967#issuecomment-4101162575,https://github.com/WICG/webcomponents/issues/967,Interaction between imperative slotting and declarative shadow DOM,2026-03-20T21:58:23Z,justinfagnani
4101117460,whatwg/html,I have an (as of yet unreviewed) implementation of these changes for the Ladybird browser here: http,https://github.com/whatwg/html/pull/12294#issuecomment-4101117460,https://github.com/whatwg/html/pull/12294,Properly set visibility state for nested documents,2026-03-20T21:45:30Z,Psychpsyo
4101030283,whatwg/html,Opened https://github.com/whatwg/html/pull/12294 which should hopefully address this.,https://github.com/whatwg/html/issues/12285#issuecomment-4101030283,https://github.com/whatwg/html/issues/12285,Creating an iframe's child navigable as written is impossible.,2026-03-20T21:23:49Z,Psychpsyo
4100450822,w3ctag/design-reviews,@stephanieyzhang Reopened! Sorry for the inconvenience. We occasionally receive spam posts without t,https://github.com/w3ctag/design-reviews/issues/1206#issuecomment-4100450822,https://github.com/w3ctag/design-reviews/issues/1206,Other Spec Review: OpaqueRange,2026-03-20T19:15:24Z,christianliebel
4100285922,w3ctag/design-reviews,"Hello,  I noticed that issue #1206 for OpaqueRange <https://github.com/w3ctag/design-reviews/issu",https://github.com/w3ctag/design-reviews/issues/1206#issuecomment-4100285922,https://github.com/w3ctag/design-reviews/issues/1206,Other Spec Review: OpaqueRange,2026-03-20T18:46:02Z,stephanieyzhang
4099444752,whatwg/html,"Sorry for the ping (@annevk, @zcorpan) after such a long time, but could you please clarify whether ",https://github.com/whatwg/html/pull/12148#issuecomment-4099444752,https://github.com/whatwg/html/pull/12148,Fix type mismatch for reflected FrozenArray<T>?,2026-03-20T16:35:10Z,gmvrpw
4099339442,whatwg/dom,I can switch the WPT test case over if that direction is preferred. I suppose in that case DOM stand,https://github.com/whatwg/dom/pull/1460#issuecomment-4099339442,https://github.com/whatwg/dom/pull/1460,"Differentiate between ""children change"" steps and ""children inserted"" steps",2026-03-20T16:15:54Z,shannonbooth
4099314568,whatwg/dom,> > It's probably not a common scenario but there could be still compatibility bug / regression if w,https://github.com/whatwg/dom/pull/1460#issuecomment-4099314568,https://github.com/whatwg/dom/pull/1460,"Differentiate between ""children change"" steps and ""children inserted"" steps",2026-03-20T16:11:32Z,rniwa
4099296671,whatwg/dom,"> It's probably not a common scenario but there could be still compatibility bug / regression if we ",https://github.com/whatwg/dom/pull/1460#issuecomment-4099296671,https://github.com/whatwg/dom/pull/1460,"Differentiate between ""children change"" steps and ""children inserted"" steps",2026-03-20T16:08:30Z,noamr
4099261998,whatwg/dom,It's probably not a common scenario but there could be still compatibility bug / regression if we ch,https://github.com/whatwg/dom/pull/1460#issuecomment-4099261998,https://github.com/whatwg/dom/pull/1460,"Differentiate between ""children change"" steps and ""children inserted"" steps",2026-03-20T16:02:38Z,rniwa
4099042240,whatwg/dom,I dug up some archeological discussions about this: https://lists.w3.org/Archives/Public/public-what,https://github.com/whatwg/dom/pull/1460#issuecomment-4099042240,https://github.com/whatwg/dom/pull/1460,"Differentiate between ""children change"" steps and ""children inserted"" steps",2026-03-20T15:26:22Z,noamr
4098970878,w3c/web-performance,Thanks for reviewing our charter draft\!\!  > I am not convinced that lowering the bar for inclusi,https://github.com/w3c/web-performance/pull/67#issuecomment-4098970878,https://github.com/w3c/web-performance/pull/67,Web Performance Working Group 2026 Charter,2026-03-20T15:20:57Z,yoavweiss
4098861963,whatwg/html,"Why shouldn't the spec emulate what users do?  - Add a `retry` attribute for `iframe` elements with ",https://github.com/whatwg/html/issues/125#issuecomment-4098861963,https://github.com/whatwg/html/issues/125,spec a way to determine when an iframe fails to load,2026-03-20T15:12:39Z,jabcreations
4098048358,whatwg/html,The proposal is to allow you to specify the overrides without a submit button in the DOM. I think th,https://github.com/whatwg/html/issues/12290#issuecomment-4098048358,https://github.com/whatwg/html/issues/12290,HTMLFormElement.requestSubmit should allow specifying form overrides like a submit button does,2026-03-20T13:41:41Z,nicksloan
4096961452,whatwg/html,> MDN and browser bugs should be completed for this as well before landing.  Done.,https://github.com/whatwg/html/pull/11933#issuecomment-4096961452,https://github.com/whatwg/html/pull/11933,Add text imports,2026-03-20T10:01:45Z,eemeli
4096861704,w3ctag/design-reviews,"Just a small clarification, in   > Relying solely on HTTP redirects would prevent migrations where t",https://github.com/w3ctag/design-reviews/issues/1164#issuecomment-4096861704,https://github.com/w3ctag/design-reviews/issues/1164,Incubation: PWA (same-site) Origin Migration,2026-03-20T09:38:42Z,ylafon
4096763173,whatwg/html,I don't think anything allows for a race here? They're all synchronous algorithms until you're somew,https://github.com/whatwg/html/issues/12290#issuecomment-4096763173,https://github.com/whatwg/html/issues/12290,HTMLFormElement.requestSubmit should allow specifying form overrides like a submit button does,2026-03-20T09:16:44Z,annevk
4096606156,whatwg/html,"I've seen #12150, and I think it would solve my problem.  This proposal offers an alternative to add",https://github.com/whatwg/html/issues/12290#issuecomment-4096606156,https://github.com/whatwg/html/issues/12290,HTMLFormElement.requestSubmit should allow specifying form overrides like a submit button does,2026-03-20T08:39:04Z,nicksloan
4096419363,w3c/web-performance,"With my WebKit hat on, the charter overall is moving in a good direction, especially around clarifyi",https://github.com/w3c/web-performance/pull/67#issuecomment-4096419363,https://github.com/w3c/web-performance/pull/67,Web Performance Working Group 2026 Charter,2026-03-20T08:05:08Z,marcoscaceres
4096334558,whatwg/html,MDN and browser bugs should be completed for this as well before landing.,https://github.com/whatwg/html/pull/11933#issuecomment-4096334558,https://github.com/whatwg/html/pull/11933,Add text imports,2026-03-20T07:48:21Z,annevk
4096151352,whatwg/html,Thanks @shannonbooth!,https://github.com/whatwg/html/pull/12284#issuecomment-4096151352,https://github.com/whatwg/html/pull/12284,Don't prepare script for script elements when src attribute is removed,2026-03-20T07:09:23Z,annevk
4096064365,whatwg/html,> Do the tests cover module preload?  @noamr They do now (I just updated the WPT PR).,https://github.com/whatwg/html/pull/11933#issuecomment-4096064365,https://github.com/whatwg/html/pull/11933,Add text imports,2026-03-20T06:56:03Z,eemeli
4095927118,whatwg/html,"They are read from the element you pass to `requestSubmit()`. I think the main thing you are asking ",https://github.com/whatwg/html/issues/12290#issuecomment-4095927118,https://github.com/whatwg/html/issues/12290,HTMLFormElement.requestSubmit should allow specifying form overrides like a submit button does,2026-03-20T06:26:58Z,annevk
4095211256,w3c/geolocation,"Hi @marcoscaceres and @antosart , I rebased the PR and now we finally get rid of ins and del tag. ",https://github.com/w3c/geolocation/pull/195#issuecomment-4095211256,https://github.com/w3c/geolocation/pull/195,Add support for approximate geolocation,2026-03-20T03:31:46Z,alvinjiooo
4093260922,whatwg/html,"Oh, they do? Didn't know (and hadn't checked)! Ignore my comment then :)",https://github.com/whatwg/html/issues/12262#issuecomment-4093260922,https://github.com/whatwg/html/issues/12262,Consider marking input buttons as obsolete,2026-03-19T21:00:17Z,bramus
4093205667,whatwg/html,All of those exist on HTMLButtonElement too though?,https://github.com/whatwg/html/issues/12262#issuecomment-4093205667,https://github.com/whatwg/html/issues/12262,Consider marking input buttons as obsolete,2026-03-19T20:48:40Z,lukewarlow
4093123180,whatwg/html,One of the reasons to use an `<input type=submit>` is its support for the `formtarget` and other `fo,https://github.com/whatwg/html/issues/12262#issuecomment-4093123180,https://github.com/whatwg/html/issues/12262,Consider marking input buttons as obsolete,2026-03-19T20:32:31Z,bramus
4088854034,whatwg/html,[This Playwright test](https://github.com/microsoft/playwright/blob/23b41bbc614d0f7776e0fff6d9fd7654,https://github.com/whatwg/html/pull/8300#issuecomment-4088854034,https://github.com/whatwg/html/pull/8300,Add integration points for WebDriver BiDi load scripts,2026-03-19T09:28:51Z,hbenl
3386232152,whatwg/html,"@domenic  > Why is this better than using `classList` and dot-prefixed selectors? You state ""There a",https://github.com/whatwg/html/issues/11466#issuecomment-3386232152,https://github.com/whatwg/html/issues/11466,`Element.prototype.states` to expand `:state()` to all elements?,2025-10-09T15:14:29Z,LeaVerou
2657019389,WICG/webcomponents,"continued, 1 year later, below",https://github.com/WICG/webcomponents/issues/551#issuecomment-2657019389,https://github.com/WICG/webcomponents/issues/551,connectedCallback timing when the document parser creates custom elements,2025-02-13T15:48:19Z,Danny-Engelman