id,repo,body,url,issue_url,issue_title,created_at,user
4574600201,webkit/standards-positions,"Cross posting from https://github.com/mozilla/standards-positions/issues/401 Hello, our use case for",https://github.com/WebKit/standards-positions/issues/506#issuecomment-4574600201,https://github.com/WebKit/standards-positions/issues/506,Local Font Access API,2026-05-29T11:49:14Z,Nehon
4574421048,mozilla/standards-positions,"Hello, our use case for this feature is Wasm + 3D viewer (epic games fab.com 3D Viewer). We display ",https://github.com/mozilla/standards-positions/issues/401#issuecomment-4574421048,https://github.com/mozilla/standards-positions/issues/401,Local Font Access API,2026-05-29T11:32:00Z,Nehon
4574200486,whatwg/html,"In ""4.5.26 The span element""; > Content model: > If the element is a descendant of an option eleme",https://github.com/whatwg/html/pull/12504#issuecomment-4574200486,https://github.com/whatwg/html/pull/12504,Make select/option content model clearer about children versus descendants,2026-05-29T11:04:35Z,mtrootyy
4572694939,WICG/webcomponents,"Alice, Jake, Olli, and I discussed this issue and we left a recommendation here: https://github.com/",https://github.com/WICG/webcomponents/issues/1098#issuecomment-4572694939,https://github.com/WICG/webcomponents/issues/1098,Reference Target: How to handle events fired on the reference target by related elements?,2026-05-29T08:39:38Z,annevk
4572681552,whatwg/html,"Alice, Jake, Olli, and I discussed the event model again. Here's the concrete proposal:  - For eve",https://github.com/whatwg/html/pull/10995#issuecomment-4572681552,https://github.com/whatwg/html/pull/10995,Add reference target,2026-05-29T08:38:10Z,annevk
4572540122,w3c/ServiceWorker,"Hi,   I have initially opened the Issue in the soft-navigarion initiative. However this seems to be ",https://github.com/w3c/ServiceWorker/issues/1515#issuecomment-4572540122,https://github.com/w3c/ServiceWorker/issues/1515,Service worker client URL discrepancy,2026-05-29T08:22:41Z,fbuecklers
4570028503,mozilla/standards-positions,I think there are two issues being conflated here. Let's consider an iframe trying to trigger a vuln,https://github.com/mozilla/standards-positions/issues/1271#issuecomment-4570028503,https://github.com/mozilla/standards-positions/issues/1271,window.crashReport key-value API,2026-05-29T02:48:27Z,domfarolino
4569413787,w3c/ServiceWorker,Not sure where this would be potentially useful in the SW spec. For the event listener existence che,https://github.com/w3c/ServiceWorker/issues/1342#issuecomment-4569413787,https://github.com/w3c/ServiceWorker/issues/1342,Ground event listener existence check in new primitive,2026-05-29T00:29:47Z,mkruisselbrink
4569399458,w3c/ServiceWorker,[Bug triage] Issue still exists,https://github.com/w3c/ServiceWorker/issues/1245#issuecomment-4569399458,https://github.com/w3c/ServiceWorker/issues/1245,Spec additional Client API features in V2,2026-05-29T00:26:11Z,monica-ch
4569383307,w3c/ServiceWorker,"[Bug triage] keeping it open, but think of other cases of unnecessary communication with service wor",https://github.com/w3c/ServiceWorker/issues/1036#issuecomment-4569383307,https://github.com/w3c/ServiceWorker/issues/1036,Support returning ServiceWorker Client environments from `Clients.matchAll()`,2026-05-29T00:22:14Z,monica-ch
4569344109,w3c/ServiceWorker,"[Bug triage] Issue still exists, see if we can implement per the above suggestion",https://github.com/w3c/ServiceWorker/issues/1187#issuecomment-4569344109,https://github.com/w3c/ServiceWorker/issues/1187,skipWaiting() promise should resolve after promotion to .active,2026-05-29T00:13:09Z,monica-ch
4569307961,w3c/ServiceWorker,"[Bug triage] Issue still exists, having this feature is nice.",https://github.com/w3c/ServiceWorker/issues/1326#issuecomment-4569307961,https://github.com/w3c/ServiceWorker/issues/1326,should getRegistration() return anything for clients with a local URL that inherited the controller?,2026-05-29T00:04:38Z,monica-ch
4569284216,w3c/ServiceWorker,"[Bug triage] Fixed, see https://w3c.github.io/ServiceWorker/#request-matches-cached-item-algorithm",https://github.com/w3c/ServiceWorker/issues/1320#issuecomment-4569284216,https://github.com/w3c/ServiceWorker/issues/1320,Query Cache algorithm should copy objects it manipulates,2026-05-28T23:59:00Z,monica-ch
4569261531,w3c/ServiceWorker,"FWIW, https://github.com/WICG/web-app-launch/blob/main/sw_launch_event.md is the latest version of a",https://github.com/w3c/ServiceWorker/issues/1028#issuecomment-4569261531,https://github.com/w3c/ServiceWorker/issues/1028,Consider providing `navigation` event,2026-05-28T23:53:29Z,mkruisselbrink
4569245613,w3c/ServiceWorker,[Bug triage] keep it open to future discussions,https://github.com/w3c/ServiceWorker/issues/1313#issuecomment-4569245613,https://github.com/w3c/ServiceWorker/issues/1313,should document.open() inherit the controller?,2026-05-28T23:49:37Z,monica-ch
4569226376,w3c/ServiceWorker,[Bug triage] Issue still exists https://w3c.github.io/ServiceWorker/#on-fetch-request-algorithm at s,https://github.com/w3c/ServiceWorker/issues/1311#issuecomment-4569226376,https://github.com/w3c/ServiceWorker/issues/1311,Handle Fetch does a dubious SecureContext check on a reserved client,2026-05-28T23:45:11Z,monica-ch
4569202278,w3c/ServiceWorker,[Bug triage] Keep the issue open as it is valid and important,https://github.com/w3c/ServiceWorker/issues/1310#issuecomment-4569202278,https://github.com/w3c/ServiceWorker/issues/1310,Size constraints for cache names?,2026-05-28T23:39:21Z,monica-ch
4568901321,webkit/standards-positions,"I have one small issue that's already raised by Mozilla. For this to work in WebKit, we have to disa",https://github.com/WebKit/standards-positions/issues/558#issuecomment-4568901321,https://github.com/WebKit/standards-positions/issues/558,CSS anchor positioning with transforms,2026-05-28T22:37:45Z,tuankiet65
4568857518,w3c/payment-request,"Thank you @ianbjacobs! Looking forward to it. ",https://github.com/w3c/payment-request/issues/1072#issuecomment-4568857518,https://github.com/w3c/payment-request/issues/1072,Should Payment Request API handle non-human payment flows?,2026-05-28T22:29:38Z,hemanth
4568812133,webkit/standards-positions,This has been implemented in WebKit since [312752@main](https://commits.webkit.org/312752@main).,https://github.com/WebKit/standards-positions/issues/558#issuecomment-4568812133,https://github.com/WebKit/standards-positions/issues/558,CSS anchor positioning with transforms,2026-05-28T22:20:52Z,tuankiet65
4568657988,w3c/payment-request,"@hemanth,  Thanks for opening this issue. W3C is organizing a [Workshop on ECommerce for humans and ",https://github.com/w3c/payment-request/issues/1072#issuecomment-4568657988,https://github.com/w3c/payment-request/issues/1072,Should Payment Request API handle non-human payment flows?,2026-05-28T21:54:32Z,ianbjacobs
4568012886,whatwg/html,The only difference is the computed style. Putting things in the UA sheet affects the computed style,https://github.com/whatwg/html/issues/12501#issuecomment-4568012886,https://github.com/whatwg/html/issues/12501,frameset/frame style adjustments should be defined in HTML UA stylesheet,2026-05-28T20:38:10Z,nt1m
4567985016,whatwg/html,Is there anything else I can do to get this PR merged? I'd like to ship the changes in chromium.,https://github.com/whatwg/html/pull/12263#issuecomment-4567985016,https://github.com/whatwg/html/pull/12263,Clone into all descendant selectedcontent elements,2026-05-28T20:34:55Z,josepharhar
4567897789,whatwg/html,Using the ua stylesheet sounds good to me. I guess the c++ code you mentioned is doing the same thin,https://github.com/whatwg/html/issues/12501#issuecomment-4567897789,https://github.com/whatwg/html/issues/12501,frameset/frame style adjustments should be defined in HTML UA stylesheet,2026-05-28T20:23:17Z,josepharhar
4567830372,webkit/standards-positions,"I'd missed the resolution to this request, but feel compelled to point out that the reasoning provid",https://github.com/WebKit/standards-positions/issues/619#issuecomment-4567830372,https://github.com/WebKit/standards-positions/issues/619,BeforeInstallPromptEvent,2026-05-28T20:13:30Z,slightlyoff
4567265613,whatwg/html,"I was pointed to this issue because I noticed the same thing when trying to add FLIP transitions to ",https://github.com/whatwg/html/issues/10831#issuecomment-4567265613,https://github.com/whatwg/html/issues/10831,Detect UA transitions on same-origin cross-document navigations,2026-05-28T18:54:32Z,leifniem
4566978661,whatwg/html,"Carryovers: - https://github.com/whatwg/html/issues/12342 ",https://github.com/whatwg/html/issues/12503#issuecomment-4566978661,https://github.com/whatwg/html/issues/12503,Meeting 44 for joint OpenUI-WHATWG/HTML-CSSWG task force on styleable form controls,2026-05-28T18:16:14Z,mfreed7
4566975455,whatwg/html,Next meeting: https://github.com/whatwg/html/issues/12503,https://github.com/whatwg/html/issues/12455#issuecomment-4566975455,https://github.com/whatwg/html/issues/12455,Meeting 43 for joint OpenUI-WHATWG/HTML-CSSWG task force on styleable form controls,2026-05-28T18:15:50Z,mfreed7
4566544102,whatwg/html,I prefer having this as part of the UA styles rather than as some magic style adjustment personally.,https://github.com/whatwg/html/issues/12501#issuecomment-4566544102,https://github.com/whatwg/html/issues/12501,frameset/frame style adjustments should be defined in HTML UA stylesheet,2026-05-28T17:18:31Z,nt1m
4566018744,whatwg/html,> Several of us were discussing some interesting (single-value) `<select>` sizing behavior yesterday,https://github.com/whatwg/html/issues/12342#issuecomment-4566018744,https://github.com/whatwg/html/issues/12342,Selectedcontent in select multiple,2026-05-28T16:10:44Z,lukewarlow
4565911657,w3c/web-performance,"> This seems completely fair, and I'd understand it could be a valid reason not to provide this func",https://github.com/w3c/web-performance/issues/68#issuecomment-4565911657,https://github.com/w3c/web-performance/issues/68,Discussing a potential performance.isProfiling() method,2026-05-28T15:57:45Z,yoavweiss
4565794715,WICG/webcomponents,"Thanks @smaug----  for taking a look at this, sorry for missing this comment till just now.  A probl",https://github.com/WICG/webcomponents/issues/1098#issuecomment-4565794715,https://github.com/WICG/webcomponents/issues/1098,Reference Target: How to handle events fired on the reference target by related elements?,2026-05-28T15:43:58Z,dandclark
4565588061,whatwg/html,"https://github.com/w3c/csswg-drafts/issues/3248#issuecomment-4565579232 has minutes of a discussion ",https://github.com/whatwg/html/issues/3748#issuecomment-4565588061,https://github.com/whatwg/html/issues/3748,"UA shadow roots are observable via inheritance. ",2026-05-28T15:20:48Z,dbaron
4565525487,whatwg/html,"Several of us were discussing some interesting (single-value) `<select>` sizing behavior yesterday: ",https://github.com/whatwg/html/issues/12342#issuecomment-4565525487,https://github.com/whatwg/html/issues/12342,Selectedcontent in select multiple,2026-05-28T15:14:25Z,fantasai
4565375898,whatwg/html,"And one more: after waiting for a new `<source>`, Firefox (the only one that will load it) transitio",https://github.com/whatwg/html/issues/12500#issuecomment-4565375898,https://github.com/whatwg/html/issues/12500,Inconsistent cross-browser behavior for mutating child <source>s of a <video>,2026-05-28T14:58:15Z,nicolo-ribaudo
4565237108,whatwg/html,@jstenback requesting a quick agenda+ for #10378 if there's room?,https://github.com/whatwg/html/issues/12476#issuecomment-4565237108,https://github.com/whatwg/html/issues/12476,Upcoming WHATNOT meeting on 2026-05-28,2026-05-28T14:45:00Z,scottjehl
4564850254,whatwg/html,An extra case: _moving_ a source into an _empty_ `<video>`  I believe this does not trigger the reso,https://github.com/whatwg/html/issues/12500#issuecomment-4564850254,https://github.com/whatwg/html/issues/12500,Inconsistent cross-browser behavior for mutating child <source>s of a <video>,2026-05-28T14:08:40Z,nicolo-ribaudo
4564850222,whatwg/html,Added Agenda+ to discuss advancing this proposal to Stage 2.  This was previously requested at WHATN,https://github.com/whatwg/html/issues/11729#issuecomment-4564850222,https://github.com/whatwg/html/issues/11729,Menu elements proposal,2026-05-28T14:08:39Z,dbaron
4564750601,whatwg/html,"cc @whatwg/media ",https://github.com/whatwg/html/issues/12500#issuecomment-4564750601,https://github.com/whatwg/html/issues/12500,Inconsistent cross-browser behavior for mutating child <source>s of a <video>,2026-05-28T13:59:07Z,andreubotella
4563226497,w3c/selection-api,> Am I missing something? It doesn't seem to me like Safari 16.4 and Firefox 153 behave the same for,https://github.com/w3c/selection-api/pull/357#issuecomment-4563226497,https://github.com/w3c/selection-api/pull/357,Fix selection.modify() to use resolved text direction instead of inline base direction,2026-05-28T10:41:19Z,sambandaru
4562908439,whatwg/html,@stephanieyzhang could you also make sure this discussion is linked from one of the DOM standard iss,https://github.com/whatwg/html/issues/11478#issuecomment-4562908439,https://github.com/whatwg/html/issues/11478,OpaqueRange Interface,2026-05-28T10:04:08Z,annevk
4562897123,whatwg/html,"To add, your `OpaqueRangeController` object design appears incomplete. You need control over the sta",https://github.com/whatwg/html/issues/11478#issuecomment-4562897123,https://github.com/whatwg/html/issues/11478,OpaqueRange Interface,2026-05-28T10:02:48Z,annevk
4562879349,whatwg/html,I'm not sure about `disconnect()` still. Wouldn't that mean the custom element has to implement refe,https://github.com/whatwg/html/issues/11478#issuecomment-4562879349,https://github.com/whatwg/html/issues/11478,OpaqueRange Interface,2026-05-28T10:00:32Z,annevk
4562588098,whatwg/html,"I think the `OpaqueRangeController` is a good design that answers the custom element case nicely. I ",https://github.com/whatwg/html/issues/11478#issuecomment-4562588098,https://github.com/whatwg/html/issues/11478,OpaqueRange Interface,2026-05-28T09:28:38Z,keithamus
4562167609,mozilla/standards-positions,I'm not quite sure other APIs make it  possible to collect similar information. Things like OOMs and,https://github.com/mozilla/standards-positions/issues/1271#issuecomment-4562167609,https://github.com/mozilla/standards-positions/issues/1271,window.crashReport key-value API,2026-05-28T08:33:55Z,smaug----
4561295501,whatwg/html,"In that case the ""hint"" name is fine, right? The normative requirements are the problem then, not th",https://github.com/whatwg/html/issues/12378#issuecomment-4561295501,https://github.com/whatwg/html/issues/12378,cachehint attribute of <script> for inline script caching,2026-05-28T06:15:34Z,annevk
4561224967,whatwg/html,`<details>` closes the `<p>` element. Try using `<div>` instead.,https://github.com/whatwg/html/issues/12498#issuecomment-4561224967,https://github.com/whatwg/html/issues/12498,Make it possible to render `details` inline,2026-05-28T06:00:19Z,annevk
4560795307,webkit/standards-positions,"I'd prefer to use this issue as the source of truth, instead. It has updated links to the explainer ",https://github.com/WebKit/standards-positions/issues/670#issuecomment-4560795307,https://github.com/WebKit/standards-positions/issues/670,WebMCP,2026-05-28T04:18:24Z,domfarolino
4560788749,webkit/standards-positions,"duplicate of https://github.com/WebKit/standards-positions/issues/649 ... @domfarolino, mind moving ",https://github.com/WebKit/standards-positions/issues/670#issuecomment-4560788749,https://github.com/WebKit/standards-positions/issues/670,WebMCP,2026-05-28T04:16:36Z,marcoscaceres
4560786827,webkit/standards-positions,"Note that https://github.com/WebKit/standards-positions/issues/670 now exists, so I vote that we clo",https://github.com/WebKit/standards-positions/issues/649#issuecomment-4560786827,https://github.com/WebKit/standards-positions/issues/649,WebMCP,2026-05-28T04:16:03Z,domfarolino
4560754209,mozilla/standards-positions,"We've filed https://github.com/mozilla/standards-positions/issues/1412, so I believe we can close th",https://github.com/mozilla/standards-positions/issues/1391#issuecomment-4560754209,https://github.com/mozilla/standards-positions/issues/1391,WebMCP,2026-05-28T04:06:50Z,domfarolino
4560745107,whatwg/html,Recap of open questions and proposals (as of May 27):   1. **Controller pattern for custom elements.,https://github.com/whatwg/html/issues/11478#issuecomment-4560745107,https://github.com/whatwg/html/issues/11478,OpaqueRange Interface,2026-05-28T04:04:30Z,stephanieyzhang
4560587804,mozilla/standards-positions,"How do you feel about the end of that section, which mentions that the same data could be collected ",https://github.com/mozilla/standards-positions/issues/1271#issuecomment-4560587804,https://github.com/mozilla/standards-positions/issues/1271,window.crashReport key-value API,2026-05-28T03:23:20Z,domfarolino
4559623316,whatwg/html,Adding agenda+ to request stage 3 for this. Here are the changes in https://github.com/whatwg/html/p,https://github.com/whatwg/html/issues/10650#issuecomment-4559623316,https://github.com/whatwg/html/issues/10650,HTML-in-Canvas,2026-05-27T23:48:38Z,foolip
4559171869,whatwg/html,bumping this!  context: a Chromium bug (crbug.com/478905599) and CL (https://chromium-review.googles,https://github.com/whatwg/html/issues/8445#issuecomment-4559171869,https://github.com/whatwg/html/issues/8445,No load or error event for <video poster>,2026-05-27T22:29:41Z,hjanuschka
4558889821,whatwg/html,"As for naming,  > Although the proposed name has ""hint"" in the name, the explainer at least seems to",https://github.com/whatwg/html/issues/12378#issuecomment-4558889821,https://github.com/whatwg/html/issues/12378,cachehint attribute of <script> for inline script caching,2026-05-27T21:40:40Z,hiroshige-g
4558055702,webkit/standards-positions,I'd like to offer the perspective of a developer for a paid progressive web app:  There is a growing,https://github.com/WebKit/standards-positions/issues/619#issuecomment-4558055702,https://github.com/WebKit/standards-positions/issues/619,BeforeInstallPromptEvent,2026-05-27T19:39:49Z,George713
4557950886,w3ctag/design-reviews,One note about fingerprinting:  I think the risk of additional entropy is pretty low since I think a,https://github.com/w3ctag/design-reviews/issues/1186#issuecomment-4557950886,https://github.com/w3ctag/design-reviews/issues/1186,Other Spec Review: named-feature() function for CSS @supports,2026-05-27T19:25:55Z,dbaron
4557217824,webkit/standards-positions,"The fullscreen analogy is also useful for in-page UX. Do you think we should remove the ability for ",https://github.com/WebKit/standards-positions/issues/619#issuecomment-4557217824,https://github.com/WebKit/standards-positions/issues/619,BeforeInstallPromptEvent,2026-05-27T18:00:41Z,dmurph
4557107119,whatwg/html,"Sure thing. Should be in your calendar now, if not, do let me know. @thejohnjansen ",https://github.com/whatwg/html/issues/12476#issuecomment-4557107119,https://github.com/whatwg/html/issues/12476,Upcoming WHATNOT meeting on 2026-05-28,2026-05-27T17:46:58Z,jstenback
4557076243,webkit/standards-positions," I’d like to offer two counterpoints from a developer and user-experience perspective:  **1.  Better",https://github.com/WebKit/standards-positions/issues/619#issuecomment-4557076243,https://github.com/WebKit/standards-positions/issues/619,BeforeInstallPromptEvent,2026-05-27T17:42:38Z,dmurph
4556428986,whatwg/html,Re multiple implementer support - I've filed https://github.com/WebKit/standards-positions/issues/62,https://github.com/whatwg/html/pull/12495#issuecomment-4556428986,https://github.com/whatwg/html/pull/12495,Add `runScripts` to `SetHTMLUnsafeOptions`,2026-05-27T16:19:21Z,noamr
4554893482,mozilla/standards-positions,"Proposed positive, it's improving an extending the `-webkit-line-clamp` support all engines currentl",https://github.com/mozilla/standards-positions/issues/984#issuecomment-4554893482,https://github.com/mozilla/standards-positions/issues/984,`line-clamp` CSS property (collapse variant),2026-05-27T13:22:27Z,emilio
4554889619,mozilla/standards-positions,"This looks good after all the discussion in the CSSWG, fwiw.",https://github.com/mozilla/standards-positions/issues/984#issuecomment-4554889619,https://github.com/mozilla/standards-positions/issues/984,`line-clamp` CSS property (collapse variant),2026-05-27T13:22:00Z,emilio
4554889287,whatwg/html,"@mfreed7 can you give this a sanity check?  cc @annevk ",https://github.com/whatwg/html/pull/12493#issuecomment-4554889287,https://github.com/whatwg/html/pull/12493,"Ensure ""topmost popover ancestor"" is only called for auto or hint popovers",2026-05-27T13:21:57Z,jakearchibald
4554881538,whatwg/html,PR up https://github.com/whatwg/html/pull/12493,https://github.com/whatwg/html/issues/10988#issuecomment-4554881538,https://github.com/whatwg/html/issues/10988,The topmost popover ancestor algorithm is used for manual popovers,2026-05-27T13:20:59Z,jakearchibald
4554589350,whatwg/html,"Yes I put it there to match Chromium's order.  To notice a difference, you would need to do someth",https://github.com/whatwg/html/pull/12492#issuecomment-4554589350,https://github.com/whatwg/html/pull/12492,"Specify rate limiter for navigation, history traversal, and pushState/replaceState",2026-05-27T12:40:56Z,zcorpan
4554477057,whatwg/html,What's your opinion on internally preventing the default of `mousedown` when it happens on a disable,https://github.com/whatwg/html/issues/2368#issuecomment-4554477057,https://github.com/whatwg/html/issues/2368,Mouse events & disabled form controls,2026-05-27T12:26:58Z,waterplea
4554324301,w3c/pointerevents,Should be done at the [end of June](https://lists.w3.org/Archives/Member/w3c-ac-members/2026AprJun/0,https://github.com/w3c/pointerevents/issues/548#issuecomment-4554324301,https://github.com/w3c/pointerevents/issues/548,Retire Pointer Events 2,2026-05-27T12:05:22Z,plehegar
4554244551,w3c/ServiceWorker,"Thanks for pointing out the idl, I hadn't double checked it in the spec, only in the repo (Servo).  ",https://github.com/w3c/ServiceWorker/issues/1823#issuecomment-4554244551,https://github.com/w3c/ServiceWorker/issues/1823,Client postmessage uses MessageEvent,2026-05-27T11:51:58Z,gterzian
4554200994,whatwg/html,"I do think it's surprising behavior, this is very much related to click being an ""activation"" event ",https://github.com/whatwg/html/issues/2368#issuecomment-4554200994,https://github.com/whatwg/html/issues/2368,Mouse events & disabled form controls,2026-05-27T11:43:47Z,saschanaz
4554180751,whatwg/html,This looks pretty much like how I envisioned. The only thing I'm not entirely sure about about is ho,https://github.com/whatwg/html/pull/12492#issuecomment-4554180751,https://github.com/whatwg/html/pull/12492,"Specify rate limiter for navigation, history traversal, and pushState/replaceState",2026-05-27T11:39:55Z,farre
4554169601,whatwg/html,## Changes in this PR Details ..,https://github.com/whatwg/html/pull/12480#issuecomment-4554169601,https://github.com/whatwg/html/pull/12480,Allow activation of a checked radio button to clear it,2026-05-27T11:37:59Z,Jobayer-cloud1
4553963398,whatwg/html,"> The following are menubar element inner content elements: > →   div, fieldset, menuitem, span  ",https://github.com/whatwg/html/pull/12011#issuecomment-4553963398,https://github.com/whatwg/html/pull/12011,Introduce the new menu elements,2026-05-27T11:08:01Z,mtrootyy
4553864958,whatwg/html,I just don't want this discussion to turn into workaround excuses. The case I presented is just a pa,https://github.com/whatwg/html/issues/2368#issuecomment-4553864958,https://github.com/whatwg/html/issues/2368,Mouse events & disabled form controls,2026-05-27T10:53:02Z,waterplea
4553805861,mozilla/standards-positions,"> I started developing it for firefox, `layout.css.corner-shape.enabled` should appear on nightly so",https://github.com/mozilla/standards-positions/issues/823#issuecomment-4553805861,https://github.com/mozilla/standards-positions/issues/823,CSS corner-shape,2026-05-27T10:44:41Z,xblurx
4553372425,WICG/webcomponents,We maintain [Spectrum Web Components](https://opensource.adobe.com/spectrum-web-components/). `sp-ch,https://github.com/WICG/webcomponents/issues/1111#issuecomment-4553372425,https://github.com/WICG/webcomponents/issues/1111,"Reference Target ""phase 2"": seeking feedback and use cases",2026-05-27T09:42:48Z,Rajdeepc
4552947646,whatwg/html,The reason we are trying to help with other solutions is because this behavior is made for webcompat,https://github.com/whatwg/html/issues/2368#issuecomment-4552947646,https://github.com/whatwg/html/issues/2368,Mouse events & disabled form controls,2026-05-27T08:46:58Z,saschanaz
4552737459,whatwg/html,"i *think* for `optgroup` the behavior/expectation can remain the same, as i don't think there's a si",https://github.com/whatwg/html/issues/12485#issuecomment-4552737459,https://github.com/whatwg/html/issues/12485,"Relaxing the ""`legend` must be the first child of `fieldset`"" requirement",2026-05-27T08:17:26Z,patrickhlauke
4552632515,whatwg/html,"I see, that would indeed be a more invasive change and potentially expensive. At least it seems that",https://github.com/whatwg/html/issues/12485#issuecomment-4552632515,https://github.com/whatwg/html/issues/12485,"Relaxing the ""`legend` must be the first child of `fieldset`"" requirement",2026-05-27T08:02:17Z,annevk
