id,repo,body,url,issue_url,issue_title,created_at,user
3003424374,mozilla/standards-positions,"> if you print a US-Letter page on A4 paper, the top and bottom edges will get larger effective marg",https://github.com/mozilla/standards-positions/issues/1258#issuecomment-3003424374,https://github.com/mozilla/standards-positions/issues/1258,Expose unprintable areas via CSS,2025-06-25T05:52:07Z,dholbert
3003362180,whatwg/html,Thanks for your detailed reply! I think I'm aligned on most points. To summarize:  * We can use th,https://github.com/whatwg/html/pull/11392#issuecomment-3003362180,https://github.com/whatwg/html/pull/11392,Markup: Wrap algorithms in <div> tags,2025-06-25T05:22:15Z,domenic
3002258781,mozilla/standards-positions,"`getUserMedia()` isn't going anywhere, so solving the three-click problem seems a bit of a tangent. ",https://github.com/mozilla/standards-positions/issues/1245#issuecomment-3002258781,https://github.com/mozilla/standards-positions/issues/1245,Page Embedded Permission Control (Take 2),2025-06-25T00:46:52Z,jan-ivar
3001749201,whatwg/html,"I don't know whether keyboards or IMEs support, but adding `inputmode=""numeric""` would be nicer for ",https://github.com/whatwg/html/issues/11395#issuecomment-3001749201,https://github.com/whatwg/html/issues/11395,"Define optional normalization of full-width characters in <input type=""number"">",2025-06-24T20:18:35Z,myakura
3001723081,mozilla/standards-positions,"Yes, good point about the downscaling. This needs to be a per-page thing, since not all pages may ha",https://github.com/mozilla/standards-positions/issues/1258#issuecomment-3001723081,https://github.com/mozilla/standards-positions/issues/1258,Expose unprintable areas via CSS,2025-06-24T20:07:53Z,mstensho
3001701610,whatwg/html,> This is more than I anticipated in [#10483 (comment)](https://github.com/whatwg/html/issues/10483#,https://github.com/whatwg/html/pull/11392#issuecomment-3001701610,https://github.com/whatwg/html/pull/11392,Markup: Wrap algorithms in <div> tags,2025-06-24T20:00:03Z,jmdyck
3001670281,mozilla/standards-positions,"(The 85in x 110in example is just for illustration; the more-likely real-world-scenario would be A4 ",https://github.com/mozilla/standards-positions/issues/1258#issuecomment-3001670281,https://github.com/mozilla/standards-positions/issues/1258,Expose unprintable areas via CSS,2025-06-24T19:47:22Z,dholbert
3001607405,mozilla/standards-positions,"Yeah, this seems fine to me too, in spirit.  I'll note a few things..  (1) the `env(safe-printable-i",https://github.com/mozilla/standards-positions/issues/1258#issuecomment-3001607405,https://github.com/mozilla/standards-positions/issues/1258,Expose unprintable areas via CSS,2025-06-24T19:20:44Z,dholbert
3001434011,whatwg/html,"yeah, I think it was a mistake to make disabled controls not focusable. EDIT: To clarify, I mean tha",https://github.com/whatwg/html/issues/7168#issuecomment-3001434011,https://github.com/whatwg/html/issues/7168,Behavior of disabled with input type=radio and option is unclear,2025-06-24T18:10:09Z,SB3NDER
3001187038,whatwg/dom,Is the problem with 2 that https://html.spec.whatwg.org/multipage/dom.html#htmlconstructor doesn't s,https://github.com/whatwg/dom/issues/1379#issuecomment-3001187038,https://github.com/whatwg/dom/issues/1379,Scoped custom element registry issues,2025-06-24T16:47:14Z,annevk
3000967774,w3c/pointerevents,> That scenario is indeed remedied by permission controlled APIs as you suggested at the cost of use,https://github.com/w3c/pointerevents/pull/318#issuecomment-3000967774,https://github.com/w3c/pointerevents/pull/318,Add secure context criteria to pointerrawupdate and getCoalescedEvents,2025-06-24T15:28:42Z,szmarczak
3000882088,whatwg/html,"This is interesting what it enables, but odd in how it does: certain features will be *runtime mixin",https://github.com/whatwg/html/issues/11061#issuecomment-3000882088,https://github.com/whatwg/html/issues/11061,Proposal: Customized built-in elements via `elementInternals.type`,2025-06-24T15:07:46Z,trusktr
3000881166,mozilla/standards-positions,> We are negative on this proposal. While we plan to describe the reasons further in [our proposal](,https://github.com/mozilla/standards-positions/issues/1015#issuecomment-3000881166,https://github.com/mozilla/standards-positions/issues/1015,Web Translation API,2025-06-24T15:07:30Z,sandstrom
3000838802,whatwg/html,"I don't think disabled means ""don't read""?",https://github.com/whatwg/html/issues/7168#issuecomment-3000838802,https://github.com/whatwg/html/issues/7168,Behavior of disabled with input type=radio and option is unclear,2025-06-24T14:55:16Z,annevk
3000797098,whatwg/html,"[According to the HTML standard](https://html.spec.whatwg.org/multipage/syntax.html#start-tags), the",https://github.com/whatwg/html/issues/11240#issuecomment-3000797098,https://github.com/whatwg/html/issues/11240,"Proposal: Shorthand syntax for external stylesheets (<style src=""..."">)",2025-06-24T14:43:03Z,maherbo
3000790367,whatwg/html,"PR is updated, created a PR to update the tests, and wrote a patch for WebKit.",https://github.com/whatwg/html/issues/10155#issuecomment-3000790367,https://github.com/whatwg/html/issues/10155,It's not clear how constraint validation works for FACE if the 'validation anchor' is null,2025-06-24T14:41:08Z,annevk
3000727036,whatwg/html,Firefox 140 shipped today!,https://github.com/whatwg/html/issues/7867#issuecomment-3000727036,https://github.com/whatwg/html/issues/7867,Remove UA style for h1-h6 in section (et. al.) and hgroup,2025-06-24T14:26:45Z,zcorpan
3000607234,w3ctag/design-reviews,Hi @yoavweiss!  Thanks for taking a look. I have amended the explainer with an API Shape section (co,https://github.com/w3ctag/design-reviews/issues/1097#issuecomment-3000607234,https://github.com/w3ctag/design-reviews/issues/1097,Browser Bound Keys for Secure Payment Confirmation,2025-06-24T13:55:39Z,pejic
3000146739,whatwg/html,I've been playing around a bit with this and I have the following suggestion:  * Since this is an is,https://github.com/whatwg/html/issues/11184#issuecomment-3000146739,https://github.com/whatwg/html/issues/11184,Navigation API: Navigation's ongoing navigate event is not null in #inner-navigate-event-firing-algorithm,2025-06-24T12:21:28Z,farre
3000018599,whatwg/html,"Hi @domenic Hope you are fine.  Thanks for the clarification. While HTML5 permits this, in practice,",https://github.com/whatwg/html/issues/11394#issuecomment-3000018599,https://github.com/whatwg/html/issues/11394,Avoid Using <div> Inside <a> – Violates HTML5 Semantics,2025-06-24T11:50:16Z,mtechamit
2999768057,whatwg/html,"See https://github.com/WICG/proposals/issues/216. It takes a lot of inspiration from the discussion ",https://github.com/whatwg/html/issues/2791#issuecomment-2999768057,https://github.com/whatwg/html/issues/2791,Client side include feature for HTML,2025-06-24T10:44:51Z,noamr
2999767630,whatwg/html,See https://github.com/WICG/proposals/issues/216,https://github.com/whatwg/html/issues/2142#issuecomment-2999767630,https://github.com/whatwg/html/issues/2142,A way to stream content into an element,2025-06-24T10:44:41Z,noamr
2999720672,mozilla/standards-positions,cc @dholbert / @jwatt / @alaskanemily / @jfkthame   I think this is fine.,https://github.com/mozilla/standards-positions/issues/1258#issuecomment-2999720672,https://github.com/mozilla/standards-positions/issues/1258,Expose unprintable areas via CSS,2025-06-24T10:28:04Z,emilio
2999585371,whatwg/html,Once .source retargeting is sorted out.,https://github.com/whatwg/html/pull/11255#issuecomment-2999585371,https://github.com/whatwg/html/pull/11255,Make command events not composed,2025-06-24T09:43:55Z,smaug----
2999552016,whatwg/html,"> Why It's a Problem: >  > 1. The  tag is inline by default, and putting a block-level element like ",https://github.com/whatwg/html/issues/11394#issuecomment-2999552016,https://github.com/whatwg/html/issues/11394,Avoid Using <div> Inside <a> – Violates HTML5 Semantics,2025-06-24T09:32:39Z,domenic
2999376911,w3ctag/design-reviews,"Hey @pejic!  The explainer covers the motivation well, but doesn't really explain how web developers",https://github.com/w3ctag/design-reviews/issues/1097#issuecomment-2999376911,https://github.com/w3ctag/design-reviews/issues/1097,Browser Bound Keys for Secure Payment Confirmation,2025-06-24T08:41:33Z,yoavweiss
2998818595,whatwg/dom,"AFAIK they use moveBefore already and you can move before any node, including text and comments so I",https://github.com/whatwg/dom/issues/1385#issuecomment-2998818595,https://github.com/whatwg/dom/issues/1385,[moveBefore] Consider making this a feature of Node not ParentNode,2025-06-24T05:04:04Z,WebReflection
2998793809,whatwg/html,"Sorry for the big delay, been able to spend less time browser hacking in my free time than I would l",https://github.com/whatwg/html/issues/11340#issuecomment-2998793809,https://github.com/whatwg/html/issues/11340,WorkerGlobal scope's URL accessed for fetch blob partitioning before being set,2025-06-24T04:48:06Z,shannonbooth
2998567441,mozilla/standards-positions,"As of 2024-09-20, Firefox de-facto supports this with the resolution of [bug 1910206](https://bugzil",https://github.com/mozilla/standards-positions/issues/1033#issuecomment-2998567441,https://github.com/mozilla/standards-positions/issues/1033,WebGPU: GPUAdapter info attribute,2025-06-24T02:33:37Z,ErichDonGubler
2998497217,whatwg/html,My reaction is the same as @tabatkins. This is more than I anticipated in https://github.com/whatwg/,https://github.com/whatwg/html/pull/11392#issuecomment-2998497217,https://github.com/whatwg/html/pull/11392,Markup: Wrap algorithms in <div> tags,2025-06-24T01:50:30Z,domenic
2998494245,whatwg/html,"> Out of curiosity, why use a different attribute marker to indicate an algorithm than what Bikeshed",https://github.com/whatwg/html/pull/11392#issuecomment-2998494245,https://github.com/whatwg/html/pull/11392,Markup: Wrap algorithms in <div> tags,2025-06-24T01:48:46Z,jmdyck
2998269433,webkit/standards-positions,I've drafted an [explainer](https://github.com/WebAudio/web-speech-api/pull/167) that contains a few,https://github.com/WebKit/standards-positions/issues/517#issuecomment-2998269433,https://github.com/WebKit/standards-positions/issues/517,Web Speech API Contextual Biasing,2025-06-23T23:28:13Z,evanbliu
2998115943,w3ctag/design-reviews,"It sounds like the central question you are asking is whether the use case is genuinely compelling, ",https://github.com/w3ctag/design-reviews/issues/1092#issuecomment-2998115943,https://github.com/w3ctag/design-reviews/issues/1092,Web Authentication Immediate Mediation,2025-06-23T22:14:38Z,kenrb
2998014093,whatwg/html,@annevk It's true that the HTML Standard doesn't mandate that the second input should be inaccessibl,https://github.com/whatwg/html/issues/7168#issuecomment-2998014093,https://github.com/whatwg/html/issues/7168,Behavior of disabled with input type=radio and option is unclear,2025-06-23T21:35:11Z,SB3NDER
2997955536,w3ctag/design-reviews,"@Shrinivassab, I must confess that my framework-fu is very weak, so I can't give you substantial ans",https://github.com/w3ctag/design-reviews/issues/1111#issuecomment-2997955536,https://github.com/w3ctag/design-reviews/issues/1111,Declarative Interactions,2025-06-23T21:12:18Z,szager-chromium
2997782023,mozilla/standards-positions,Note this position refers to the [explainer.md](https://github.com/WICG/PEPC/blob/9dee065fa7e28578a5,https://github.com/mozilla/standards-positions/issues/908#issuecomment-2997782023,https://github.com/mozilla/standards-positions/issues/908,Page Embedded Permission Control,2025-06-23T19:59:50Z,jan-ivar
2997730027,mozilla/standards-positions,I'm sorry - I'm new to these processes. Why isn't Kelsey's comment of 2024-7-8 sufficient to close t,https://github.com/mozilla/standards-positions/issues/1033#issuecomment-2997730027,https://github.com/mozilla/standards-positions/issues/1033,WebGPU: GPUAdapter info attribute,2025-06-23T19:39:31Z,jimblandy
2997213206,webkit/standards-positions,"Safari's rendering of find-in-page search results is not representable in CSS, so such a pseudo seem",https://github.com/WebKit/standards-positions/issues/421#issuecomment-2997213206,https://github.com/WebKit/standards-positions/issues/421," CSS highlight pseudo ::search-text",2025-06-23T16:59:35Z,hober
2997210579,whatwg/html,"Out of curiosity, why use a different attribute marker to indicate an algorithm than what Bikeshed u",https://github.com/whatwg/html/pull/11392#issuecomment-2997210579,https://github.com/whatwg/html/pull/11392,Markup: Wrap algorithms in <div> tags,2025-06-23T16:58:50Z,tabatkins
2996911644,whatwg/html,"I think it's one of these cases where the website itself has to be fixed. The only way to ""fix"" it o",https://github.com/whatwg/html/issues/6235#issuecomment-2996911644,https://github.com/whatwg/html/issues/6235,"Escape ""<"" and "">"" in attributes when serializing HTML",2025-06-23T15:22:28Z,securityMB
2996803049,whatwg/html,Is there a fix you envision other than asking the website to make it work on their end?,https://github.com/whatwg/html/issues/6235#issuecomment-2996803049,https://github.com/whatwg/html/issues/6235,"Escape ""<"" and "">"" in attributes when serializing HTML",2025-06-23T14:51:00Z,mozfreddyb
2996719613,whatwg/dom,Note to self: note that this resolves #1366 when merging.,https://github.com/whatwg/dom/pull/1384#issuecomment-2996719613,https://github.com/whatwg/dom/pull/1384,Copy document's allow declarative shadow roots,2025-06-23T14:27:54Z,annevk
2996636728,webkit/standards-positions,"Colleagues and I support the general idea here, but we'll wait with a formal position until the prop",https://github.com/WebKit/standards-positions/issues/513#issuecomment-2996636728,https://github.com/WebKit/standards-positions/issues/513,Customized built-in elements via elementInternals.type,2025-06-23T14:04:56Z,annevk
2996630762,w3c/pointerevents,@szmarczak this PR was merged a while ago and I do encourage you to file a new issue as that might g,https://github.com/w3c/pointerevents/pull/318#issuecomment-2996630762,https://github.com/w3c/pointerevents/pull/318,Add secure context criteria to pointerrawupdate and getCoalescedEvents,2025-06-23T14:03:24Z,NavidZ
2995956184,whatwg/html,Looks like https://source.chromium.org/chromium/chromium/src/+/main:third_party/blink/web_tests/http,https://github.com/whatwg/html/issues/8013#issuecomment-2995956184,https://github.com/whatwg/html/issues/8013,Prevent top navigations without user activation in some circumstances?,2025-06-23T10:55:57Z,annevk
2995804876,whatwg/html,"> That would allow the custom element itself to be the anchor, right?  Indeed, without having to rel",https://github.com/whatwg/html/issues/10155#issuecomment-2995804876,https://github.com/whatwg/html/issues/10155,It's not clear how constraint validation works for FACE if the 'validation anchor' is null,2025-06-23T10:10:10Z,annevk
2995669237,whatwg/html,Looks like we have the first bug report caused by this change: https://issues.chromium.org/issues/42,https://github.com/whatwg/html/issues/6235#issuecomment-2995669237,https://github.com/whatwg/html/issues/6235,"Escape ""<"" and "">"" in attributes when serializing HTML",2025-06-23T09:30:46Z,securityMB
2995551935,whatwg/dom,"Yeah, this should be handled by the CSS WG.",https://github.com/whatwg/dom/issues/1383#issuecomment-2995551935,https://github.com/whatwg/dom/issues/1383,Proposal: matchContainer API,2025-06-23T08:54:11Z,annevk
2995442692,mozilla/standards-positions,"I think the way Martin phrased it ""spontaneously without any interaction"" it is definitely true.  Th",https://github.com/mozilla/standards-positions/issues/1245#issuecomment-2995442692,https://github.com/mozilla/standards-positions/issues/1245,Page Embedded Permission Control (Take 2),2025-06-23T08:26:58Z,simon-friedberger
2995368654,webkit/standards-positions,"I discussed this with colleagues and we suggest resolving this as ""position: support"" one week from ",https://github.com/WebKit/standards-positions/issues/518#issuecomment-2995368654,https://github.com/WebKit/standards-positions/issues/518,__Http- and __HostHttp- cookie prefixes,2025-06-23T08:02:38Z,annevk
2995192953,mozilla/standards-positions,"Got it, thanks for clarifying.   > That doesn't mean that it wasn't a mistake. That a site can turn ",https://github.com/mozilla/standards-positions/issues/1245#issuecomment-2995192953,https://github.com/mozilla/standards-positions/issues/1245,Page Embedded Permission Control (Take 2),2025-06-23T07:04:34Z,mharbach
2995179832,mozilla/standards-positions,"> on my second visit, the camera turns on without me clicking any button on the page  This is not so",https://github.com/mozilla/standards-positions/issues/1245#issuecomment-2995179832,https://github.com/mozilla/standards-positions/issues/1245,Page Embedded Permission Control (Take 2),2025-06-23T06:59:32Z,martinthomson
2995168039,mozilla/standards-positions,> I see nothing in PEPC or our feedback that is threatening the persistent permission option in brow,https://github.com/mozilla/standards-positions/issues/1245#issuecomment-2995168039,https://github.com/mozilla/standards-positions/issues/1245,Page Embedded Permission Control (Take 2),2025-06-23T06:54:59Z,mharbach
2994885216,webkit/standards-positions,"Although the use case seems interesting, the part linked to in the spec doesn't answer how the value",https://github.com/WebKit/standards-positions/issues/517#issuecomment-2994885216,https://github.com/WebKit/standards-positions/issues/517,Web Speech API Contextual Biasing,2025-06-23T04:33:32Z,marcoscaceres
2994229115,whatwg/html,"should i start working on it @alexkeng ",https://github.com/whatwg/html/issues/11390#issuecomment-2994229115,https://github.com/whatwg/html/issues/11390,Use a static property instead of ElementInternals.type for declaring native behaviors,2025-06-22T13:56:06Z,Ayushsaxena0227
2993930407,whatwg/html,I was gonna post a new feature request but found a bunch of related issues:  - https://github.com/ds,https://github.com/whatwg/html/issues/6107#issuecomment-2993930407,https://github.com/whatwg/html/issues/6107,Transferable resolve/reject,2025-06-22T04:33:46Z,jimmywarting
2993790517,w3c/pointerevents,> Add secure context criteria to pointerrawupdate event and getCoalescedEvents APIs to reduce its ex,https://github.com/w3c/pointerevents/pull/318#issuecomment-2993790517,https://github.com/w3c/pointerevents/pull/318,Add secure context criteria to pointerrawupdate and getCoalescedEvents,2025-06-21T22:03:33Z,szmarczak
2993713877,webkit/standards-positions,"> Hey, I'm currently experiencing problems with this on Safari Version 18.5 (20621.2.5.11.8) The sou",https://github.com/WebKit/standards-positions/issues/190#issuecomment-2993713877,https://github.com/WebKit/standards-positions/issues/190,Re-introduction of Media Queries (and srcset/sizes) in Source Elements,2025-06-21T18:33:44Z,nt1m
2993622135,webkit/standards-positions,"Hey, I'm currently experiencing problems with this on Safari Version 18.5 (20621.2.5.11.8) The sourc",https://github.com/WebKit/standards-positions/issues/190#issuecomment-2993622135,https://github.com/WebKit/standards-positions/issues/190,Re-introduction of Media Queries (and srcset/sizes) in Source Elements,2025-06-21T14:58:12Z,Ghostavio
2993599146,whatwg/dom,I found [this discussion at the CSSWG](https://github.com/w3c/csswg-drafts/issues/6205) and [this ex,https://github.com/whatwg/dom/issues/1383#issuecomment-2993599146,https://github.com/whatwg/dom/issues/1383,Proposal: matchContainer API,2025-06-21T14:02:36Z,ddamato
2993444199,w3ctag/design-reviews,@christianliebel: The monkey-patching draft at https://explainers-by-googlers.github.io/script-block,https://github.com/w3ctag/design-reviews/issues/1114#issuecomment-2993444199,https://github.com/w3ctag/design-reviews/issues/1114,Script Blocking (in Incognito mode),2025-06-21T07:49:36Z,mikewest
2993327967,whatwg/html,"Yes, you have correctly described how HTML works!",https://github.com/whatwg/html/issues/11391#issuecomment-2993327967,https://github.com/whatwg/html/issues/11391,Script Execution Order and `body.className,2025-06-21T04:55:13Z,domenic
2992592435,whatwg/html,">Perhaps instead, ""type"" behavior should be configured similar to formAssociated via a static proper",https://github.com/whatwg/html/issues/11061#issuecomment-2992592435,https://github.com/whatwg/html/issues/11061,Proposal: Customized built-in elements via `elementInternals.type`,2025-06-20T19:21:25Z,alexkeng
2992525887,whatwg/html,"> By virtue of the fact modal dialogs close open popovers, yes. (Might not close manual ones though)",https://github.com/whatwg/html/issues/3567#issuecomment-2992525887,https://github.com/whatwg/html/issues/3567,Have some way of opening `<dialog>` elements without JavaScript,2025-06-20T18:47:26Z,martpet
2992510331,w3c/editing,Adding my thoughts based on current ongoing and future considerations:  - ClipboardChange event - we,https://github.com/w3c/editing/issues/487#issuecomment-2992510331,https://github.com/w3c/editing/issues/487,TPAC 2025 - should we have a meeting?,2025-06-20T18:41:32Z,ragoulik
2992205011,whatwg/html,"> Is `document.write()` really bad? From what I understand, the bad bit is when it's called while ne",https://github.com/whatwg/html/issues/7977#issuecomment-2992205011,https://github.com/whatwg/html/issues/7977,Mark `document.write()` as obsolete,2025-06-20T16:30:50Z,gsnedders
2992189341,whatwg/html,"By virtue of the fact modal dialogs close open popovers, yes. (Might not close manual ones though)",https://github.com/whatwg/html/issues/3567#issuecomment-2992189341,https://github.com/whatwg/html/issues/3567,Have some way of opening `<dialog>` elements without JavaScript,2025-06-20T16:23:18Z,lukewarlow
2991900744,whatwg/html,Can command/commandfor open a dialog AND close a popover at the same time?,https://github.com/whatwg/html/issues/3567#issuecomment-2991900744,https://github.com/whatwg/html/issues/3567,Have some way of opening `<dialog>` elements without JavaScript,2025-06-20T14:44:58Z,martpet
2991578172,w3ctag/design-reviews,@xiaochengh I added a note to the spec in https://github.com/w3c/csswg-drafts/commit/50ea52c173b317e,https://github.com/w3ctag/design-reviews/issues/1073#issuecomment-2991578172,https://github.com/w3ctag/design-reviews/issues/1073,Column wrapping for multicol,2025-06-20T13:11:37Z,rachelandrew
2990795640,w3ctag/design-reviews,"Hi @andypaicu,  Thanks for this submission, this looks to be a promising area to investigate. It see",https://github.com/w3ctag/design-reviews/issues/1079#issuecomment-2990795640,https://github.com/w3ctag/design-reviews/issues/1079,Page-Embedded Permission Controls,2025-06-20T10:20:48Z,lolaodelola
2990337032,whatwg/html,"Is `document.write()` really bad? From what I understand, the bad bit is when it's called while netw",https://github.com/whatwg/html/issues/7977#issuecomment-2990337032,https://github.com/whatwg/html/issues/7977,Mark `document.write()` as obsolete,2025-06-20T08:55:28Z,jakearchibald
2989852466,whatwg/html,Thanks for fixing this!,https://github.com/whatwg/html/pull/11384#issuecomment-2989852466,https://github.com/whatwg/html/pull/11384,Discourage `document.writeln()` like `document.write()`,2025-06-20T05:37:16Z,annevk
2989709773,w3ctag/design-reviews,"Dear Payments Working Group,  Thank you for sharing the draft charter with the TAG for review. Apolo",https://github.com/w3ctag/design-reviews/issues/1080#issuecomment-2989709773,https://github.com/w3ctag/design-reviews/issues/1080,[wg/payments] Web Payments Working Group Charter,2025-06-20T03:41:32Z,marcoscaceres
2989452014,whatwg/html,> I want to point out what I think is a critical detail: we already have cross-scope style sharing i,https://github.com/whatwg/html/issues/11364#issuecomment-2989452014,https://github.com/whatwg/html/issues/11364,Exploration of exposing stylesheets across scopes,2025-06-20T00:13:50Z,robglidden
2989206629,whatwg/html,"> You need to make your membership of the organization public.  Done, I was not aware.  > Also p",https://github.com/whatwg/html/pull/11384#issuecomment-2989206629,https://github.com/whatwg/html/pull/11384,Discourage `document.writeln()` like `document.write()`,2025-06-19T21:54:07Z,caugner
2989073586,whatwg/dom,"> _hydration_ story gotta be in ... no comments?  Yes, there is a potential for _hydration_ too, it'",https://github.com/whatwg/dom/issues/736#issuecomment-2989073586,https://github.com/whatwg/dom/issues/736,Proposal: a DocumentFragment whose nodes do not get removed once inserted,2025-06-19T20:12:30Z,FrameMuse
2989070188,whatwg/dom,"great ... but just as reminder: the *hydration* story gotta be in ... no comments? no hydration, and",https://github.com/whatwg/dom/issues/736#issuecomment-2989070188,https://github.com/whatwg/dom/issues/736,Proposal: a DocumentFragment whose nodes do not get removed once inserted,2025-06-19T20:09:58Z,WebReflection
2989065564,whatwg/dom,"> this topic should not creep on implementation details bikeshedding, imho, it should move forward w",https://github.com/whatwg/dom/issues/736#issuecomment-2989065564,https://github.com/whatwg/dom/issues/736,Proposal: a DocumentFragment whose nodes do not get removed once inserted,2025-06-19T20:07:38Z,FrameMuse
2989058014,whatwg/dom,"> how I could implement this without patching DOM, something which seemed to be impossible turned ou",https://github.com/whatwg/dom/issues/736#issuecomment-2989058014,https://github.com/whatwg/dom/issues/736,Proposal: a DocumentFragment whose nodes do not get removed once inserted,2025-06-19T20:02:30Z,WebReflection
