id,repo,body,url,issue_url,issue_title,created_at,user
3020507660,whatwg/html,"Thanks for clarifying, that makes sense. Tried to reword the note with that in mind, and used @annev",https://github.com/whatwg/html/pull/11419#issuecomment-3020507660,https://github.com/whatwg/html/pull/11419,Fix description of missing-semicolon-after-character-reference error,2025-06-30T19:54:03Z,squeek502
3020250634,whatwg/html,I’ve reported this behavior to Firefox Bugzilla for tracking: https://bugzilla.mozilla.org/show_bug.,https://github.com/whatwg/html/issues/11405#issuecomment-3020250634,https://github.com/whatwg/html/issues/11405,"Gecko accepts non-conforming full-width digits in <input type=""number"">",2025-06-30T18:18:04Z,kyouhei-horizumi
3019854390,whatwg/html,"cc @whatwg/a11y ",https://github.com/whatwg/html/issues/11416#issuecomment-3019854390,https://github.com/whatwg/html/issues/11416,Add showValidationMessage() method for validation without focus management,2025-06-30T16:24:16Z,annevk
3019826103,whatwg/html,It seems reasonable to me to add an opt-in method name (or option in an options bag) to prevent focu,https://github.com/whatwg/html/issues/11416#issuecomment-3019826103,https://github.com/whatwg/html/issues/11416,Add showValidationMessage() method for validation without focus management,2025-06-30T16:18:00Z,keithamus
3019669351,w3c/pointerevents,I think we can close this issue: unlike `click` we haven't ported `dblclick` to PointerEvents consid,https://github.com/w3c/pointerevents/issues/507#issuecomment-3019669351,https://github.com/w3c/pointerevents/issues/507,Clarify (or override) `dblclick` event target,2025-06-30T15:37:27Z,mustaqahmed
3019560687,whatwg/html,"Based on only positive opinions expressed, I've gone ahead and renamed the attribute in the explaine",https://github.com/whatwg/html/issues/11312#issuecomment-3019560687,https://github.com/whatwg/html/issues/11312,Naming of the `interesttarget` attribute,2025-06-30T15:12:23Z,mfreed7
3019413669,whatwg/html,"How would this work accessibility-wise? cc @keithamus ",https://github.com/whatwg/html/issues/11416#issuecomment-3019413669,https://github.com/whatwg/html/issues/11416,Add showValidationMessage() method for validation without focus management,2025-06-30T14:35:32Z,annevk
3019315858,whatwg/webidl,Big fan of matching ECMAScript built-ins. You can consider WebKit supportive of this change.,https://github.com/whatwg/webidl/issues/1497#issuecomment-3019315858,https://github.com/whatwg/webidl/issues/1497,The attribute setter operation mismatch between browsers for the arguments count,2025-06-30T14:09:35Z,annevk
3019253489,whatwg/webidl,"Yes, the possible modification is the following, for steps 4.1-2.  ```   4. Let steps be the followi",https://github.com/whatwg/webidl/issues/1497#issuecomment-3019253489,https://github.com/whatwg/webidl/issues/1497,The attribute setter operation mismatch between browsers for the arguments count,2025-06-30T13:52:01Z,arai-a
3019091943,whatwg/webidl,Nice find! So your suggestion is to make the specification match Safari?,https://github.com/whatwg/webidl/issues/1497#issuecomment-3019091943,https://github.com/whatwg/webidl/issues/1497,The attribute setter operation mismatch between browsers for the arguments count,2025-06-30T13:09:10Z,annevk
3018841867,whatwg/html,"> To me, describing `&notin` as ambiguous is a bit strange, since it's exactly as ambiguous as `&not",https://github.com/whatwg/html/pull/11419#issuecomment-3018841867,https://github.com/whatwg/html/pull/11419,Fix description of missing-semicolon-after-character-reference error,2025-06-30T11:45:18Z,domenic
3018215099,whatwg/html,"Maybe invert it? ```       <p class=""example"">For example, <code data-x="""">&amp;notin</code> will ",https://github.com/whatwg/html/pull/11419#issuecomment-3018215099,https://github.com/whatwg/html/pull/11419,Fix description of missing-semicolon-after-character-reference error,2025-06-30T08:13:29Z,annevk
3018207498,whatwg/html,"Thanks, happy to hear it!  To me, describing `&notin` as ambiguous is a bit strange, since it's ex",https://github.com/whatwg/html/pull/11419#issuecomment-3018207498,https://github.com/whatwg/html/pull/11419,Fix description of missing-semicolon-after-character-reference error,2025-06-30T08:10:58Z,squeek502
3017772984,whatwg/html,"Thanks for finding this bug, and also I have to say I really enjoyed [your blog post](https://www.ry",https://github.com/whatwg/html/pull/11419#issuecomment-3017772984,https://github.com/whatwg/html/pull/11419,Fix description of missing-semicolon-after-character-reference error,2025-06-30T04:41:16Z,domenic
3016420106,whatwg/dom,> One thing to point out since I'm seeing folks duplicate the `addEventListener()` and promise rejec,https://github.com/whatwg/dom/issues/946#issuecomment-3016420106,https://github.com/whatwg/dom/issues/946,Expose an `aborted` promise on AbortSignal?,2025-06-29T08:38:56Z,polRk
3016409051,whatwg/html,Just gently following up to see if there’s further feedback from spec editors on this idea.   Apprec,https://github.com/whatwg/html/issues/11376#issuecomment-3016409051,https://github.com/whatwg/html/issues/11376,Feature Request: Built-In Web Libraries (BWL) via browser-lib attribute,2025-06-29T08:28:51Z,TTMTT
3016351819,whatwg/html,"I couldn't find an actual ""documentation"" about that wording, but it seems it was in the [first vers",https://github.com/whatwg/html/issues/11165#issuecomment-3016351819,https://github.com/whatwg/html/issues/11165,Add target HDR headroom to `CanvasRenderingContext2D `,2025-06-29T06:44:46Z,Kaiido
3016258231,whatwg/html,This is very related to https://github.com/whatwg/html/pull/11169 which we closed out recently. I gu,https://github.com/whatwg/html/issues/11410#issuecomment-3016258231,https://github.com/whatwg/html/issues/11410,Repeated navigations with location.hash etc should throw,2025-06-29T03:14:23Z,domenic
3016257092,whatwg/html,We're fine with the current syntax. This kind of change was not requested on the issue tracker. If y,https://github.com/whatwg/html/pull/11418#issuecomment-3016257092,https://github.com/whatwg/html/pull/11418,"Refactor dfn.js: modern JS, keyboard accessibility, and multipage support",2025-06-29T03:11:28Z,domenic
3016204666,whatwg/html,I have submitted a PR for WPT and also opened an issue for Chromium: <https://issues.chromium.org/is,https://github.com/whatwg/html/issues/11417#issuecomment-3016204666,https://github.com/whatwg/html/issues/11417,should canvas `.toBlob()`/`.convertToBlob()` work without a rendering context?,2025-06-29T01:20:47Z,zamfofex
3016024779,WICG/webcomponents,"@titoBouzout can you expand/rephrase/reformulate a bit, please? Your list is so squeezed I'm not sur",https://github.com/WICG/webcomponents/issues/1069#issuecomment-3016024779,https://github.com/WICG/webcomponents/issues/1069,[templates] A declarative JavaScript templating API,2025-06-28T20:48:20Z,dariomannu
3015970615,whatwg/html,"> Just to participate in the bike-shedding, what about `globalHDRHeadroom`? This would match `global",https://github.com/whatwg/html/issues/11165#issuecomment-3015970615,https://github.com/whatwg/html/issues/11165,Add target HDR headroom to `CanvasRenderingContext2D `,2025-06-28T18:22:33Z,ccameron-chromium
3015216436,whatwg/html,"I agree this could use clarification.  All major browsers (Chrome, Firefox, Safari) return the same ",https://github.com/whatwg/html/issues/5266#issuecomment-3015216436,https://github.com/whatwg/html/issues/5266,"""determine the value of a named property"" should not imply a new object each time",2025-06-28T12:15:49Z,AbdelatefElshafei
3015191309,whatwg/html,That's a bug. If this isn't covered yet by WPT maybe consider contributing tests there?,https://github.com/whatwg/html/issues/11417#issuecomment-3015191309,https://github.com/whatwg/html/issues/11417,should canvas `.toBlob()`/`.convertToBlob()` work without a rendering context?,2025-06-28T11:17:26Z,annevk
3015123580,whatwg/html,"Just for the record, CSS now has semantic pseudo-classes `:heading` and `:heading(An+B)`.   https://",https://github.com/whatwg/html/issues/7390#issuecomment-3015123580,https://github.com/whatwg/html/issues/7390,"Element request: `<h>` to reconcile heading levels, outlines, and components",2025-06-28T08:50:42Z,Crissov
3014280728,whatwg/html,> [...] specificity for these pseudo-classes [...]  The spec states: https://drafts.csswg.org/sele,https://github.com/whatwg/html/pull/11413#issuecomment-3014280728,https://github.com/whatwg/html/pull/11413,Add :heading and :heading() pseudo-classes,2025-06-27T20:27:19Z,keithamus
3014050694,whatwg/html,It appears that FOUC that can sometimes occur from CSS `<link>`s to external style sheets in declara,https://github.com/whatwg/html/issues/11019#issuecomment-3014050694,https://github.com/whatwg/html/issues/11019,Support fragment references in the `<link>` tag's `href` attribute,2025-06-27T18:39:48Z,robglidden
3014038481,whatwg/html,@fantasai pointed out to me that in https://github.com/w3c/csswg-drafts/issues/10296#issuecomment-27,https://github.com/whatwg/html/pull/11413#issuecomment-3014038481,https://github.com/whatwg/html/pull/11413,Add :heading and :heading() pseudo-classes,2025-06-27T18:33:40Z,annevk
3013731379,whatwg/dom,"I've just looked into 3 again. If I remove my ad-hoc ""if the navigable has no active document, retur",https://github.com/whatwg/dom/issues/1379#issuecomment-3013731379,https://github.com/whatwg/dom/issues/1379,Scoped custom element registry issues,2025-06-27T16:49:39Z,AtkinsSJ
3013637706,whatwg/dom,> Is the problem with 2 that [html.spec.whatwg.org/multipage/dom.html#htmlconstructor](https://html.,https://github.com/whatwg/dom/issues/1379#issuecomment-3013637706,https://github.com/whatwg/dom/issues/1379,Scoped custom element registry issues,2025-06-27T16:27:01Z,AtkinsSJ
3013522310,whatwg/html,"> Firefox 140 shipped today!  Congrats! I'm sure you will, but just to be sure: can you please check",https://github.com/whatwg/html/issues/7867#issuecomment-3013522310,https://github.com/whatwg/html/issues/7867,Remove UA style for h1-h6 in section (et. al.) and hgroup,2025-06-27T15:52:00Z,mfreed7
3013226488,whatwg/html,I’ve opened a dedicated issue in the Web Platform Tests repository to track adding a test for this b,https://github.com/whatwg/html/issues/11405#issuecomment-3013226488,https://github.com/whatwg/html/issues/11405,"Gecko accepts non-conforming full-width digits in <input type=""number"">",2025-06-27T14:14:11Z,kyouhei-horizumi
3013209809,WICG/webcomponents,"Downsides:  - not able to set a namespace, say to create a partial that goes inside SVG/MathML - ret",https://github.com/WICG/webcomponents/issues/1069#issuecomment-3013209809,https://github.com/WICG/webcomponents/issues/1069,[templates] A declarative JavaScript templating API,2025-06-27T14:08:21Z,titoBouzout
3013119645,webkit/standards-positions,Yes the `:heading` and `:heading(<An+B>#)` selectors could be included in this position.   They're d,https://github.com/WebKit/standards-positions/issues/523#issuecomment-3013119645,https://github.com/WebKit/standards-positions/issues/523,Headingoffset & Headingreset attributes,2025-06-27T13:36:39Z,keithamus
3013112119,whatwg/html,Turned out to be a little more than 5 with a different regexp (13).,https://github.com/whatwg/html/pull/11415#issuecomment-3013112119,https://github.com/whatwg/html/pull/11415,"Editorial: change instances of ""zero"" to 0",2025-06-27T13:34:02Z,keithamus
3013044711,whatwg/html,"Yeah, I think we've come around to agreeing that any number that appears in an algorithm should be a",https://github.com/whatwg/html/issues/11414#issuecomment-3013044711,https://github.com/whatwg/html/issues/11414,"The spec inconsistently uses ""0"" or ""zero"".",2025-06-27T13:14:20Z,annevk
3012939909,whatwg/html,I guess leaving out the change to the individual `hN` selectors makes sense. We can make that change,https://github.com/whatwg/html/pull/11413#issuecomment-3012939909,https://github.com/whatwg/html/pull/11413,Add :heading and :heading() pseudo-classes,2025-06-27T12:39:47Z,annevk
3012638822,mozilla/standards-positions,"This solves a long-standing problem where the previous solution (sectioning elements + `h1`) didn't ",https://github.com/mozilla/standards-positions/issues/1263#issuecomment-3012638822,https://github.com/mozilla/standards-positions/issues/1263,Headingoffset & Headingreset attributes,2025-06-27T11:12:52Z,zcorpan
3012424763,whatwg/html,"The problem with ""run a script"" specifically is that 8.2.2 throws and 11 returns a throw completion.",https://github.com/whatwg/html/issues/11404#issuecomment-3012424763,https://github.com/whatwg/html/issues/11404,"Verify handling of the throw completion returned by ""run a classic script""",2025-06-27T09:57:18Z,annevk
3012377450,webkit/standards-positions,"Is this a duplicate of #509? Or is `<use>` somehow special here? Either way, the same concerns apply",https://github.com/WebKit/standards-positions/issues/522#issuecomment-3012377450,https://github.com/WebKit/standards-positions/issues/522,[SVG] Support for width and height as css attributes on <use> element,2025-06-27T09:41:55Z,annevk
3012359508,webkit/standards-positions,Will this include a pseudo-class? What about impact on the user agent style sheet?,https://github.com/WebKit/standards-positions/issues/523#issuecomment-3012359508,https://github.com/WebKit/standards-positions/issues/523,Headingoffset & Headingreset attributes,2025-06-27T09:34:58Z,annevk
3012324521,WICG/webcomponents,"The question I don't see answered: *who is this for*?  - Is it for the ""end user"" who will use it to",https://github.com/WICG/webcomponents/issues/1069#issuecomment-3012324521,https://github.com/WICG/webcomponents/issues/1069,[templates] A declarative JavaScript templating API,2025-06-27T09:21:47Z,dmitriid
3012077656,whatwg/html,The wpt sync PR is here: https://github.com/web-platform-tests/wpt/pull/53435,https://github.com/whatwg/html/issues/11184#issuecomment-3012077656,https://github.com/whatwg/html/issues/11184,Navigation API: Navigation's ongoing navigate event is not null in #inner-navigate-event-firing-algorithm,2025-06-27T07:52:18Z,zcorpan
3012055097,mozilla/standards-positions,Having all browser use the same header and aligning with the CORS spec seems quite reasonable. Firef,https://github.com/mozilla/standards-positions/issues/1259#issuecomment-3012055097,https://github.com/mozilla/standards-positions/issues/1259,"Remove non-standard prefetch headers like X-Moz for Sec-Purpose for prefetches, prerenders, etc.",2025-06-27T07:44:25Z,valenting
3012039651,whatwg/html,Demo for `pushState`: https://software.hixie.ch/utilities/js/live-dom-viewer/?saved=13881 Demo for `,https://github.com/whatwg/html/issues/11410#issuecomment-3012039651,https://github.com/whatwg/html/issues/11410,Repeated navigations with location.hash etc should throw,2025-06-27T07:40:00Z,zcorpan
3012015941,whatwg/html,"And I absolutely thought that the notes were good, and needed. As for implementation bugs, we've alr",https://github.com/whatwg/html/pull/11409#issuecomment-3012015941,https://github.com/whatwg/html/pull/11409,Abort ongoing navigations when firing certain navigate events,2025-06-27T07:33:02Z,farre
3011966089,whatwg/html,That's strange. A PR should've been created automatically once it hit mozilla-central. Investigating,https://github.com/whatwg/html/issues/11184#issuecomment-3011966089,https://github.com/whatwg/html/issues/11184,Navigation API: Navigation's ongoing navigate event is not null in #inner-navigate-event-firing-algorithm,2025-06-27T07:17:28Z,farre
3011731304,whatwg/html,What was confusing here is that there is no interaction with ECMA-262. This is an HTML algorithm onl,https://github.com/whatwg/html/issues/11404#issuecomment-3011731304,https://github.com/whatwg/html/issues/11404,"Verify handling of the throw completion returned by ""run a classic script""",2025-06-27T05:33:45Z,nicolo-ribaudo
3011674813,whatwg/html,Don't we normally keep the issue open until the WPT is written?,https://github.com/whatwg/html/issues/11405#issuecomment-3011674813,https://github.com/whatwg/html/issues/11405,"Gecko accepts non-conforming full-width digits in <input type=""number"">",2025-06-27T05:01:41Z,annevk
3011671873,mozilla/standards-positions,"> Note that in Firefox currently the [1] example gives incorrect result, that is, width and height a",https://github.com/mozilla/standards-positions/issues/1262#issuecomment-3011671873,https://github.com/mozilla/standards-positions/issues/1262,[SVG] Support for width and height as css attributes on <use> element,2025-06-27T05:00:11Z,martinthomson
3011662698,whatwg/html,I've posted a PR.  The tests don't seem to have made their way into the actual web platform tests re,https://github.com/whatwg/html/issues/11184#issuecomment-3011662698,https://github.com/whatwg/html/issues/11184,Navigation API: Navigation's ongoing navigate event is not null in #inner-navigate-event-firing-algorithm,2025-06-27T04:54:21Z,domenic
3011201679,WICG/webcomponents,"I think you are missing an arrow in the original comment:  ```js const {html} = HTMLElement;  const ",https://github.com/WICG/webcomponents/issues/1069#issuecomment-3011201679,https://github.com/WICG/webcomponents/issues/1069,[templates] A declarative JavaScript templating API,2025-06-27T02:59:00Z,franciscop
3011194841,whatwg/html,"(responding to the rest of Domenic's comment...)  > Going through all the `<div var-scope>` (with ",https://github.com/whatwg/html/pull/11392#issuecomment-3011194841,https://github.com/whatwg/html/pull/11392,Markup: Wrap algorithms in <div> tags,2025-06-27T02:54:05Z,jmdyck
3010998823,whatwg/html,"Yes, this is a straightforward spec violation by Gecko, so a web platform test and Gecko bug would b",https://github.com/whatwg/html/issues/11405#issuecomment-3010998823,https://github.com/whatwg/html/issues/11405,"Gecko accepts non-conforming full-width digits in <input type=""number"">",2025-06-27T01:20:13Z,domenic
3010990808,whatwg/html,This is similar to https://github.com/whatwg/infra/issues/518.  I have always considered it equivale,https://github.com/whatwg/html/issues/11404#issuecomment-3010990808,https://github.com/whatwg/html/issues/11404,"Verify handling of the throw completion returned by ""run a classic script""",2025-06-27T01:17:50Z,domenic
3010497459,w3c/resource-timing,@noamr : I also filed a PR to fetch: https://github.com/whatwg/fetch/pull/1837  I would add you a,https://github.com/w3c/resource-timing/pull/418#issuecomment-3010497459,https://github.com/w3c/resource-timing/pull/418,Edit the list of possible initiatorType values.,2025-06-26T23:05:51Z,guohuideng2024
3010311595,w3c/resource-timing,I made this edit mostly based on https://developer.mozilla.org/en-US/docs/Web/API/PerformanceResourc,https://github.com/w3c/resource-timing/pull/418#issuecomment-3010311595,https://github.com/w3c/resource-timing/pull/418,Edit the list of possible initiatorType values.,2025-06-26T22:14:51Z,guohuideng2024
3010272649,whatwg/html,"Not seeing any topics for today, cancelling.",https://github.com/whatwg/html/issues/11386#issuecomment-3010272649,https://github.com/whatwg/html/issues/11386,Upcoming WHATNOT meeting on 2025-06-26,2025-06-26T21:59:34Z,cwilso
3009918274,mozilla/standards-positions,> Then we would potentially have to provide a different value for env(safe-printable-inset) dependin,https://github.com/mozilla/standards-positions/issues/1258#issuecomment-3009918274,https://github.com/mozilla/standards-positions/issues/1258,Expose unprintable areas via CSS,2025-06-26T20:37:05Z,dholbert
3009185626,mozilla/standards-positions,"CC @mayyasunil @valenting ",https://github.com/mozilla/standards-positions/issues/1260#issuecomment-3009185626,https://github.com/mozilla/standards-positions/issues/1260,Request for Mozilla Position on an Emerging Web Specification: Local Network Access,2025-06-26T17:13:29Z,larseggert
3009155418,mozilla/standards-positions,Webkit standards position issue: https://github.com/WebKit/standards-positions/issues/520,https://github.com/mozilla/standards-positions/issues/1260#issuecomment-3009155418,https://github.com/mozilla/standards-positions/issues/1260,Request for Mozilla Position on an Emerging Web Specification: Local Network Access,2025-06-26T17:05:44Z,hubertchao
3009123188,whatwg/html,"@r12a Thank you for raising this important question.  When implementing the normalization in Chrome,",https://github.com/whatwg/html/issues/11395#issuecomment-3009123188,https://github.com/whatwg/html/issues/11395,"Define optional normalization of full-width characters in <input type=""number"">",2025-06-26T16:52:05Z,kyouhei-horizumi
3009005084,w3c/editing,Thank you! We have filed a form to meet on Thursday. -> https://github.com/w3c/tpac2025-meetings/iss,https://github.com/w3c/editing/issues/487#issuecomment-3009005084,https://github.com/w3c/editing/issues/487,TPAC 2025 - should we have a meeting?,2025-06-26T16:06:04Z,siusin
3008880891,whatwg/html,Thanks for the suggestion. I went ahead and opened a follow-up issue as you mentioned: https://githu,https://github.com/whatwg/html/issues/11395#issuecomment-3008880891,https://github.com/whatwg/html/issues/11395,"Define optional normalization of full-width characters in <input type=""number"">",2025-06-26T15:24:21Z,kyouhei-horizumi
3008867979,w3ctag/design-reviews,"> I think this represents a serious gap in the platform, and I agree that adding APIs to support mor",https://github.com/w3ctag/design-reviews/issues/1095#issuecomment-3008867979,https://github.com/w3ctag/design-reviews/issues/1095,"Canvas Text Metrics for Editing, Art and Design",2025-06-26T15:20:11Z,mbeganyi-a11y
3008786233,whatwg/notifications,"The updated telemetry still reports absolute zero use of non-UTF8 URLs. We'll try dropping document ",https://github.com/whatwg/notifications/issues/209#issuecomment-3008786233,https://github.com/whatwg/notifications/issues/209,Icon fetch in Gecko/Blink uses document charset for URL encoding,2025-06-26T14:54:56Z,saschanaz
3008776145,whatwg/html,Not seeing any topics on the agenda.  Should we cancel today's meeting?,https://github.com/whatwg/html/issues/11386#issuecomment-3008776145,https://github.com/whatwg/html/issues/11386,Upcoming WHATNOT meeting on 2025-06-26,2025-06-26T14:51:50Z,cwilso
3008734220,whatwg/html,Ideally we would prevent clobbering of all standard properties in the prototype chain. But we can st,https://github.com/whatwg/html/issues/10687#issuecomment-3008734220,https://github.com/whatwg/html/issues/10687,Prevent currentScript from being overridden on document via name='',2025-06-26T14:39:15Z,zcorpan
3008724730,whatwg/html,"Update: it appears that this applies to `rel=prefetch` as well, given https://wpt.fyi/results/preloa",https://github.com/whatwg/html/issues/11400#issuecomment-3008724730,https://github.com/whatwg/html/issues/11400,Link elements should not fetch and process upon idempotent attribute mutations,2025-06-26T14:36:20Z,domfarolino
3008288679,whatwg/html,"> If you're interested in exploring (2) further, I’d be happy to open that follow-up issue.  I think",https://github.com/whatwg/html/issues/11395#issuecomment-3008288679,https://github.com/whatwg/html/issues/11395,"Define optional normalization of full-width characters in <input type=""number"">",2025-06-26T12:17:57Z,annevk
3008108118,whatwg/html,These are the [tests](https://bugzilla.mozilla.org/show_bug.cgi?id=1974199) I'm planning to land.,https://github.com/whatwg/html/issues/11184#issuecomment-3008108118,https://github.com/whatwg/html/issues/11184,Navigation API: Navigation's ongoing navigate event is not null in #inner-navigate-event-firing-algorithm,2025-06-26T11:10:36Z,farre
3007993885,whatwg/html,Very nicely written issue @kyouhei-horizumi .  Thanks for raising this.  I put together a very simpl,https://github.com/whatwg/html/issues/11395#issuecomment-3007993885,https://github.com/whatwg/html/issues/11395,"Define optional normalization of full-width characters in <input type=""number"">",2025-06-26T10:26:32Z,r12a
3007858204,w3ctag/design-reviews,We discussed this on the TAG call and we don't have concerns with this particular API. Its use of di,https://github.com/w3ctag/design-reviews/issues/878#issuecomment-3007858204,https://github.com/w3ctag/design-reviews/issues/878,confidence reporting for PerformanceNavigationTiming,2025-06-26T09:40:31Z,yoavweiss
3007740305,w3ctag/design-reviews,"That looks great, thank you!",https://github.com/w3ctag/design-reviews/issues/1073#issuecomment-3007740305,https://github.com/w3ctag/design-reviews/issues/1073,Column wrapping for multicol,2025-06-26T09:00:39Z,xiaochengh
3007680969,whatwg/html,"perfect, thank you for the clarification!",https://github.com/whatwg/html/issues/11402#issuecomment-3007680969,https://github.com/whatwg/html/issues/11402,parser rules clarification,2025-06-26T08:40:51Z,marsp0
3007616335,whatwg/html,"No, this is not meant to be this way. It has a boolean associated to it. That boolean is named ""pars",https://github.com/whatwg/html/issues/11402#issuecomment-3007616335,https://github.com/whatwg/html/issues/11402,parser rules clarification,2025-06-26T08:18:40Z,domenic
3007500011,mozilla/standards-positions,I think so. `X-Moz` is only used [here](https://searchfox.org/mozilla-central/rev/b731af0459d1aaa9bd,https://github.com/mozilla/standards-positions/issues/1259#issuecomment-3007500011,https://github.com/mozilla/standards-positions/issues/1259,"Remove non-standard prefetch headers like X-Moz for Sec-Purpose for prefetches, prerenders, etc.",2025-06-26T07:37:32Z,valenting
3007107416,whatwg/html,I'm happy to be able to help improve things! And it's very convenient to do it while we're implement,https://github.com/whatwg/html/issues/11184#issuecomment-3007107416,https://github.com/whatwg/html/issues/11184,Navigation API: Navigation's ongoing navigate event is not null in #inner-navigate-event-firing-algorithm,2025-06-26T05:30:12Z,farre
