id,repo,body,url,issue_url,issue_title,created_at,user
3642476109,whatwg/html,> @sadym-chromium [#11441 (comment)](https://github.com/whatwg/html/pull/11441#discussion_r244798631,https://github.com/whatwg/html/pull/11441#issuecomment-3642476109,https://github.com/whatwg/html/pull/11441,[WebDriver BiDi] enable and disable scripting via BiDi,2025-12-11T15:30:29Z,sadym-chromium
3642472580,whatwg/html,"I'd like to briefly discuss https://github.com/whatwg/html/issues/11975, but it's okay if it happens",https://github.com/whatwg/html/issues/11889#issuecomment-3642472580,https://github.com/whatwg/html/issues/11889,Meeting 32 for joint OpenUI-WHATWG/HTML-CSSWG task force on styleable form controls,2025-12-11T15:29:43Z,annevk
3642460243,w3c/editing,TPAC 2025: > Ollie: Postpone due to editor being in other meeting.,https://github.com/w3c/editing/issues/490#issuecomment-3642460243,https://github.com/w3c/editing/issues/490,Nested editing hosts do not need to be wrapped in insertParagraph,2025-12-11T15:27:24Z,johanneswilm
3642453290,w3c/clipboard-apis,TPAC 2025: > Smaug There seem to be a proposal Rohan The proposal in the issue looks good. Can we co,https://github.com/w3c/clipboard-apis/issues/237#issuecomment-3642453290,https://github.com/w3c/clipboard-apis/issues/237,Questions about implementing `clipboard.write`,2025-12-11T15:26:00Z,johanneswilm
3642450822,w3c/editing,On the new spec:  TPAC 2025: > support for Bidirectional(presence of both ltr and rtl) text: Sele,https://github.com/w3c/editing/pull/515#issuecomment-3642450822,https://github.com/w3c/editing/pull/515,add a draft charter for the 2025 recharter,2025-12-11T15:25:34Z,johanneswilm
3642442720,w3c/editcontext,"TPAC 2025: > Ashish Memory usage for edit context for apps which are not using the text property, fo",https://github.com/w3c/edit-context/issues/104#issuecomment-3642442720,https://github.com/w3c/edit-context/issues/104,`EditContext.text` should not extend by default,2025-12-11T15:24:03Z,johanneswilm
3642439838,w3c/editcontext,TPAC 2025: > Ashish .text attribute might be problematic from the performance point of view. Smaug I,https://github.com/w3c/edit-context/issues/107#issuecomment-3642439838,https://github.com/w3c/edit-context/issues/107,EditContext.text can be problematic from performance point of view,2025-12-11T15:23:30Z,johanneswilm
3642437709,w3c/editcontext,"TPAC 2025: > Ashish Demonstration of the issue To propose the solution, make changes in #115 The pro",https://github.com/w3c/edit-context/issues/111#issuecomment-3642437709,https://github.com/w3c/edit-context/issues/111,The interaction between composition and `updateText`/`updateSelection` should be more clearly defined,2025-12-11T15:23:03Z,johanneswilm
3642432395,w3c/clipboard-apis,"TPAC 2025: > Rohan Spaces in MIME types are alright, but not according to the spec. Amend the spec m",https://github.com/w3c/clipboard-apis/issues/242#issuecomment-3642432395,https://github.com/w3c/clipboard-apis/issues/242,`ClipboardItem`: clarify mime parsing,2025-12-11T15:21:49Z,johanneswilm
3642429603,w3c/clipboard-apis,TPAC 2025: > Rohan The proposal is to have a new MIME type whenever a site copies data to the clipbo,https://github.com/w3c/clipboard-apis/issues/244#issuecomment-3642429603,https://github.com/w3c/clipboard-apis/issues/244,"Standardize Clipboard Source url, aka the URL from which the content has been copied from",2025-12-11T15:21:08Z,johanneswilm
3642425127,w3c/clipboard-apis,"TPAC 2025: > Rohan I hope everyone is aware of this proposal to optimize MIME type reading  We want ",https://github.com/w3c/clipboard-apis/issues/240#issuecomment-3642425127,https://github.com/w3c/clipboard-apis/issues/240,Selective Clipboard Format Read,2025-12-11T15:20:08Z,johanneswilm
3642422623,w3c/clipboard-apis,TPAC 2025: > Rohan Once they write any custom data to clipboard to have a custom MIME type If the un,https://github.com/w3c/clipboard-apis/issues/243#issuecomment-3642422623,https://github.com/w3c/clipboard-apis/issues/243,`changeId` interaction between `clipboard.write` and `clipboardchange`,2025-12-11T15:19:32Z,johanneswilm
3642418762,w3c/clipboard-apis,"TPAC 2025: > Resolution is to include the feedback from Anne And adopt the resolution ",https://github.com/w3c/clipboard-apis/pull/239#issuecomment-3642418762,https://github.com/w3c/clipboard-apis/pull/239,Add comprehensive clipboardchange event API specification,2025-12-11T15:18:40Z,johanneswilm
3642370536,w3c/editing,"We have agreed on ""Caret movement spec"" during TPAC 2025.",https://github.com/w3c/editing/issues/488#issuecomment-3642370536,https://github.com/w3c/editing/issues/488,new document defining editing behavior - name is needed,2025-12-11T15:07:26Z,johanneswilm
3642345200,whatwg/html,I filed a WebKit bug: https://bugs.webkit.org/show_bug.cgi?id=303993  Closing since it seems the spe,https://github.com/whatwg/html/issues/10671#issuecomment-3642345200,https://github.com/whatwg/html/issues/10671,[images] Lazy loading and out of band loads.,2025-12-11T15:01:38Z,zcorpan
3642343134,w3c/clipboard-apis,https://github.com/w3c/clipboard-apis/commit/efdccf07a0cc518b4faba4095a07b0a2e0f06c83.diff,https://github.com/w3c/clipboard-apis/pull/239#issuecomment-3642343134,https://github.com/w3c/clipboard-apis/pull/239,Add comprehensive clipboardchange event API specification,2025-12-11T15:01:10Z,NAME-sovsec
3642329896,whatwg/html,"> Do we know if there's a web compat reason for `createContextualFragment` to preload images?  It's ",https://github.com/whatwg/html/issues/11669#issuecomment-3642329896,https://github.com/whatwg/html/issues/11669,Coherent story for HTML-setting methods,2025-12-11T14:58:06Z,noamr
3642303094,whatwg/html,Do we know if there's a web compat reason for `createContextualFragment` to preload images?,https://github.com/whatwg/html/issues/11669#issuecomment-3642303094,https://github.com/whatwg/html/issues/11669,Coherent story for HTML-setting methods,2025-12-11T14:52:37Z,zcorpan
3642270800,mozilla/standards-positions,"> I also don't see an intent to implement on the webkit position, which means that as per the charte",https://github.com/mozilla/standards-positions/issues/1191#issuecomment-3642270800,https://github.com/mozilla/standards-positions/issues/1191,Enabling Web Applications to understand bimodal performance timings,2025-12-11T14:46:22Z,yoavweiss
3642242364,w3c/editing,The really surprising thing here is that the behavior depends on whether the parent of that empty di,https://github.com/w3c/editing/issues/496#issuecomment-3642242364,https://github.com/w3c/editing/issues/496,Safari Desktop: position: relative on parent of empty text div makes content leak outside the text div.,2025-12-11T14:39:39Z,michael
3642217905,whatwg/html,"Hmm, that fullscreen is _possibly_ still an issue. allow-focus-steps is using transient user activat",https://github.com/whatwg/html/pull/11519#issuecomment-3642217905,https://github.com/whatwg/html/pull/11519,[focus-without-user-activation] Allow focus if a descendant has focus,2025-12-11T14:34:32Z,smaug----
3642199170,w3c/editing,"Yeah I think that makes sense. Maybe a first topic for the ""caret movement spec"" is specifying how c",https://github.com/w3c/editing/issues/499#issuecomment-3642199170,https://github.com/w3c/editing/issues/499,Safari Desktop: Conditional Show/ Hide of br element in contenteditable element make caret disappear,2025-12-11T14:30:42Z,michael
3642176204,whatwg/html,Closing and reopening to see if the PR preview makes a new version.,https://github.com/whatwg/html/pull/11519#issuecomment-3642176204,https://github.com/whatwg/html/pull/11519,[focus-without-user-activation] Allow focus if a descendant has focus,2025-12-11T14:25:29Z,zcorpan
3642169536,w3c/editing,Step 4 in https://w3c.github.io/editing/docs/execCommand/#methods-to-query-and-execute-commands seem,https://github.com/w3c/editing/issues/504#issuecomment-3642169536,https://github.com/w3c/editing/issues/504,Firefox + Chrome Desktop + Android: document.execCommand does not trigger a 'historyUndo' onbeforinput event after running document.execCommand('undo'),2025-12-11T14:24:04Z,johanneswilm
3642166122,whatwg/html,"I've created this comprehensive table to explain how the different modes of HTML, including existing",https://github.com/whatwg/html/issues/11669#issuecomment-3642166122,https://github.com/whatwg/html/issues/11669,Coherent story for HTML-setting methods,2025-12-11T14:23:16Z,noamr
3642153392,w3c/editing,"I don't think we have specific caret rendering behavior anywhere. This could go into the new ""caret ",https://github.com/w3c/editing/issues/499#issuecomment-3642153392,https://github.com/w3c/editing/issues/499,Safari Desktop: Conditional Show/ Hide of br element in contenteditable element make caret disappear,2025-12-11T14:20:16Z,johanneswilm
3642151970,w3c/editing,"I don't think we have specific caret rendering behavior anywhere. This could go into the new ""caret ",https://github.com/w3c/editing/issues/498#issuecomment-3642151970,https://github.com/w3c/editing/issues/498,Safari/Chrome/Firefox: Caret Rendering inconsistent with empty placeholder across browsers,2025-12-11T14:19:55Z,johanneswilm
3642144677,w3c/editing,"This doesn't seem to go against any spec, and as we have not been defining the dom changes that vari",https://github.com/w3c/editing/issues/497#issuecomment-3642144677,https://github.com/w3c/editing/issues/497,Safari Desktop: Editing an empty `<a>` makes content leak outside the `<a>`,2025-12-11T14:18:04Z,johanneswilm
3642135288,w3c/editing,We have not defined the exact dom changes that will be triggered by user action even if we have unde,https://github.com/w3c/editing/issues/496#issuecomment-3642135288,https://github.com/w3c/editing/issues/496,Safari Desktop: position: relative on parent of empty text div makes content leak outside the text div.,2025-12-11T14:15:46Z,johanneswilm
3642106786,w3c/editing,This is clearly defined in the Input Events spec and this issue therefore appears to be an implement,https://github.com/w3c/editing/issues/494#issuecomment-3642106786,https://github.com/w3c/editing/issues/494,Safari Desktop: `insertReplacementText` not fired,2025-12-11T14:09:10Z,johanneswilm
3642095949,whatwg/html,@sadym-chromium https://github.com/whatwg/html/pull/11441#discussion_r2447986316 is not resolved. Is,https://github.com/whatwg/html/pull/11441#issuecomment-3642095949,https://github.com/whatwg/html/pull/11441,[WebDriver BiDi] enable and disable scripting via BiDi,2025-12-11T14:06:22Z,zcorpan
3642083293,whatwg/html,"Thanks @sadym-chromium, @juliandescottes. I think it's now clear that it's intentional to run some s",https://github.com/whatwg/html/issues/11874#issuecomment-3642083293,https://github.com/whatwg/html/issues/11874,Support for disabling scripts from WebDriver BiDi,2025-12-11T14:03:30Z,zcorpan
3642063669,w3c/editing,This is well-defined in the Input Events spec and should not require additional spec work. It may ne,https://github.com/w3c/editing/issues/492#issuecomment-3642063669,https://github.com/w3c/editing/issues/492,"Safari Desktop: Doesn't fire inputType 'formatBold', 'formatItalic' etc. in beforeinput",2025-12-11T13:59:01Z,johanneswilm
3642059088,mozilla/standards-positions,We still think many of the spec is assuming cloud backend based on AI which we are not interested in,https://github.com/mozilla/standards-positions/issues/1015#issuecomment-3642059088,https://github.com/mozilla/standards-positions/issues/1015,Web Translation API,2025-12-11T13:57:56Z,saschanaz
3642018299,mozilla/standards-positions,@jfkthame do you think you can quickly check we are okay with this? ðŸ‘€,https://github.com/mozilla/standards-positions/issues/1150#issuecomment-3642018299,https://github.com/mozilla/standards-positions/issues/1150,HTML Canvas: Add the lang IDL attribute to CanvasTextDrawingStyles,2025-12-11T13:47:45Z,saschanaz
3641994361,mozilla/standards-positions,My current inclination is to be negative. For a couple of reasons:  1. Users can trivially be tracke,https://github.com/mozilla/standards-positions/issues/1191#issuecomment-3641994361,https://github.com/mozilla/standards-positions/issues/1191,Enabling Web Applications to understand bimodal performance timings,2025-12-11T13:42:08Z,Bas-moz
3641924534,whatwg/html,I think we should make it a parse error if we change this.,https://github.com/whatwg/html/pull/11988#issuecomment-3641924534,https://github.com/whatwg/html/pull/11988,Encourage always-escaping ampersand character.,2025-12-11T13:26:09Z,zcorpan
3641288837,whatwg/html,"If I understand correctly, this PR will change user-facing behavior from:  (the arrows indicate a ",https://github.com/whatwg/html/pull/11536#issuecomment-3641288837,https://github.com/whatwg/html/pull/11536,Change light dismiss to use click events,2025-12-11T10:34:26Z,sb3nder
3641210243,whatwg/html,"@zcorpan can we treat the discussion in https://github.com/whatwg/html/issues/11956 as ""two implemen",https://github.com/whatwg/html/pull/11984#issuecomment-3641210243,https://github.com/whatwg/html/pull/11984,Expose NavigationPrecommitController.addHandler,2025-12-11T10:13:38Z,noamr
3641192143,whatwg/html,@zcorpan all boxes ticked. Review plz?,https://github.com/whatwg/html/pull/11983#issuecomment-3641192143,https://github.com/whatwg/html/pull/11983,Download link: inform the navigation API about aborting,2025-12-11T10:08:57Z,noamr
3641161692,whatwg/html,"Here is breakdown of the behaviors in case of scenario ""Load the page, then disable scripting"".  # M",https://github.com/whatwg/html/issues/11874#issuecomment-3641161692,https://github.com/whatwg/html/issues/11874,Support for disabling scripts from WebDriver BiDi,2025-12-11T10:01:05Z,sadym-chromium
3640654790,whatwg/html,"In chromium, we cannot check the origin of a microtask scheduled by `setTimeout`, `setInterval` or a",https://github.com/whatwg/html/issues/11874#issuecomment-3640654790,https://github.com/whatwg/html/issues/11874,Support for disabling scripts from WebDriver BiDi,2025-12-11T07:44:15Z,sadym-chromium
3640631050,whatwg/html,"We discussed this topic yesterday during the webdriver WG meeting. Trying to summarize, on the WebDr",https://github.com/whatwg/html/issues/11874#issuecomment-3640631050,https://github.com/whatwg/html/issues/11874,Support for disabling scripts from WebDriver BiDi,2025-12-11T07:35:52Z,juliandescottes
3640455816,mozilla/standards-positions,"^^ @Bas-moz ",https://github.com/mozilla/standards-positions/issues/1191#issuecomment-3640455816,https://github.com/mozilla/standards-positions/issues/1191,Enabling Web Applications to understand bimodal performance timings,2025-12-11T06:35:30Z,yoavweiss
3640454392,webkit/standards-positions,^^ @achristensen07 - who was involved in the relevant WG discussions,https://github.com/WebKit/standards-positions/issues/469#issuecomment-3640454392,https://github.com/WebKit/standards-positions/issues/469,Enabling Web Applications to understand bimodal performance timings,2025-12-11T06:34:54Z,yoavweiss
3640260550,w3c/pointerevents,"Starting from Firefox 148, Firefox will start setting non-zero to `movementX` and `movementY` of `po",https://github.com/w3c/pointerevents/issues/535#issuecomment-3640260550,https://github.com/w3c/pointerevents/issues/535,Define `pointermove` and `pointerrawupdate` may have delta from previous corresponding pointer event as `movementX` and `movementY`,2025-12-11T05:43:58Z,masayuki-nakano
3640259486,w3ctag/design-reviews,"I took a look at this. I have quite a few concerns:  1. Venue. The bulk of this work belongs at the ",https://github.com/w3ctag/design-reviews/issues/1169#issuecomment-3640259486,https://github.com/w3ctag/design-reviews/issues/1169,Incubation: Email Verification Protocol,2025-12-11T05:43:50Z,martinthomson
3640062739,whatwg/html,Here is the aforementioned fix for the immediate light dismiss: https://github.com/whatwg/html/pull/,https://github.com/whatwg/html/pull/11536#issuecomment-3640062739,https://github.com/whatwg/html/pull/11536,Change light dismiss to use click events,2025-12-11T04:33:47Z,josepharhar
3639877714,webkit/standards-positions,"This will enable web apps have a more customizable design overall, i would expect a PWA to look like",https://github.com/WebKit/standards-positions/issues/557#issuecomment-3639877714,https://github.com/WebKit/standards-positions/issues/557,Window Controls Overlay for Installed Desktop Web Apps,2025-12-11T03:12:44Z,PMARZV
3639714120,whatwg/html,"> This seems mostly editorial right?  I'm not sure if this is editorial, but it should make the be",https://github.com/whatwg/html/pull/11805#issuecomment-3639714120,https://github.com/whatwg/html/pull/11805,Fix base appearance select styles,2025-12-11T02:04:28Z,josepharhar
3639665480,whatwg/html,I'd like to discuss https://github.com/whatwg/html/pull/11981,https://github.com/whatwg/html/issues/11989#issuecomment-3639665480,https://github.com/whatwg/html/issues/11989,Upcoming WHATNOT meeting on 2025-12-11,2025-12-11T01:38:46Z,KurtCattiSchmidt
3639484909,w3ctag/design-reviews,"Yup, I am very sorry! It's meant for the Digital Credentials API!",https://github.com/w3ctag/design-reviews/issues/1178#issuecomment-3639484909,https://github.com/w3ctag/design-reviews/issues/1178,Define DC API behavior in Private Browsing Mode,2025-12-11T00:23:23Z,mohamedamir
3639459187,w3ctag/design-reviews,"@mohamedamir, did you mean to open this issue somewhere else?",https://github.com/w3ctag/design-reviews/issues/1178#issuecomment-3639459187,https://github.com/w3ctag/design-reviews/issues/1178,Define DC API behavior in Private Browsing Mode,2025-12-11T00:13:07Z,martinthomson
3639337780,mozilla/standards-positions,I think landing something doesn't mean s-p should be closed? ðŸ¤”,https://github.com/mozilla/standards-positions/issues/1150#issuecomment-3639337780,https://github.com/mozilla/standards-positions/issues/1150,HTML Canvas: Add the lang IDL attribute to CanvasTextDrawingStyles,2025-12-10T23:16:19Z,saschanaz
3639283077,whatwg/html,"> I thought about the serialization steps, but when I read through these lines in serializing an ele",https://github.com/whatwg/html/pull/12000#issuecomment-3639283077,https://github.com/whatwg/html/pull/12000,Introduce customelementregistry global attribute,2025-12-10T22:55:15Z,Jamesernator
3639277595,mozilla/standards-positions,The spec has landed. Closing this.,https://github.com/mozilla/standards-positions/issues/1150#issuecomment-3639277595,https://github.com/mozilla/standards-positions/issues/1150,HTML Canvas: Add the lang IDL attribute to CanvasTextDrawingStyles,2025-12-10T22:52:42Z,schenney-chromium
3639153687,webkit/standards-positions,WebKit has some concerns about the interaction of this proposal and various aspects of accessibility,https://github.com/WebKit/standards-positions/issues/378#issuecomment-3639153687,https://github.com/WebKit/standards-positions/issues/378,CSS reading-flow,2025-12-10T22:05:19Z,fantasai
3638751878,w3c/pointerevents,"I think we are on the same page. And when I think about these click heuristics, I frame them in term",https://github.com/w3c/pointerevents/issues/512#issuecomment-3638751878,https://github.com/w3c/pointerevents/issues/512,Enable mouse click and drag to scroll and other pointer behavior customizations,2025-12-10T20:03:10Z,sb3nder
3638512768,whatwg/dom,> or are there concerns about always allocating an object that might only sometimes be used?  It's,https://github.com/whatwg/dom/pull/1425#issuecomment-3638512768,https://github.com/whatwg/dom/pull/1425,Add abortSignal.addAbortCallback,2025-12-10T18:53:02Z,michaelficarra
3638422369,w3c/pointerevents,"> click heuristics  just to make sure we're on the same page, can you clarify your definition of ""cl",https://github.com/w3c/pointerevents/issues/512#issuecomment-3638422369,https://github.com/w3c/pointerevents/issues/512,Enable mouse click and drag to scroll and other pointer behavior customizations,2025-12-10T18:30:03Z,patrickhlauke
3638378433,w3c/editing,"@johanneswilm, pls review and merge.",https://github.com/w3c/editing/pull/517#issuecomment-3638378433,https://github.com/w3c/editing/pull/517,Rename 512.html to 513.html and add repro for #516,2025-12-10T18:16:48Z,michael
3638368575,w3c/editing,Likely related: #499,https://github.com/w3c/editing/issues/516#issuecomment-3638368575,https://github.com/w3c/editing/issues/516,"Safari Desktop: Adding an empty span to an otherwise empty editable element, makes the element unselectable",2025-12-10T18:13:59Z,michael
3638302332,whatwg/html,I did some testing regarding the `keydown` â†’ `keyup` â†’ `click` interaction: https://github.com/w3c/a,https://github.com/whatwg/html/issues/7578#issuecomment-3638302332,https://github.com/whatwg/html/issues/7578,:active and activating via the keyboard,2025-12-10T17:55:33Z,sb3nder
3638176376,whatwg/html,We'd like to discuss issue #11839.,https://github.com/whatwg/html/issues/11989#issuecomment-3638176376,https://github.com/whatwg/html/issues/11989,Upcoming WHATNOT meeting on 2025-12-11,2025-12-10T17:26:55Z,leotlee
3638072143,w3c/pointerevents,"Some questions:  1. For devices(touch, pen, ...) that have *click heuristics* when *direct manipulat",https://github.com/w3c/pointerevents/issues/512#issuecomment-3638072143,https://github.com/w3c/pointerevents/issues/512,Enable mouse click and drag to scroll and other pointer behavior customizations,2025-12-10T17:00:15Z,sb3nder
3638054993,whatwg/html,"@Jamesernator @annevk  I thought about the serialization steps, but when I read through these lines",https://github.com/whatwg/html/pull/12000#issuecomment-3638054993,https://github.com/whatwg/html/pull/12000,Introduce customelementregistry global attribute,2025-12-10T16:55:33Z,ja-y-son
3638021236,w3c/editing,"Putting this on the agenda for tomorrow's WG meetup, as I assume this should be a rather easy fix fo",https://github.com/w3c/editing/issues/505#issuecomment-3638021236,https://github.com/w3c/editing/issues/505,"Safari Desktop: When aborting a composition after pressing a dead key (e.g. `^`) in oncompositionend event.data will have `""""` while `""^""` is expected",2025-12-10T16:46:36Z,michael
3637804495,whatwg/html,"> Additionally, on https://software.hixie.ch/utilities/js/live-dom-viewer/?saved=14376 with safari, ",https://github.com/whatwg/html/pull/11560#issuecomment-3637804495,https://github.com/whatwg/html/pull/11560,Redact ancestorOrigins using iframe referrerpolicy,2025-12-10T16:02:34Z,zcorpan
3637748368,mozilla/standards-positions,Thanks @keithamus   I've opened this issue in Bugzilla for the request as well https://bugzilla.mozi,https://github.com/mozilla/standards-positions/issues/1325#issuecomment-3637748368,https://github.com/mozilla/standards-positions/issues/1325,Add support for video element lazy-loading via the loading attribute,2025-12-10T15:50:23Z,scottjehl
3637629929,w3c/pointerevents,"ah, thanks for those examples @sadym-chromium (still feels a bit odd to me that it's not relegated t",https://github.com/w3c/pointerevents/pull/561#issuecomment-3637629929,https://github.com/w3c/pointerevents/pull/561,WebDriver BiDi emulated max touch points,2025-12-10T15:26:06Z,patrickhlauke
3637543063,whatwg/html,I think this also looks right to me. This is very related to my comment above https://github.com/wha,https://github.com/whatwg/html/issues/10671#issuecomment-3637543063,https://github.com/whatwg/html/issues/10671,[images] Lazy loading and out of band loads.,2025-12-10T15:07:38Z,domfarolino
3637400526,w3c/pointerevents,"> I'll admit that I've not seen this sort of Webdriver-specific information being added directly to ",https://github.com/w3c/pointerevents/pull/561#issuecomment-3637400526,https://github.com/w3c/pointerevents/pull/561,WebDriver BiDi emulated max touch points,2025-12-10T14:39:03Z,sadym-chromium
3637360710,w3c/pointerevents,"I'll admit that I've not seen this sort of Webdriver-specific information being added directly to a ",https://github.com/w3c/pointerevents/pull/561#issuecomment-3637360710,https://github.com/w3c/pointerevents/pull/561,WebDriver BiDi emulated max touch points,2025-12-10T14:30:09Z,patrickhlauke
3637230344,whatwg/dom,`addAbortCallback` returning a disposable (`Symbol.dispose`) sounds useful to me - or are there conc,https://github.com/whatwg/dom/pull/1425#issuecomment-3637230344,https://github.com/whatwg/dom/pull/1425,Add abortSignal.addAbortCallback,2025-12-10T14:01:02Z,acutmore
3636672789,whatwg/html,> > @smaug---- pointed out is that the spec has `SameObject` but WebKit and Chromium return a new ob,https://github.com/whatwg/html/pull/11560#issuecomment-3636672789,https://github.com/whatwg/html/pull/11560,Redact ancestorOrigins using iframe referrerpolicy,2025-12-10T11:38:36Z,theIDinside
3636317636,whatwg/html,"We don't track proposals this way, they can continue to be tracked in issues. ",https://github.com/whatwg/html/pull/12005#issuecomment-3636317636,https://github.com/whatwg/html/pull/12005,Add proposal for maxcount attribute,2025-12-10T10:10:08Z,keithamus
3636100976,whatwg/html,https://github.com/WICG/declarative-partial-updates/blob/main/patching-explainer.md has been updated,https://github.com/whatwg/html/issues/11542#issuecomment-3636100976,https://github.com/whatwg/html/issues/11542,"Out of order HTML streaming (""patching"")",2025-12-10T09:15:17Z,foolip
3635282547,whatwg/html,"The `toggle` may be a workaround for it. But doesn't apply to shadowDom, the event isn't composed.  ",https://github.com/whatwg/html/issues/9075#issuecomment-3635282547,https://github.com/whatwg/html/issues/9075,"API to get top layer elements ",2025-12-10T04:03:46Z,woody-li
3635216554,whatwg/html,"> we used to have `<hgroup>` that wraps multiple h elements to represent a heading with subheadings ",https://github.com/whatwg/html/issues/7879#issuecomment-3635216554,https://github.com/whatwg/html/issues/7879,Suboptimal subheading workarounds,2025-12-10T03:37:44Z,alecgargett
