id,repo,body,url,issue_url,issue_title,created_at,user
2502769138,whatwg/html,"@annevk, I think you might be best-positioned to help solve this? In particular, I'm unsure how to l",https://github.com/whatwg/html/issues/10796#issuecomment-2502769138,https://github.com/whatwg/html/issues/10796,"""create navigation params by fetching"" invokes ""should navigation request of type be blocked by Content Security Policy?"" without setting the policy container",2024-11-27T04:51:57Z,domenic
2502766783,w3c/pointerevents,"Firefox just follows the Pointer Events spec. I mean Firefox can synthesize pointer boundary events ",https://github.com/w3c/pointerevents/issues/529#issuecomment-2502766783,https://github.com/w3c/pointerevents/issues/529,Mouse and Pointer events from a stationary mouse,2024-11-27T04:50:17Z,masayuki-nakano
2502766392,whatwg/html,Why do you think this? If we reach step 2 of https://html.spec.whatwg.org/#navigate-to-a-javascript:,https://github.com/whatwg/html/issues/10800#issuecomment-2502766392,https://github.com/whatwg/html/issues/10800,Some calls https://html.spec.whatwg.org/#set-the-ongoing-navigation could need some clarification,2024-11-27T04:49:54Z,domenic
2502725177,w3ctag/design-reviews,"The TAG agrees that it would be useful to enable the user-focused use case here. Specifically, the w",https://github.com/w3ctag/design-reviews/issues/975#issuecomment-2502725177,https://github.com/w3ctag/design-reviews/issues/975,Fenced frames with local unpartitioned data access,2024-11-27T04:27:15Z,jyasskin
2502665412,whatwg/html,Per spec it's a conformance error; see https://html.spec.whatwg.org/multipage/parsing.html#markup-de,https://github.com/whatwg/html/issues/10801#issuecomment-2502665412,https://github.com/whatwg/html/issues/10801,"Clarify using CDATA in HTML context ",2024-11-27T03:57:14Z,domenic
2502371846,WICG/webcomponents,"> As of 2024Q4, the following tasks are NOT blocking an initial release, right?  Right. I've edite",https://github.com/WICG/webcomponents/issues/1086#issuecomment-2502371846,https://github.com/WICG/webcomponents/issues/1086,Reference Target Tracking Issue,2024-11-27T00:57:29Z,dandclark
2502363342,WICG/webcomponents,"As of 2024Q4, the following tasks are NOT blocking an initial release, right? - [ ] An issue still ",https://github.com/WICG/webcomponents/issues/1086#issuecomment-2502363342,https://github.com/WICG/webcomponents/issues/1086,Reference Target Tracking Issue,2024-11-27T00:51:45Z,Westbrook
2502358923,WICG/webcomponents,"I agree that 1a is the right path here. I'd love for the browser to give me ""dev time"" warnings abou",https://github.com/WICG/webcomponents/issues/1071#issuecomment-2502358923,https://github.com/WICG/webcomponents/issues/1071,Reference Target: How to handle invalid ID references?,2024-11-27T00:47:03Z,Westbrook
2501934559,w3c/pointerevents,I have edited my original post above based on @flackr's observation above.,https://github.com/w3c/pointerevents/issues/529#issuecomment-2501934559,https://github.com/w3c/pointerevents/issues/529,Mouse and Pointer events from a stationary mouse,2024-11-26T21:05:56Z,mustaqahmed
2501899670,whatwg/html,":closed was resolved to be removed for now, so I'm removing it from this PR: https://github.com/w3c/",https://github.com/whatwg/html/pull/10126#issuecomment-2501899670,https://github.com/whatwg/html/pull/10126,Add the :open pseudo-class,2024-11-26T20:43:23Z,josepharhar
2501890990,webkit/standards-positions,":closed was resolved to be removed for now, so I'm removing it from this proposal: https://github.co",https://github.com/WebKit/standards-positions/issues/413#issuecomment-2501890990,https://github.com/WebKit/standards-positions/issues/413,:open pseudo-class,2024-11-26T20:38:48Z,josepharhar
2501889270,mozilla/standards-positions,":closed was resolved to be removed for now, so I'm removing it from this proposal: https://github.co",https://github.com/mozilla/standards-positions/issues/1085#issuecomment-2501889270,https://github.com/mozilla/standards-positions/issues/1085,:open pseudo-class,2024-11-26T20:38:20Z,josepharhar
2501831771,w3c/pointerevents,> There are important differences between major browsers here: >  > * [Repro for top frame](https:,https://github.com/w3c/pointerevents/issues/529#issuecomment-2501831771,https://github.com/w3c/pointerevents/issues/529,Mouse and Pointer events from a stationary mouse,2024-11-26T20:13:40Z,flackr
2501756154,whatwg/html,"Yeah it's unfortunate that there is a platform difference like this with the same html, and I'm worr",https://github.com/whatwg/html/issues/8189#issuecomment-2501756154,https://github.com/whatwg/html/issues/8189,Rendering <select> as a listbox is a one-line widget that opens a popup on iOS and Android,2024-11-26T19:27:33Z,josepharhar
2501502680,mozilla/standards-positions,We're going back to add Prior Art and Alternatives Considered to our explainer. We'll post again whe,https://github.com/mozilla/standards-positions/issues/1112#issuecomment-2501502680,https://github.com/mozilla/standards-positions/issues/1112,Payment link type in HTML,2024-11-26T17:15:25Z,ynyhxfo
2501501988,webkit/standards-positions,We're going back to add Prior Art and Alternatives Considered to our explainer. We'll post again whe,https://github.com/WebKit/standards-positions/issues/428#issuecomment-2501501988,https://github.com/WebKit/standards-positions/issues/428,Payment link type in HTML,2024-11-26T17:15:13Z,ynyhxfo
2501500666,w3ctag/design-reviews,We're going back to add Prior Art and Alternatives Considered to our explainer. We'll post again whe,https://github.com/w3ctag/design-reviews/issues/1015#issuecomment-2501500666,https://github.com/w3ctag/design-reviews/issues/1015,Payment link type in HTML,2024-11-26T17:14:52Z,ynyhxfo
2501492769,whatwg/html,From my understanding the hesitation was because of Webkit using Cairo in 2021 but now in 2024 based,https://github.com/whatwg/html/issues/5620#issuecomment-2501492769,https://github.com/whatwg/html/issues/5620,Perspective transforms for Canvas2D,2024-11-26T17:12:43Z,talltyler
2501249123,w3c/pointerevents,"FYI: @flackr @smaug---- @masayuki-nakano ",https://github.com/w3c/pointerevents/issues/529#issuecomment-2501249123,https://github.com/w3c/pointerevents/issues/529,Mouse and Pointer events from a stationary mouse,2024-11-26T16:01:27Z,mustaqahmed
2501231629,w3c/pointerevents,The FPWD for Level 4 will be published on Thursday: 1. /TR/pointerevents/ will point to it 2. Afte,https://github.com/w3c/pointerevents/issues/506#issuecomment-2501231629,https://github.com/w3c/pointerevents/issues/506,https://www.w3.org/TR/pointerevents/ redirects to old spec...,2024-11-26T15:54:21Z,plehegar
2501017254,whatwg/html,> This is cumbersome to implement as not all browsers/platforms respond in the same way  That seem,https://github.com/whatwg/html/issues/10799#issuecomment-2501017254,https://github.com/whatwg/html/issues/10799,Allow `MutationObserver` to observe (certain) element property changes,2024-11-26T14:50:20Z,annevk
2500846493,whatwg/webidl,We ran another experiment with changed behaviour where for unions of `string | async iterable<T>` th,https://github.com/whatwg/webidl/pull/1397#issuecomment-2500846493,https://github.com/whatwg/webidl/pull/1397,Add `async iterable<T>` type to WebIDL,2024-11-26T13:46:14Z,lucacasonato
2500813880,whatwg/html,It seems like an implementation bug. Closing then as this indeed has nothing to do with the HTML sta,https://github.com/whatwg/html/issues/10797#issuecomment-2500813880,https://github.com/whatwg/html/issues/10797,Display gap between 00 and 01,2024-11-26T13:32:04Z,annevk
2500799917,whatwg/dom,"last question from me: is it possible to rename and land this method as `moveBeforeAtomic(child, ref",https://github.com/whatwg/dom/issues/1255#issuecomment-2500799917,https://github.com/whatwg/dom/issues/1255,Atomic move operation for element reparenting & reordering,2024-11-26T13:26:07Z,WebReflection
2500786093,whatwg/html,"> How is this an issue with the HTML standard?  I am not sure.   <input type=""time"">  There in",https://github.com/whatwg/html/issues/10797#issuecomment-2500786093,https://github.com/whatwg/html/issues/10797,Display gap between 00 and 01,2024-11-26T13:20:01Z,prashanthcoe19
2500641277,whatwg/html,How is this an issue with the HTML standard?,https://github.com/whatwg/html/issues/10797#issuecomment-2500641277,https://github.com/whatwg/html/issues/10797,Display gap between 00 and 01,2024-11-26T12:18:40Z,annevk
2500225681,mozilla/standards-positions,There is a spec issue open to remove clipboard event. https://github.com/w3c/clipboard-apis/issues/,https://github.com/mozilla/standards-positions/issues/1115#issuecomment-2500225681,https://github.com/mozilla/standards-positions/issues/1115,Clipboardchange event API,2024-11-26T10:22:27Z,smaug----
2500022367,whatwg/dom,The way I am looking at this is whether the method performs a move or not. For the past two-and-half,https://github.com/whatwg/dom/issues/1255#issuecomment-2500022367,https://github.com/whatwg/dom/issues/1255,Atomic move operation for element reparenting & reordering,2024-11-26T08:50:40Z,annevk
2499526168,whatwg/dom,I want to push back lightly on the use cases (e.g. https://github.com/whatwg/dom/issues/1255#issueco,https://github.com/whatwg/dom/issues/1255#issuecomment-2499526168,https://github.com/whatwg/dom/issues/1255,Atomic move operation for element reparenting & reordering,2024-11-26T02:37:29Z,sorvell
2499277380,w3ctag/design-reviews,"Sorry, I meant the state of adoption by community and working groups. https://www.chromium.org/blink",https://github.com/w3ctag/design-reviews/issues/1018#issuecomment-2499277380,https://github.com/w3ctag/design-reviews/issues/1018,[Handwriting] Add Handwriting CSS Value,2024-11-26T00:00:21Z,jyasskin
2499212601,w3ctag/design-reviews,There is currently no code implemented for the feature. We are adding a use counter to try to measur,https://github.com/w3ctag/design-reviews/issues/1018#issuecomment-2499212601,https://github.com/w3ctag/design-reviews/issues/1018,[Handwriting] Add Handwriting CSS Value,2024-11-25T23:04:47Z,gastonrod
2499200015,w3c/pointerevents,I reopened this issue to discuss the Pointer/Mouse event differences.  Looks like there are other di,https://github.com/w3c/pointerevents/issues/457#issuecomment-2499200015,https://github.com/w3c/pointerevents/issues/457,pointerout even if the pointer doesn't move?,2024-11-25T22:54:44Z,mustaqahmed
2498944872,whatwg/html,Good to see in the updated explainer consideration of import attributes like SVG.  I note that thi,https://github.com/whatwg/html/issues/10673#issuecomment-2498944872,https://github.com/whatwg/html/issues/10673,Declarative CSS Modules and Declarative Shadow DOM `adoptedstylesheets` attribute,2024-11-25T20:15:06Z,robglidden
2498934898,whatwg/dom,The benchmark discussion was simply us assessing whether it's fast enough for it to be viable for us,https://github.com/whatwg/dom/issues/1255#issuecomment-2498934898,https://github.com/whatwg/dom/issues/1255,Atomic move operation for element reparenting & reordering,2024-11-25T20:09:23Z,dead-claudia
2498875138,w3ctag/design-reviews,"What's the adoption state here? I see enough Chrome interest to justify adopting this into the WICG,",https://github.com/w3ctag/design-reviews/issues/1018#issuecomment-2498875138,https://github.com/w3ctag/design-reviews/issues/1018,[Handwriting] Add Handwriting CSS Value,2024-11-25T19:36:10Z,jyasskin
2498839765,whatwg/dom,"> @WebReflection given that it's established that raw `moveBefore` has valid use cases, and we can p",https://github.com/whatwg/dom/issues/1255#issuecomment-2498839765,https://github.com/whatwg/dom/issues/1255,Atomic move operation for element reparenting & reordering,2024-11-25T19:16:51Z,dead-claudia
2498625537,whatwg/html,"""In parallel"" has a common meaning in English, which does not match the intended meaning here.  ""R",https://github.com/whatwg/html/issues/10049#issuecomment-2498625537,https://github.com/whatwg/html/issues/10049,"""in parallel"" in algorithm headers can be confusing",2024-11-25T17:29:14Z,TallTed
2498593672,whatwg/dom,FYI React experimental reconcilier integration PR: https://github.com/facebook/react/pull/31596 with,https://github.com/whatwg/dom/issues/1255#issuecomment-2498593672,https://github.com/whatwg/dom/issues/1255,Atomic move operation for element reparenting & reordering,2024-11-25T17:15:31Z,slorber
2498557864,whatwg/dom,"Thanks! Yeah, this is a longstanding issue where we don't define the internal layout of event object",https://github.com/whatwg/dom/issues/1328#issuecomment-2498557864,https://github.com/whatwg/dom/issues/1328,Missing machinery for associated Event data,2024-11-25T16:59:19Z,annevk
2498473019,w3ctag/design-reviews,"Thank you for sending us this review. We see a few different ways that your work could be applied, a",https://github.com/w3ctag/design-reviews/issues/977#issuecomment-2498473019,https://github.com/w3ctag/design-reviews/issues/977,Accessibility conformance Testing (ACT) Rules Format 1.1,2024-11-25T16:22:34Z,matatk
2498457084,whatwg/html,"> That strategy does sound reasonable, although I wonder if you should merge the algorithm with ""try",https://github.com/whatwg/html/pull/10759#issuecomment-2498457084,https://github.com/whatwg/html/pull/10759,Add initial scroll position hook to HTML spec,2024-11-25T16:15:56Z,DavMila
2498158745,whatwg/dom,Do we have reasonable test coverage to ensure that mutation of the live range through the API update,https://github.com/whatwg/dom/issues/772#issuecomment-2498158745,https://github.com/whatwg/dom/issues/772,Should a Range object be able to update a Selection object,2024-11-25T14:24:12Z,annevk
2498055788,whatwg/dom,@noamr the whole discussion is about **not** landing `moveBefore` as it is so me opening a new discu,https://github.com/whatwg/dom/issues/1255#issuecomment-2498055788,https://github.com/whatwg/dom/issues/1255,Atomic move operation for element reparenting & reordering,2024-11-25T13:41:55Z,WebReflection
2498038759,whatwg/dom,"@WebReflection given that it's established that raw `moveBefore` has valid use cases, and we can per",https://github.com/whatwg/dom/issues/1255#issuecomment-2498038759,https://github.com/whatwg/dom/issues/1255,Atomic move operation for element reparenting & reordering,2024-11-25T13:34:12Z,noamr
2498031090,WICG/webcomponents,I should have taken a bit more time to fully explain where my idea came from. I was thinking that ap,https://github.com/WICG/webcomponents/issues/1040#issuecomment-2498031090,https://github.com/WICG/webcomponents/issues/1040,[scoped-registries] Finding a definition for disconnected elements,2024-11-25T13:30:44Z,annevk
2498021240,whatwg/dom,"@WebReflection Sorry, I meant like specific time numbers, like 60k ops/sec or 1 ms/op.",https://github.com/whatwg/dom/issues/1255#issuecomment-2498021240,https://github.com/whatwg/dom/issues/1255,Atomic move operation for element reparenting & reordering,2024-11-25T13:26:37Z,dead-claudia
2498011835,whatwg/dom,multiple moves and we're talking 0.3 VS 0.4 but for benchmarks 0.1 might mean everything ... of cour,https://github.com/whatwg/dom/issues/1255#issuecomment-2498011835,https://github.com/whatwg/dom/issues/1255,Atomic move operation for element reparenting & reordering,2024-11-25T13:22:19Z,WebReflection
2497923912,whatwg/dom,"> to whom it might concern, just adding those two `isConnected` checks repeatedly gave me ~30% slowe",https://github.com/whatwg/dom/issues/1255#issuecomment-2497923912,https://github.com/whatwg/dom/issues/1255,Atomic move operation for element reparenting & reordering,2024-11-25T12:44:21Z,dead-claudia
2497899631,whatwg/dom,"to whom it might concern, just adding those two `isConnected` checks repeatedly gave me ~30% slower ",https://github.com/whatwg/dom/issues/1255#issuecomment-2497899631,https://github.com/whatwg/dom/issues/1255,Atomic move operation for element reparenting & reordering,2024-11-25T12:33:32Z,WebReflection
2489688718,w3ctag/design-reviews,"Overall, we think masonry, grid, and wrapping-flexbox should be incorporated into a unified set of p",https://github.com/w3ctag/design-reviews/issues/1003#issuecomment-2489688718,https://github.com/w3ctag/design-reviews/issues/1003,CSS Masonry Layout,2024-11-20T22:46:38Z,jyasskin
2469608360,whatwg/html,"Currently for local purpose, testing for popup permission i use this trickery   --> have installed a",https://github.com/whatwg/html/issues/10751#issuecomment-2469608360,https://github.com/whatwg/html/issues/10751,Way to close stale window with null reference that browser opens after a blocked popup was allowed by user,2024-11-12T04:53:38Z,tathastu871
2455320714,mozilla/standards-positions,"All browsers, including Firefox, [support `align-content`](https://web.dev/blog/align-content-block)",https://github.com/mozilla/standards-positions/issues/941#issuecomment-2455320714,https://github.com/mozilla/standards-positions/issues/941,CSS Box Alignment Module Level 3,2024-11-04T17:37:21Z,o-t-w
2293918624,WICG/webcomponents,"I was just about to add a note about signals. I think this is a great place to start adding signals ",https://github.com/WICG/webcomponents/issues/1069#issuecomment-2293918624,https://github.com/WICG/webcomponents/issues/1069,[templates] A declarative JavaScript templating API,2024-08-16T17:51:48Z,justinfagnani
1614741965,whatwg/html,Still getting reports about this: https://github.com/Scirra/Construct-bugs/issues/7164,https://github.com/whatwg/html/issues/6731#issuecomment-1614741965,https://github.com/whatwg/html/issues/6731,Canvas textBaseline needs better tests,2023-06-30T14:31:57Z,AshleyScirra
1545493376,whatwg/html,"Still getting complaints about production apps affected by this, e.g.: https://www.construct.net/en/",https://github.com/whatwg/html/issues/6731#issuecomment-1545493376,https://github.com/whatwg/html/issues/6731,Canvas textBaseline needs better tests,2023-05-12T09:59:49Z,AshleyScirra