id,repo,body,url,issue_url,issue_title,created_at,user
2170388735,whatwg/html,Agreed with @domenic about making the property more specific. [Consistency](https://www.w3.org/TR/de,https://github.com/whatwg/html/issues/9111#issuecomment-2170388735,https://github.com/whatwg/html/issues/9111,Popover does not know what triggered it,2024-06-15T17:15:55Z,LeaVerou
2169377939,whatwg/html,"I think you nailed it for the first time with the `action` name, `command` seems really distant to a",https://github.com/whatwg/html/issues/9625#issuecomment-2169377939,https://github.com/whatwg/html/issues/9625,[Proposal] Invoker Buttons - allowing popover/dialog and more to be invoked without JS,2024-06-15T11:35:37Z,lubomirblazekcz
2168770381,whatwg/html,"@domenic @annevk When you have a chance, would you mind an early review to make sure this aligns wit",https://github.com/whatwg/html/pull/10404#issuecomment-2168770381,https://github.com/whatwg/html/pull/10404,Create a 'report an exception' algorithm per #958,2024-06-14T21:13:27Z,jeremyroman
2168347303,whatwg/html,I added you to the invite.,https://github.com/whatwg/html/issues/10408#issuecomment-2168347303,https://github.com/whatwg/html/issues/10408," Upcoming WHATNOT meeting on 6/20/2024",2024-06-14T16:14:56Z,past
2168228146,whatwg/html,cc @whatwg/media,https://github.com/whatwg/html/issues/10410#issuecomment-2168228146,https://github.com/whatwg/html/issues/10410,video networkState and currentSrc after load() with no source,2024-06-14T15:01:49Z,annevk
2168164096,whatwg/dom,"I am interested in two things here.  1. The integrity of the ""is changed by API"" bit that Chromium",https://github.com/whatwg/dom/issues/1288#issuecomment-2168164096,https://github.com/whatwg/dom/issues/1288,Request for mechanism to determine if children changed steps are called as a result of script or parser,2024-06-14T14:26:18Z,domfarolino
2167550580,whatwg/html,"I'd like to join. ",https://github.com/whatwg/html/issues/10408#issuecomment-2167550580,https://github.com/whatwg/html/issues/10408," Upcoming WHATNOT meeting on 6/20/2024",2024-06-14T08:43:50Z,muan
2167332462,whatwg/html,Getting back to this as we have someone working on it again.  > I feel like there's still no signi,https://github.com/whatwg/html/pull/8972#issuecomment-2167332462,https://github.com/whatwg/html/pull/8972,Add steps to destroy documents that are ineligible for receiving message when posting message through broadcast channel,2024-06-14T06:42:13Z,fergald
2167214741,mozilla/standards-positions,"I agree with Emilio, this is generally worthwhile.  One piece of feedback here: please try to find",https://github.com/mozilla/standards-positions/issues/1040#issuecomment-2167214741,https://github.com/mozilla/standards-positions/issues/1040,Partitioned :visited links history,2024-06-14T05:01:21Z,martinthomson
2167203567,whatwg/html,> do you have a fuller example of what you're trying to accomplish and how the current api falls sho,https://github.com/whatwg/html/issues/10411#issuecomment-2167203567,https://github.com/whatwg/html/issues/10411,Range search for localstorage and session storage,2024-06-14T04:47:32Z,anuragvohraec
2167174643,whatwg/html,do you have a fuller example of what you're trying to accomplish and how the current api falls short,https://github.com/whatwg/html/issues/10411#issuecomment-2167174643,https://github.com/whatwg/html/issues/10411,Range search for localstorage and session storage,2024-06-14T04:10:36Z,nektro
2167022332,webkit/standards-positions,Duplicate of #193  Thanks!,https://github.com/WebKit/standards-positions/issues/302#issuecomment-2167022332,https://github.com/WebKit/standards-positions/issues/302,Cross-Document View Transitions,2024-06-14T00:53:56Z,nt1m
2167021443,webkit/standards-positions,This solves repetition in certain use cases of View Transitions in a straightforward way.  I'll ma,https://github.com/WebKit/standards-positions/issues/321#issuecomment-2167021443,https://github.com/WebKit/standards-positions/issues/321,View Transition Classes,2024-06-14T00:52:33Z,nt1m
2167021146,w3ctag/design-reviews,"@jiajiabingcheng you may be interested in the progress on WebVTT kind disambiguation, including meta",https://github.com/w3ctag/design-reviews/issues/952#issuecomment-2167021146,https://github.com/w3ctag/design-reviews/issues/952,Support Video Chapter in MediaMetadata,2024-06-14T00:52:05Z,cookiecrook
2166712951,whatwg/html,"Terrific job @saschanaz, thank you!",https://github.com/whatwg/html/issues/10408#issuecomment-2166712951,https://github.com/whatwg/html/issues/10408," Upcoming WHATNOT meeting on 6/20/2024",2024-06-13T20:32:17Z,past
2166711437,whatwg/html,Thank you for capturing and posting the meeting notes @saschanaz!,https://github.com/whatwg/html/issues/10400#issuecomment-2166711437,https://github.com/whatwg/html/issues/10400,Upcoming WHATNOT meeting on 6/13/2024,2024-06-13T20:31:13Z,past
2166085701,w3c/editing,"The Web Editing Working Group just discussed `normative spec changes do not always end up as issues ",https://github.com/w3c/editing/issues/463#issuecomment-2166085701,https://github.com/w3c/editing/issues/463,normative spec changes do not always end up as issues filed with browsers,2024-06-13T15:57:25Z,css-meeting-bot
2166009952,whatwg/dom,"> This now seems to invoke TT even when we have specifications manipulate attributes,  Should I ad",https://github.com/whatwg/dom/pull/1268#issuecomment-2166009952,https://github.com/whatwg/dom/pull/1268,Trusted types attributes,2024-06-13T15:28:52Z,lukewarlow
2165970625,w3c/clipboard-apis,"The Web Editing Working Group just discussed `Write UTF-8 data to the clipboard.`, and agreed to the",https://github.com/w3c/clipboard-apis/issues/217#issuecomment-2165970625,https://github.com/w3c/clipboard-apis/issues/217,Write UTF-8 data to the clipboard.,2024-06-13T15:13:30Z,css-meeting-bot
2165955028,whatwg/dom,The change to `set an attribute value` breaks iframe.srcdoc property setting currently (it'll do a d,https://github.com/whatwg/dom/pull/1268#issuecomment-2165955028,https://github.com/whatwg/dom/pull/1268,Trusted types attributes,2024-06-13T15:08:30Z,lukewarlow
2165953464,whatwg/dom,# Trusted Types integration with DOM  The DOM spec already contains partial integration with Trust,https://github.com/whatwg/dom/pull/1268#issuecomment-2165953464,https://github.com/whatwg/dom/pull/1268,Trusted types attributes,2024-06-13T15:07:52Z,lukewarlow
2165833822,whatwg/encoding,Thank you!,https://github.com/whatwg/encoding/issues/329#issuecomment-2165833822,https://github.com/whatwg/encoding/issues/329,"Reference link wrong in ""If ioQueue is empty...""",2024-06-13T14:25:40Z,annevk
2165811423,whatwg/encoding,LGTM (and now I need to look at my specs for the same glitch...),https://github.com/whatwg/encoding/pull/330#issuecomment-2165811423,https://github.com/whatwg/encoding/pull/330,"Editorial: correct ""is empty"" reference",2024-06-13T14:18:10Z,inexorabletash
2165605121,whatwg/html,reading-flow (reading-order-items) is relevant to the focusgroup idea imo. It will fall into the sam,https://github.com/whatwg/html/issues/10407#issuecomment-2165605121,https://github.com/whatwg/html/issues/10407,Proposal: CSS reading-order-items,2024-06-13T13:01:27Z,lukewarlow
2165411351,mozilla/standards-positions,"To clarify, I think the security + performance benefits probably out-weight breaking some users' exp",https://github.com/mozilla/standards-positions/issues/1040#issuecomment-2165411351,https://github.com/mozilla/standards-positions/issues/1040,Partitioned :visited links history,2024-06-13T11:40:34Z,emilio
2165361076,mozilla/standards-positions,"Generally positive as a concept and from the CSS side, though skeptic about the loss of functionalit",https://github.com/mozilla/standards-positions/issues/1040#issuecomment-2165361076,https://github.com/mozilla/standards-positions/issues/1040,Partitioned :visited links history,2024-06-13T11:18:40Z,emilio
2165357302,mozilla/standards-positions,This is not the right place to follow implementation progress in Gecko. https://bugzilla.mozilla.org,https://github.com/mozilla/standards-positions/issues/831#issuecomment-2165357302,https://github.com/mozilla/standards-positions/issues/831,"Exclusive accordions with <details name="""">",2024-06-13T11:16:59Z,zcorpan
2165259713,whatwg/html,"cc @annevk @foolip ",https://github.com/whatwg/html/pull/10409#issuecomment-2165259713,https://github.com/whatwg/html/pull/10409,Editorial: add Oxford commas,2024-06-13T10:30:59Z,OrKoN
2165259087,whatwg/html,@annevk PTAL https://github.com/whatwg/html/pull/10409,https://github.com/whatwg/html/pull/10402#issuecomment-2165259087,https://github.com/whatwg/html/pull/10402,Report opener for WebDriver,2024-06-13T10:30:41Z,OrKoN
2165241858,whatwg/html,"Hmm, this is missing three Oxford commas. Can someone fix that in a follow-up?",https://github.com/whatwg/html/pull/10402#issuecomment-2165241858,https://github.com/whatwg/html/pull/10402,Report opener for WebDriver,2024-06-13T10:22:30Z,annevk
2165188556,whatwg/html,We discussed this a bit in WHATNOT today: https://github.com/whatwg/html/issues/10400#issuecomment-2,https://github.com/whatwg/html/issues/9625#issuecomment-2165188556,https://github.com/whatwg/html/issues/9625,[Proposal] Invoker Buttons - allowing popover/dialog and more to be invoked without JS,2024-06-13T10:00:38Z,zcorpan
2165185296,whatwg/html,OpenUI has been regularly discussing focus groups and it is an active proposal being prototyped. I t,https://github.com/whatwg/html/issues/10407#issuecomment-2165185296,https://github.com/whatwg/html/issues/10407,Proposal: CSS reading-order-items,2024-06-13T09:59:09Z,keithamus
2165047333,w3c/clipboard-apis,This doesn't seem to define any of the sanitization required...,https://github.com/w3c/clipboard-apis/pull/216#issuecomment-2165047333,https://github.com/w3c/clipboard-apis/pull/216,Add SVG format to the spec.,2024-06-13T08:56:41Z,annevk
2165018041,whatwg/html,Today I had no issue with Google Meet and was able to join and do my first scribe. Next one is ... @,https://github.com/whatwg/html/issues/10400#issuecomment-2165018041,https://github.com/whatwg/html/issues/10400,Upcoming WHATNOT meeting on 6/13/2024,2024-06-13T08:43:10Z,saschanaz
2164947493,whatwg/html,@foolip I think both PRs are ready if we do not need additional reviewers here,https://github.com/whatwg/html/pull/10402#issuecomment-2164947493,https://github.com/whatwg/html/pull/10402,Report opener for WebDriver,2024-06-13T08:12:02Z,OrKoN
2164938313,whatwg/html,Should we merge this at the same time as https://github.com/w3c/webdriver-bidi/pull/664? Is there an,https://github.com/whatwg/html/pull/10402#issuecomment-2164938313,https://github.com/whatwg/html/pull/10402,Report opener for WebDriver,2024-06-13T08:07:41Z,foolip
2164768308,whatwg/html,"To be clear, I don't think @bkardell's response addressed my question. (But perhaps that was clear a",https://github.com/whatwg/html/issues/10407#issuecomment-2164768308,https://github.com/whatwg/html/issues/10407,Proposal: CSS reading-order-items,2024-06-13T07:14:15Z,annevk
2164513098,mozilla/standards-positions,"Just to clear aside the questions about negative positions on related work, the harms we perceive in",https://github.com/mozilla/standards-positions/issues/805#issuecomment-2164513098,https://github.com/mozilla/standards-positions/issues/805,Private Aggregation API,2024-06-13T06:03:38Z,martinthomson
2164429811,w3c/editcontext,> Can you share an example of where you're not seeing this not work correctly?  I was testing with,https://github.com/w3c/edit-context/issues/81#issuecomment-2164429811,https://github.com/w3c/edit-context/issues/81,Handling 'backwards' selection direction in an EditContext implementation,2024-06-13T05:32:14Z,marijnh
2164417970,w3c/clipboard-apis,Why do we decode at all if the payload is a blob? Like how does this make sense for `image/png`?,https://github.com/w3c/clipboard-apis/issues/217#issuecomment-2164417970,https://github.com/w3c/clipboard-apis/issues/217,Write UTF-8 data to the clipboard.,2024-06-13T05:27:14Z,annevk
2164120797,w3c/clipboard-apis,"@sanketj @whsieh @EdgarChen ",https://github.com/w3c/clipboard-apis/issues/217#issuecomment-2164120797,https://github.com/w3c/clipboard-apis/issues/217,Write UTF-8 data to the clipboard.,2024-06-13T00:14:11Z,snianu
2164120487,w3c/editcontext,"@marijnh This was fixed [here](https://chromium-review.googlesource.com/c/chromium/src/+/5301307), a",https://github.com/w3c/edit-context/issues/81#issuecomment-2164120487,https://github.com/w3c/edit-context/issues/81,Handling 'backwards' selection direction in an EditContext implementation,2024-06-13T00:13:49Z,dandclark
2163925792,whatwg/html,"@whatwg/triage the agenda doesn't have any new items for this meeting, but there are a few carry ove",https://github.com/whatwg/html/issues/10400#issuecomment-2163925792,https://github.com/whatwg/html/issues/10400,Upcoming WHATNOT meeting on 6/13/2024,2024-06-12T21:23:33Z,past
2163781203,w3c/editcontext,"> The Chomium implementation still needs to be updated to allow it for updateText, though.  This s",https://github.com/w3c/edit-context/issues/81#issuecomment-2163781203,https://github.com/w3c/edit-context/issues/81,Handling 'backwards' selection direction in an EditContext implementation,2024-06-12T19:47:02Z,marijnh
2163775559,whatwg/html,"Making the transform layer-local (resetting it when we enter a layer) might have another advantage. ",https://github.com/whatwg/html/pull/9537#issuecomment-2163775559,https://github.com/whatwg/html/pull/9537,Add a layer and filter interface in the 2D canvas,2024-06-12T19:43:24Z,graveljp
2163679585,whatwg/html,"I'm very happy to edit things into the spec that we think are usefully defined there, I'm not comple",https://github.com/whatwg/html/issues/10407#issuecomment-2163679585,https://github.com/whatwg/html/issues/10407,Proposal: CSS reading-order-items,2024-06-12T18:39:09Z,rachelandrew
2163673245,whatwg/html,> We're intending to discuss the linked issue at the f2f tomorrow morning. This proposal is in suppo,https://github.com/whatwg/html/issues/10407#issuecomment-2163673245,https://github.com/whatwg/html/issues/10407,Proposal: CSS reading-order-items,2024-06-12T18:35:11Z,mfreed7
2163513777,whatwg/html,Service workers was designed this way from the start. And arguably shouldn't have used events becaus,https://github.com/whatwg/html/issues/9540#issuecomment-2163513777,https://github.com/whatwg/html/issues/9540,Considering event.waitUntil(promise) for async listeners,2024-06-12T17:00:21Z,annevk
2163492775,whatwg/html,"> I see. Agreeing to work on something is very different from ""The CSS WG has proposed ..."" Clarifyi",https://github.com/whatwg/html/issues/10407#issuecomment-2163492775,https://github.com/whatwg/html/issues/10407,Proposal: CSS reading-order-items,2024-06-12T16:47:53Z,dizhang168
2163483020,whatwg/html,Sad to see this closed. The async listener is a reality for many modern frameworks and libraries ...,https://github.com/whatwg/html/issues/9540#issuecomment-2163483020,https://github.com/whatwg/html/issues/9540,Considering event.waitUntil(promise) for async listeners,2024-06-12T16:42:10Z,WebReflection
2163440442,w3c/pointerlock,"At this point, I am in favor of landing this PR and move the discussion to open issues as we agreed ",https://github.com/w3c/pointerlock/pull/99#issuecomment-2163440442,https://github.com/w3c/pointerlock/pull/99,Add lock options to requestPointerLock,2024-06-12T16:17:31Z,mustaqahmed
2163432526,whatwg/html,"> It really is unrelated to ""asynchronous listeners"".  It's not ... if `event.waitUntil` would be ",https://github.com/whatwg/html/issues/9540#issuecomment-2163432526,https://github.com/whatwg/html/issues/9540,Considering event.waitUntil(promise) for async listeners,2024-06-12T16:13:13Z,WebReflection
2163425323,whatwg/html,"It really is unrelated to ""asynchronous listeners"". Those are not even a thing as far as DOM is conc",https://github.com/whatwg/html/issues/9540#issuecomment-2163425323,https://github.com/whatwg/html/issues/9540,Considering event.waitUntil(promise) for async listeners,2024-06-12T16:09:19Z,annevk
2163390105,whatwg/html,"to whom it might concern, using [this first test](https://github.com/whatwg/html/issues/9540#issueco",https://github.com/whatwg/html/issues/9540#issuecomment-2163390105,https://github.com/whatwg/html/issues/9540,Considering event.waitUntil(promise) for async listeners,2024-06-12T15:52:27Z,WebReflection
2163354819,whatwg/html,"those are fine, the fact `currentTarget` is prematurely lost or lost out of the blue when nothing co",https://github.com/whatwg/html/issues/9540#issuecomment-2163354819,https://github.com/whatwg/html/issues/9540,Considering event.waitUntil(promise) for async listeners,2024-06-12T15:40:40Z,WebReflection
2163351248,whatwg/html,"NodeJS prolly just has the same bug. It's not like event dispatch is handled by V8. But also, `event",https://github.com/whatwg/html/issues/9540#issuecomment-2163351248,https://github.com/whatwg/html/issues/9540,Considering event.waitUntil(promise) for async listeners,2024-06-12T15:38:57Z,annevk
2163332132,whatwg/html,@annevk it's not Chromium there then ... it's V8 as I get the same in NodeJS. This is still somethin,https://github.com/whatwg/html/issues/9540#issuecomment-2163332132,https://github.com/whatwg/html/issues/9540,Considering event.waitUntil(promise) for async listeners,2024-06-12T15:30:11Z,WebReflection
2163316658,whatwg/html,"There is no re-dispatch when bubbling. That's not how it works. Anyway, DOM is pretty clear on this.",https://github.com/whatwg/html/issues/9540#issuecomment-2163316658,https://github.com/whatwg/html/issues/9540,Considering event.waitUntil(promise) for async listeners,2024-06-12T15:23:20Z,annevk
2163281969,whatwg/html,@annevk please explain me this:  ```js const listener = async event => {   console.log(event.cur,https://github.com/whatwg/html/issues/9540#issuecomment-2163281969,https://github.com/whatwg/html/issues/9540,Considering event.waitUntil(promise) for async listeners,2024-06-12T15:07:40Z,WebReflection
2163275174,webkit/standards-positions,"An update: No-Vary-Search header support for navigational prefetch shipped in Chrome 121, and will s",https://github.com/WebKit/standards-positions/issues/106#issuecomment-2163275174,https://github.com/WebKit/standards-positions/issues/106,No-Vary-Search,2024-06-12T15:04:30Z,liviutinta
2163273797,mozilla/standards-positions,"An update: No-Vary-Search header support for navigational prefetch shipped in Chrome 121, and will s",https://github.com/mozilla/standards-positions/issues/717#issuecomment-2163273797,https://github.com/mozilla/standards-positions/issues/717,Request for Position: No-Vary-Search,2024-06-12T15:03:50Z,liviutinta
2163264754,whatwg/html,"@annevk  > `currentTarget`'s value is only meaningful ...  that's not too explicit  in specs or ",https://github.com/whatwg/html/issues/9540#issuecomment-2163264754,https://github.com/whatwg/html/issues/9540,Considering event.waitUntil(promise) for async listeners,2024-06-12T14:59:53Z,WebReflection
2163238474,whatwg/html,`currentTarget`'s value is only meaningful within the context of a callback as an event can have man,https://github.com/whatwg/html/issues/9540#issuecomment-2163238474,https://github.com/whatwg/html/issues/9540,Considering event.waitUntil(promise) for async listeners,2024-06-12T14:49:18Z,annevk
2163222150,whatwg/html,I've put this in my calendar to merge on June 19. Happy to do it sooner if @domenic or @syg can conf,https://github.com/whatwg/html/pull/9038#issuecomment-2163222150,https://github.com/whatwg/html/pull/9038,Add the HostSystemUTCEpochNanoseconds abstract operation,2024-06-12T14:46:07Z,annevk
2163118065,whatwg/html,"To whom it might concern, I've digged further around this `currentTarget` absurdity and it looks lik",https://github.com/whatwg/html/issues/9540#issuecomment-2163118065,https://github.com/whatwg/html/issues/9540,Considering event.waitUntil(promise) for async listeners,2024-06-12T14:10:51Z,WebReflection
2162999503,whatwg/html,> The other thing that comes to mind here is https://github.com/whatwg/html/issues/7054. Is that sti,https://github.com/whatwg/html/issues/10407#issuecomment-2162999503,https://github.com/whatwg/html/issues/10407,Proposal: CSS reading-order-items,2024-06-12T13:22:11Z,bkardell
2162978937,whatwg/html,"I see. Agreeing to work on something is very different from ""The CSS WG has proposed ..."" Clarifying",https://github.com/whatwg/html/issues/10407#issuecomment-2162978937,https://github.com/whatwg/html/issues/10407,Proposal: CSS reading-order-items,2024-06-12T13:13:10Z,annevk
2162968041,whatwg/html,Rebased and fixed merge conflict,https://github.com/whatwg/html/pull/10204#issuecomment-2162968041,https://github.com/whatwg/html/pull/10204,Update HostEnsureCanCompileStrings definition,2024-06-12T13:07:44Z,lukewarlow
2162955755,whatwg/html,"As code speaks thousand words:  ```html <!doctype html> <html lang=""en""> <head>   <meta charse",https://github.com/whatwg/html/issues/9540#issuecomment-2162955755,https://github.com/whatwg/html/issues/9540,Considering event.waitUntil(promise) for async listeners,2024-06-12T13:02:14Z,WebReflection
2162932749,whatwg/html,not that I expect anyone suddenly realizing how broken are `async` listeners in the *EventTarget* in,https://github.com/whatwg/html/issues/9540#issuecomment-2162932749,https://github.com/whatwg/html/issues/9540,Considering event.waitUntil(promise) for async listeners,2024-06-12T12:51:05Z,WebReflection
2162801158,whatwg/dom,"This now seems to invoke TT even when we have specifications manipulate attributes, or when `element",https://github.com/whatwg/dom/pull/1268#issuecomment-2162801158,https://github.com/whatwg/dom/pull/1268,Trusted types attributes,2024-06-12T11:44:20Z,annevk
2162781877,whatwg/html,We're intending to discuss the linked issue at the f2f tomorrow morning. This proposal is in support,https://github.com/whatwg/html/issues/10407#issuecomment-2162781877,https://github.com/whatwg/html/issues/10407,Proposal: CSS reading-order-items,2024-06-12T11:33:16Z,rachelandrew
2162773012,whatwg/html,When I look at the [last comment](https://github.com/w3c/csswg-drafts/issues/7387#issuecomment-16902,https://github.com/whatwg/html/issues/10407#issuecomment-2162773012,https://github.com/whatwg/html/issues/10407,Proposal: CSS reading-order-items,2024-06-12T11:28:03Z,annevk
2162653718,whatwg/html,> Why has the **have an element target node in a specific scope** such name (step number 3 shows tha,https://github.com/whatwg/html/issues/10285#issuecomment-2162653718,https://github.com/whatwg/html/issues/10285,"The section ""The stack of open elements"" needs some explanation.",2024-06-12T10:24:00Z,zcorpan
2162602991,whatwg/html,"> It's not clear when a character is consumed, is it discarded from the input stream or not?  The ",https://github.com/whatwg/html/issues/10388#issuecomment-2162602991,https://github.com/whatwg/html/issues/10388,"The term ""insertion point""",2024-06-12T09:57:46Z,zcorpan
2162406747,mozilla/standards-positions,Is there any progress on this issue? Firefox is the last browser to not support the `name `attribute,https://github.com/mozilla/standards-positions/issues/831#issuecomment-2162406747,https://github.com/mozilla/standards-positions/issues/831,"Exclusive accordions with <details name="""">",2024-06-12T08:25:08Z,MBeggiato
2161983873,webkit/standards-positions,"Hey folks, I wanted to flag that the analogous issue on the Mozilla s-p repo has been [closed with a",https://github.com/WebKit/standards-positions/issues/142#issuecomment-2161983873,https://github.com/WebKit/standards-positions/issues/142,Interoperable Private Attribution (IPA),2024-06-12T02:26:33Z,martinthomson
2161981542,mozilla/standards-positions,"OK, having filed this and then sat on it for a long time, it's a bit awkward closing this in this wa",https://github.com/mozilla/standards-positions/issues/753#issuecomment-2161981542,https://github.com/mozilla/standards-positions/issues/753,Request for Mozilla Position on Interoperable Private Attribution,2024-06-12T02:24:02Z,martinthomson
2161951355,whatwg/html,"> That's one more surprising behavior and I don't see where it would come from in the current PR. ",https://github.com/whatwg/html/pull/9537#issuecomment-2161951355,https://github.com/whatwg/html/pull/9537,Add a layer and filter interface in the 2D canvas,2024-06-12T02:00:02Z,graveljp
2161891657,w3ctag/design-reviews,"Having some guidance in non-normative text, specifically around the different DoS vectors and mitiga",https://github.com/w3ctag/design-reviews/issues/933#issuecomment-2161891657,https://github.com/w3ctag/design-reviews/issues/933,Updated review of WebNN API,2024-06-12T01:30:42Z,cynthia
2161818150,mozilla/standards-positions,"That sounds right, though I think that many of these manifest as (pretend) network errors in Firefox",https://github.com/mozilla/standards-positions/issues/436#issuecomment-2161818150,https://github.com/mozilla/standards-positions/issues/436,Heavy Ad Intervention,2024-06-12T00:01:57Z,martinthomson
2161807378,mozilla/standards-positions,"Thanks @michaelwasserman, we'll just close this then.",https://github.com/mozilla/standards-positions/issues/714#issuecomment-2161807378,https://github.com/mozilla/standards-positions/issues/714,Request for Position: Fullscreen Popup Windows,2024-06-11T23:59:50Z,martinthomson
2161715084,whatwg/html,"> They would be applied to filters applied via `beginLayer`.  That's one more surprising behavior ",https://github.com/whatwg/html/pull/9537#issuecomment-2161715084,https://github.com/whatwg/html/pull/9537,Add a layer and filter interface in the 2D canvas,2024-06-11T22:37:28Z,Kaiido
