id,repo,body,url,issue_url,issue_title,created_at,user
2177373434,w3ctag/design-reviews,My current thinking is that I'd like to do the following: * support both `interpolate-size` (as res,https://github.com/w3ctag/design-reviews/issues/955#issuecomment-2177373434,https://github.com/w3ctag/design-reviews/issues/955,CSS calc-size() function,2024-06-19T01:53:27Z,dbaron
2177313518,w3ctag/design-reviews,"Hi @pmeenan, conflict escalation is for when a WG canâ€™t come to consensus and wants the TAG to help ",https://github.com/w3ctag/design-reviews/issues/969#issuecomment-2177313518,https://github.com/w3ctag/design-reviews/issues/969,Compression Dictionary Transport: Align on a single Content-Encoding for the web?,2024-06-19T00:45:09Z,plinss
2177303724,webkit/standards-positions,"@annevk That feedback wasn't captured in a bug yet, but I can file one.  I also want to flag that ",https://github.com/WebKit/standards-positions/issues/292#issuecomment-2177303724,https://github.com/WebKit/standards-positions/issues/292,Observable,2024-06-19T00:33:41Z,esprehn
2177286048,mozilla/standards-positions,[As the person who wrote the quoted text](https://datatracker.ietf.org/doc/draft-kucherawy-dispatch-,https://github.com/mozilla/standards-positions/pull/1042#issuecomment-2177286048,https://github.com/mozilla/standards-positions/pull/1042,Switch position on zstd to positive,2024-06-19T00:13:48Z,adamroach
2177285160,w3c/pointerevents,> The note in that section implies (at least to me) that the userEvent is the PointerEvent (i.e. poi,https://github.com/w3c/pointerevents/issues/508#issuecomment-2177285160,https://github.com/w3c/pointerevents/issues/508,Clarify what event is `userEvent` to consider `click`/`auxclick` event target after `touchend` (or `pointerup`),2024-06-19T00:12:48Z,masayuki-nakano
2177224980,w3ctag/design-reviews,"@diekus, did you see @LeaVerou's questions above?",https://github.com/w3ctag/design-reviews/issues/946#issuecomment-2177224980,https://github.com/w3ctag/design-reviews/issues/946,Web Install API - Cross-Origin,2024-06-18T23:02:32Z,hober
2177210967,w3ctag/design-reviews,Is this the wrong way to ask the TAG to weigh-in or is it a matter of the TAG not having an interest,https://github.com/w3ctag/design-reviews/issues/969#issuecomment-2177210967,https://github.com/w3ctag/design-reviews/issues/969,Compression Dictionary Transport: Align on a single Content-Encoding for the web?,2024-06-18T22:46:47Z,pmeenan
2177203693,w3ctag/design-reviews,"> do you think having the calc-size() opt-in is too unreadable to be the only opt-in, or do you also",https://github.com/w3ctag/design-reviews/issues/955#issuecomment-2177203693,https://github.com/w3ctag/design-reviews/issues/955,CSS calc-size() function,2024-06-18T22:38:29Z,martinthomson
2177189969,w3ctag/design-reviews,There doesn't appear to be a conflict here that requires the TAG to weigh in. Closing this.,https://github.com/w3ctag/design-reviews/issues/969#issuecomment-2177189969,https://github.com/w3ctag/design-reviews/issues/969,Compression Dictionary Transport: Align on a single Content-Encoding for the web?,2024-06-18T22:24:46Z,plinss
2177156006,w3ctag/design-reviews,"@matatk, @plinss, and I discussed this one.  Like @LeaVerou, we're enthusiastic about these changes.",https://github.com/w3ctag/design-reviews/issues/965#issuecomment-2177156006,https://github.com/w3ctag/design-reviews/issues/965,improvements to <details> styling (widget structure),2024-06-18T22:04:23Z,martinthomson
2177063483,whatwg/webidl,"Sorry, to be a little more specific, the conflict is referring to the type and the operation name ha",https://github.com/whatwg/webidl/issues/1411#issuecomment-2177063483,https://github.com/whatwg/webidl/issues/1411,How are name conflicts specified?,2024-06-18T21:35:19Z,srujzs
2176946177,whatwg/html,"I think this is ready for another look.  There are a few additional changes since the last round of ",https://github.com/whatwg/html/pull/10265#issuecomment-2176946177,https://github.com/whatwg/html/pull/10265,Specify the rendering of <details> in more detail.,2024-06-18T20:48:24Z,dbaron
2176647563,w3c/pointerevents,The note in that section implies (at least to me) that the userEvent is the PointerEvent (i.e. point,https://github.com/w3c/pointerevents/issues/508#issuecomment-2176647563,https://github.com/w3c/pointerevents/issues/508,Clarify what event is `userEvent` to consider `click`/`auxclick` event target after `touchend` (or `pointerup`),2024-06-18T17:46:34Z,flackr
2176465960,whatwg/dom,> This is the only (relevant) place that's wrong from my testing but it's possible there could be ot,https://github.com/whatwg/dom/issues/1288#issuecomment-2176465960,https://github.com/whatwg/dom/issues/1288,Request for mechanism to determine if children changed steps are called as a result of script or parser,2024-06-18T16:04:16Z,domfarolino
2176400519,whatwg/html,> > * Maybe the `type` attribute can default to `button` if one of `command`/`commandfor` are presen,https://github.com/whatwg/html/issues/9625#issuecomment-2176400519,https://github.com/whatwg/html/issues/9625,[Proposal] Invoker Buttons - allowing popover/dialog and more to be invoked without JS,2024-06-18T15:35:04Z,mfreed7
2176095559,whatwg/html,"Github UI really wants to hide my comment about:   The ""elsewhere"" part wasn't fixed. ""While unload",https://github.com/whatwg/html/pull/10154#issuecomment-2176095559,https://github.com/whatwg/html/pull/10154,Add may-block reasons to NotRestoredReasons,2024-06-18T13:23:50Z,smaug----
2175982478,whatwg/html,> > Whereas <button command=toggle for=x> is not that much longer and a lot less ambiguous at the sa,https://github.com/whatwg/html/issues/9625#issuecomment-2175982478,https://github.com/whatwg/html/issues/9625,[Proposal] Invoker Buttons - allowing popover/dialog and more to be invoked without JS,2024-06-18T12:28:40Z,lukewarlow
2175933418,whatwg/html,> We discussed this a bit in WHATNOT today: [#10400 (comment)](https://github.com/whatwg/html/issues,https://github.com/whatwg/html/issues/9625#issuecomment-2175933418,https://github.com/whatwg/html/issues/9625,[Proposal] Invoker Buttons - allowing popover/dialog and more to be invoked without JS,2024-06-18T12:02:13Z,keithamus
2175927719,whatwg/html,"@keithamus Sure, here are two examples, both really concerned with `popover` rather than modal `<dia",https://github.com/whatwg/html/issues/9373#issuecomment-2175927719,https://github.com/whatwg/html/issues/9373,Add light dismiss functionality to `<dialog>`,2024-06-18T11:59:07Z,mayank99
2175877233,whatwg/html,Thanks for commenting @mayank99 - it's important to get different perspectives captured here!  > I,https://github.com/whatwg/html/issues/9373#issuecomment-2175877233,https://github.com/whatwg/html/issues/9373,Add light dismiss functionality to `<dialog>`,2024-06-18T11:32:34Z,keithamus
2175789063,whatwg/html,"Just to provide some quick clarifications (not responding to the core of the comment)  > Similarly, ",https://github.com/whatwg/html/issues/9373#issuecomment-2175789063,https://github.com/whatwg/html/issues/9373,Add light dismiss functionality to `<dialog>`,2024-06-18T10:42:36Z,lukewarlow
2175768116,whatwg/html,"While I'm glad that this functionality is being added to the platform, I have concerns around the cu",https://github.com/whatwg/html/issues/9373#issuecomment-2175768116,https://github.com/whatwg/html/issues/9373,Add light dismiss functionality to `<dialog>`,2024-06-18T10:31:31Z,mayank99
2175592798,whatwg/dom,"I'll take some more time to properly read through and respond but regarding how correct the ""is chan",https://github.com/whatwg/dom/issues/1288#issuecomment-2175592798,https://github.com/whatwg/dom/issues/1288,Request for mechanism to determine if children changed steps are called as a result of script or parser,2024-06-18T09:07:38Z,lukewarlow
2175589576,whatwg/html,"> This PR does not handle dismiss yet?  Well it does, on the assumption that none/accept/dismiss a",https://github.com/whatwg/html/pull/10189#issuecomment-2175589576,https://github.com/whatwg/html/pull/10189,Support automatic user prompt handing in WebDriver BiDi,2024-06-18T09:06:03Z,jgraham
2175465491,w3c/pointerevents,Sorting out the issues: * `click` event target may be different even if same position is clicked/ta,https://github.com/w3c/pointerevents/issues/508#issuecomment-2175465491,https://github.com/w3c/pointerevents/issues/508,Clarify what event is `userEvent` to consider `click`/`auxclick` event target after `touchend` (or `pointerup`),2024-06-18T08:05:26Z,masayuki-nakano
2175015202,whatwg/html,It doesn't seem like a great idea to globally hijack the default activation behavior? Allowing custo,https://github.com/whatwg/html/issues/9110#issuecomment-2175015202,https://github.com/whatwg/html/issues/9110,"Support `popovertarget` on custom elements with `role=""button""` ",2024-06-18T05:09:41Z,annevk
2175013647,whatwg/html,"> Indeed. I'd rather have some reasonable API on top of IndexedDB, or make IndexedDB itself easy to ",https://github.com/whatwg/html/issues/10411#issuecomment-2175013647,https://github.com/whatwg/html/issues/10411,Range search for localstorage and session storage,2024-06-18T05:08:06Z,anuragvohraec
2175010472,whatwg/html,> Are there any libraries that offer this functionality and how popular are they?  There are no li,https://github.com/whatwg/html/issues/10411#issuecomment-2175010472,https://github.com/whatwg/html/issues/10411,Range search for localstorage and session storage,2024-06-18T05:04:54Z,anuragvohraec
2174891424,w3c/pointerevents,"Currently, if I change Firefox behavior to conform to the spec, [links in this bxSlider deom](https:",https://github.com/w3c/pointerevents/issues/508#issuecomment-2174891424,https://github.com/w3c/pointerevents/issues/508,Clarify what event is `userEvent` to consider `click`/`auxclick` event target after `touchend` (or `pointerup`),2024-06-18T03:22:36Z,masayuki-nakano
2174882669,w3c/pointerevents,(FYI: This issue blocks Mozilla fixing the failures of `pointerevent_click_during_capture.html`.),https://github.com/w3c/pointerevents/issues/508#issuecomment-2174882669,https://github.com/w3c/pointerevents/issues/508,Clarify what event is `userEvent` to consider `click`/`auxclick` event target after `touchend` (or `pointerup`),2024-06-18T03:12:21Z,masayuki-nakano
2174881695,w3c/pointerevents,"Ccing: @mustaqahmed, @smaug----, @flackr ",https://github.com/w3c/pointerevents/issues/508#issuecomment-2174881695,https://github.com/w3c/pointerevents/issues/508,Clarify what event is `userEvent` to consider `click`/`auxclick` event target after `touchend` (or `pointerup`),2024-06-18T03:11:15Z,masayuki-nakano
2174880202,w3c/pointerevents,Created [a new test](https://github.com/web-platform-tests/wpt/pull/46805) which (probably) conforms,https://github.com/w3c/pointerevents/issues/508#issuecomment-2174880202,https://github.com/w3c/pointerevents/issues/508,Clarify what event is `userEvent` to consider `click`/`auxclick` event target after `touchend` (or `pointerup`),2024-06-18T03:10:15Z,masayuki-nakano
2174749764,w3c/pointerevents,"Oh, if `touchstart` is canceled, `click` should not be fired.",https://github.com/w3c/pointerevents/issues/508#issuecomment-2174749764,https://github.com/w3c/pointerevents/issues/508,Clarify what event is `userEvent` to consider `click`/`auxclick` event target after `touchend` (or `pointerup`),2024-06-18T01:42:45Z,masayuki-nakano
2174625886,whatwg/webidl,What is the conflict thatâ€™s referred to in the issue title? Web IDL doesnâ€™t seem to currently forbid,https://github.com/whatwg/webidl/issues/1411#issuecomment-2174625886,https://github.com/whatwg/webidl/issues/1411,How are name conflicts specified?,2024-06-17T23:36:35Z,bhathos
2174593587,whatwg/webidl,the method is `globalThis.StorageAccessHandle.prototype.BroadcastChannel` and the return type is `g,https://github.com/whatwg/webidl/issues/1411#issuecomment-2174593587,https://github.com/whatwg/webidl/issues/1411,How are name conflicts specified?,2024-06-17T23:10:03Z,nektro
2174493751,w3ctag/design-reviews,"@plinss and I looked at this today and it seems broadly acceptable. We have a few concerns here, bu",https://github.com/w3ctag/design-reviews/issues/911#issuecomment-2174493751,https://github.com/w3ctag/design-reviews/issues/911,Long Animation Frame API (LoAF),2024-06-17T21:52:27Z,martinthomson
2174477741,w3ctag/design-reviews,"@tabatkins just to make sure they see the message above. And @abatkins, sorry for the mention. ðŸ˜„ ",https://github.com/w3ctag/design-reviews/issues/848#issuecomment-2174477741,https://github.com/w3ctag/design-reviews/issues/848,Specification review for CSS Anchor Positioning,2024-06-17T21:42:43Z,mfreed7
2174299098,w3c/pointerevents,Gentle ping :),https://github.com/w3c/pointerevents/pull/495#issuecomment-2174299098,https://github.com/w3c/pointerevents/pull/495,Add persistentDeviceId to PointerEvent,2024-06-17T19:48:19Z,sahirv
2174276231,whatwg/html,"Looking at the definition: ""A [cross-origin opener policy value](https://html.spec.whatwg.org/#cross",https://github.com/whatwg/html/issues/10373#issuecomment-2174276231,https://github.com/whatwg/html/issues/10373,Severing a document's opener relationship regardless of origin,2024-06-17T19:37:43Z,yoavweiss
2174009664,whatwg/html,I'd rather make invokers/commands/actions global and let one to use those. The popover specific attr,https://github.com/whatwg/html/issues/9110#issuecomment-2174009664,https://github.com/whatwg/html/issues/9110,"Support `popovertarget` on custom elements with `role=""button""` ",2024-06-17T18:02:03Z,smaug----
2173991375,whatwg/html,"That, and also this feels like a distinct feature of COOP itself, just like the existing noopener is",https://github.com/whatwg/html/issues/10373#issuecomment-2173991375,https://github.com/whatwg/html/issues/10373,Severing a document's opener relationship regardless of origin,2024-06-17T17:50:50Z,smaug----
2173947977,w3ctag/design-reviews,"The TAG revisited this issue today, and have decided to close this review as unsatisfied. We would p",https://github.com/w3ctag/design-reviews/issues/798#issuecomment-2173947977,https://github.com/w3ctag/design-reviews/issues/798,Early design review: Document Picture-in-Picture,2024-06-17T17:25:47Z,hober
2173936817,whatwg/html,"Indeed. I'd rather have some reasonable API on top of IndexedDB, or make IndexedDB itself easy to us",https://github.com/whatwg/html/issues/10411#issuecomment-2173936817,https://github.com/whatwg/html/issues/10411,Range search for localstorage and session storage,2024-06-17T17:19:19Z,smaug----
2173934184,w3ctag/design-reviews,"The TAG looked at this again in a breakout today, and we returned to the naming issue. The name `pre",https://github.com/w3ctag/design-reviews/issues/864#issuecomment-2173934184,https://github.com/w3ctag/design-reviews/issues/864,text-wrap: pretty,2024-06-17T17:17:36Z,hober
2173908005,webkit/standards-positions,"FWIW, I'm mostly concerned that the noopener part seems to be rather distinct feature. Coupling that",https://github.com/WebKit/standards-positions/issues/360#issuecomment-2173908005,https://github.com/WebKit/standards-positions/issues/360,Add a noopener-allow-popups value to COOP,2024-06-17T17:03:06Z,smaug----
2173820008,w3ctag/design-reviews,Hi @abatkins - Thanks for engaging with us here. We are just wondering if the feedback above has bee,https://github.com/w3ctag/design-reviews/issues/848#issuecomment-2173820008,https://github.com/w3ctag/design-reviews/issues/848,Specification review for CSS Anchor Positioning,2024-06-17T16:14:50Z,torgo
2173772057,webkit/standards-positions,To clarify the default will be the existing behaviour. No change will happen until you add the attri,https://github.com/WebKit/standards-positions/issues/329#issuecomment-2173772057,https://github.com/WebKit/standards-positions/issues/329,Dialog light dismiss,2024-06-17T15:52:35Z,lukewarlow
2173757420,w3ctag/design-reviews,Hi folks - in order to proceed with a review we really need an explainer that more-or-less follows t,https://github.com/w3ctag/design-reviews/issues/945#issuecomment-2173757420,https://github.com/w3ctag/design-reviews/issues/945,"FedCM bundle: Continuation API, account labels, custom parameters, scopes",2024-06-17T15:46:28Z,torgo
2173692225,webkit/standards-positions,It's rather unclear what the actual state of this proposal is. I take it https://github.com/whatwg/h,https://github.com/WebKit/standards-positions/issues/329#issuecomment-2173692225,https://github.com/WebKit/standards-positions/issues/329,Dialog light dismiss,2024-06-17T15:18:09Z,annevk
2173630839,webkit/standards-positions,How does this avoid potential problems with the main document and service worker having different po,https://github.com/WebKit/standards-positions/issues/359#issuecomment-2173630839,https://github.com/WebKit/standards-positions/issues/359,ServiceWorkerAutoPreload,2024-06-17T14:52:12Z,annevk
2173612573,webkit/standards-positions,"This seems reasonable. I suggest we mark this as ""position: support"" one week from now. I know @smau",https://github.com/WebKit/standards-positions/issues/360#issuecomment-2173612573,https://github.com/WebKit/standards-positions/issues/360,Add a noopener-allow-popups value to COOP,2024-06-17T14:44:33Z,annevk
2173592858,webkit/standards-positions,"@annevk The maintenance SVG WG has not yet started. Looking at blame for that section it appears to ",https://github.com/WebKit/standards-positions/issues/362#issuecomment-2173592858,https://github.com/WebKit/standards-positions/issues/362,Support 'color-interpolation: linearrgb' on SVG gradients,2024-06-17T14:35:54Z,astearns
2173573201,webkit/standards-positions,"I don't see an immediate problem with this, but I thought that the SVG2 effort would largely focus o",https://github.com/WebKit/standards-positions/issues/362#issuecomment-2173573201,https://github.com/WebKit/standards-positions/issues/362,Support 'color-interpolation: linearrgb' on SVG gradients,2024-06-17T14:27:26Z,annevk
2173448713,w3c/pointerlock,Landing now but please continue the discussion in linked or new issues.,https://github.com/w3c/pointerlock/pull/99#issuecomment-2173448713,https://github.com/w3c/pointerlock/pull/99,Add lock options to requestPointerLock,2024-06-17T13:49:51Z,mustaqahmed
2173443486,webkit/standards-positions,> whether this has been presented to/discussed with TC39 again more recently?  No it hasn't. I had,https://github.com/WebKit/standards-positions/issues/292#issuecomment-2173443486,https://github.com/WebKit/standards-positions/issues/292,Observable,2024-06-17T13:47:36Z,domfarolino
2173420399,w3ctag/design-reviews,The definition of `::details-content` refers to the definition of a new [part-like pseudo-element](h,https://github.com/w3ctag/design-reviews/issues/965#issuecomment-2173420399,https://github.com/w3ctag/design-reviews/issues/965,improvements to <details> styling (widget structure),2024-06-17T13:37:17Z,dbaron
2173356719,w3c/clipboard-apis,"> get enough implementor interest  Cool. What does this mean in practice? What's the best way for ",https://github.com/w3c/clipboard-apis/issues/218#issuecomment-2173356719,https://github.com/w3c/clipboard-apis/issues/218,"Support clipboard write() for audio formats (midi, wav)",2024-06-17T13:08:50Z,chr15m
2173348760,w3c/clipboard-apis,The new item indeed would only make sense when we get enough implementor interest.,https://github.com/w3c/clipboard-apis/issues/218#issuecomment-2173348760,https://github.com/w3c/clipboard-apis/issues/218,"Support clipboard write() for audio formats (midi, wav)",2024-06-17T13:05:08Z,saschanaz
2173314685,whatwg/html,Hello there! Any update on this ? :),https://github.com/whatwg/html/issues/10056#issuecomment-2173314685,https://github.com/whatwg/html/issues/10056,Image `loading` on page load,2024-06-17T12:49:44Z,gyurielf
2173311117,w3c/clipboard-apis,> There are [mandatory/optional types](https://w3c.github.io/clipboard-apis/#mandatory-data-types-x),https://github.com/w3c/clipboard-apis/issues/218#issuecomment-2173311117,https://github.com/w3c/clipboard-apis/issues/218,"Support clipboard write() for audio formats (midi, wav)",2024-06-17T12:47:52Z,tomayac
2173303556,w3c/clipboard-apis,Yes it is a request to add audio mimetypes to the mandatory list. At least `audio/wav` and `audio/mi,https://github.com/w3c/clipboard-apis/issues/218#issuecomment-2173303556,https://github.com/w3c/clipboard-apis/issues/218,"Support clipboard write() for audio formats (midi, wav)",2024-06-17T12:43:49Z,chr15m
2173283773,w3c/clipboard-apis,There are [mandatory/optional types](https://w3c.github.io/clipboard-apis/#mandatory-data-types-x) s,https://github.com/w3c/clipboard-apis/issues/218#issuecomment-2173283773,https://github.com/w3c/clipboard-apis/issues/218,"Support clipboard write() for audio formats (midi, wav)",2024-06-17T12:35:17Z,saschanaz
2173273728,w3c/clipboard-apis,"> It would be nice to speak based on the specification rather than Chromium implementation here, for",https://github.com/w3c/clipboard-apis/issues/218#issuecomment-2173273728,https://github.com/w3c/clipboard-apis/issues/218,"Support clipboard write() for audio formats (midi, wav)",2024-06-17T12:30:19Z,tomayac
2173258979,w3c/clipboard-apis,"It would be nice to speak based on the specification rather than Chromium implementation here, for t",https://github.com/w3c/clipboard-apis/issues/218#issuecomment-2173258979,https://github.com/w3c/clipboard-apis/issues/218,"Support clipboard write() for audio formats (midi, wav)",2024-06-17T12:24:27Z,saschanaz
2173253582,whatwg/html,I tagged it for you.,https://github.com/whatwg/html/issues/10408#issuecomment-2173253582,https://github.com/whatwg/html/issues/10408," Upcoming WHATNOT meeting on 6/20/2024",2024-06-17T12:21:37Z,past
2173232227,w3c/clipboard-apis,"I love the user case. This is more of a browser support request than a spec issue, though. For Chrom",https://github.com/w3c/clipboard-apis/issues/218#issuecomment-2173232227,https://github.com/w3c/clipboard-apis/issues/218,"Support clipboard write() for audio formats (midi, wav)",2024-06-17T12:10:21Z,tomayac
2173179338,whatwg/html,"I'd like to potentially discuss https://github.com/whatwg/html/pull/10394 (no permissions to ""agenda",https://github.com/whatwg/html/issues/10408#issuecomment-2173179338,https://github.com/whatwg/html/issues/10408," Upcoming WHATNOT meeting on 6/20/2024",2024-06-17T11:49:48Z,yoavweiss
2173121927,whatwg/encoding,Let's skip as we only had a couple editorial changes.,https://github.com/whatwg/encoding/pull/331#issuecomment-2173121927,https://github.com/whatwg/encoding/pull/331,Review Draft Publication: June 2024,2024-06-17T11:19:59Z,annevk
2173011353,w3ctag/design-reviews,"Hi there,  We looked at this during a breakout today.  First, the purpose of the explainer is no",https://github.com/w3ctag/design-reviews/issues/949#issuecomment-2173011353,https://github.com/w3ctag/design-reviews/issues/949,document.caretPositionFromPoint API in shadow DOM scenario,2024-06-17T10:36:06Z,LeaVerou
2172855132,whatwg/html,"Sorry for the delay, now I addressed all the comments. @smaug---- Can you PTAL again? Thanks in adv",https://github.com/whatwg/html/pull/10154#issuecomment-2172855132,https://github.com/whatwg/html/pull/10154,Add may-block reasons to NotRestoredReasons,2024-06-17T09:26:03Z,rubberyuzu
2172799142,w3ctag/design-reviews,"Just noting that the spec hasn't been updated since July of last year and we have not heard back on ",https://github.com/w3ctag/design-reviews/issues/872#issuecomment-2172799142,https://github.com/w3ctag/design-reviews/issues/872,Captured Mouse Events,2024-06-17T09:11:17Z,torgo
2172754329,whatwg/html,Are there any libraries that offer this functionality and how popular are they?  In general though,https://github.com/whatwg/html/issues/10411#issuecomment-2172754329,https://github.com/whatwg/html/issues/10411,Range search for localstorage and session storage,2024-06-17T09:06:49Z,annevk
2172582092,whatwg/dom,"By ""invalidation"" I meant having the `script` element maintain a boolean that gets set to false (inv",https://github.com/whatwg/dom/issues/1288#issuecomment-2172582092,https://github.com/whatwg/dom/issues/1288,Request for mechanism to determine if children changed steps are called as a result of script or parser,2024-06-17T08:08:08Z,annevk
2172556514,webkit/standards-positions,One other thing that came up when looking at this internally is that `yield()` and `render()` are in,https://github.com/WebKit/standards-positions/issues/361#issuecomment-2172556514,https://github.com/WebKit/standards-positions/issues/361,Prioritized Task Scheduling,2024-06-17T07:55:54Z,annevk
2172516375,webkit/standards-positions,https://github.com/WICG/observable?tab=readme-ov-file#userland-libraries is really great to see. The,https://github.com/WebKit/standards-positions/issues/292#issuecomment-2172516375,https://github.com/WebKit/standards-positions/issues/292,Observable,2024-06-17T07:35:00Z,annevk
2172422968,webkit/standards-positions,"Colleagues and I discussed this once more and our suggestion is to mark this as â€˜position: supportâ€™ ",https://github.com/WebKit/standards-positions/issues/186#issuecomment-2172422968,https://github.com/WebKit/standards-positions/issues/186,Trusted Types,2024-06-17T06:45:08Z,annevk
2172412197,whatwg/html,That seems like an oversight. As far as I know everyone implements this event.,https://github.com/whatwg/html/issues/10414#issuecomment-2172412197,https://github.com/whatwg/html/issues/10414,Status of `onbeforeinput` event handler attribute,2024-06-17T06:37:07Z,annevk
2171674239,w3ctag/design-reviews,"+1 from me, this solves a longstanding author pain point. The spec should clarify what pseudo-classe",https://github.com/w3ctag/design-reviews/issues/965#issuecomment-2171674239,https://github.com/w3ctag/design-reviews/issues/965,improvements to <details> styling (widget structure),2024-06-16T13:56:56Z,LeaVerou
