id,repo,body,url,issue_url,issue_title,created_at,user
2979517290,whatwg/html,Imagine a future where BWL does exist: websites will start putting nonsense values in the `src` attr,https://github.com/whatwg/html/issues/11376#issuecomment-2979517290,https://github.com/whatwg/html/issues/11376,Feature Request: Built-In Web Libraries (BWL) via browser-lib attribute,2025-06-17T08:55:04Z,0f-0b
2979465635,mozilla/standards-positions,@martinthomson Can you elaborate further why having time-of-use and time-of-grant coincide is your g,https://github.com/mozilla/standards-positions/issues/1245#issuecomment-2979465635,https://github.com/mozilla/standards-positions/issues/1245,Page Embedded Permission Control (Take 2),2025-06-17T08:39:12Z,mharbach
2979225203,whatwg/html,"This isn't really the right issue, but yes, the warning applies to `writeln` as well, they're essent",https://github.com/whatwg/html/issues/7977#issuecomment-2979225203,https://github.com/whatwg/html/issues/7977,Mark `document.write()` as obsolete,2025-06-17T07:19:44Z,annevk
2979181453,whatwg/html,"> For what it's worth, we've been down this path several times before and bundling the libraries wit",https://github.com/whatwg/html/issues/11376#issuecomment-2979181453,https://github.com/whatwg/html/issues/11376,Feature Request: Built-In Web Libraries (BWL) via browser-lib attribute,2025-06-17T07:03:42Z,TTMTT
2979097100,whatwg/webidl,"No, anyone is welcome to solve it! Have at it. 😊",https://github.com/whatwg/webidl/issues/1495#issuecomment-2979097100,https://github.com/whatwg/webidl/issues/1495,Specify best practices for sequence/FrozenArray/ObservableArray,2025-06-17T06:25:25Z,annevk
2978903968,w3ctag/design-reviews,"> What if developers set `extendedLifetime: true` to every shared worker just to be ""safe"" (as it wo",https://github.com/w3ctag/design-reviews/issues/1089#issuecomment-2978903968,https://github.com/w3ctag/design-reviews/issues/1089,Extended lifetime shared workers,2025-06-17T04:34:08Z,domenic
2978850878,w3ctag/design-reviews,"Hi @schenney-chromium, and thanks for your review request. We have a few questions about the proposa",https://github.com/w3ctag/design-reviews/issues/1095#issuecomment-2978850878,https://github.com/w3ctag/design-reviews/issues/1095,"Canvas Text Metrics for Editing, Art and Design",2025-06-17T04:02:24Z,jyasskin
2978846600,w3ctag/design-reviews,"It feels like this is a larger discussion to have in WebAppSec WG, as part of the Credential Managem",https://github.com/w3ctag/design-reviews/issues/1092#issuecomment-2978846600,https://github.com/w3ctag/design-reviews/issues/1092,Web Authentication Immediate Mediation,2025-06-17T03:59:29Z,marcoscaceres
2978843473,w3ctag/design-reviews,"@kenrb, Can you help us understand the proposal better? We understand that the original design of We",https://github.com/w3ctag/design-reviews/issues/1092#issuecomment-2978843473,https://github.com/w3ctag/design-reviews/issues/1092,Web Authentication Immediate Mediation,2025-06-17T03:57:55Z,martinthomson
2978793878,w3ctag/design-reviews,"Hi @domenic, thanks for pointing out the resource cost for preparing a shared worker to have an exte",https://github.com/w3ctag/design-reviews/issues/1089#issuecomment-2978793878,https://github.com/w3ctag/design-reviews/issues/1089,Extended lifetime shared workers,2025-06-17T03:20:33Z,xiaochengh
2978460504,whatwg/html,Do the concerns for `write()` in the note up the top also apply to `Document.writeln()`?  It looks l,https://github.com/whatwg/html/issues/7977#issuecomment-2978460504,https://github.com/whatwg/html/issues/7977,Mark `document.write()` as obsolete,2025-06-16T23:24:16Z,hamishwillee
2978227305,whatwg/html,"> [@mfreed7](https://github.com/mfreed7) IIRC you wanted to add a use counter for this in Chromium. ",https://github.com/whatwg/html/issues/10879#issuecomment-2978227305,https://github.com/whatwg/html/issues/10879,Audit and fix innerHTML scripting disabled parsing behavior for template,2025-06-16T21:35:01Z,mfreed7
2977978244,whatwg/html,> I believe the question boils down to - should the spec note that transient activation should not b,https://github.com/whatwg/html/issues/11330#issuecomment-2977978244,https://github.com/whatwg/html/issues/11330,Transient activation and focus,2025-06-16T20:13:11Z,EdgarChen
2977706103,whatwg/webidl,"@domenic Thank you, that's a much better summary! I agree with all of this.  @annevk Would you prefe",https://github.com/whatwg/webidl/issues/1495#issuecomment-2977706103,https://github.com/whatwg/webidl/issues/1495,Specify best practices for sequence/FrozenArray/ObservableArray,2025-06-16T18:47:18Z,tabatkins
2977505569,whatwg/html,I just found that the intended behavior of setting `CustomElementRegistry` is outlined in [the spec],https://github.com/whatwg/html/issues/11382#issuecomment-2977505569,https://github.com/whatwg/html/issues/11382,Behavior of `innerHTML` on element with scoped custom element registry,2025-06-16T17:50:06Z,ja-y-son
2977422625,whatwg/html,> I'd be curious about the use cases here. How common does this occur in practice? How does a websit,https://github.com/whatwg/html/issues/11375#issuecomment-2977422625,https://github.com/whatwg/html/issues/11375,Is it possible to annotate an autocomplete attribute to accept either `email` or `tel`?,2025-06-16T17:19:00Z,samuelgoto
2977397388,whatwg/html,This should all follow from https://html.spec.whatwg.org/multipage/parsing.html#create-an-element-fo,https://github.com/whatwg/html/issues/11382#issuecomment-2977397388,https://github.com/whatwg/html/issues/11382,Behavior of `innerHTML` on element with scoped custom element registry,2025-06-16T17:09:40Z,annevk
2977356492,whatwg/html,"Building on top of @sorvell's observation, here're some additional behavior from safari tech preview",https://github.com/whatwg/html/issues/11382#issuecomment-2977356492,https://github.com/whatwg/html/issues/11382,Behavior of `innerHTML` on element with scoped custom element registry,2025-06-16T16:54:15Z,ja-y-son
2976995110,whatwg/html,"CC @sefeng211 ",https://github.com/whatwg/html/issues/11365#issuecomment-2976995110,https://github.com/whatwg/html/issues/11365,COEP/CORP report-to incorrect and can we have a name for the reporting body object?,2025-06-16T14:58:22Z,hsinyi
2976979873,whatwg/html,Discussed this with fellow Mozillians and we have some comments:   - It may be tricky to correctly s,https://github.com/whatwg/html/issues/11348#issuecomment-2976979873,https://github.com/whatwg/html/issues/11348,Add form persistence,2025-06-16T14:54:08Z,keithamus
2976866311,whatwg/html,"I'd be curious about the use cases here. How common does this occur in practice? How does a website ",https://github.com/whatwg/html/issues/11375#issuecomment-2976866311,https://github.com/whatwg/html/issues/11375,Is it possible to annotate an autocomplete attribute to accept either `email` or `tel`?,2025-06-16T14:23:19Z,keithamus
2976812299,whatwg/html,@mfreed7 IIRC you wanted to add a use counter for this in Chromium. Is there an issue filed?,https://github.com/whatwg/html/issues/10879#issuecomment-2976812299,https://github.com/whatwg/html/issues/10879,Audit and fix innerHTML scripting disabled parsing behavior for template,2025-06-16T14:08:55Z,zcorpan
2976803780,whatwg/html,"For what it's worth, we've been down this path several times before and bundling the libraries with ",https://github.com/whatwg/html/issues/11376#issuecomment-2976803780,https://github.com/whatwg/html/issues/11376,Feature Request: Built-In Web Libraries (BWL) via browser-lib attribute,2025-06-16T14:06:33Z,pmeenan
2976580197,whatwg/html,Yes.  I think Edge Legacy is dead. [Edge Legacy was EOL'd in 2021](https://en.wikipedia.org/wiki/Mic,https://github.com/whatwg/html/issues/11356#issuecomment-2976580197,https://github.com/whatwg/html/issues/11356,"Remove ""X-UA-Compatible"" pragma",2025-06-16T13:04:36Z,zcorpan
2976423044,whatwg/html,"I remember when 20 years ago, XHTML 2 proposed the simple and obvious solution of replacing `<h1-6/>",https://github.com/whatwg/html/pull/7829#issuecomment-2976423044,https://github.com/whatwg/html/pull/7829,replace current outline algorithm with one based on heading levels,2025-06-16T12:14:30Z,flying-sheep
2975474858,webkit/standards-positions,Have you since thought about how to address the `Highlight` use case and other expansions? When this,https://github.com/WebKit/standards-positions/issues/512#issuecomment-2975474858,https://github.com/WebKit/standards-positions/issues/512,Add `getSelectionBoundingClientRect()` for `<textarea>` and `<input>` elements,2025-06-16T07:55:11Z,annevk
2975339378,mozilla/standards-positions,"@andypaicu the problems you highlight with ""notifications"" is why we would prefer this effort not tr",https://github.com/mozilla/standards-positions/issues/1245#issuecomment-2975339378,https://github.com/mozilla/standards-positions/issues/1245,Page Embedded Permission Control (Take 2),2025-06-16T07:04:18Z,martinthomson
2975305236,whatwg/html,"I guess it depends on whether you look at that issue as solely providing ""username or email"" or a mo",https://github.com/whatwg/html/issues/11375#issuecomment-2975305236,https://github.com/whatwg/html/issues/11375,Is it possible to annotate an autocomplete attribute to accept either `email` or `tel`?,2025-06-16T06:49:44Z,annevk
2975297093,whatwg/webidl,"I'm still in favor of attempting to eliminate 1 in favor of 2 and making 2 easier for specification ",https://github.com/whatwg/webidl/issues/1495#issuecomment-2975297093,https://github.com/whatwg/webidl/issues/1495,Specify best practices for sequence/FrozenArray/ObservableArray,2025-06-16T06:45:59Z,annevk
2975168470,whatwg/webidl,"I think this is the current state of things:  1. If you want to expose an array, and the values won'",https://github.com/whatwg/webidl/issues/1495#issuecomment-2975168470,https://github.com/whatwg/webidl/issues/1495,Specify best practices for sequence/FrozenArray/ObservableArray,2025-06-16T05:38:50Z,domenic
2975084078,w3ctag/design-reviews,Thank you Martin for thoughtful feedback.  > The question is then only whether to delay (at the brow,https://github.com/w3ctag/design-reviews/issues/1052#issuecomment-2975084078,https://github.com/w3ctag/design-reviews/issues/1052,Early Design Review for Device Bound Session Credentials,2025-06-16T04:42:49Z,arnar
2975027878,whatwg/html,Thank you very much!,https://github.com/whatwg/html/pull/11283#issuecomment-2975027878,https://github.com/whatwg/html/pull/11283,Editorial: proper step references in 2.1.1 example,2025-06-16T03:57:24Z,domenic
2975027781,w3ctag/design-reviews,"@guidou, would you mind completing the template?",https://github.com/w3ctag/design-reviews/issues/1107#issuecomment-2975027781,https://github.com/w3ctag/design-reviews/issues/1107,echoCancellation mode,2025-06-16T03:57:18Z,martinthomson
2974946405,w3ctag/design-reviews,[This](https://tess.oconnor.cx/2025/06/complexity) was on my reading list today.  It seems pertinent,https://github.com/w3ctag/design-reviews/issues/1052#issuecomment-2974946405,https://github.com/w3ctag/design-reviews/issues/1052,Early Design Review for Device Bound Session Credentials,2025-06-16T02:45:32Z,martinthomson
2974223696,whatwg/html,@domenic @smaug---- could you help to review this change? This is an addition to https://github.com/,https://github.com/whatwg/html/pull/11381#issuecomment-2974223696,https://github.com/whatwg/html/pull/11381,Add new strings for notRestoredReason,2025-06-15T16:38:55Z,lozy219
2973297496,w3ctag/design-reviews,"Hi @szager-chromium , TAG team,  Thanks for sharing this, the explainer clearly highlights a perform",https://github.com/w3ctag/design-reviews/issues/1111#issuecomment-2973297496,https://github.com/w3ctag/design-reviews/issues/1111,Declarative Interactions,2025-06-14T22:33:53Z,Shrinivassab
2972899183,whatwg/html,"The CI errors are from ""conformance checker"", which is saying that attributes `noexport` and `abstra",https://github.com/whatwg/html/pull/11379#issuecomment-2972899183,https://github.com/whatwg/html/pull/11379,Editorial prep for wrapping algorithms in <div>,2025-06-14T17:33:49Z,jmdyck
2972846646,whatwg/html,"(Hm, getting build errors, but when I build locally I get Success.)",https://github.com/whatwg/html/pull/11379#issuecomment-2972846646,https://github.com/whatwg/html/pull/11379,Editorial prep for wrapping algorithms in <div>,2025-06-14T15:59:48Z,jmdyck
2972842286,whatwg/html,"See PR #11379   > > ### (1) `dt/dd` > > > > * 2.7.1 ""Serializable objects"", in the example >  > Usin",https://github.com/whatwg/html/issues/10483#issuecomment-2972842286,https://github.com/whatwg/html/issues/10483,Static checker for the spec?,2025-06-14T15:48:41Z,jmdyck
2970932993,webkit/standards-positions,"WebKit is lagging behind with all new (and super useful) apis. Wasm Apis, Ai apis, and a lot more (N",https://github.com/WebKit/standards-positions/issues/422#issuecomment-2970932993,https://github.com/WebKit/standards-positions/issues/422,JavaScript Promise Integration (JSPI),2025-06-13T16:43:10Z,ApoloApps