id,closed,title,url,created_at,updated_at,user,labels,reactions
186317233,true,"Change ""index handle"" -> ""object store handle"" references within `IDB…",https://github.com/w3c/IndexedDB/pull/103,2016-10-31T15:42:03Z,2016-10-31T18:17:13Z,brettz9,,0
184364514,true,Linkify more ES terms,https://github.com/w3c/IndexedDB/pull/101,2016-10-20T23:21:08Z,2016-10-21T21:20:34Z,inexorabletash,,0
184289858,true,Replace abrupt completion asserts/returns with !? shortcuts from ES spec,https://github.com/w3c/IndexedDB/pull/100,2016-10-20T17:20:30Z,2016-10-20T21:43:51Z,inexorabletash,,0
182596884,true,Define how implementations should fail open/deleteDatabase. For #74,https://github.com/w3c/IndexedDB/pull/97,2016-10-12T18:20:42Z,2016-10-12T19:33:13Z,inexorabletash,,0
179910785,true,Remove IDBEnvironment in favor of partial interface,https://github.com/w3c/IndexedDB/pull/95,2016-09-28T22:48:11Z,2016-09-29T02:49:50Z,inexorabletash,,0
175616621,true,"Abort behavior for renames of newly created stores/indexes, for #89",https://github.com/w3c/IndexedDB/pull/90,2016-09-07T21:57:19Z,2016-09-08T05:45:33Z,inexorabletash,,0
164511564,true,Make IDBRequest.error and IDBRequest.transaction nullable,https://github.com/w3c/IndexedDB/pull/80,2016-07-08T11:26:39Z,2016-07-08T16:35:47Z,nox,,0
89011043,true,Add link to IDB Feature Request wiki,https://github.com/w3c/IndexedDB/pull/25,2015-06-17T13:03:21Z,2015-06-17T17:14:02Z,AFBarstow,,0